Authors,Title,Year,Source title,Cited by,Link,Abstract,Document Type,Publication Stage,Source,EID
"Quigley M., Conley K., Gerkey B.P., Faust J., Foote T., Leibs J., Wheeler R., Ng A.Y.","ROS: An open-source robot operating system",2009,"ICRA Workshop on Open Source Software",5122,,[No abstract available],,"Final",Scopus,2-s2.0-77957352104
"Koenig N., Howard A.","Design and use paradigms for Gazebo, an open-source multi-robot simulator",2004,"2004 IEEE/RSJ International Conference on Intelligent Robots and Systems (IROS)",1607,"https://www.scopus.com/inward/record.uri?eid=2-s2.0-14044257268&partnerID=40&md5=d469678f36673d212d0c42ecf11416ab","Simulators have played a critical role in robotics research as tools for quick and efficient testing of new concepts, strategies, and algorithms. To date, most simulators have been restricted to 2D worlds, and few have matured to the point where they are both highly capable and easily adaptable. Gazebo is designed to fill this niche by creating a 3D dynamic multi-robot environment capable of recreating the complex worlds that will be encountered by the next generation of mobile robots. Its open source status, fine grained control, and high fidelity place Gazebo in a unique position to become more than just a stepping stone between the drawing board and real hardware: data visualization, simulation of remote environments, and even reverse engineering of black-box systems are all possible applications. Gazebo is developed in cooperation with the Player and Stage projects [1], [2], [3], and is available from http://playerstage.sourceforge.net/gazebo/gazebo.html.",Conference Paper,"Final",Scopus,2-s2.0-14044257268
"Şucan I.A., Moll M., Kavraki L.","The open motion planning library",2012,"IEEE Robotics and Automation Magazine",776,"https://www.scopus.com/inward/record.uri?eid=2-s2.0-84871385657&doi=10.1109%2fMRA.2012.2205651&partnerID=40&md5=bce18fde61a714b54dcaff67af3bbc0c","The open motion planning library (OMPL) is a new library for sampling-based motion planning, which contains implementations of many state-of-the-art planning algorithms. The library is designed in a way that it allows the user to easily solve a variety of complex motion planning problems with minimal input. A simple graphical user interface (GUI) built on top of the library, a number of tutorials, demos, and programming assignments are designed to teach students about sampling-based motion planning. The library is also available for use through Robot Operating System (ROS). OMPL is structured to have a clear mapping between the motion planning concepts used in the literature and the classes that are defined in the implementation. A software package that is complementary to OMPL is OpenRAVE, designed to be a complete package for robotics. OMPL is intended for use in research and education, as well as in industry, due to its clarity, efficiency, simple integration with other software packages and straight-forward integration of external contributions.",Article,"Final",Scopus,2-s2.0-84871385657
"Barbosa F., Woetzel J., Mischke J., Ribeirinho M.J., Sridhar M., Parsons M., Bertram N., Brown S.","Reinventing Construction: A Route to Higher Productivity",2017,"Reinventing Construction: A Route to Higher Productivity",356,,[No abstract available],,"Final",Scopus,2-s2.0-85046345496
"Chitta S., Sucan I., Cousins S.","MoveIt!",2012,"IEEE Robotics and Automation Magazine",250,"https://www.scopus.com/inward/record.uri?eid=2-s2.0-84859727432&doi=10.1109%2fMRA.2011.2181749&partnerID=40&md5=80ed6ca64dca4b38c93c98d2bbc3a9f4","MoveIt! is a set of software packages integrated with the Robot Operating System (ROS) and designed specifically to provide mobile manipulation. MoveIt! will allow robots to build up a representation of their environment using data fused from three-dimensional (3-D) and other sensors, generate motion plans that effectively and safely move the robot around in the environment, and execute the motion plans while constantly monitoring the environment for changes. Lightweight ROS bindings and wrappers will allow ROS users to easily configure and interface with the components of MoveIt!. Advanced users and application developers will be able to directly incorporate the core capabilities in MoveIt! through libraries without needing to depend on a large part of ROS. MoveIt! will be crucial in the goal of enabling safer, more capable robots that can function effectively in human environments.",Short Survey,"Final",Scopus,2-s2.0-84859727432
"Pan J., Chitta S., Manocha D.","FCL: A general purpose library for collision and proximity queries",2012,"Proceedings - IEEE International Conference on Robotics and Automation",250,"https://www.scopus.com/inward/record.uri?eid=2-s2.0-84864484328&doi=10.1109%2fICRA.2012.6225337&partnerID=40&md5=454da98a23e11ae3ad3ba56fc2a7eda5","We present a new collision and proximity library that integrates several techniques for fast and accurate collision checking and proximity computation. Our library is based on hierarchical representations and designed to perform multiple proximity queries on different model representations. The set of queries includes discrete collision detection, continuous collision detection, separation distance computation and penetration depth estimation. The input models may correspond to triangulated rigid or deformable models and articulated models. Moreover, FCL can perform probabilistic collision checking between noisy point clouds that are captured using cameras or LIDAR sensors. The main benefit of FCL lies in the fact that it provides a unified interface that can be used by various applications. Furthermore, its flexible architecture makes it easier to implement new algorithms within this framework. The runtime performance of the library is comparable to state of the art collision and proximity algorithms. We demonstrate its performance on synthetic datasets as well as motion planning and grasping computations performed using a two-armed mobile manipulation robot. © 2012 IEEE.",Conference Paper,"Final",Scopus,2-s2.0-84864484328
"CPWR – The Center for Construction Research and Training","The Construction Chart Book",2020,"The Construction Chart Book",119,,[No abstract available],,"Final",Scopus,2-s2.0-0042978815
"Du J., Zou Z., Shi Y., Zhao D.","Zero latency: Real-time synchronization of BIM data in virtual reality for collaborative decision-making",2018,"Automation in Construction",97,"https://www.scopus.com/inward/record.uri?eid=2-s2.0-85031747080&doi=10.1016%2fj.autcon.2017.10.009&partnerID=40&md5=b174e5343565c812ade9ead2d6bf45e1","Virtual Reality (VR) has attracted increasing attention of the Architecture, Engineering, Construction and Facility Management (AEC/FM) industry in recent years, as it shows a great potential to improve workflow efficiency through enhanced common understanding. A problem with current VR applications in AEC/FM is that the manual conversation from official design data (e.g., a BIM model) to VR displays is difficult and time consuming. There is a lack of automated and efficient data transfer approach between BIM and VR. In this paper, we will introduce a BIM[sbnd]VR real-time synchronization system called BVRS, which is based on an innovative Cloud-based BIM metadata interpretation and communication method. BVRS allows users to update BIM model changes in VR headsets (such as Oculus Rift DK2) automatically and simultaneously. We tested BVRS in a variety of design change scenarios including changing object dimensions, changing object locations and changing object types. Results confirmed the usability and efficiency of BVRS. © 2017 Elsevier B.V.",Article,"Final",Scopus,2-s2.0-85031747080
"Davila Delgado J.M., Oyedele L., Ajayi A., Akanbi L., Akinade O., Bilal M., Owolabi H.","Robotics and automated systems in construction: Understanding industry-specific challenges for adoption",2019,"Journal of Building Engineering",78,"https://www.scopus.com/inward/record.uri?eid=2-s2.0-85073652295&doi=10.1016%2fj.jobe.2019.100868&partnerID=40&md5=4a7777bb736cc946a648ff39cb1c7623","The construction industry is a major economic sector, but it is plagued with inefficiencies and low productivity. Robotics and automated systems have the potential to address these shortcomings; however, the level of adoption in the construction industry is very low. This paper presents an investigation into the industry-specific factors that limit the adoption in the construction industry. A mixed research method was employed combining literature review, qualitative and quantitative data collection and analysis. Three focus groups with 28 experts and an online questionnaire were conducted. Principal component and correlation analyses were conducted to group the identified factors and find hidden correlations. The main identified challenges were grouped into four categories and ranked in order of importance: contractor-side economic factors, client-side economic factors, technical and work-culture factors, and weak business case factors. No strong correlation was found among factors. This study will help stakeholders to understand the main industry-specific factors limiting the adoption of robotics and automated systems in the construction industry. The presented findings will support stakeholders to devise mitigation strategies. © 2019 The Authors",Article,"Final",Scopus,2-s2.0-85073652295
"Smits R.",[No title available],0000,"KDL: Kinematics and Dynamics Library",75,,[No abstract available],,"Final",Scopus,2-s2.0-78650276513
"Kim D., Kim J., Lee K., Park C., Song J., Kang D.","Excavator tele-operation system using a human arm",2009,"Automation in Construction",71,"https://www.scopus.com/inward/record.uri?eid=2-s2.0-57649234925&doi=10.1016%2fj.autcon.2008.07.002&partnerID=40&md5=73ae9e9c184a9a42a2fe86ce992c4e48","It is difficult, for those without experience, to operate and manipulate a mechanical excavator. There is a long learning process to gain the skills required in operating the excavator's overall swing motions as well as movements of its boom, arm and bucket. In addition it is dangerous to operate such excavators on an inclined plane as this can lead to instability and puts the operator at great risk. In this study, a simple light weight tele-operation system has been developed for the excavator for dealing with these problems. Three sensors are attached to the operator's arm, in order to detect his movements. The operating commands for the actuators of an excavator will be transmitted via Bluetooth wireless communications. The new tele-operation system developed is simple, cost effective and lighter compared to typical haptic devices using a force feedback mechanisms. The operating algorithm has been modified and verified in many test cases. Prior to testing, the algorithms have been verified using the visual simulator, OpenGL. The operating system to operate the excavator easily and safely is developed and the control algorithm verified by tests. © 2008 Elsevier B.V. All rights reserved.",Article,"Final",Scopus,2-s2.0-57649234925
"Chitta S., Marder-Eppstein E., Meeussen W., Pradeep V., Rodríguez Tsouroukdissian A., Bohren J., Coleman D., Magyar B., Raiola G., Lüdtke M., Fernández Perdomo E.","Ros control: A generic and simple control framework for ros",2017,"The Journal of Open Source Software",68,,[No abstract available],,"Final",Scopus,2-s2.0-85051855317
"Feng C., Xiao Y., Willette A., McGee W., Kamat V.R.","Vision guided autonomous robotic assembly and as-built scanning on unstructured construction sites",2015,"Automation in Construction",60,"https://www.scopus.com/inward/record.uri?eid=2-s2.0-84944441544&doi=10.1016%2fj.autcon.2015.06.002&partnerID=40&md5=a0dbc77e8100bb4028a22408a31909af","Unlike robotics in the manufacturing industry, on-site construction robotics has to consider and address two unique challenges: 1) the rugged, evolving, and unstructured environment of typical work sites; and 2) the reversed spatial relationship between the product and the manipulator, i.e., the manipulator has to travel to and localize itself at the work face, rather than a partially complete product arriving at an anchored manipulator. The presented research designed and implemented algorithms that address these challenges and enable autonomous robotic assembly of freeform modular structures on construction sites. Building on the authors' previous work in computer-vision-based pose estimation, the designed algorithms enable a mobile robotic manipulator to: 1) autonomously identify and grasp prismatic building components (e.g., bricks, blocks) that are typically non-unique and arbitrarily stored on-site; and 2) assemble these components into pre-designed modular structures. The algorithms use a single camera and a visual marker-based metrology to rapidly establish local reference frames and to detect staged building components. Based on the design of the structure being assembled, the algorithms automatically determine the assembly sequence. Furthermore, if a 3D camera is mounted on the manipulator, 3D point clouds can be readily captured and registered into a same reference frame through our marker-based metrology and the manipulator's internal encoders, either after construction to facilitate as-built Building Information Model (BIM) generation, or during construction to document details of the progress. Implemented using a 7-axis KUKA KR100 robotic manipulator, the presented robotic system has successfully assembled various structures and created as-built 3D point cloud models autonomously, demonstrating the designed algorithms' effectiveness in autonomous on-site construction robotics applications. © 2015 Elsevier B.V.",Article,"Final",Scopus,2-s2.0-84944441544
"You S., Kim J.-H., Lee S., Kamat V., Robert L.P., Jr.","Enhancing perceived safety in human–robot collaborative construction using immersive virtual environments",2018,"Automation in Construction",43,"https://www.scopus.com/inward/record.uri?eid=2-s2.0-85053825953&doi=10.1016%2fj.autcon.2018.09.008&partnerID=40&md5=c1e1bba33f5315cf12725d702df4d61f","Advances in robotics now permit humans to work collaboratively with robots. However, humans often feel unsafe working alongside robots. Our knowledge of how to help humans overcome this issue is limited by two challenges. One, it is difficult, expensive and time-consuming to prototype robots and set up various work situations needed to conduct studies in this area. Two, we lack strong theoretical models to predict and explain perceived safety and its influence on human–robot work collaboration (HRWC). To address these issues, we introduce the Robot Acceptance Safety Model (RASM) and employ immersive virtual environments (IVEs) to examine perceived safety of working on tasks alongside a robot. Results from a between-subjects experiment done in an IVE show that separation of work areas between robots and humans increases perceived safety by promoting team identification and trust in the robot. In addition, the more participants felt it was safe to work with the robot, the more willing they were to work alongside the robot in the future. © 2018 Elsevier B.V.",Article,"Final",Scopus,2-s2.0-85053825953
"Wang Q., Guo J., Kim M.-K.","An application oriented scan-to-bim framework",2019,"Remote Sensing",36,"https://www.scopus.com/inward/record.uri?eid=2-s2.0-85061404405&doi=10.3390%2frs11030365&partnerID=40&md5=bca16a5fa53459f9247d5f848a48aac0","Building information modelling (BIM) has been adopted in the construction industry. The success of BIM implementation relies on the accurate building information stored in BIM models. However, building information in BIM models can be inaccurate, out-of-date, or missing in real-world projects. 3D laser scanning has been leveraged to capture the accurate as-is conditions of buildings and create as-is BIM models of buildings; this is known as the scan-to-BIM process. Although industry practitioners and researchers have implemented and studied the scan-to-BIM process, there is no framework that systematically defines and discusses the key steps and considerations in the process. This study proposes an application-oriented framework for scan-to-BIM, which describes the four major steps of a scan-to-BIM process and their relationships. The framework is oriented towards the specific BIM application to be implemented using the created as-is BIM, and includes four steps: (1) identification of information requirements, (2) determination of required scan data quality, (3) scan data acquisition, and (4) as-is BIM reconstruction. Two illustrative examples are provided to demonstrate the feasibility of the proposed scan-to-BIM framework. Furthermore, future research directions within the scan-to-BIM framework are suggested. © 2019 by the authors.",Article,"Final",Scopus,2-s2.0-85061404405
"Jen Y.H., Taha Z., Vui L.J.","VR-Based robot programming and simulation system for an industrial robot",2008,"International Journal of Industrial Engineering : Theory Applications and Practice",29,"https://www.scopus.com/inward/record.uri?eid=2-s2.0-77749317403&partnerID=40&md5=ae7f705fabd5ef683135c3d1db53b1c6","Traditional robot programming such as teach by lead etc have been used for many years. These methods are considered not efficient and outdated in the current industrial and market demands. In this paper, virtual reality (VR) technology is used to improve human-robot interface - no complicated command or programming knowledge is required. The system is divided into three major parts: task teaching by demonstration in a computer generated virtual environment, a graphical robot simulator with intelligent robot command generator and last but not least, real task execution. The user is requested to complete the desired task in a virtual teaching system by wearing a data glove attached with a sensor tracker. The process path will be simulated and analyzed to obtain the optimum trajectory. Robot motions can be checked through the simulation program and robot program can be generated for the real task execution. © INTERNATIONAL JOURNAL OF INDUSTRIAL ENGINEERING.",Article,"Final",Scopus,2-s2.0-77749317403
"Xu L., Feng C., Kamat V.R., Menassa C.C.","An Occupancy Grid Mapping enhanced visual SLAM for real-time locating applications in indoor GPS-denied environments",2019,"Automation in Construction",27,"https://www.scopus.com/inward/record.uri?eid=2-s2.0-85064747805&doi=10.1016%2fj.autcon.2019.04.011&partnerID=40&md5=3bfe222f42d71a43a6e92cbbbce3ed3b","Current Real-Time Locating Systems (RTLS)typically deployed in indoor built environments are generally based on wireless technologies, fixed cameras, or Lidar-based Simultaneous Localization and Mapping (SLAM), which generally suffer from the drawbacks of low accuracy, reliance on existing infrastructures that may be not available in the deployed environments, labor-intensive environment instrumentation, or economic infeasibility for wide deployment. By improving an ORB RGB-D SLAM with Occupancy Grid Mapping, this paper proposes a new indoor RTLS that can be readily adapted and deployed for a broad range of indoor locating applications while overcoming the limitations faced by current solutions. In addition to the sparse feature map that is maintained by ORB SLAM itself, a new 2D mapping module is developed to build and maintain an additional 2D Occupancy Grid Map (OGM). The 2D OGM is built with the 3D camera poses estimated by Visual SLAM (vSLAM)and laser scans extracted from the point cloud observed by the camera from those poses. In addition, the Robot Operating System (ROS)visualization tools are used to overlay real-time current camera poses and observations (virtual laser scans)on the OGM. This approach not only provides more intuitive pose information to users and allows them to interact with the system, but also enables path planning and continuous navigation, which cannot be implemented directly on vSLAM's original feature map. The localization accuracy of the proposed system is experimentally evaluated with a set of visual landmarks that are installed in a large-scale building environment. The achieved marker position measurement accuracy ranges from 0.039 m to 0.186 m and the marker distance measurement accuracy ranges from 0.018 m to 0.235 m, proving the method's feasibility and applicability in providing real-time and accurate localization for a wide range of applications within constructed facilities and the built environment. Three examples are provided to highlight such potential applications, including path planning and real-time navigation, geo-tagged date collection and location-aware point cloud updating. © 2019 Elsevier B.V.",Article,"Final",Scopus,2-s2.0-85064747805
"Lundeen K.M., Kamat V.R., Menassa C.C., McGee W.","Autonomous motion planning and task execution in geometrically adaptive robotized construction work",2019,"Automation in Construction",25,"https://www.scopus.com/inward/record.uri?eid=2-s2.0-85059588840&doi=10.1016%2fj.autcon.2018.12.020&partnerID=40&md5=eec116e8c4725ff5808a6f1c87fe6d9a","This research explores a means by which a construction robot can leverage its sensors and a Building Information Model (BIM) to perceive and model the actual geometry of its workpieces, adapt its work plan, and execute work in a construction environment. The adaptive framework uses the Generalized Resolution Correlative Scan Matching (GRCSM) search algorithm for model registration, a new formulation for fill plan adaptation, and new hardware for robotic material dispensing. Joint filling is used as a case study to demonstrate the formulation of an adaptive plan and evaluate a robot's ability to perform adaptive work in an environment where the actual location and geometry of its workpieces may deviate from their designed counterparts. Averaged across five experiments, the robot was found capable of identifying the true position and orientation of the joint's center with a mean norm positioning error of 0.11 mm and orientation error of 1.1 ° . The adaptive framework offers significant promise for a range of construction activities, including those involving objects of complex geometry and detailed work. © 2019 Elsevier B.V.",Article,"Final",Scopus,2-s2.0-85059588840
"Lundeen K.M., Kamat V.R., Menassa C.C., McGee W.","Scene understanding for adaptive manipulation in robotized construction work",2017,"Automation in Construction",21,"https://www.scopus.com/inward/record.uri?eid=2-s2.0-85021346169&doi=10.1016%2fj.autcon.2017.06.022&partnerID=40&md5=85594cda1c29f12e0a1831acd14fca66","Unlike manufacturing robots, whose kinematics are pre-programmed based on robust metrology, tight tolerances, and rigid workpieces, construction robots operate under conditions of imperfect metrology, loose tolerances, and large workpiece uncertainties. Despite having access to a designed Building Information Model (BIM), construction robots must sense and model their actual environment, and adapt their kinematic plan to compensate for deviations from the expected. This research investigates methods to enable the autonomous sensing and modeling of construction objects so construction robots can ultimately adapt to unexpected circumstances and perform quality work. To that end, two construction component model fitting techniques are presented, namely the Clustering and Iterative Closest Point (CICP) construction component model fitting technique and the Generalized Resolution Correlative Scan Matching (GRCSM) construction component model fitting technique. The GRCSM construction component model fitting technique employs the presented GRCSM search algorithm, which is a modified version of the existing Multi-Resolution Correlative Scan Matching (MRCSM) search algorithm. Three experiments are presented to evaluate the ability of the CICP and GRCSM construction component model fitting techniques to model construction features. It was found that the CICP and GRCSM construction component model fitting techniques are capable of estimating the pose and geometry of arbitrarily shaped objects and construction joints, but are susceptible to modeling error. Despite their limitations, the CICP and GRCSM construction component model fitting techniques appear to be promising tools for the geometric estimation of construction features, especially for situations involving full automation, detailed construction work, incomplete sensor data, and complex object geometry. © 2017 Elsevier B.V.",Article,"Final",Scopus,2-s2.0-85021346169
