Authors,Title,Year,Source title,Cited by,Link,Abstract,Document Type,Publication Stage,Source,EID
"Chotiprayanakul P., Liu D.K., Dissanayake G.","Human-robot-environment interaction interface for robotic grit-blasting of complex steel bridges",2012,"Automation in Construction",21,"https://www.scopus.com/inward/record.uri?eid=2-s2.0-84863697780&doi=10.1016%2fj.autcon.2012.04.014&partnerID=40&md5=e8145c0f06105dde90a43884d95fb796","This paper presents a human-robot-environment interaction (HREI) interface using haptic feedback for a grit-blasting robot operating in close proximity to a complex steel bridge structure. The productivity requirements dictate the need for efficient algorithms for mapping, exploration, and collision-free motion planning. While a large portion of the grit-blasting operation can be automated, a tele-operation is essential to deal with some difficult to access sections such as edges, complex corners, and surfaces which can only be approached through hole. A 3-dimensional virtual force field (3D-VF 2) method is developed for capturing the relationship between the robot and its environment. A novel haptic force generation method and a workspace mapping algorithm allow intuitive interaction between the operator and the robot through haptic feedback. The strategies presented are verified in extensive simulations and experiments conducted on a steel bridge with a prototype grit-blasting robot. © 2012 Elsevier B.V.",Article,"Final",Scopus,2-s2.0-84863697780
"Tavares P., Costa C.M., Rocha L., Malaca P., Costa P., Moreira A.P., Sousa A., Veiga G.","Collaborative Welding System using BIM for Robotic Reprogramming and Spatial Augmented Reality",2019,"Automation in Construction",20,"https://www.scopus.com/inward/record.uri?eid=2-s2.0-85067040551&doi=10.1016%2fj.autcon.2019.04.020&partnerID=40&md5=b5c99a6354ccbe7b961d641d9c891faf","The optimization of the information flow from the initial design and through the several production stages plays a critical role in ensuring product quality while also reducing the manufacturing costs. As such, in this article we present a cooperative welding cell for structural steel fabrication that is capable of leveraging the Building Information Modeling (BIM) standards to automatically orchestrate the necessary tasks to be allocated to a human operator and a welding robot moving on a linear track. We propose a spatial augmented reality system that projects alignment information into the environment for helping the operator tack weld the beam attachments that will be later on seam welded by the industrial robot. This way we ensure maximum flexibility during the beam assembly stage while also improving the overall productivity and product quality since the operator no longer needs to rely on error prone measurement procedures and he receives his tasks through an immersive interface, relieving him from the burden of analyzing complex manufacturing design specifications. Moreover, no expert robotics knowledge is required to operate our welding cell because all the necessary information is extracted from the Industry Foundation Classes (IFC), namely the CAD models and welding sections, allowing our 3D beam perception systems to correct placement errors or beam bending, which coupled with our motion planning and welding pose optimization system ensures that the robot performs its tasks without collisions and as efficiently as possible while maximizing the welding quality. © 2019 Elsevier B.V.",Article,"Final",Scopus,2-s2.0-85067040551
"Fukuda T., Fujisawa Y.","A new robotic manipulator in construction based on man-robot cooperation work",1991,"Proc. of the 8th International Symposium on Automation and Robotics in Construction",18,,[No abstract available],,"Final",Scopus,2-s2.0-33847744821
"Liang C.J., Lundeen K.M., McGee W., Menassa C.C., Lee S., Kamat V.R.","Stacked hourglass networks for markerless pose estimation of articulated construction robots",2018,"ISARC 2018 - 35th International Symposium on Automation and Robotics in Construction and International AEC/FM Hackathon: The Future of Building Things",15,"https://www.scopus.com/inward/record.uri?eid=2-s2.0-85088408166&doi=10.22260%2fisarc2018%2f0120&partnerID=40&md5=8287a439d71e7fed435e1f13a21b8e1b","The objective of this research is to evaluate vision-based pose estimation methods for on-site construction robots. The prospect of human-robot collaborative work on construction sites introduces new workplace hazards that must be mitigated to ensure safety. Human workers working on tasks alongside construction robots must perceive the interaction to be safe to ensure team identification and trust. Detecting the robot pose in real-time is thus a key requirement in order to inform the workers and to enable autonomous operation. Vision-based (marker-less, marker-based) and sensor-based (IMU, UWB) are two of the main methods for estimating robot pose. The marker-based and sensor-based methods require some additional preinstalled sensors or markers, whereas the marker-less method only requires an on-site camera system, which is common on modern construction sites. In this research, we develop a marker-less pose estimation system, which is based on a convolutional neural network (CNN) human pose estimation algorithm: stacked hourglass networks. The system is trained with image data collected from a factory setup environment and labels of excavator pose. We use a KUKA robot arm with a bucket mounted on the end-effector to represent a robotic excavator in our experiment. We evaluate the marker-less method and compare the result with the robot’s ground truth pose. The preliminary results show that the marker-less method is capable of estimating the pose of the excavator based on a state-of-the-art human pose estimation algorithm. © ISARC 2018 - 35th International Symposium on Automation and Robotics in Construction and International AEC/FM Hackathon: The Future of Building Things. All rights reserved.",Conference Paper,"Final",Scopus,2-s2.0-85088408166
"Jung K., Chu B., Park S., Hong D.","An implementation of a teleoperation system for robotic beam assembly in construction",2013,"International Journal of Precision Engineering and Manufacturing",14,"https://www.scopus.com/inward/record.uri?eid=2-s2.0-84875913955&doi=10.1007%2fs12541-013-0049-3&partnerID=40&md5=e82283aed87467de3d303aa465caa8cd","Recently, a robot-based construction automation (RCA) project was finished in Korea, whose purpose was to employ a robotic system instead of human labor in steel beam assembly tasks. In that research, a robotic beam assembly (RBA) system was developed to execute a beam assembly task. A field application using the RBA system at an actual construction site was completed. Because a human operator had to board the cabin and manipulate the system in the air, causing possible safety problems, a teleoperation system was developed and is the subject of this paper. To evaluate the performance of the teleoperation system, a pointing task experiment based on Fitts' law was conducted to determine whether it obeyed speed-accuracy tradeoff rules. Results are discussed and an overview of the actual bolting test using the teleoperation system is presented here. Finally, conclusions are drawn about the feasibility of implementing an RBA system with teleoperation in actual building construction applications. © 2013 Korean Society for Precision Engineering and Springer-Verlag Berlin Heidelberg.",Article,"Final",Scopus,2-s2.0-84875913955
"Liang C.-J., Kamat V.R., Menassa C.C.","Teaching robots to perform quasi-repetitive construction tasks through human demonstration",2020,"Automation in Construction",10,"https://www.scopus.com/inward/record.uri?eid=2-s2.0-85088870979&doi=10.1016%2fj.autcon.2020.103370&partnerID=40&md5=f5067f34b6e7f3f67e1c6051e3e7275c","Robots can assist workers in performing physically-demanding construction tasks, which are typically quasi-repetitive, wherein the geometry of the workspace is dissimilar despite similar tasks. As a result, robots must determine motion trajectories based on the encountered workspace geometry. Learning from Demonstration (LfD) methods have the potential to be used in teaching robots specific tasks through human demonstration, such that robots can then perform learned tasks under different conditions. In this paper, the LfD method is investigated to teach robots how to perform quasi-repetitive construction tasks. Considering ceiling tile installation as the experimental process, the tasks of maneuvering and positioning tiles in a ceiling grid are defined as the target knowledge to be learned. Using a set of human demonstration videos, the designed approach first translates the physical work context, e.g., the pose of the tile, to the target digital twin, i.e., the workspace as-perceived by the robot. The Reinforcement Learning method is then applied to generate the control policy for the robot to perform the subsequent tasks. The proposed method is evaluated in the Robot Operating System (ROS) Gazebo simulator using a KUKA mobile industrial robotic arm emulator and 60 different scenes as test cases. The results show a 78% success rate in installing ceiling tiles based on 3000 virtual and 85 real demonstration videos. The success rate tends to continually rise with an increase in the number of real demonstration videos, confirming the promise and applicability of the LfD method in teaching robot apprentices to perform quasi-repetitive tasks on construction sites. © 2020 Elsevier B.V.",Article,"Final",Scopus,2-s2.0-85088870979
"Liang C.J., Kamat V.R., Menassa C.C.","Teaching robots to perform construction tasks via learning from demonstration",2019,"Proceedings of the 36th International Symposium on Automation and Robotics in Construction, ISARC 2019",10,"https://www.scopus.com/inward/record.uri?eid=2-s2.0-85071479614&doi=10.22260%2fisarc2019%2f0175&partnerID=40&md5=ba6cfbaffbfc8afebd22f5203ee25fd3","Robots are expected to be widely used on future construction sites to assist human workers in the performance of repetitive physically-demanding tasks. Unlike typical manufacturing assembly lines, where parts are delivered to robots and workers in stationary workstations, construction robots and human workers must accumulate all necessary resources and repeatedly navigate to desired assembly locations on-site to perform useful work. The condition of such resources and the geometry of the environment are constantly changing and generally unstructured. As a result, the motion trajectories of any robot arms cannot be programmed beforehand. The robots must define the trajectory based on the encountered workspace geometry. Learning from Demonstration (LfD) methods have the potential to be used in teaching robots specific skills through human demonstration such that the robots can repeat the same process in different conditions. In this research, we explore the LfD method to teach robots to perform repetitive but geometrically adaptive construction tasks of installing suspended ceiling tiles within pre-assembled ceiling grids. The developed method translates the work context from the set of training videos demonstrated by humans to the target scene, then applies the reinforcement learning method to generate the policy for the robot to perform the subsequent ceiling tile installation. The first phase of the proposed method, i.e., the context translation model, is implemented and evaluated by characterizing whether robot-installed ceiling tiles are successfully moved to the grid area. The experiments demonstrate promising results that show the applicability of the LfD method in teaching robots to perform geometrically-adaptive construction tasks. © 2019 International Association for Automation and Robotics in Construction I.A.A.R.C. All rights reserved.",Conference Paper,"Final",Scopus,2-s2.0-85071479614
"Su X., Cai H.","Enabling Construction 4D Topological Analysis for Effective Construction Planning",2016,"Journal of Computing in Civil Engineering",6,"https://www.scopus.com/inward/record.uri?eid=2-s2.0-84952361602&doi=10.1061%2f%28ASCE%29CP.1943-5487.0000463&partnerID=40&md5=4c5cc9b2774292c5440cb1a975651b70","Construction four-dimensional (4D) models have emerged to become a powerful tool for effective construction planning and control. However, the emphasis has been visualization and 4D topological analysis capabilities are not well-incorporated in the existing practice. Some 4D models enabled space-time conflict detection or site layout analysis, subtypes of 4D topological analysis; these functions are fragmented and constrained in particular construction scenarios. This paper presents a generic construction 4D topology framework that enables 4D topological analysis to support a wide range of construction planning tasks. The framework includes a 4D topological representation method that formalizes the spatial-temporal relationships between construction activities, a topology categorization method that formats the 4D topological representations into task templates, and a mathematical method to conduct the analysis. The framework is tested in a prototype through a case study, which proves that the framework is able to facilitate many construction planning works such as space-time conflict detection and test for crane's cover range. © 2014 American Society of Civil Engineers.",Article,"Final",Scopus,2-s2.0-84952361602
"Lee S., Moon J.I.","Introduction of human-robot cooperation technology at construction sites",2014,"31st International Symposium on Automation and Robotics in Construction and Mining, ISARC 2014 - Proceedings",6,"https://www.scopus.com/inward/record.uri?eid=2-s2.0-84912529986&partnerID=40&md5=c24a8f35a28e76529085f65cd1ad6f42","Currently, a new construction method using a robotic system is widely spreading in construction sites. This study is related to introduction of human-robot cooperation technology which can improve convenience and productivity through the efficient interaction between a worker and a robotic system while doing glass panel installation works. Based on the analysis on glass panel installation with a glazing robot, functional requirements and approaches to address these requirements that can implement human-robot cooperative manipulation at construction sites. A practical example, which is applied to a specific target construction site, is also described in this paper. After field test at a real construction site, productivity and safety of the proposed system are compared with the existing glass panel installation system.",Conference Paper,"Final",Scopus,2-s2.0-84912529986
"Milberg C., Tommelein I.","Role of tolerances and process capability data in product and process design integration",2003,"Construction Research Congress",6,,[No abstract available],,"Final",Scopus,2-s2.0-84940847101
"Liu M.","Video-Based Human Motion Capture and Force Estimation for Comprehensive On-Site Ergonomic Risk Assessment",2019,"Video-Based Human Motion Capture and Force Estimation for Comprehensive On-Site Ergonomic Risk Assessment",3,,[No abstract available],,"Final",Scopus,2-s2.0-85084131593
"Yu Y.-H., Yeh C.-H., Lee T.-T., Chen P.-Y., Shiau Y.-H.","Chip-based real-time gesture tracking for construction robot's guidance",2014,"31st International Symposium on Automation and Robotics in Construction and Mining, ISARC 2014 - Proceedings",3,"https://www.scopus.com/inward/record.uri?eid=2-s2.0-84912575639&partnerID=40&md5=b6c26df3e41a96829c98545132d1a7ff","Mobile robots in automation construction have been designed for applications of craning, conveying, excavating, and floor polishing. These robots nowadays are equipped with various sensors to detect environmental information and finish tasks autonomously. When robot's navigating path needs to be rescheduled, the supervisor of robot can duly interrupt system and then redefines a new route for robot. In addition to robot remote control by radio signals, using digital camera to receive instructions from supervisor's gestures is also effective and can avoid the drawback of networked data routing. In this paper, we propose a gesture tracking system by simulating a traffic light baton to guide a differential drive robot in construction site. Here a real-time moving object detection first tracks supervisor's waves (gestures) with digital camera. Next the system determines guiding direction and steering angles based on fuzzy logic. All of our designs are implemented in single FPGA chip for operating under rigor environments. The experimental results demonstrate that proposed gesture tracking system is accurate and promising for chip-based gesture guidance on construction robots in the future.",Conference Paper,"Final",Scopus,2-s2.0-84912575639
[No author name available],[No title available],2020,"Construction loses 975, 000 jobs in april, due to covid-19 impacts",2,,[No abstract available],,"Final",Scopus,2-s2.0-85109414963
"Hornung A, Wurm KM, Bennewitz M, Stachniss C, Burgard W","An efficient probabilistic 3d mapping framework based on octrees armin hornung",2013,"Autonomous Robots Journal",1,,[No abstract available],,"Final",Scopus,2-s2.0-85109385449
[No author name available],[No title available],0000,,1,,[No abstract available],,"Final",Scopus,2-s2.0-85109421349
[No author name available],[No title available],0000,,1,,[No abstract available],,"Final",Scopus,2-s2.0-85109421291
[No author name available],[No title available],0000,"Mule",1,,[No abstract available],,"Final",Scopus,2-s2.0-85109366322
[No author name available],[No title available],0000,,1,,[No abstract available],,"Final",Scopus,2-s2.0-85109359930
