Authors,Title,Year,Source title,Cited by,Link,Abstract,Document Type,Publication Stage,Source,EID
"Turk Ž., Klinc R.","Potentials of Blockchain Technology for Construction Management",2017,"Procedia Engineering",152,"https://www.scopus.com/inward/record.uri?eid=2-s2.0-85030479533&doi=10.1016%2fj.proeng.2017.08.052&partnerID=40&md5=4878dacb604a1adffad4e389b518d155","Blockchain technology enables distributed, encrypted and secure logging of digital transactions. It is the underlying technology of Bitcoin and other cryptocurrencies. Blockchain is expected to revolutionize computing in several areas, particularly where centralization was unnatural and privacy was important. In the paper, we present research on where and how this technology could be useful in the construction industry. The work is based on the study of literature on open issues that exist in construction process management. These are than matched to the capabilities of blockchain. We are motivated by the fact that construction projects involve a dynamic grouping of several companies. We study the degree to which the relationships among them are hierarchical or peer-to-peer and note that particularly in information intensive phases, centralization of information management was necessary because of technology. When using un-constraining technology, communication patterns among participants show a peer-to-peer nature of the relationships. In such environment, blockchain can provide a trustworthy infrastructure for information management during all building life-cycle stages. Even if building information modelling (BIM) is used, which assumes a centralized building information model, there is a role for blockchain to manage information on who did what and when and thus provide a basis for any legal arguments that might occur. On the construction site blockchain can improve the reliability and trustworthiness of construction logbooks, works performed and material quantities recorded. In the facility maintenance phase, blockchain's main potential is the secure storage of sensor data which are sensitive to privacy. We conclude that blockchain provides solutions to many current problems in construction information management. However, it is more likely that it will be built into generic IT infrastructure on top of which construction applications are built, rather than used directly by authors of construction related software. It has a potential to make construction processes less centralized which opens needs for research in that direction. © 2017 The Authors.",Conference Paper,"Final",Scopus,2-s2.0-85030479533
"Attia S., Eleftheriou P., Xeni F., Morlot R., Ménézo C., Kostopoulos V., Betsi M., Kalaitzoglou I., Pagliano L., Cellura M., Almeida M., Ferreira M., Baracu T., Badescu V., Crutescu R., Hidalgo-Betanzos J.M.","Overview and future challenges of nearly zero energy buildings (nZEB) design in Southern Europe",2017,"Energy and Buildings",151,"https://www.scopus.com/inward/record.uri?eid=2-s2.0-85030678485&doi=10.1016%2fj.enbuild.2017.09.043&partnerID=40&md5=109e104b39710569dac8c6e33e6734f4","In times of great transition of the European construction sector to energy efficient and nearly zero energy buildings (nZEB), a market observation containing qualitative and quantitative indications should help to fill out some of the current gaps concerning the EU 2020 carbon targets. Next to the economic challenges, there are equally important factors that hinder renovating the existing residential building stock and adding newly constructed high performance buildings. Under these circumstances this paper summarises the findings of a cross-comparative study of the societal and technical barriers of nZEB implementation in 7 Southern European countries. The study analyses the present situation and provides an overview on future prospects for nZEB in Southern Europe. The result presents an overview of challenges and provides recommendations based on available empirical evidence to further lower those barriers in the European construction sector. The paper finds that the most Southern European countries are poorly prepared for nZEB implementation and especially to the challenge/opportunity of retrofitting existing buildings. Creating a common approach to further develop nZEB targets, concepts and definitions in synergy with the climatic, societal and technical state of progress in Southern Europe is essential. The paper provides recommendations for actions to shift the identified gaps into opportunities for future development of climate adaptive high performance buildings. © 2017 Elsevier B.V.",Article,"Final",Scopus,2-s2.0-85030678485
"Fleisch E.","What is the internet of things? An economic perspective",2010,"Economics, Management, and Financial Markets",144,,[No abstract available],,"Final",Scopus,2-s2.0-84866084988
"Li C.Z., Xue F., Li X., Hong J., Shen G.Q.","An Internet of Things-enabled BIM platform for on-site assembly services in prefabricated construction",2018,"Automation in Construction",143,"https://www.scopus.com/inward/record.uri?eid=2-s2.0-85041490568&doi=10.1016%2fj.autcon.2018.01.001&partnerID=40&md5=54594456009137618c6a125cd68469a2","Building Information Modelling (BIM) serves as a useful tool in facilitating the on-site assembly services (OAS) of prefabricated construction for its benefits of powerful management of physical and functional digital presentations. However, the benefits of using BIM in the OAS of prefabricated construction cannot be cultivated with an incomplete, inaccurate, and untimely data exchange and lack of real-time visibility and traceability. To deal with these challenges, an Internet of Things (IoT)-enabled platform is designed by integrating IoT and BIM for prefabricated public housing projects in Hong Kong. The demands of the stakeholders were analysed; then smart construction objects (SCOs) and smart gateway are defined and designed to collect real-time data throughout the working processes of on-site assembly of prefabricated construction using the radio frequency identification (RFID) technology. The captured data is uploaded to cloud in real-time to process and analyse for decision support purposes for the involved site managers and workers. Visibility and traceability functions are developed with BIM and virtual reality (VR) technologies, through which managers can supervise the construction progress and approximate cost information in a real-time manner. The IoT-enabled platform can provide various decision support tools and services to different stakeholders, for improving the efficiency and effectiveness of daily operations, decision making, collaboration, and supervision throughout on-site assembly processes of prefabricated construction. © 2018 Elsevier B.V.",Article,"Final",Scopus,2-s2.0-85041490568
"Li J., Greenwood D., Kassem M.","Blockchain in the built environment and construction industry: A systematic review, conceptual models and practical use cases",2019,"Automation in Construction",120,"https://www.scopus.com/inward/record.uri?eid=2-s2.0-85062655898&doi=10.1016%2fj.autcon.2019.02.005&partnerID=40&md5=fa2ff537ecae8f73124cf714c19d4d7f","The construction industry is facing many challenges including low productivity, poor regulation and compliance, lack of adequate collaboration and information sharing, and poor payment practices. Advances in distributed ledger technologies (DLT), also referred to as Blockchain, are increasingly investigated as one of the constituents in the digital transformation of the construction industry and its response to these challenges. The overarching aim of this study was to analyse the current state of DLT in the built environment and the construction sector with a view to developing a coherent approach to support its adoption specifically in the construction industry. Three objectives were established to achieve this: (a) to present the first state-of-the-art and literature review on DLT in the built environment and construction industry providing a consolidated view of the applications explored and potential use cases that could support disruption of the construction industry. Seven use-categories were identified: [1] Smart Energy, [2] Smart Cities & the Sharing Economy, [3] Smart Government, [4] Smart Homes, [5] Intelligent Transport, [6] BIM and Construction Management, and [7] Business Models and Organisational Structures; (b) to propose a framework for implementation composed of two conceptual models (i.e. the DLT Four-Dimensional Model, and the DLT Actors Model), developed according to extended socio-technical systems theory and including four dimensions (technical, social, process and policy), to support the development of DLT-based solutions that are adequate to the challenges faced by the construction industry. The DLT Four-Dimensional Model and the DLT Actors Model contribute to improve the understanding of the concepts involved when discussing DLT applications in construction and represent flexible, adaptable and scalable knowledge constructs and foundations that can be used for various further investigations; and (c) to appraise three specific use cases (i.e. Project Bank Accounts, regulation and compliance, and a single shared-access BIM model) as potential areas for DLT through the application of a decision support tool. The results show that Project Bank Accounts (PBAs) and regulation and compliance are candidate areas for DLT applications and warrant further attention. However, for the third use case (i.e. single shared-access BIM model) DLT are still insufficiently developed at this time. The research shows that there is real potential for DLT to support digitalisation in the construction industry and enable solutions to many of its challenges. However, there needs to be further investigation of the readiness of the industry, its organisations and processes, and to evaluate what changes need to occur before implementation can be successful. Further investigations will include the development of a roadmap process incorporating the four dimensions to evaluate readiness across a series of use cases for the construction industry. © 2019 Elsevier B.V.",Article,"Final",Scopus,2-s2.0-85062655898
"Boje C., Guerriero A., Kubicki S., Rezgui Y.","Towards a semantic Construction Digital Twin: Directions for future research",2020,"Automation in Construction",113,"https://www.scopus.com/inward/record.uri?eid=2-s2.0-85082386834&doi=10.1016%2fj.autcon.2020.103179&partnerID=40&md5=914efcd6c064d6a97299f00d812bb8fc","As the Architecture, Engineering and Construction sector is embracing the digital age, the processes involved in the design, construction and operation of built assets are more and more influenced by technologies dealing with value-added monitoring of data from sensor networks, management of this data in secure and resilient storage systems underpinned by semantic models, as well as the simulation and optimisation of engineering systems. Aside from enhancing the efficiency of the value chain, such information-intensive models and associated technologies play a decisive role in minimising the lifecycle impacts of our buildings. While Building Information Modelling provides procedures, technologies and data schemas enabling a standardised semantic representation of building components and systems, the concept of a Digital Twin conveys a more holistic socio-technical and process-oriented characterisation of the complex artefacts involved by leveraging the synchronicity of the cyber-physical bi-directional data flows. Moreover, BIM lacks semantic completeness in areas such as control systems, including sensor networks, social systems, and urban artefacts beyond the scope of buildings, thus requiring a holistic, scalable semantic approach that factors in dynamic data at different levels. The paper reviews the multi-faceted applications of BIM during the construction stage and highlights limits and requirements, paving the way to the concept of a Construction Digital Twin. A definition of such a concept is then given, described in terms of underpinning research themes, while elaborating on areas for future research. © 2020 The Authors",Review,"Final",Scopus,2-s2.0-85082386834
"Jazizadeh F., Ghahramani A., Becerik-Gerber B., Kichkaylo T., Orosz M.","Human-building interaction framework for personalized thermal comfort-driven systems in office buildings",2014,"Journal of Computing in Civil Engineering",107,"https://www.scopus.com/inward/record.uri?eid=2-s2.0-84891479841&doi=10.1061%2f%28ASCE%29CP.1943-5487.0000300&partnerID=40&md5=9ce5db59c9ebb953a316e478ea2ecb9e","Centrally controlled heating, ventilation, and air conditioning (HVAC) systems in commercial buildings are operated by building management systems (BMS) based on the predefined operational settings and a set of assumptions. Despite the high rate of energy consumption by HVAC systems in commercial buildings, observations showed that a significant portion of the occupants remain dissatisfied with thermal conditions. One of the main reasons is that HVAC systems do not take into account personalized comfort preferences in their operational rules. This study proposes a framework to integrate building occupants in the HVAC control loop, learn their comfort profiles, and control the HVAC system based on occupants' personalized comfort profiles. The framework fuses occupants' comfort perception indices (i.e., comfort votes provided by users and mapped to a numerical value), collected through participatory sensing, and ambient temperature data, collected through a sensor network, and computes occupants' comfort profiles by using a fuzzy rule-based descriptive and predictive model. The performance of the comfort-profiling algorithm was assessed using human subject data and synthetically generated data. For actuation, a BMS controller was proposed and tested in two zones of an office building. The BMS controller uses a proportional controller algorithm that regulates room temperatures to be equidistant from preferred temperatures of all occupants in the same thermal zone. Validation of the framework components demonstrated that the nonlinear underlying pattern of the thermal comfort sensation scale could accurately be recognized. Results of the BMS controller experiments revealed that the proportional controller algorithm is capable of keeping the thermal zones' temperatures in the ranges of preferred temperatures. © 2014 American Society of Civil Engineers.",Article,"Final",Scopus,2-s2.0-84891479841
"Tasca P., Tessone C.J.","A taxonomy of blockchain technologies: Principles of identification and classification",2019,"Ledger",100,,[No abstract available],,"Final",Scopus,2-s2.0-85055604208
"Henisz W.J., Levitt R.E., Scott W.R.","Toward a unified theory of project governance: Economic, sociological and psychological supports for relational contracting",2012,"Engineering Project Organization Journal",99,,[No abstract available],,"Final",Scopus,2-s2.0-84875366993
"Frizzo-Barker J., Chow-White P.A., Adams P.R., Mentanko J., Ha D., Green S.","Blockchain as a disruptive technology for business: A systematic review",2020,"International Journal of Information Management",95,"https://www.scopus.com/inward/record.uri?eid=2-s2.0-85075538339&doi=10.1016%2fj.ijinfomgt.2019.10.014&partnerID=40&md5=2cb0dc449c6c1213300549d2114041a2","Blockchain is the latest ‘disruptive innovation’ that has caught scholars’ attention. It is the underlying technology for Bitcoin and other digital currencies. Stakeholders like developers, entrepreneurs, and technology enthusiasts claim blockchain has the potential to reconfigure the contemporary economic, legal, political and cultural landscape. Skeptics claim the concept and its applications remain ambiguous and uncertain. Business scholars began publishing studies on the emergence and impact of blockchain, bitcoin, and related projects in 2014. In this study, we conduct a PRISMA guided systematic review of blockchain research in the business literature from 2014 to 2018. Our results show a rapid increase of studies over the five year period. The findings also convey key insights about the current state of scholarly investigation on blockchain, including its top benefits and challenges for business and society. We found that blockchain remains an early-stage domain of research in terms of theoretical grounding, methodological diversity, and empirically grounded work. We suggest research directions to improve our understanding of the state of blockchain and advance future research of this increasingly important and expansive area. © 2019 Elsevier Ltd",Article,"Final",Scopus,2-s2.0-85075538339
"Crozet M., Milet E.","Should everybody be in services? The effect of servitization on manufacturing firm performance",2017,"Journal of Economics and Management Strategy",90,"https://www.scopus.com/inward/record.uri?eid=2-s2.0-85018948303&doi=10.1111%2fjems.12211&partnerID=40&md5=bd88a14ff42388391c21c9ac72efbaeb","The servitization of the manufacturing sector refers to the evolution of manufacturers' capabilities to offer services as complements to or substitutes for the goods that they produce. A vast literature has described these strategies and has shown that this phenomenon is widespread and growing in most developed economies. However, very little systematic evidence of the extent or consequences of servitization based on a comprehensive data set of firms exists. In this paper, we provide such evidence using exhaustive data for French manufacturing firms between 1997 and 2007. We find that the vast majority of French manufacturers sell services in addition to producing goods. The shift toward services is growing steadily but at a slow pace. We also estimate the impact of servitization on firm performance. Controlling for various sources of endogeneity bias, our most conservative results show that firms that start selling services increase their profitability by 0.4%, their employment by 2.1%, and their total sales by 0.6%. For small businesses, we also find a positive impact on the production of goods. We also uncover strong heterogeneity across manufacturing industries. © 2017 Wiley Periodicals, Inc.",Article,"Final",Scopus,2-s2.0-85018948303
"Perera S., Nanayakkara S., Rodrigo M.N.N., Senaratne S., Weinand R.","Blockchain technology: Is it hype or real in the construction industry?",2020,"Journal of Industrial Information Integration",88,"https://www.scopus.com/inward/record.uri?eid=2-s2.0-85078491522&doi=10.1016%2fj.jii.2020.100125&partnerID=40&md5=05d7f7fd510f32dad3d51f26f567a8ca","The dawn of the 21st century has seen the advent of many technologies targeting commercial and financial sectors. These include Big Data, Internet of Things and FinTechs such as blockchain. Blockchain is a type of a distributed database that is used to replicate, share, and synchronise data spread across different geographical locations such as multiple sites, countries, or organisations. The main property of blockchain is that there is no central administrator or centralised data storage mechanism. Consensus algorithms govern the peer-to-peer decentralised network. Numerous benefits and applications of blockchains have resulted in it becoming popular among a broad spectrum of businesses, but is it the case in the construction industry? Given, the backward nature of the construction industry in digitalisation and its reticence to change, it becomes important to analyse the potential impact of Blockchains as a potential disruptive technology. Although there exists a significant research gap and the potential possibility to test blockchain in the construction sector, the construction industry is historically reported as the second lowest sector to have adopted information technology. This leads to a conundrum whether blockchain is a pure technological hype or whether there is a real potential application in construction. The paper is aimed at critically analysing the application potential of blockchains in construction through a use case analysis and comprehensive literature review to resolve whether it is pure hype or real. The exploration revealed that due to the exponential uses of blockchain, investments involved, and a number of start-up businesses contributing to Industry 4.0, blockchain indeed has a credible potential in the construction industry. © 2020 Elsevier Inc.",Review,"Final",Scopus,2-s2.0-85078491522
"Dixon T., Pottinger G., Jordan A.","Lessons from the private finance initiative in the UK: Benefits, problems and critical success factors",2005,"Journal of Property Investment and Finance",84,"https://www.scopus.com/inward/record.uri?eid=2-s2.0-24344440678&doi=10.1108%2f14635780510616016&partnerID=40&md5=3315bcee4c2ed9f6b384b00fcc437e29","Purpose - This paper summarises the main research findings from a detailed, qualitative set of structured interviews and case studies of private finance initiative (PFI) schemes in the UK, which involve the construction of built facilities. The research, which was funded by the Foundation for the Built Environment, examines the emergence of PFI in the UK. Benefits and problems in the PFI process are investigated. Best practice, the key critical factors for success, and lessons for the future are also analysed. Design/methodology/approach - The research is based around 11 semi-structured interviews conducted with stakeholders in key PFI projects in the UK. Findings - The research demonstrates that value for money and risk transfer are key success criteria. High procurement and transaction costs are a feature of PFI projects, and the large-scale nature of PFI projects frequently acts as barrier to entry. Research limitations/implications - The research is based on a limited number of in-depth case study interviews. The paper also shows that further research is needed to find better ways to measure these concepts empirically. Practical implications - The paper is important in highlighting four main areas of practical improvement in the PFI process: Value for money assessment; establishing end-user needs; developing competitive markets and developing appropriate skills in the public sector. Originality/value - The paper examines the drivers, barriers and critical success factors for PFI in the UK for the first time in detail and will be of value to property investors, financiers, and others involved in the PFI process. © Emerald Group Publishing Limited.",Article,"Final",Scopus,2-s2.0-24344440678
"Pätäri S., Sinkkonen K.","Energy Service Companies and Energy Performance Contracting: Is there a need to renew the business model? Insights from a Delphi study",2014,"Journal of Cleaner Production",81,"https://www.scopus.com/inward/record.uri?eid=2-s2.0-84893817341&doi=10.1016%2fj.jclepro.2013.10.017&partnerID=40&md5=bfe369e95534e0842b8b798325474df8","Energy Service Companies have faced strong expectations to capitalise on large but untapped energy-efficiency opportunities, but have fallen short in terms of diffusion. This paper focuses on the viability of a business model based on Energy Performance Contracting. Following a two-round Delphi study conducted in Finland, we analyse the insights provided by the experts through the Hamel business model framework. The main aim is to increase understanding of the model that Energy Service Companies use, and to identify the main factors that hinder their business development. The findings suggest that rather little is known about these companies and their service offerings. The uncertainty surrounding the business affects the customers' readiness to invest their time and resources in the projects. One of the key development needs for the business is thus to put a strong emphasis on both the visible and the invisible benefits. © 2013 Elsevier Ltd. All rights reserved.",Article,"Final",Scopus,2-s2.0-84893817341
"Meacham B., Bowen R., Traw J., Moore A.","Performance-based building regulation: Current situation and future needs",2005,"Building Research and Information",79,"https://www.scopus.com/inward/record.uri?eid=2-s2.0-12844249367&doi=10.1080%2f0961321042000322780&partnerID=40&md5=681da60985e6f291e0b1f9f5c8e8cd14","Although performance-based building regulations are in use or under development in numerous countries worldwide, there remain significant challenges in adequately identifying and defining performance, in understanding and addressing diverse societal expectations, and in establishing robust performance-based regulatory systems. These challenges become intensified as the building construction market becomes increasingly global, with the resulting expectation that building regulatory instruments remain valid across borders and do not create barriers to trade, while at the same time address local and national needs without compromising local cultural and societal norms. Many of these issues are just now beginning to be explored, and there is significant opportunity and need for future research and development in these areas.",Review,"Final",Scopus,2-s2.0-12844249367
