Authors,Title,Year,Source title,Cited by,Link,Abstract,Document Type,Publication Stage,Source,EID
"Jiang Z., Guo Y., Wang Z.","Digital twin to improve the virtual-real integration of industrial IoT",2021,"Journal of Industrial Information Integration",14,"https://www.scopus.com/inward/record.uri?eid=2-s2.0-85098952548&doi=10.1016%2fj.jii.2020.100196&partnerID=40&md5=dde6cbc7227195c0e2168eb57671cf2b","The Industrial Internet of Things (IIoT) brings value-added services to traditional devices and has become an important business and technology mode in the industry 4.0 era. While, the combination of digital twin (DT) and the IoT can promote the integration of the physical world (real) and the digital world (virtual), which becomes the key to give play to the value of the IIoT. This research analyzes the concept of DT and several influential DT framework models and concludes that the implementation of DT focuses on data, models, and services (DMS framework). This framework is applied to the device acquisition layer and the remote system layer of IIoT, and the DT of the device is composed logically by constructing partial DT with different functions. The IoT system formed by this approach focuses on ""device-DT-application"". This method has guided the establishment of the IoT of Gas-insulated Switchgear (GIS) and been proved to be feasible. It proposes a unified architecture for IoT systems, which can flexibly support an internal extension of the DT and multi-DT connection to map complex systems better in the digital world. It isolates the direct access of business to equipment, strengthens the division and cooperation between local and cloud, and promotes the integration and synchronization of virtual and real. Also, this study provides some references for the collaborative framework between the edge and the cloud. © 2020 Elsevier Inc.",Article,"Final",Scopus,2-s2.0-85098952548
"Glatt M., Sinnwell C., Yi L., Donohoe S., Ravani B., Aurich J.C.","Modeling and implementation of a digital twin of material flows based on physics simulation",2021,"Journal of Manufacturing Systems",14,"https://www.scopus.com/inward/record.uri?eid=2-s2.0-85085323138&doi=10.1016%2fj.jmsy.2020.04.015&partnerID=40&md5=3aeeb8f94f435c13d734d2ede73dae82","Cyber-physical production systems enable adaptivity and flexibility when manufacturing customized products in small batches. Due to varying routes and a high variance of workpieces, material flows in cyber-physical production systems can get highly complex, which can lead to physically induced disturbances that can result in accidents or decreased throughput and high costs. This issue can be addressed by applying a physics engine to simulate the physical interaction between workpieces and the material handling systems during the operation. Connecting such a digital model to a real material handling system in order to derive simulation-based decision support leads to the concept of digital twins. To date, few practical implementations of digital twins in manufacturing outside the machine tool domain were reported. Therefore, this paper describes the modeling and the subsequent implementation of an integrated system that consists of a real material handling system and its digital twin, based on physics simulation. A practical use case demonstrates the versatile advantages of the implemented solution for a manufacturing system with respect to the three digital twin functions prediction, monitoring and diagnosis. © 2020 The Society of Manufacturing Engineers",Article,"Final",Scopus,2-s2.0-85085323138
"Mourtzis D., Boli N., Alexopoulos K., Rózycki D.","A Framework of Energy Services: From Traditional Contracts to Product-Service System (PSS)",2018,"Procedia CIRP",14,"https://www.scopus.com/inward/record.uri?eid=2-s2.0-85047057509&doi=10.1016%2fj.procir.2017.11.118&partnerID=40&md5=4913a5fcaff7d512ca2295e484932862","The sustainability, the environmental impact, as well as the operating costs of a production site, are highly dependent on energy consumption. Having as a main objective to address the aforementioned challenges, this work proposes an energy services framework which introduces a new way of energy services management and which aims at reducing the environmental footprint of production sites through the control and monitoring of electrical energy usage. Following the shift to Servitization, energy suppliers want to offer more than traditional energy contracts to their industrial customers. Considering that tendency, an Energy Services Framework with three interdependent services namely Environmental Impact Calculator, Energy Demand Management and Power Interruption Planner is proposed. The proposed framework is validated using real data from an energy supplier and its potential customers. © 2018 The Authors. Published by Elsevier B.V. This is an open access article under the CC BY-NC-ND license.",Conference Paper,"Final",Scopus,2-s2.0-85047057509
"Schär F.","Decentralized Finance: On Blockchain- and Smart Contract-based Financial Markets",2020,"Decentralized finance: On blockchain-and smart contract-based financial markets",13,,[No abstract available],,"Final",Scopus,2-s2.0-85086778061
"Papachristos G., Jain N., Burman E., Zimmermann N., Mumovic D., Davies M., Edkins A.","Low carbon building performance in the construction industry: A multi-method approach of project management operations and building energy use applied in a UK public office building",2020,"Energy and Buildings",12,"https://www.scopus.com/inward/record.uri?eid=2-s2.0-85075021572&doi=10.1016%2fj.enbuild.2019.109609&partnerID=40&md5=4d32bfb537c07faf193d023a677ab0bf","The “performance gap” in the United Kingdom construction industry is a persistent problem as new building development projects underperform more often than not. The “performance gap” is partially attributed to the number of stages involved in building project development and the coordination difficulties of partners with different incentives. The project outcome is important for energy consumption, carbon emissions and occupant well-being. Thus, it is important to study the project management process in terms of the standard time, cost and quality parameters, but also in terms of project partner incentives and coordination, and the subsequent energy performance and resultant indoor environmental conditions. A system dynamics model of project management processes is developed to explore the implications of partner coordination for building quality. The system dynamics model is coupled to a building performance simulation model to explore building energy consumption and Indoor Environmental Quality, and apply this on a recent building project case study. Results show that greater project partner alignment can reduce annual energy consumption up to 12% and CO2 emissions up to 37%, with greater emphasis in the design stage of the project subject to resource availability. The trade-offs involved on value appropriation are considered and discussion of results points to possible ways for improvement. © 2019 Elsevier B.V.",Article,"Final",Scopus,2-s2.0-85075021572
"Nguyen B., Buscher V., Cavendish W., Gerber D., Leung S., Krzyzaniak A., Robinson R., Burgess J., Proctor M., O'Grady K., Flapper T.","Blockchain and The Built Environment: Arup",2019,"Blockchain and the Built Environment",12,,[No abstract available],,"Final",Scopus,2-s2.0-85080744478
"Ye X., König M.","Framework for Automated Billing in the Construction Industry Using BIM and Smart Contracts",2021,"Lecture Notes in Civil Engineering",11,"https://www.scopus.com/inward/record.uri?eid=2-s2.0-85088420729&doi=10.1007%2f978-3-030-51295-8_57&partnerID=40&md5=597afcf7b97ceca3e20e23090731df3e","Building Information Modeling (BIM) represents the application of digital building models to improve project-wide collaboration. With the help of building information models, elements with tendering information, construction work to be carried out, quantities to be processed, planned times and subcontractors commissioned can be described in an integrated way. However, digital models are currently still little used for the automated billing of construction work. In this paper, an approach is presented to make contract management and payment within construction projects simpler, more transparent and more automated. The implementation takes place with the help of Smart Contracts, which are linked to digital building information models. For this purpose, a billing model and processes for checking the contract are defined on the basis of the building elements, determined quantities and defined construction works. If the contracted construction has been checked and accepted, the payment procedure is started automatically. The Smart Contract, as well as the individual transactions, are managed using Blockchain technology. Detailed contract data and execution information is stored in a common data environment (CDE) and linked to the Smart Contract. The concept for the realization of “BIM contracts” as well as aspects of the implementation are presented in this paper. Finally, we discuss several aspects for improvement and further development in the future. © 2021, The Editor(s) (if applicable) and The Author(s), under exclusive license to Springer Nature Switzerland AG.",Book Chapter,"Final",Scopus,2-s2.0-85088420729
"Gurcan O., Agenis-Nevers M., Batany Y.-M., Elmtiri M., Le Fevre F., Tucci-Piergiovanni S.","An Industrial Prototype of Trusted Energy Performance Contracts Using Blockchain Technologies",2019,"Proceedings - 20th International Conference on High Performance Computing and Communications, 16th International Conference on Smart City and 4th International Conference on Data Science and Systems, HPCC/SmartCity/DSS 2018",11,"https://www.scopus.com/inward/record.uri?eid=2-s2.0-85062493839&doi=10.1109%2fHPCC%2fSmartCity%2fDSS.2018.00222&partnerID=40&md5=22b858c2ebc6e3a7d7e9eeb736fcb941","Energy conservation measurements in buildings are more and more popular as they benefit from an intelligent contractual framework called Energy Performance Contracts (EPC), where energy savings are measured as the difference between a predictive baseline model and the actual consumption. While modern predictive models make use of large amounts of data from external sources and increasingly complex algorithms, these two aspects make their use difficult in practice because they need mutual understanding and transparency, requiring the involvement of a third-party for auditing. In this sense, we designed and developed a prototype that overcomes these issues by storing the predictive models and the data in an immutable blockchained data structure using the Ethereum framework. To the best of our knowledge, this is the first working prototype using the blockchain technology applied to EPCs. This paper presents and discusses the technical solutions and best-practice guidelines adopted in this prototype. © 2018 IEEE.",Conference Paper,"Final",Scopus,2-s2.0-85062493839
"Tezel A., Febrero P., Papadonikolaki E., Yitmen I.","Insights into Blockchain Implementation in Construction: Models for Supply Chain Management",2021,"Journal of Management in Engineering",7,"https://www.scopus.com/inward/record.uri?eid=2-s2.0-85105865993&doi=10.1061%2f%28ASCE%29ME.1943-5479.0000939&partnerID=40&md5=880d7945f4ee832377c5be20fb7a7247","The interest in the implementation of distributed ledger technologies (DLTs) is on the rise in the construction sector. One specific type of DLT that has recently attracted much attention is blockchain. Blockchain has been mostly discussed conceptually for construction to date. This study presents some empirical discussions on supply chain management (SCM) applications of blockchain for construction by collecting feedback for three blockchain-based models: project bank accounts (PBAs) for payments, reverse auction-based tendering for bidding, and asset tokenization for project financing. The feedback was collected from three focus groups and a workshop. The working prototypes for the models were developed on Ethereum. The implementation of blockchain in payment arrangements was found to be simpler than in tendering and project tokenization workflows. However, the blockchain integration of those workflows may have large-scale impacts on the sector in the future. A broad set of general and model-specific benefits/opportunities and requirements/challenges was also identified for blockchain in construction. Some of these include streamlined, transparent transactions and rational trust building, and the need for challenging the sector culture, upscaling the legacy information technology (IT) systems, and compliance with the regulatory structures. © 2021 American Society of Civil Engineers.",Article,"Final",Scopus,2-s2.0-85105865993
"Voshmgir B.S., Zargham M.","Foundations of cryptoeconomic systems, cryptoeconomics work",2019,"Foundations of Cryptoeconomic Systems",7,,[No abstract available],,"Final",Scopus,2-s2.0-85082190199
"O’Reilly A., Mathews M.","Incentivising Multidisciplinary Teams with New Methods of Procurement Using BIM + Blockchain",2019,"Incentivising Multidisciplinary Teams with New Methods of Procurement Using BIM + Blockchain",7,,[No abstract available],,"Final",Scopus,2-s2.0-85092675750
"Dapp M.M.","Toward a sustainable circular economy powered by community-based incentive systems",2018,"Business Transformation through Blockchain: Volume II",7,"https://www.scopus.com/inward/record.uri?eid=2-s2.0-85085724669&doi=10.1007%2f978-3-319-99058-3_6&partnerID=40&md5=46d601fc026b02afc0dbdedc21c3cff6",[No abstract available],Book Chapter,"Final",Scopus,2-s2.0-85085724669
"Office for Infrastructure and Logistics","Manual of Standard Building Specifications",2011,"Manual of Standard Building Specifications",7,,[No abstract available],,"Final",Scopus,2-s2.0-85047167608
"Etherscan",[No title available],2020,"Ethereum Average Gas Limit Chart",6,,[No abstract available],,"Final",Scopus,2-s2.0-85095320520
"Scheepbouwer E., Gransberg D.D., Lopez Del Puerto C.","Construction engineering management culture shift: Is the lowest tender offer dead?",2017,"Front. Eng. Manage.",6,,[No abstract available],,"Final",Scopus,2-s2.0-85070116646
"Ballandies M.C., Dapp M.M., Pournaras E.","Decrypting distributed ledger design—taxonomy, classification and blockchain community evaluation",2021,"Cluster Computing",5,"https://www.scopus.com/inward/record.uri?eid=2-s2.0-85105178058&doi=10.1007%2fs10586-021-03256-w&partnerID=40&md5=80f085dfabbbeecc3f0ce80439e411d0","More than 1000 distributed ledger technology (DLT) systems raising $600 billion in investment in 2016 feature the unprecedented and disruptive potential of blockchain technology. A systematic and data-driven analysis, comparison and rigorous evaluation of the different design choices of distributed ledgers and their implications is a challenge. The rapidly evolving nature of the blockchain landscape hinders reaching a common understanding of the techno-socio-economic design space of distributed ledgers and the cryptoeconomies they support. To fill this gap, this paper makes the following contributions: (i) A conceptual architecture of DLT systems with which (ii) a taxonomy is designed and (iii) a rigorous classification of DLT systems is made using real-world data and wisdom of the crowd. (iv) A DLT design guideline is the end result of applying machine learning methodologies on the classification data. Compared to related work and as defined in earlier taxonomy theory, the proposed taxonomy is highly comprehensive, robust, explanatory and extensible. The findings of this paper can provide new insights and better understanding of the key design choices evolving the modeling complexity of DLT systems, while identifying opportunities for new research contributions and business innovation. © 2021, The Author(s).",Article,"Article in Press",Scopus,2-s2.0-85105178058
"Brilakis I., Pan Y., Borrmann A., Mayer H., Rhein F., Vos C., Pettinato E., Wagner S.",[No title available],2022,"Built Environment Digital Twinning",4,,[No abstract available],,"Final",Scopus,2-s2.0-85108350238
"Hamledari H., Fischer M.","Construction payment automation using blockchain-enabled smart contracts and robotic reality capture technologies",2021,"Automation in Construction",4,"https://www.scopus.com/inward/record.uri?eid=2-s2.0-85114236304&doi=10.1016%2fj.autcon.2021.103926&partnerID=40&md5=c641a1262221a16f9065af7e798264cb","This paper introduces an autonomous payment administration solution, integrating blockchain-enabled smart contracts and robotic reality capture technologies. The construction progress is captured, analyzed, and documented respectively using sensing, machine intelligence, and as-built building information models (BIM). The progress data is stored in a distributed manner using content addressable file sharing; it is then broadcasted to a smart contract which administers payments and transfers lien rights respectively using crypto currencies/tokens and non-fungible tokens (NFT). The method was successfully implemented for payments to 7 subcontractors in two real-world commercial construction projects in Canada and United States where progress was captured using a camera-equipped unmanned aerial vehicle (UAV) and an unmanned ground vehicle (UGV) equipped with a laser scanner. The method eliminates reliance on today's heavily intermediated payment applications and showed promise for achieving accurate, efficient, and timely payment administration. Future work should further explore the connections between off- and on-chain realities. © 2021 Elsevier B.V.",Article,"Final",Scopus,2-s2.0-85114236304
"Sigalov K., Ye X., König M., Hagedorn P., Blum F., Severin B., Hettmer M., Hückinghaus P., Wölkerling J., Groß D.","Automated payment and contract management in the construction industry by integrating building information modeling and blockchain-based smart contracts",2021,"Applied Sciences (Switzerland)",3,"https://www.scopus.com/inward/record.uri?eid=2-s2.0-85113372086&doi=10.3390%2fapp11167653&partnerID=40&md5=2665e238d311502cf5b6b87eb94377b4","Construction projects usually involve signing various contracts with specific billing proce-dures. In practice, dealing with complex contract structures causes significant problems, especially with regard to timely payment and guaranteed cash flow. Furthermore, a lack of transparency leads to a loss of trust. As a result, late or non-payment is a common problem in the construction industry. This paper presents the concept of implementing smart contracts for automated, transparent, and traceable payment processing for construction projects. Automated billing is achieved by combining Building Information Modeling (BIM) approaches with blockchain-based smart contracts. Thereby, parts of traditional construction contracts are transferred to a smart contract. The smart contract is set up using digital BIM-based tender documents and contains all of the relevant data for financial transactions. Once the contracted construction work has been accepted by the client, payments can be made automatically via authorized financial institutions. This paper describes the framework, referred to as BIMcontracts, the container-based data exchange, and the digital contract management workflow. It discusses the industry-specific requirements for blockchain and data storage and explains which technical and software architectural decisions were made. A case study is used to demonstrate the current implementation of the concept. © 2021 by the authors. Licensee MDPI, Basel, Switzerland.",Article,"Final",Scopus,2-s2.0-85113372086
"Hunhevicz J.J., Schraner T., Hall D.M.","Incentivizing high-quality data sets in construction using blockchain: A feasibility study in the swiss industry",2020,"Proceedings of the 37th International Symposium on Automation and Robotics in Construction, ISARC 2020: From Demonstration to Practical Use - To New Stage of Construction Robot",3,"https://www.scopus.com/inward/record.uri?eid=2-s2.0-85108338599&partnerID=40&md5=6939d9462230abfffc1b6659529830ba","Data sets are often incomplete and lowquality at the end of a construction project. This creates rework or hinders opportunities to use data during future activities of the facility lifecycle (e.g. facility management, renovation, demolition). This research prototypes and evaluates a novel process to use blockchain and smart contracts in construction projects to incentivize high quality data sets. The proposed solution is defined in collaboration with construction professionals. The process traces and saves project data while incentivizing participants to create high-quality data sets through reward tokens. To validate the process, an Ethereum-based blockchain prototype is developed. A simple case study is conducted in collaboration with local industry professionals to simulate how the prototype can function in a typical design bid build process used in Switzerland. The early findings and possible subsequent research steps are presented. Overall, it was found that such a blockchain based incentive systems has the potential to not only incentivize highquality data sets, but also change the way of tendering and related construction processes. © 2020 Proceedings of the 37th International Symposium on Automation and Robotics in Construction, ISARC 2020: From Demonstration to Practical Use - To New Stage of Construction Robot. All rights reserved.",Conference Paper,"Final",Scopus,2-s2.0-85108338599
"Scott D.J., Broyd T., Ma L.","Exploratory literature review of blockchain in the construction industry",2021,"Automation in Construction",2,"https://www.scopus.com/inward/record.uri?eid=2-s2.0-85114111875&doi=10.1016%2fj.autcon.2021.103914&partnerID=40&md5=a17680d6ef731f7c6f5be8e4a0ff4e76","First academic publications on blockchain in construction instantiated in 2017, with three documents. Over the course of several years, new literature emerged at an average annual growth rate of 184%, surmounting to 121 documents at time of writing this article in early 2021. All 121 publications were reviewed to investigate the expansion and progression of the topic. A mixed methods approach was implemented to assess the existing environment through a literature review and scientometric analysis. Altogether, 33 application categories of blockchain in construction were identified and organised into seven subject areas, these include (1) procurement and supply chain, (2) design and construction, (3) operations and life cycle, (4) smart cities, (5) intelligent systems, (6) energy and carbon footprint, and (7) decentralised organisations. Limitations included using only one scientific database (Scopus), this was due to format inconsistencies when downloading and merging various bibliographic data sets for use in visual mapping software. © 2021 The Authors",Review,"Final",Scopus,2-s2.0-85114111875
"Spychiger F., Tasca P., Tessone C. J.","Unveiling the importance and evolution of design components through the “tree of blockchain",2021,"Frontiers in Blockchain",2,,[No abstract available],,"Final",Scopus,2-s2.0-85109061445
"Papachristos G.","A modelling framework for the diffusion of low carbon energy performance contracts",2020,"Energy Efficiency",2,"https://www.scopus.com/inward/record.uri?eid=2-s2.0-85084820037&doi=10.1007%2fs12053-020-09866-4&partnerID=40&md5=c22d1f1a1e46f3a0ffd423a19f72116a","The building sector contributes significantly to global energy consumption and CO2 emissions. It is urgent to reduce them through the retrofit of the current building stock and improvements in new building designs. The energy performance contracts that can deliver energy consumption savings must have an attractive rate of return to make financial sense for public and private sector buildings. These contracts must also have a wide uptake in the market to improve significantly the energy performance of the building stock. This paper develops a hybrid bottom up and system dynamics modelling framework to: (1) explore the diffusion of energy performance contracts and its effect on operational building energy consumption and (2) facilitate integration into policy making. The bottom up modelling component is used to provide estimates of potential operational building energy use savings. The estimates are the input to the system dynamics diffusion model which is used to explore diffusion pathways of energy performance contracts. The framework will facilitate scenario and policy analysis for the diffusion of the contracts on the building stock and their potential impact on energy consumption and associated CO2 emissions. © 2020, Springer Nature B.V.",Article,"Final",Scopus,2-s2.0-85084820037
