Authors,Title,Year,Source title,Cited by,Link,Abstract,Document Type,Publication Stage,Source,EID
"Buratti C., Ricciardi P., Vergoni M.","HVAC systems testing and check: A simplified model to predict thermal comfort conditions in moderate environments",2013,"Applied Energy",71,"https://www.scopus.com/inward/record.uri?eid=2-s2.0-84870869694&doi=10.1016%2fj.apenergy.2012.11.015&partnerID=40&md5=2d63a3cf15237f75deac415227f8a91b","An interesting tool for testing and check phases of HVAC systems was developed, in order to evaluate thermal comfort parameters only measuring temperature and relative humidity in moderate environments, for a wide range of clothing thermal insulation. A simplified approach to thermal comfort was developed in the seventies by Rohles, who found a correlation between PMV, air temperature and relative humidity, for sedentary activity and clothing thermal insulation equal to 0.6. clo. An improvement of Rohles model is proposed, aiming to extend results in a wider range of clothing thermal insulation (0.25-1.65. clo). Data from experimental campaigns in moderate environments were used to implement a function PMV. =PMV(T, RH) and diagrams PMV vs. temperature, for different values of relative humidity, were traced (nine equations and diagrams for male, female, and both sexes, and for three ranges of Icl). Standard deviation between measured and calculated data was evaluated and a mean error on PMV of ±0.22 was found; a T-Student test was also performed and results were significant. Mean Radiant Temperature data were used to calculate Operative Temperature and to correlate to PMV and to Neutral Temperature, corresponding to thermal comfort, by means of linear regression method. © 2012 Elsevier Ltd.",Article,"Final",Scopus,2-s2.0-84870869694
"Gruneberg S., Hughes W., Ancell D.","Risk under performance-based contracting in the UK construction sector",2007,"Construction Management and Economics",67,"https://www.scopus.com/inward/record.uri?eid=2-s2.0-34547600532&doi=10.1080%2f01446190601164097&partnerID=40&md5=a827e557e45d977fa13b003687541f94","As a method of procuring the services of the built environment, performance-based contracting (PBC) seeks to link the building supplier to longer term commitments than has traditionally been the case in the construction sector. By rewarding the building producer according to the way that building or structure delivers the users' requirements, rather than according to a list of assembled parts, a number of additional risks are taken by contractors, including fitness for purpose, costs and briefing. The extent to which contractors recognize these risks and their methods of dealing with them vary considerably and are influenced by their attitudes towards risk. As the risks associated with PBC are seen as large, uninsurable, and vulnerable to changing client requirements, the majority of respondents would reject the use of PBC as a method of contracting. Nevertheless, PBC may be used under particular conditions, where rewards are deemed sufficient to compensate for the additional risk to the contractor of undertaking work on the basis of a stream of payments paid over the life of a structure depending on the satisfactory performance of the building or as part of a private finance initiative.",Article,"Final",Scopus,2-s2.0-34547600532
"Kaewunruen S., Lian Q.","Digital twin aided sustainability-based lifecycle management for railway turnout systems",2019,"Journal of Cleaner Production",54,"https://www.scopus.com/inward/record.uri?eid=2-s2.0-85065500423&doi=10.1016%2fj.jclepro.2019.04.156&partnerID=40&md5=0e84e0f706252c9d902bb9b7bfe1a1ae","Railway turnouts or so-called ‘switches and crossings’ are complex systems by nature of design and construction. Railway turnouts are used to change direction of trains from one to another. They require high-quality construction and maintenance, in order to minimise rapid degradation and component failures that could result in train derailments. Due to the complexity of railway turnouts, the efficiency and effectiveness of maintenance can be improved by integrating existing practice by Building Information Modelling (BIM). This research establishes and analyses the world's first 6D BIM for life cycle management of a railway turnout system. The BIM (Level 3)has integrated 6-dimensions of field data information based on Revit-2018 and Navisworks-2018 platforms. The digital twins of a railway turnout in 3D embrace time schedule, costs and sustainability across the whole life cycle. The use of BIM for railway turnout systems has the potential to improve the overall information flow of the turnout planning and design, manufacturing pre-assembly and logistic, construction and installation, operation and management and demolition, thereby achieving better project performance and quality. Based on integrated information of railway turnout system, the 6D BIM has the ability to assess on economic, management and sustainability, and achieve a balance among them. This is the word first to demonstrate that BIM can fully deliver its essential benefits by information sharing, easing technical communication, improving design quality, reducing of design errors, accelerating implementation, speeding up work, shortening construction duration, reducing construction costs, enhancing carbon efficiency, supporting project management, and providing its owners with higher operational efficiency over the railway turnout system life-cycle. The results reveal that embodied material emission is the main contributor towards carbon footprint, especially produced during the manufacturing stage. The reconstruction stage contributes the most expensive phase of life cycle. The insight will significantly benefit the co-value creation among engineers, project managers, technicians, and senior management team. © 2019 Elsevier Ltd",Article,"Final",Scopus,2-s2.0-85065500423
"Borrmann A., König M., Koch C., Beetz J.","Preface",2018,"Building Information Modeling: Technology Foundations and Industry Practice",54,"https://www.scopus.com/inward/record.uri?eid=2-s2.0-85083937880&doi=10.1007%2f978-3-319-92862-3&partnerID=40&md5=5664fc9626084cf58025b940e98bba58",[No abstract available],Editorial,"Final",Scopus,2-s2.0-85083937880
"Huang S., Wang G., Yan Y., Fang X.","Blockchain-based data management for digital twin of product",2020,"Journal of Manufacturing Systems",52,"https://www.scopus.com/inward/record.uri?eid=2-s2.0-85079151075&doi=10.1016%2fj.jmsy.2020.01.009&partnerID=40&md5=2eb4194f639b30af9eec3c258d62ddb9","The concept of digital twin was originally proposed to assist product lifecycle management through the high-fidelity virtual product. In product lifecycle, there are many participators constructing a complicated network with enormous product lifecycle data. It is difficult to manage data of digital twin efficiently and securely from the perspectives of data storage, data access, data sharing, and data authenticity among the complicated network. Moreover, the virtual product is always updated to the latest state of the physical product by overwriting the history virtual product that records the development process of digital twin. To address abovementioned data management problems simultaneously, a data management method for digital twin of product based on blockchain technology is proposed in this paper. A peer-to-peer network is constructed to enhance data sharing efficiency among participators. The basic structure of blockchain is introduced, including block, chain, and transaction. The blockchain is used for data storage through cryptography that ensuring only eligible participators can access the corresponding data. The change sensitive characteristic of blockchain can ensure data authenticity as well. In addition, the concept of smart contract can be used to execute some actions automatically to increase data sharing efficiency. A case study is presented to demonstrate the effectiveness of the proposed data management method. The results show that the proposed method can solve the abovementioned data management problems simultaneously. © 2020 The Society of Manufacturing Engineers",Article,"Final",Scopus,2-s2.0-85079151075
"Mason J.","Intelligent contracts and the construction industry",2017,"J. Leg. Aff. Dispute Resolut. Eng. Constr.",52,,[No abstract available],,"Final",Scopus,2-s2.0-85059827438
"Nawari N.O., Ravindran S.","Blockchain and the built environment: Potentials and limitations",2019,"Journal of Building Engineering",51,"https://www.scopus.com/inward/record.uri?eid=2-s2.0-85067577174&doi=10.1016%2fj.jobe.2019.100832&partnerID=40&md5=74a271ab39edc3d8d866ab8bce48efec","Blockchain is a relatively new concept that originated from the first cryptocurrency known as Bitcoin and was soon noted to have a much wider range of applications than just serving as the platform for digital cryptocurrency. A blockchain (BC) is essentially a decentralized ledger that records every transaction made in the network, known as a ‘block’, the body of which comprises encrypted data of the entire transaction history. The implementation of decentralized technology in any industry would require augmented security, enforce accountability, and could potentially accelerate a shift in workflow dynamics from the current hierarchical structure to a decentralized, cooperative chain of command and affect a cultural and societal change by encouraging trust and transparency. This paper presents an evaluation survey of blockchain technology and its applications in the built environment and examines the potential integration with the BIM process. Moreover, the study explores how employing distributed ledger technology (DLT) could be advantageous in the BIM working environment by reinforcing network security, providing more reliable data storage and management of permissions, and ensuring change tracing and data ownership. The study discusses the basic fundamentals of distributed ledgers, their potential future applications and current advances, and their classification based on inherent characteristics of consensus reaching and permission management. Furthermore, the paper evaluates the potential application of BC technologies in enhancing the framework for automating the construction design review process such as smart contract technologies and Hyperledger Fabric, as well as discussing the pros, cons, and possible future research directions. © 2019",Review,"Final",Scopus,2-s2.0-85067577174
"Elghaish F., Abrishami S., Hosseini M.R.","Integrated project delivery with blockchain: An automated financial system",2020,"Automation in Construction",50,"https://www.scopus.com/inward/record.uri?eid=2-s2.0-85081692918&doi=10.1016%2fj.autcon.2020.103182&partnerID=40&md5=ef6c5a2b380368a2368f15e2dcac6e97","Integrated project delivery (IPD) in the architecture, engineering and construction (AEC) industry relies on risk/reward sharing and deferral of parties' profit payments until all project activities are completed. A decentralised, automated and secured financial platform is needed to enable all parties to control and track financial transactions, with no unauthorised changes allowed. The new technology, blockchain, enables data to be recorded, has no network participant with dominant power and manages data using specific functions, in line with smart contracts. The present study is the first to develop a framework proposing blockchain technology utilisation in IPD projects. The framework would enable core project team members to automatically execute all financial transactions, through coding the three main transactions of IPD projects: reimbursed costs, profit and cost saving, as functions of the IPD smart contract. To demonstrate the proposed framework's applicability, a “proof of concept” is developed and validated through an IPD case project. The practicality of the built-up hyperledger network (IBM® Blockchain Cloud Beta 2) and the advantages of the proposed smart contract functions are examined. The user-friendliness of the proposed financial system and its efficiency in automating all transactions are demonstrated. No deficiency is found in the blockchain network components. The study's findings, applied in a favourable external context, would facilitate IPD adoption and use across the AEC industry by providing a workable solution to existing financial barriers. The findings extend the horizon for further research on exploring blockchain's capabilities to solve comparable deficiencies to those affecting the AEC industry. © 2020 Elsevier B.V.",Article,"Final",Scopus,2-s2.0-85081692918
"Abergel T., Delmastro C.","Tracking Buildings 2020",2020,"Tracking Buildings 2020",47,,[No abstract available],,"Final",Scopus,2-s2.0-85096170018
"Deng Q., Zhang L., Cui Q., Jiang X.","A simulation-based decision model for designing contract period in building energy performance contracting",2014,"Building and Environment",43,"https://www.scopus.com/inward/record.uri?eid=2-s2.0-84886065916&doi=10.1016%2fj.buildenv.2013.09.010&partnerID=40&md5=9d02a32bb3492bc2fe95bc6692c5de45","This paper presents a simulation-based decision model for contract period determination in Energy Performance Contracting (EPC). The model attempts to assist the Energy Service Companies (ESCOs) on how long the contract period should be to balance the bidding competitiveness and the potential revenue loss. The uncertainties within the energy efficiency investment and the energy cost savings as return are addressed by stochastic processes, taking the maintenance and savings performance variations and the energy price fluctuations into account. Considering both the contract period and the energy cost savings guarantee, a framework is proposed to identify the profit sharing in EPC for both the owners and the ESCOs. An optimization model is derived accordingly, and the balanced length of the contract period is then reached. Finally, a campus case is presented to verify the applicability of the proposed model. The method can be used by industry practitioners as a decision support tool for contract period design, and is worth popularizing in other performance-based projects. © 2013.",Article,"Final",Scopus,2-s2.0-84886065916
"Hunhevicz J.J., Hall D.M.","Do you need a blockchain in construction? Use case categories and decision framework for DLT design options",2020,"Advanced Engineering Informatics",41,"https://www.scopus.com/inward/record.uri?eid=2-s2.0-85083420937&doi=10.1016%2fj.aei.2020.101094&partnerID=40&md5=7d35b9529c49a8ede45da6fe50599449","Blockchain and other forms of Distributed Ledger Technology (DLT) provide an opportunity to integrate digital information, management, and contracts to increase trust and collaboration within the construction industry. DLT enables direct peer-to-peer transactions of value across a distributed network by providing an immutable and transparent record of these transactions. Furthermore, there is potential for business process optimization and automation on the transaction level through the use of smart contracts, which are code protocols deployed on supported DLT systems. However, DLT research in the construction industry remains at a theoretical level; there have been few implementation case studies to date. One potential reason for this is a knowledge gap between use-case ideas and the DLT technical system implementation. This paper aims to reduce this gap by (1) reviewing and categorizing proposed DLT use cases in construction literature, (2) providing an overview of DLT and its design options, (3) proposing an integrated framework to match DLT design options with desired characteristics of a use case, and (4) analysing the use cases using the new framework. Together, the use case categories and proposed decision framework can guide future implementers toward more connected and structured thinking between the technological properties of DLT and use cases in construction. © 2020 Elsevier Ltd",Article,"Final",Scopus,2-s2.0-85083420937
"Bakens W., Foliente G., Jasuja M.","Engaging stakeholders in performance-based building: Lessons from the Performance-Based Building (PeBBu) Network",2005,"Building Research and Information",41,"https://www.scopus.com/inward/record.uri?eid=2-s2.0-12844285619&doi=10.1080%2f0961321042000322609&partnerID=40&md5=f3992cceb557158690f10b8da1d55d08","Despite decades of recognition and development, performance-based thinking and practice have not been as widely adopted by industry. To address this, the Performance-Based Building (PeBBu) Networks in Europe and Australia engaged a wide variety of industry stakeholders (on both 'supply' and 'demand' sides) in advancing the application of the performance approach in building processes. The background development, activities and accomplishments of the PeBBu Networks are presented together with some lessons learned from the experience of running the Network programmes. To engage stakeholders effectively, the performance approach should be presented as a business issue rather than primarily as a technical issue. The dominant need is for clear communication of the meaning, application and benefits of the performance approach, with emphasis on actual benefits and value.",Review,"Final",Scopus,2-s2.0-12844285619
"Shim C.-S., Dang N.-S., Lon S., Jeon C.-H.","Development of a bridge maintenance system for prestressed concrete bridges using 3D digital twin model",2019,"Structure and Infrastructure Engineering",39,"https://www.scopus.com/inward/record.uri?eid=2-s2.0-85066812168&doi=10.1080%2f15732479.2019.1620789&partnerID=40&md5=9ba1b50226ea35f615b5482a8a41562b","Preventive maintenance is increasingly becoming an essential strategy in the bridge industry owing to its proactive advantage of maintaining the structural sustainability during its entire service life. Several in-use bridges lack an appropriate regular maintenance solution, leading to extra cost during the operation stage. This paper proposes a new generation of the bridge maintenance system by using a digital twin model concept for more reliable decision-making. A detailed solution is proposed in this work to enhance the bridge maintenance process using a parallel solution: a maintenance information management system based on a 3D information model in conjunction with a digital inspection system using image processing. Three-dimensional digital models are required to utilise information from the entire lifecycle of a project, including design and construction, operation, and maintenance, by continuously exchanging and updating data from each stakeholder. For the maintenance of prestressed concrete bridges, the twin models are defined and their uses are presented. © 2019, © 2019 Informa UK Limited, trading as Taylor & Francis Group.",Article,"Final",Scopus,2-s2.0-85066812168
"Zhai Y., Chen K., Zhou J.X., Cao J., Lyu Z., Jin X., Shen G.Q.P., Lu W., Huang G.Q.","An Internet of Things-enabled BIM platform for modular integrated construction: A case study in Hong Kong",2019,"Advanced Engineering Informatics",39,"https://www.scopus.com/inward/record.uri?eid=2-s2.0-85074177142&doi=10.1016%2fj.aei.2019.100997&partnerID=40&md5=3c4ddbd098526809030e14f357b2849c","In recent years, Building Information Modelling (BIM) has been acting an important role in the delivery of Modular Integrated Construction (MiC) project. However, the full potential of BIM to MiC project cannot be realized without accurate information collection, timely information exchange, and automatic decision support throughout the project life cycle. In order to fulfil such requirements, this paper aims to develop an Internet of Things-enabled BIM platform (IBIMP) for the MiC project. A real-life project located in Hong Kong were deeply explored for developing the platform. The IBIMP consists of smart construction objects (SCOs) equipped with smart trinity tag (STT) and GPS sensor, smart gateway system, data source management service, location-based service, rule-based progress control service, as well as decision support services for prefabrication production, transportation, and on-site assembly processes. With the combination of advanced Internet of Things (IoT) technology and BIM technology, the barriers that hamper the possible functions of BIM can be overcame. By using application scenarios of a subsided sale flats MiC project in Hong Kong as examples, this study demonstrates how problems encountered by independent stakeholders such as inconvenient data collection, lack of automatic decision support, and incomplete information can be addressed by the IBIMP. © 2019 Elsevier Ltd",Article,"Final",Scopus,2-s2.0-85074177142
"Lu Q., Xie X., Parlikad A.K., Schooling J.M.","Digital twin-enabled anomaly detection for built asset monitoring in operation and maintenance",2020,"Automation in Construction",38,"https://www.scopus.com/inward/record.uri?eid=2-s2.0-85085247924&doi=10.1016%2fj.autcon.2020.103277&partnerID=40&md5=1f0230cdbd9e34660593d42dc02c0c7d","Effective asset management plays a significant role in delivering the functionality and serviceability of buildings. However, there is a lack of efficient strategies and comprehensive approaches for managing assets and their associated data that can help to monitor, detect, record, and communicate operation and maintenance (O&M) issues. With the importance of Digital Twin (DT) concepts being proven in the architecture, engineering, construction and facility management (AEC/FM) sectors, a DT-enabled anomaly detection system for asset monitoring and its data integration method based on extended industry foundation classes (IFC) in daily O&M management are provided in this study. This paper presents a novel IFC-based data structure, using which a set of monitoring data that carries diagnostic information on the operational condition of assets is extracted from building DTs. Considering that assets run under changing loads determined by human demands, a Bayesian change point detection methodology that handles the contextual features of operational data is adopted to identify and filter contextual anomalies through cross-referencing with external operation information. Using the centrifugal pumps in the heating, ventilation and air-cooling (HVAC) system as a case study, the results indicate and prove that the novel DT-based anomaly detection process flow realizes a continuous anomaly detection of pumps, which contributes to efficient and automated asset monitoring in O&M. © 2020 Elsevier B.V.",Article,"Final",Scopus,2-s2.0-85085247924
"Kinnaird C., Geipel M., Bew M.","Blockchain Technology: How the Inventions Behind Bitcoin are Enabling a Network of Trust for the Built Environment, ARUP",2017,"Blockchain Technology",37,,[No abstract available],,"Final",Scopus,2-s2.0-85053936123
"Pan Y., Zhang L.","A BIM-data mining integrated digital twin framework for advanced project management",2021,"Automation in Construction",35,"https://www.scopus.com/inward/record.uri?eid=2-s2.0-85100105417&doi=10.1016%2fj.autcon.2021.103564&partnerID=40&md5=49e39927fc17695bb17310d9e858b6c6","With the focus of smart construction project management, this paper presents a closed-loop digital twin framework under the integration of Building Information Modeling (BIM), Internet of Things (IoT), and data mining (DM) techniques. To be specific, IoT connects the physical and cyber world to capture real-time data for modeling and analyzing, and data mining methods incorporated in the virtual model aim to discover hidden knowledge in collected data. The proposed digital twin has been verified in a practical BIM-based project. Based on large inspection data from IoT devices, the 4D visualization and task-centered or worker-centered process model are built as the virtual model to simulate both the task execution and worker cooperation. Then, the high-fidelity virtual model is investigated by process mining and time series analysis. Results show that possible bottlenecks in the current process can be foreseen using the fuzzy miner, while the number of finished tasks in the next phase can be predicted by the multivariate autoregressive integrated moving average (ARIMAX) model. Consequently, tactic decision-making can realize to not only prevent possible failure in advance, but also arrange work and staffing reasonably to make the process adapt to changeable conditions. In short, the significance of this paper is to build a data-driven digital twin framework integrating with BIM, IoT, and data mining for advanced project management, which can facilitate data communication and exploration to better understand, predict, and optimize the physical construction operations. In future works, more complex cases with multiple data streams will be used to test the developed framework, and more detailed interpretations with the actual observations of construction activities will be given. © 2021 Elsevier B.V.",Article,"Final",Scopus,2-s2.0-85100105417
