Authors,Title,Year,Source title,Cited by,Link,Abstract,Document Type,Publication Stage,Source,EID
"Gubbi J., Buyya R., Marusic S., Palaniswami M.","Internet of Things (IoT): A vision, architectural elements, and future directions",2013,"Future Generation Computer Systems",6945,"https://www.scopus.com/inward/record.uri?eid=2-s2.0-84876943063&doi=10.1016%2fj.future.2013.01.010&partnerID=40&md5=b9f84477e4bfc7ed42bf27de7ee14537","Ubiquitous sensing enabled by Wireless Sensor Network (WSN) technologies cuts across many areas of modern day living. This offers the ability to measure, infer and understand environmental indicators, from delicate ecologies and natural resources to urban environments. The proliferation of these devices in a communicating-actuating network creates the Internet of Things (IoT), wherein sensors and actuators blend seamlessly with the environment around us, and the information is shared across platforms in order to develop a common operating picture (COP). Fueled by the recent adaptation of a variety of enabling wireless technologies such as RFID tags and embedded sensor and actuator nodes, the IoT has stepped out of its infancy and is the next revolutionary technology in transforming the Internet into a fully integrated Future Internet. As we move from www (static pages web) to web2 (social networking web) to web3 (ubiquitous computing web), the need for data-on-demand using sophisticated intuitive queries increases significantly. This paper presents a Cloud centric vision for worldwide implementation of Internet of Things. The key enabling technologies and application domains that are likely to drive IoT research in the near future are discussed. A Cloud implementation using Aneka, which is based on interaction of private and public Clouds is presented. We conclude our IoT vision by expanding on the need for convergence of WSN, the Internet and distributed computing directed at technological research community. © 2013 Elsevier B.V. All rights reserved.",Article,"Final",Scopus,2-s2.0-84876943063
[No author name available],[No title available],2009,"Buildings Energy Data Book",640,,[No abstract available],,"Final",Scopus,2-s2.0-57049094560
"Grieves M.","Digital Twin: Manufacturing Excellence through Virtual Factory Replication",2014,"Digital Twin: Manufacturing Excellence Through Virtual Factory Replication",580,,[No abstract available],,"Final",Scopus,2-s2.0-84944689700
"Negri E., Fumagalli L., Macchi M.","A Review of the Roles of Digital Twin in CPS-based Production Systems",2017,"Procedia Manufacturing",520,"https://www.scopus.com/inward/record.uri?eid=2-s2.0-85029833606&doi=10.1016%2fj.promfg.2017.07.198&partnerID=40&md5=8050bdfad87d2c836e7157bd0070c227","The Digital Twin (DT) is one of the main concepts associated to the Industry 4.0 wave. This term is more and more used in industry and research initiatives; however, the scientific literature does not provide a unique definition of this concept. The paper aims at analyzing the definitions of the DT concept in scientific literature, retracing it from the initial conceptualization in the aerospace field, to the most recent interpretations in the manufacturing domain and more specifically in Industry 4.0 and smart manufacturing research. DT provides virtual representations of systems along their lifecycle. Optimizations and decisions making would then rely on the same data that are updated in real-time with the physical system, through synchronization enabled by sensors. The paper also proposes the definition of DT for Industry 4.0 manufacturing, elaborated by the European H2020 project MAYA, as a contribution to the research discussion about DT concept. © 2017 The Authors",Article,"Final",Scopus,2-s2.0-85029833606
"Schleich B., Anwer N., Mathieu L., Wartzack S.","Shaping the digital twin for design and production engineering",2017,"CIRP Annals - Manufacturing Technology",508,"https://www.scopus.com/inward/record.uri?eid=2-s2.0-85018723536&doi=10.1016%2fj.cirp.2017.04.040&partnerID=40&md5=ba7049ec32c79b6298cc70581af3c133","The digitalization of manufacturing fuels the application of sophisticated virtual product models, which are referred to as digital twins, throughout all stages of product realization. Particularly, more realistic virtual models of manufactured products are essential to bridge the gap between design and manufacturing and to mirror the real and virtual worlds. In this paper, we propose a comprehensive reference model based on the concept of Skin Model Shapes, which serves as a digital twin of the physical product in design and manufacturing. In this regard, model conceptualization, representation, and implementation as well as applications along the product life-cycle are addressed. © 2017",Article,"Final",Scopus,2-s2.0-85018723536
"Becerik-Gerber B., Jazizadeh F., Li N., Calis G.","Application areas and data requirements for BIM-enabled facilities management",2012,"Journal of Construction Engineering and Management",504,"https://www.scopus.com/inward/record.uri?eid=2-s2.0-84859575621&doi=10.1061%2f%28ASCE%29CO.1943-7862.0000433&partnerID=40&md5=ff02cb8ce9e1f4735b345031c839e3e4","Facilities management (FM) encompasses and requires multidisciplinary activities, and thus has extensive information requirements. While some of these needs are addressed by several existing FM information systems, building information modeling (BIM), which is becoming widely adopted by the construction industry, holds undeveloped possibilities for providing and supporting FM practices with its functionalities of visualization, analysis, control, and so on. This paper explores how BIM can be a beneficial platform for supplementing FM practices. An online survey and face-to-face interviews were conducted to assess the current status of BIM implementations in FM, potential applications, and the level of interest in the utilization of BIM. Interactions between BIM and FM are defined by illustrating application areas and data requirements for BIM-enabled FM practices. Highlighting the synergy between the two, this paper can help professionals recognize potential areas in which BIM can be useful in FM practices. © 2012 American Society of Civil Engineers.",Article,"Final",Scopus,2-s2.0-84859575621
"Glaessgen E.H., Stargel D.S.","The digital twin paradigm for future NASA and U.S. air force vehicles",2012,"53rd AIAA/ASME/ASCE/AHS/ASC Structures, Structural Dynamics and Materials Conference 2012",446,"https://www.scopus.com/inward/record.uri?eid=2-s2.0-84881388851&partnerID=40&md5=76921d9a4627f52dfccb21e0f7a9d767","Future generations of NASA and U.S. Air Force vehicles will require lighter mass while being subjected to higher loads and more extreme service conditions over longer time periods than the present generation. Current approaches for certification, fleet management and sustainment are largely based on statistical distributions of material properties, heuristic design philosophies, physical testing and assumed similitude between testing and operational conditions and will likely be unable to address these extreme requirements. To address the shortcomings of conventional approaches, a fundamental paradigm shift is needed. This paradigm shift, the Digital Twin, integrates ultra-high fidelity simulation with the vehicle's on-board integrated vehicle health management system, maintenance history and all available historical and fleet data to mirror the life of its flying twin and enable unprecedented levels of safety and reliability.",Conference Paper,"Final",Scopus,2-s2.0-84881388851
"Boschert S., Rosen R.","Digital twin-the simulation aspect",2016,"Mechatronic Futures: Challenges and Solutions for Mechatronic Systems and Their Designers",426,"https://www.scopus.com/inward/record.uri?eid=2-s2.0-85016457439&doi=10.1007%2f978-3-319-32156-1_5&partnerID=40&md5=d3eccf1c33e916d426e389be5c6288cd","The vision of the Digital Twin itself refers to a comprehensive physical and functional description of a component, product or system, which includes more or less all information which could be useful in all-the current and subsequent-lifecycle phases. In this chapter we focus on the simulation aspects of the Digital Twin. Today, modelling and simulation is a standard process in system development, e.g. to support design tasks or to validate system properties. During operation and for service first simulation-based solutions are realized for optimized operations and failure prediction. In this sense, simulation merges the physical and virtual world in all life cycle phases. Current practice already enables the users (designer, SW/HW developers, test engineers, operators, maintenance personnel, etc) to master the complexity of mechatronic systems. © Springer International Publishing Switzerland 2016.",Book Chapter,"Final",Scopus,2-s2.0-85016457439
"Laustsen J.",[No title available],2008,"Energy Efficiency Requirements in Building Codes, Energy Efficiency Policies for New Buildings",330,,[No abstract available],,"Final",Scopus,2-s2.0-78149416212
"Zhou X., Xi L., Lee J.","Reliability-centered predictive maintenance scheduling for a continuously monitored system subject to degradation",2007,"Reliability Engineering and System Safety",245,"https://www.scopus.com/inward/record.uri?eid=2-s2.0-33845605765&doi=10.1016%2fj.ress.2006.01.006&partnerID=40&md5=613e18b3747b58e1da83c09e4d8832ca","This paper tries to integrate sequential imperfect maintenance policy into condition-based predictive maintenance (CBPM). A reliability-centered predictive maintenance policy is proposed for a continuously monitored system subject to degradation due to the imperfect maintenance. It is assumed that the system hazard rate is a known function of the system condition and then can be derived directly through CBPM. A hybrid hazard rate recursion rule based on the concept of age reduction factor and hazard rate increase factor is built up to predict the evolution of the system reliability in different maintenance cycles. Whenever the system reliability reaches the threshold R, an imperfect preventive maintenance (PM) is performed on the system. The optimal reliability threshold R is determined by minimizing the cumulative maintenance cost per unit time in the residual life of the system which is based on simulation. Finally, a discussion is presented to show how the optimal results depend on the different cost parameters. © 2006.",Article,"Final",Scopus,2-s2.0-33845605765
"El Saddik A.","Digital Twins: The Convergence of Multimedia Technologies",2018,"IEEE Multimedia",218,"https://www.scopus.com/inward/record.uri?eid=2-s2.0-85051272175&doi=10.1109%2fMMUL.2018.023121167&partnerID=40&md5=1f0cc65d2de15e4c4d8326890036049d","Originally developed to improve manufacturing processes, digital twins are being redefined as digital replications of living as well as nonliving entities that enable data to be seamlessly transmitted between the physical and virtual worlds. Digital twins facilitate the means to monitor, understand, and optimize the functions of all physical entities and for humans provide continuous feedback to improve quality of life and well-being. © 1994-2012 IEEE.",Article,"Final",Scopus,2-s2.0-85051272175
"Schein J., Bushby S.T., Castro N.S., House J.M.","A rule-based fault detection method for air handling units",2006,"Energy and Buildings",181,"https://www.scopus.com/inward/record.uri?eid=2-s2.0-33748442297&doi=10.1016%2fj.enbuild.2006.04.014&partnerID=40&md5=ba046a9d3bb37497e93f2feeec2f7ded","Air handling unit performance assessment rules (APAR) is a fault detection tool that uses a set of expert rules derived from mass and energy balances to detect faults in air handling units (AHUs). Control signals are used to determine the mode of operation of the AHU. A subset of the expert rules which correspond to that mode of operation are then evaluated to determine whether a fault exists. APAR is computationally simple enough that it can be embedded in commercial building automation and control systems and relies only upon the sensor data and control signals that are commonly available in these systems. APAR was tested using data sets collected from a ""hardware-in-the-loop"" emulator and from several field sites. APAR was also embedded in commercial AHU controllers and tested in the emulator.",Article,"Final",Scopus,2-s2.0-33748442297
"Asghari P., Rahmani A.M., Javadi H.H.S.","Internet of Things applications: A systematic review",2019,"Computer Networks",172,"https://www.scopus.com/inward/record.uri?eid=2-s2.0-85058557018&doi=10.1016%2fj.comnet.2018.12.008&partnerID=40&md5=0b10848a2bcc0e2be21149b54ccbc269","Internet of Things (IoT) is considered as an ecosystem that contains smart objects equipped with sensors, networking and processing technologies integrating and working together to provide an environment in which smart services are taken to the end users. The IoT is leading numerous benefits into the human life through the environment wherein smart services are provided to utilize every activity anywhere and anytime. All these facilities and services are conveyed through the diverse applications which are performed in the IoT environment. The most important utilities that are achieved by the IoT applications are monitoring and consequently immediate decision making for efficient management. In this paper, we intend to survey in divers IoT application domains to comprehend the different approaches in IoT applications which have been recently presented based on the Systematic Literature Review (SLR) method. The aim of this paper is to categorize analytically and statistically, and analyze the current research techniques on IoT applications approaches published from 2011 to 2018. A technical taxonomy is presented for the IoT applications approaches according to the content of current studies that are selected with SLR process in this study including health care, environmental monitoring, smart city, commercial, industrial and general aspects in IoT applications. IoT applications are compared with each other according to some technical features such as Quality of Service (QoS), proposed case study and evaluation environments. The achievements and disadvantages of each study is discussed as well as presenting some hints for addressing their weaknesses and highlighting the future research challenges and open issues in IoT applications. © 2018 Elsevier B.V.",Article,"Final",Scopus,2-s2.0-85058557018
"Rasheed A., San O., Kvamsdal T.","Digital twin: Values, challenges and enablers from a modeling perspective",2020,"IEEE Access",171,"https://www.scopus.com/inward/record.uri?eid=2-s2.0-85081090770&doi=10.1109%2fACCESS.2020.2970143&partnerID=40&md5=f8685f8d8213f94e7236efb808d8efa8","Digital twin can be defined as a virtual representation of a physical asset enabled through data and simulators for real-time prediction, optimization, monitoring, controlling, and improved decision making. Recent advances in computational pipelines, multiphysics solvers, artificial intelligence, big data cybernetics, data processing and management tools bring the promise of digital twins and their impact on society closer to reality. Digital twinning is now an important and emerging trend in many applications. Also referred to as a computational megamodel, device shadow, mirrored system, avatar or a synchronized virtual prototype, there can be no doubt that a digital twin plays a transformative role not only in how we design and operate cyber-physical intelligent systems, but also in how we advance the modularity of multi-disciplinary systems to tackle fundamental barriers not addressed by the current, evolutionary modeling practices. In this work, we review the recent status of methodologies and techniques related to the construction of digital twins mostly from a modeling perspective. Our aim is to provide a detailed coverage of the current challenges and enabling technologies along with recommendations and reflections for various stakeholders. © 2013 IEEE.",Article,"Final",Scopus,2-s2.0-85081090770
"Pärn E.A., Edwards D.J., Sing M.C.P.","The building information modelling trajectory in facilities management: A review",2017,"Automation in Construction",171,"https://www.scopus.com/inward/record.uri?eid=2-s2.0-85006802917&doi=10.1016%2fj.autcon.2016.12.003&partnerID=40&md5=f35273eb3a2fc65085e083adca4d1dac","There is a paucity of literature that examines building information modelling (BIM) for asset management within the architecture, engineering, construction and owner-operated (AECO) sector. This paper therefore presents a thorough review of published literature on the latest research and standards development that impact upon BIM and its application in facilities management (FM) during the operations and maintenance (O&M) phase of building usage. The purpose is to generate new ideas and provide polemic clarity geared to intellectually challenge readers from across a range of academic and industrial disciplines. The findings reveal that significant challenges facing the FM sector include the need for: greater consideration of long-term strategic aspirations; amelioration of data integration/interoperability issues; augmented knowledge management; enhanced performance measurement; and enriched training and competence development for facilities managers to better deal with the amorphous range of services covered by FM. Future work is also proposed in several key areas and includes: case studies to observe and report upon current practice and development; and supplementary research related to concepts of knowledge capture in relation to FM and the growing use of BIM for asset management. © 2016 Elsevier B.V.",Review,"Final",Scopus,2-s2.0-85006802917
"Schluse M., Priggemeyer M., Atorf L., Rossmann J.","Experimentable Digital Twins-Streamlining Simulation-Based Systems Engineering for Industry 4.0",2018,"IEEE Transactions on Industrial Informatics",167,"https://www.scopus.com/inward/record.uri?eid=2-s2.0-85041837589&doi=10.1109%2fTII.2018.2804917&partnerID=40&md5=adcb2fadec72de212880bbd6c306e5d9","Digital twins represent real objects or subjects with their data, functions, and communication capabilities in the digital world. As nodes within the internet of things, they enable networking and thus the automation of complex value-added chains. The application of simulation techniques brings digital twins to life and makes them experimentable; digital twins become experimentable digital twins (EDTs). Initially, these EDTs communicate with each other purely in the virtual world. The resulting networks of interacting EDTs model different application scenarios and are simulated in virtual testbeds, providing new foundations for comprehensive simulation-based systems engineering. Its focus is on EDTs, which become more detailed with every single application. Thus, complete digital representations of the respective real assets and their behaviors are created successively. The networking of EDTs with real assets leads to hybrid application scenarios in which EDTs are used in combination with real hardware, thus realizing complex control algorithms, innovative user interfaces, or mental models for intelligent systems. © 2005-2012 IEEE.",Article,"Final",Scopus,2-s2.0-85041837589
"Wang X., Love P.E.D., Kim M.J., Park C.-S., Sing C.-P., Hou L.","A conceptual framework for integrating building information modeling with augmented reality",2013,"Automation in Construction",150,"https://www.scopus.com/inward/record.uri?eid=2-s2.0-84878587673&doi=10.1016%2fj.autcon.2012.10.012&partnerID=40&md5=046bea5bd3acd088041e9cddf7a1739e","During the last two decades, designers have been embracing building information modeling (BIM) to improve the quality of the documentation that is produced as well as constructability. While BIM has become an innate feature of the design process within the construction industry, there have been limited investigations that have examined how it can be integrated into real-time communication on-site. In addressing this gap, this paper proposes a conceptual framework that integrates BIM with augmented reality (AR) so as to enable the physical context of each construction activity or task to be visualized in real-time. To be effective, it is suggested that AR should be ubiquitous (including context awareness) and thus operate in conjunction with tracking and sensing technologies such as radio frequency identification (RFID), laser pointing, sensors and motion tracking. © 2012 Elsevier B.V.",Article,"Final",Scopus,2-s2.0-84878587673
"Dave B., Buda A., Nurminen A., Främling K.","A framework for integrating BIM and IoT through open standards",2018,"Automation in Construction",104,"https://www.scopus.com/inward/record.uri?eid=2-s2.0-85051379498&doi=10.1016%2fj.autcon.2018.07.022&partnerID=40&md5=9daa502dc1dc7080a41fcd01842cb455","The built environment provides significant opportunities for IoT (Internet of Things) deployment, and can be singled out as one of the most important aspects for IoT related research. While the IoT deployment in the built environment is growing exponentially, there exists a gap in integrating these two in a systematic way through open standards and systems. From technological perspective, there is a need for convergence of diverse fields ranging from Building Information Systems and Building Services to Building Automation Systems, and IoT devices and finally the end user services to develop smart, user oriented applications. This paper outlines the efforts to develop a platform that integrates the built environment data with IoT sensors in a campus wide, web based system called Otaniemi3D that provides information about energy usage, occupancy and user comfort by integrating Building Information Models and IoT devices through open messaging standards (O-MI and O-DF) and IFC models. The paper describes the design criteria, the system architecture, the workflow and a proof of concept with potential use cases that integrate IoT with the built environment. Initial results show that both the end users and other research groups can benefit from such platforms by either consuming the data in their daily life or using the data for more advance research. © 2018 The Authors",Article,"Final",Scopus,2-s2.0-85051379498
"Wang M., Zhang G., Zhang C., Zhang J., Li C.","An IoT-based appliance control system for smart homes",2013,"Proceedings of the 2013 International Conference on Intelligent Control and Information Processing, ICICIP 2013",103,"https://www.scopus.com/inward/record.uri?eid=2-s2.0-84883244609&doi=10.1109%2fICICIP.2013.6568171&partnerID=40&md5=fc882b45f44cb7869a641be39e6c4eb0","With the development of the social economy, more and more appliances have been presented in a house. It comes out a problem that how to manage and control these increasing various appliances efficiently and conveniently so as to achieve more comfortable, security and healthy space at home. In this paper, a smart control system base on the technologies of internet of things has been proposed to solve the above problem. The smart home control system uses a smart central controller to set up a radio frequency 433 MHz wireless sensor and actuator network (WSAN). A series of control modules, such as switch modules, radio frequency control modules, have been developed in the WSAN to control directly all kinds of home appliances. Application servers, client computers, tablets or smart phones can communicate with the smart central controller through a wireless router via a Wi-Fi interface. Since it has WSAN as the lower control layer, a appliance can be added into or withdrawn from the control system very easily. The smart control system embraces the functions of appliance monitor, control and management, home security, energy statistics and analysis. © 2013 IEEE.",Conference Paper,"Final",Scopus,2-s2.0-84883244609
"Piette M.A., Kinney S.K., Haves P.","Analysis of an information monitoring and diagnostic system to improve building operations",2001,"Energy and Buildings",102,"https://www.scopus.com/inward/record.uri?eid=2-s2.0-0035480252&doi=10.1016%2fS0378-7788%2801%2900068-8&partnerID=40&md5=54c45e2dbdbd4177f8a957e23ccd4b29","This paper discusses a demonstration of a technology to address the problem that buildings do not perform as well as anticipated during design. We partnered with an innovative building operator to evaluate a prototype information monitoring and diagnostic system (IMDS). The IMDS consists of a set of high-quality sensors, data acquisition software and hardware, and data visualization software including a web-based remote access system, that can be used to identify control problems and equipment faults. The information system allowed the operators to make more effective use of the building control system and freeing up time to take care of other tenant needs. They report observing significant improvements in building comfort, potentially improving tenant health and productivity. The reduction in the labor costs to operate the building is about US$ 20,000 per year, which alone could pay for the information system in about 5 years. A control system retrofit based on findings from the information system is expected to reduce energy use by 20% over the next year, worth over US$ 30,000 per year in energy cost savings. The operators are recommending that similar technology be adopted in other buildings. © 2001 Elsevier Science B.V. All rights reserved.",Article,"Final",Scopus,2-s2.0-0035480252
