Authors,Title,Year,Source title,Cited by,Link,Abstract,Document Type,Publication Stage,Source,EID
"Pishdad-Bozorgi P., Gao X., Eastman C., Self A.P.","Planning and developing facility management-enabled building information model (FM-enabled BIM)",2018,"Automation in Construction",99,"https://www.scopus.com/inward/record.uri?eid=2-s2.0-85037547810&doi=10.1016%2fj.autcon.2017.12.004&partnerID=40&md5=6fd08528feacb6ad03eb898b4613d81c","Successful implementation of FM-enabled BIM can be achieved with 1) a clear definition of what FM-enabled BIM constitutes, 2) a seamless and practical process of collecting the FM-enabled BIM data throughout project development phases, and 3) a well-executed interoperability plan for exchanging data between BIM tools and facility management systems, such as Computerized Maintenance Management System (CMMS). This research contributes to the body of knowledge by first defining, and examining one of the first few pilots implementation of FM-enabled BIM, and discussing the challenges encountered and the lessons learned, and then by proposing a research framework for future researchers to systematically and strategically build the knowledge foundation on BIM for FM field. The implementation process described and the lessons learned captured in this pilot project provide valuable insights into the successful implementation of FM-enabled BIM. © 2017",Article,"Final",Scopus,2-s2.0-85037547810
"Hyvarinen J., Karki S.","Building optimization and fault diagnosis system concept",1996,"Building Optimization and Fault Diagnosis Source Book",94,,[No abstract available],,"Final",Scopus,2-s2.0-0008268607
"Mills E.","Building commissioning: A golden opportunity for reducing energy costs and greenhouse gas emissions",2009,"Building Commissioning: A Golden Opportunity for Reducing Energy Costs and Greenhouse Gas Emissions",86,,[No abstract available],,"Final",Scopus,2-s2.0-78249270339
"Martí L., Sanchez-Pi N., Molina J.M., Garcia A.C.B.","Anomaly detection based on sensor data in petroleum industry applications",2015,"Sensors (Switzerland)",73,"https://www.scopus.com/inward/record.uri?eid=2-s2.0-84921904704&doi=10.3390%2fs150202774&partnerID=40&md5=76fb14b346e3cd38f9a51fd5b8eae7f2","Anomaly detection is the problem of finding patterns in data that do not conform to an a priori expected behavior. This is related to the problem in which some samples are distant, in terms of a given metric, from the rest of the dataset, where these anomalous samples are indicated as outliers. Anomaly detection has recently attracted the attention of the research community, because of its relevance in real-world applications, like intrusion detection, fraud detection, fault detection and system health monitoring, among many others. Anomalies themselves can have a positive or negative nature, depending on their context and interpretation. However, in either case, it is important for decision makers to be able to detect them in order to take appropriate actions. The petroleum industry is one of the application contexts where these problems are present. The correct detection of such types of unusual information empowers the decision maker with the capacity to act on the system in order to correctly avoid, correct or react to the situations associated with them. In that application context, heavy extraction machines for pumping and generation operations, like turbomachines, are intensively monitored by hundreds of sensors each that send measurements with a high frequency for damage prevention. In this paper, we propose a combination of yet another segmentation algorithm (YASA), a novel fast and high quality segmentation algorithm, with a one-class support vector machine approach for efficient anomaly detection in turbomachines. The proposal is meant for dealing with the aforementioned task and to cope with the lack of labeled training data. As a result, we perform a series of empirical studies comparing our approach to other methods applied to benchmark problems and a real-life application related to oil platform turbomachinery anomaly detection. © 2015 by the authors; licensee MDPI, Basel, Switzerland.",Article,"Final",Scopus,2-s2.0-84921904704
"Wong J.K.W., Ge J., He S.X.","Digitisation in facilities management: A literature review and future research directions",2018,"Automation in Construction",71,"https://www.scopus.com/inward/record.uri?eid=2-s2.0-85046644826&doi=10.1016%2fj.autcon.2018.04.006&partnerID=40&md5=f8acfb3f60490224534de7f8d4fb1bad","Research into digital technology (DT) in construction practices has gained widespread attention. While the application of different DTs in facility management (FM) has been growing, to date, there is no holistic review of the various DT developments and research into FM. A total of 120 academic journal papers, conference proceedings and other technical notes published on the subject, mainly between 2004 and 2017, were reviewed in this paper. The applications of various major DTs, including 1) building information modelling (BIM), 2) reality capture technology (including 3D laser scanning, point cloud), 3) the Internet of Things (IoT) (including radio frequency identification (RFID) and sensor network technologies) and 4) geographic information system (GIS), were reviewed and scrutinised. The review identified a number of possibilities for future research into DT in FM, including, enhancing the interoperability of data, improving the accuracy of point cloud data for developing as-built models for existing facilities, and generating effective BIM/GIS asset database integration. It is hoped that this review and the future directions highlighted in this paper will assist researchers in identifying the areas where further research efforts are most required and in identifying which future directions would be most helpful for digital FM research. © 2018 Elsevier B.V.",Review,"Final",Scopus,2-s2.0-85046644826
"Shalabi F., Turkan Y.","IFC BIM-Based Facility Management Approach to Optimize Data Collection for Corrective Maintenance",2017,"Journal of Performance of Constructed Facilities",66,"https://www.scopus.com/inward/record.uri?eid=2-s2.0-85010465484&doi=10.1061%2f%28ASCE%29CF.1943-5509.0000941&partnerID=40&md5=27c1cbc8497a48800356b64f66ae501f","Facility managers are required to collect high-quality data to achieve corrective maintenance actions. Current facility management (FM) information systems are complex and provide high-quality data. However, they lack interoperability and visualization capabilities. The goal of this study is to improve the quality of data collected that is required for corrective maintenance by utilizing visualization and interoperability capabilities of building information modeling (BIM). To achieve that, an approach that implements industry foundation classes (IFC) BIM to link and present alarms reported by FM systems, such as building energy management systems (BEMS) and building automation systems (BAS), with related data from computerized maintenance management systems (CMMS) was developed and validated on a typical university building. The results showed an efficiency increase in high-quality maintenance data collection. The proposed approach supplements the existing body of knowledge in the FM domain by providing a schema that integrates corrective maintenance data in a three-dimensional (3D) IFC-BIM environment. Moreover, it provides a process to minimize the corrective maintenance lead-time and link equipment failures to the related maintenance information. FM practitioners can use this approach to decrease the lead-time needed corrective maintenance responses and focus their resources on productive maintenance tasks. © 2016 American Society of Civil Engineers.",Article,"Final",Scopus,2-s2.0-85010465484
"Patacas J., Dawood N., Vukovic V., Kassem M.","BIM for facilities management: Evaluating BIM standards in asset register creation and service life planning",2015,"Journal of Information Technology in Construction",66,"https://www.scopus.com/inward/record.uri?eid=2-s2.0-84979562033&partnerID=40&md5=02d973ebc58cc93654dca8857ad21627","Operation and Maintenance (O&M) costs in buildings represent a significant part of the total building life cycle cost. However, project delivery methods in the Architectural, Engineering and Construction (AEC) industry are often focused on the capital delivery stage and associated costs ranging from planning, through design, to construction and handover. Open data standards such as the Industry Foundation Classes (IFC) and specifications such as the Construction Operations Building information exchange (COBie) provide the capability to capture Facilities Management (FM) data requirements in a structured manner from the early stages of project development. We aim to investigate how and whether IFC and COBie can deliver the data and information about assets required by facility managers within a whole life cycle perspective. We focus on specific use cases including the creation of asset registers and service life planning. However, the methodology adopted can be generalised and applied to any other FM use case. The results show that IFC, COBie and the tested supporting tools exhibited some shortcomings in delivering some of the data entities, types and parameters required for the selected FM use cases. We discuss these shortcomings and propose them as areas for improvement to domain researchers, standardisation bodies and technology providers. Finally, we instigate domain researchers to adopt the proposed methodology and conduct further FM use cases. © 2015 The author.",Article,"Final",Scopus,2-s2.0-84979562033
"Bousdekis A., Magoutas B., Apostolou D., Mentzas G.","A proactive decision making framework for condition-based maintenance",2015,"Industrial Management and Data Systems",55,"https://www.scopus.com/inward/record.uri?eid=2-s2.0-84938312843&doi=10.1108%2fIMDS-03-2015-0071&partnerID=40&md5=1a52d4e55a3853effa8c7e2effad093f","Purpose-The purpose of this paper is to perform an extensive literature review in the area of decision making for condition-based maintenance (CBM) and identify possibilities for proactive online recommendations by considering real-time sensor data. Based on these, the paper aims at proposing a framework for proactive decision making in the context of CBM. Design/methodology/approach-Starting with the manufacturing challenges and the main principles of maintenance, the paper reviews the main frameworks and concepts regarding CBM that have been proposed in the literature. Moreover, the terms of e-maintenance, proactivity and decision making are analysed and their potential relevance to CBM is identified. Then, an extensive literature review of methods and techniques for the various steps of CBM is provided, especially for prognosis and decision support. Based on these, limitations and gaps are identified and a framework for proactive decision making in the context of CBM is proposed. Findings-In the proposed framework for proactive decision making, the CBMconcept is enriched in the sense that it is structured into two components: the information space and the decision space. Moreover, it is extended in a way that decision space is further analyzed according to the types of recommendations that can be provided. Moreover, possible inputs and outputs of each step are identified. Practical implications-The paper provides a framework for CBM representing the steps that need to be followed for proactive recommendations as well as the types of recommendations that can be given. The framework can be used by maintenance management of a company in order to conduct CBM by utilizing real-time sensor data depending on the type of decision required. Originality/value-The results of the work presented in this paper form the basis for the development and implementation of proactive Decision Support System (DSS) in the context of maintenance. © 2015 Emerald Group Publishing Limited.",Article,"Final",Scopus,2-s2.0-84938312843
"Levermore G.","Building Control Systems",2000,"Building Control Systems",49,,[No abstract available],,"Final",Scopus,2-s2.0-0006242030
"Malatras A., Asgari A., Baugé T.","Web enabled wireless sensor networks for facilities management",2008,"IEEE Systems Journal",45,"https://www.scopus.com/inward/record.uri?eid=2-s2.0-58649107117&doi=10.1109%2fJSYST.2008.2007815&partnerID=40&md5=2731ab8b72069f27b99bd83836033554","The cornerstone of building and overall facilities management is accurate and up-to-date monitoring of the context of the enterprise building environment and its surroundings, usually performed by sensors dispersed throughout the premises. Currently, the majority of building management systems is tightly coupled with the sensors that they utilize, restricting their extensibility. The emergence of Wireless Sensor Networks (WSNs) has brought significant benefits as far as monitoring is concerned, since they are more cost-efficient, due to the lack of wiring installations, compared to wired sensor solutions and allow for flexible positioning of the sensors, especially when building retrofitting is concerned. In line with the established move towards integration of enterprise level services, it is beneficial to consider the WSNs within that scope. In this paper, we propose to exploit a service oriented architecture for developing an enterprise networking environment that is used for integrating facilities management applications and building management systems with other operational enterprise functions for the purpose of information sharing and monitoring, controlling, and managing the enterprise environment. The WSN is viewed as an information service provider not only to building management systems but also to wider applications in the enterprise infrastructure. We provide specification and implementation details of the proposed architecture and discuss evaluation planning. © 2008 IEEE.",Article,"Final",Scopus,2-s2.0-58649107117
"Daily J., Peterson J.","Predictive maintenance: How big data analysis can improve maintenance",2016,"Supply Chain Integration Challenges in Commercial Aerospace: A Comprehensive Perspective on the Aviation Value Chain",37,"https://www.scopus.com/inward/record.uri?eid=2-s2.0-85029050507&doi=10.1007%2f978-3-319-46155-7_18&partnerID=40&md5=3b3603cc5ef5ceb35e16601f7efd1e4d","What if an aircraft part could tell you when it needs to be repaired or replaced? With continuous data collection, monitoring and application of advanced analytics, it can. Predictive maintenance in aviation offers the promise of increased reliability along with bolstered operational and supply chain efficiencies. The integration of Cloud-based analytics with industrial machinery has driven the advent of a new “Industrial Internet”-and with it, opportunities for huge productivity gains. Industrial machines equipped with a growing number of electronic sensors can see, hear and feel a lot more than ever before-and deliver enormous amounts of data to be analyzed. Sophisticated algorithms then provide insights that allow us to operate machines-fleets of engines, airplanes, and network entire systems like airlines and airports-in entirely new, more efficient ways. To realize the value in predictive maintenance and achieve business outcomes that matter, machines, data, insights and people need to be brought together. © Springer International Publishing AG 2017.",Book Chapter,"Final",Scopus,2-s2.0-85029050507
"Marzouk M., Abdelaty A.","BIM-based framework for managing performance of subway stations",2014,"Automation in Construction",37,"https://www.scopus.com/inward/record.uri?eid=2-s2.0-84897795418&doi=10.1016%2fj.autcon.2014.02.004&partnerID=40&md5=393506da46420833f0f812e999fa6c8f","Rapid transit systems are considered a sustainable mode of transportation compared to other modes of transportation taking into consideration number of passengers, energy consumed and amount of pollution emitted. Building Information Modeling (BIM) is utilized in this research along with a global ranking system to monitor Indoor Environmental Quality (IEQ) in subway stations. The research is concerned with developing global rating system for subway stations' networks. The developed framework is capable of monitoring indoor temperature and Particulate Matter (PM) concentration levels in subway stations. A rating system is developed using Simos' ranking method in order to determine the weights of different components contributing to the whole level of service of a subway station as well as maintenance priority indices. A case study is presented to illustrate the use of the proposed system. The developed ranking system showed its effectiveness in ranking maintenance actions globally. © 2014 Elsevier B.V.",Article,"Final",Scopus,2-s2.0-84897795418
"Dixit M.K., Venkatraj V., Ostadalimakhmalbaf M., Pariafsai F., Lavy S.","Integration of facility management and building information modeling (BIM): A review of key issues and challenges",2019,"Facilities",35,"https://www.scopus.com/inward/record.uri?eid=2-s2.0-85061326149&doi=10.1108%2fF-03-2018-0043&partnerID=40&md5=8851c04f72537cd9169a3d33a8424d59","Purpose: The purpose of this study is to investigate factors that impede the integration of facilities management (FM) into building information modeling (BIM) technology. The use of BIM technology in the commercial construction industry has grown enormously in recent years. Its application to FM, however, is still limited. The literature highlights issues that hinder BIM–FM integration, which are studied and discussed in detail in this paper. Design/methodology/approach: A review of literature is conducted to identify and categorize key issues hampering the application of BIM to FM. This paper has also designed a questionnaire based on a literature review and surveyed FM professionals at two industry events. Using the collected responses, these issues are analyzed and discussed using non-parametric statistical analyses. Findings: A total of 16 issues are identified through the literature review of 54 studies under the four categories of BIM-execution and information-management, technological, cost-based and legal and contractual issues. The results of the survey of FM professionals (with 57 complete responses) reveal that the single most important issue is the lack of FM involvement in project phases when BIM is evolving. Originality/value: The findings of this study could assist the construction industry (e.g. building-material and equipment manufacturers, design professionals, general contractors, construction managers, owners and facility managers) with creating guidelines that would help in BIM–FM integration. BIM is a virtual database that contains important design and construction information, which can be used for effective and efficient life cycle management if building data are captured completely and accurately with a facility manager’s involvement. © 2019, Emerald Publishing Limited.",Article,"Final",Scopus,2-s2.0-85061326149
"El Ammari K., Hammad A.","Remote interactive collaboration in facilities management using BIM-based mixed reality",2019,"Automation in Construction",34,"https://www.scopus.com/inward/record.uri?eid=2-s2.0-85071686342&doi=10.1016%2fj.autcon.2019.102940&partnerID=40&md5=65645f00fda4dcc7c818652c0644e8c2","Facilities Management (FM) day-to-day tasks require suitable methods to facilitate work orders and improve performance by better collaboration between the office and the field. Building Information Modeling (BIM) provides opportunities to support collaboration and to improve the efficiency of Computerized Maintenance Management Systems (CMMSs) by sharing building information between different applications/users throughout the lifecycle of the facility. However, manual retrieval of building element information can be challenging and time consuming for field workers during FM operations. Mixed Reality (MR) is a visualization technique that can be used to improve visual perception of the facility by superimposing 3D virtual objects and textual information on top of the view of real-world building objects. This paper discusses the development of a collaborative BIM-based MR approach to support facilities field tasks. The proposed framework integrates multisource facilities information, BIM models, and feature-based tracking in an MR-based setting to retrieve information based on time (e.g. inspection schedule) and the location of the field worker, visualize inspection and maintenance operations, and support remote collaboration and visual communication between the field worker and the manager at the office. The field worker uses an Augmented Reality (AR) application installed on his/her tablet. The manager at the office uses an Immersive Augmented Virtuality (IAV) application installed on a desktop computer. Based on the field worker location, as well as the inspection or maintenance schedule, the field worker is given work orders and instructions from the office. Other sensory data (e.g., infrared thermography) can provide additional layers of information by augmenting the actual view of the field worker and supporting him/her in making effective decisions about existing and potential problems while communicating with the office in an Interactive Virtual Collaboration (IVC) mode. Finally, to investigate the applicability of the proposed method, a prototype system is developed and tested in a case study. © 2019",Article,"Final",Scopus,2-s2.0-85071686342
"Gerrish T., Ruikar K., Cook M., Johnson M., Phillip M.","Using BIM capabilities to improve existing building energy modelling practices",2017,"Engineering, Construction and Architectural Management",33,"https://www.scopus.com/inward/record.uri?eid=2-s2.0-85016026899&doi=10.1108%2fECAM-11-2015-0181&partnerID=40&md5=45d99f4c87e2b8b67e0299be6b7056f5","Purpose -The purpose of this paper is to present a review of the implications building information modelling (BIM) is having on the building energy modelling (BEM) and design of buildings. It addresses the issues surrounding exchange of information throughout the design process, and where BIM may be useful in contributing to effective design progression and information availability. Design/methodology/approach -Through review of current design procedures and examination of the concurrency between architectural and thermophysical design modelling, a procedure for information generation relevant to design stakeholders is created, and applied to a high-performance building project currently under development. Findings -The extents of information key to the successful design of a buildings energy performance in relation to its architectural objectives are given, with indication of the level of development required at each stage of the design process. Practical implications -BIM offers an extensible medium for parametric information storage, and its implementation in design development offers the capability to include BEM parameter-integrated construction information. The extent of information required for accurate BEM at stages of a building's design is key to understanding how best to record performance information in a BIM environment. Originality/value -This paper contributes to the discussion around the integration of concurrent design procedures and a common data environment. It presents a framework for the creation and dissemination of information during design, exemplifies this on a real building project and evaluates the barriers experienced in successful implementation.",Article,"Final",Scopus,2-s2.0-85016026899
"Araszkiewicz K.","Digital Technologies in Facility Management - The state of Practice and Research Challenges",2017,"Procedia Engineering",32,"https://www.scopus.com/inward/record.uri?eid=2-s2.0-85030479508&doi=10.1016%2fj.proeng.2017.08.059&partnerID=40&md5=a2184d04af38b82351856a2cf5c91f84","Communication and information management are among the key areas of management operations at every stage of a construction project life cycle. The use of innovative digital technologies and tools for conducting such operations may significantly improve the preparation and execution of a construction project and it enables the preparation of a collection of information required to efficiently use the structure. The aim of this article is to present the results of the latest research related to the application of digitization in the Facility Management based on a critical literature review of 2010 - 2016. The article investigates the potential of Building Information Modelling to integrate data for the building lifecycle, providing information and decision support to facility management and maintenance. The results of the implementation of digital techniques for the purpose of smart Facility Management were discussed on the basis of a case study of The Edge office building in Amsterdam. The article also suggests possible directions for further research related to digitization in property management and its impact on the process of implementing the concept of intelligent and sustainable construction engineering. © 2017 The Authors.",Conference Paper,"Final",Scopus,2-s2.0-85030479508
