Authors,Title,Year,Source title,Cited by,Link,Abstract,Document Type,Publication Stage,Source,EID
"Dehlin S., Olofsson T.","An evaluation model for ICT investments in construction projects",2008,"Electronic Journal of Information Technology in Construction",32,"https://www.scopus.com/inward/record.uri?eid=2-s2.0-46349106070&partnerID=40&md5=29b50698caf97be7662c6cdc7d754a93","Even though Information and Communication Technology (ICT) investments in construction projects generally represent minor commitments of project resources by comparison to the full project cost, the value or impact on the profitability of the project are generally not considered. Also, many of the investment decisions are poorly thought through or examined. Investments decision taken during the procurement phase often merely based on intuition and rough estimations of the future costs and risks. Also, many of the traditionally used appraisal approaches have been shown inadequate in anticipating the consequences of such an investment. As a result, the investment is too often assumed to be negative since the benefits are not proper evaluated, included and weighted against the costs and risks the investment is expected to generate. Poor decision-basis does not only affect the actual decision-making in a particular project but also, in the long run, the motivation to innovate and to introduce new ICT tools and working methods into the construction industry. In view of this, a new project-oriented evaluation model is developed for the purpose to provide for a structure and a work routine to be used by a multidisciplinary project team to evaluate the implications of realizing ICT investments in construction projects. Although primarily aimed at establishing future benefits and costs the model may very well be used for follow-ups. The models' application is illustrated using a case study of a construction project using 3D and VR for coordination and evaluation. The results based on interviews and rough estimates on the ""safe side"" show that benefit of the ICT investment for the case study project was much higher compared with the cost for the project. The shift in focus from costs/benefits for the individual stakeholders to costs/benefits for the project gives a momentum to optimize the use of a new ICT tools in construction. This will surely affect the processes and the contractual environment in the project, since it has to support sharing of information and achieved benefits and the costs of the investment in the project.",Article,"Final",Scopus,2-s2.0-46349106070
"André S., Elgh F., Johansson J., Stolt R.","The design platform–a coherent platform description of heterogeneous design assets for suppliers of highly customised systems",2017,"Journal of Engineering Design",30,"https://www.scopus.com/inward/record.uri?eid=2-s2.0-85029437939&doi=10.1080%2f09544828.2017.1376244&partnerID=40&md5=2e2156526463a57318d934d1a43af6ba","Companies developing highly customised products are continuously faced with fluctuating requirements during the early and late stages of the product development (PD) process. This differs from companies that develop end-consumer products, which uses fixed specifications and where product platforms have been a successful enabler for efficient customisation. However, in the past, product platforms have not been able to fully support companies working in an engineer-to-order business environment. This article outlines the results from a three-year collaborative research project between academics within the area of engineering design and practitioners from the engineer-to-order industry. The research introduces a design platform (DP) that aims to support the development of customised products when traditional platform concepts do not suffice. The platform approach provides a coherent environment for heterogeneous design assets to be used in PD by supporting both the design activity and the finished solutions. The needs and abilities regarding such a platform were investigated through a series of interviews and workshops at four companies. Then, the DP was modelled and support tools were developed. Finally, company representatives evaluated the complete DP and its applications, reporting promising results. © 2017 Informa UK Limited, trading as Taylor & Francis Group.",Article,"Final",Scopus,2-s2.0-85029437939
"Lessing J., Brege S.","Business models for product-oriented house-building companies - experience from two Swedish case studies",2015,"Construction Innovation",26,"https://www.scopus.com/inward/record.uri?eid=2-s2.0-84941027146&doi=10.1108%2fCI-02-2015-0009&partnerID=40&md5=d48d63e566dc0506d1fbe59c5b5f6728","Purpose - The purpose of this study is to describe and analyse the business model of product-oriented house-building companies and, hence, bridging the gap of knowledge on this topic. Product-orientation implies an alternative approach to house-building, requiring new knowledge about business models and its characteristics. The balance and fit between the main business model dimensions is specifically focused on to emphasise the importance of a holistic approach. Design/methodology/approach - This study is based on a case study with two leading Swedish, product-oriented house-building companies. Semi-structured interviews with company executives, document studies, site and factory visits, along with seminars at the companies are the main data sources. Theories on business models and product orientation form the theoretical foundation for the study. Findings - The case studies describe two successful companies that used end-customer knowledge to identify a target segment, develop an offering and sequentially increase control over the production and supply chain, with limited investments. This indicates that a market-based outside-in perspective is a successful approach to establish viable house-building concepts with a balance between the business model's dimensions. Practical implications - The knowledge brought forward in this study is beneficial for practitioners that can learn about product-oriented house-building and how this must be reflected in the company's business model to be successfully applied. Social implications - The study brings forward knowledge about house-building business models that can contribute to increased house-building targeted on certain customer segments. This can be beneficial in terms of decreased costs and increased volumes of new-built, high-quality homes for a variety of customers on the market. Originality/value - Business models for product-oriented house-building companies are a scarcely covered topic in previous research, and hence, this study provides knowledge of interest for both researchers and practitioners. The case studies reveal unique information of how two companies developed their successful concepts. © Emerald Group Publishing Limited.",Article,"Final",Scopus,2-s2.0-84941027146
"Menon K., Kärkkäinen H., Wuest T., Gupta J.P.","Industrial internet platforms: A conceptual evaluation from a product lifecycle management perspective",2019,"Proceedings of the Institution of Mechanical Engineers, Part B: Journal of Engineering Manufacture",20,"https://www.scopus.com/inward/record.uri?eid=2-s2.0-85045073305&doi=10.1177%2f0954405418760651&partnerID=40&md5=c9366756c1f46cb83e3aa9d85e27d91b","Industrial Internet platforms have the ability to access, manage and control product-related data, information and knowledge across all the lifecycle phases (beginning of life, middle of life and end of life). Traditional product lifecycle management/product data management software have many limitations when it comes to solving product lifecycle management challenges, like interoperability for instance. Industrial Internet platforms can provide real-time management of data and information along all the phases of a product’s lifecycle. Platform openness in combination with the above-mentioned industrial internet platform characteristics helps solve the product lifecycle management challenges. This article describes the product lifecycle management challenges in detail from the existing literature and presents solutions using industrial internet platform openness and related dimensions as well as sub-dimensions. A wide pool of platforms is narrowed down to specific platforms that can solve the documented product lifecycle management challenges and allow the manufacturing companies to collaborate as well as enhance their business. We also present in detail managerial implications toward long-term and sustainable selection of industrial internet platform. © IMechE 2018.",Article,"Final",Scopus,2-s2.0-85045073305
"Goulding J., Rahimian F.P., Arif M., Sharp M.","Offsite construction: Strategic priorities for shaping the future research agenda",2012,"Architectonica",20,,[No abstract available],,"Final",Scopus,2-s2.0-84911360564
"Jupp J.R.","Incomplete BIM implementation: Exploring challenges and the role of product lifecycle management functions",2013,"IFIP Advances in Information and Communication Technology",19,"https://www.scopus.com/inward/record.uri?eid=2-s2.0-84919338427&doi=10.1007%2f978-3-642-41501-2_62&partnerID=40&md5=c0e92c022d1479410e8c2f4c62bf2c4f","Implementing the BIM methodology relies on mastering new digital ways of working. However approaches to BIM often lack a holistic perspective that span the whole building lifecycle. The omission of Product Lifecycle Management functions in the implementation of the BIM methodology can lead to failures in delivering the benefits of BIM to operations and diminish its value to clients with large property portfolios. In an empirical study, the paper presents an investigation into the current situation of BIM using an Australian commercial property development project. It explores implications of partial implementation for the building lifecycle. Case study findings identify deficiencies in the project environment, management shortcomings associated with the specifics of client requirements, and difficulties in the transverse use of BIM and PLM platforms due to human interface problems. © IFIP International Federation for Information Processing 2013",Conference Paper,"Final",Scopus,2-s2.0-84919338427
"Jansson G.",[No title available],2013,"Platforms in Industrialized Housebuilding",18,,[No abstract available],,"Final",Scopus,2-s2.0-85019007725
"Persson S., Malmgren L., Johnsson H.","Information management in industrial housing design and manufacture",2009,"Electronic Journal of Information Technology in Construction",18,"https://www.scopus.com/inward/record.uri?eid=2-s2.0-70349773435&partnerID=40&md5=7b5ea3675802ded5689e7f7aae2adbcd","Industrialized production of building components, or entire houses, reduces activities at the construction site to the assembly of parts and has the potential to increase productivity and reduce the design effort invested in every project. However, in order to realize all of the potential efficiency gains that use of predefined components could deliver effective, interoperable information management systems are required. This article presents a multiple case study investigating the processes, products and ICT environment involved in industrialized house construction from an information management perspective, focusing on six Swedish companies that manufacture timber frame elements and one that makes precast concrete elements. The aim of the study was to identify critical aspects of information management related to industrialization in the sector. The findings show that companies aiming to enhance control and productivity by improving information management need a better understanding of the requisites for efficient industrialized construction in terms of ICT support. Changes in the perspectives of the construction companies appear to be needed in terms of not only the manufacturing processes, but also information management. Three main areas are identified that should be prioritized before any investments in ICT can be implemented effectively: formal description of the relevant processes, detailed description of the product range and its full variety, and creation of an appropriate information systems strategy.",Article,"Final",Scopus,2-s2.0-70349773435
"Boton C., Rivest L., Forgues D., Jupp J.","Comparing PLM and BIM from the product structure standpoint",2016,"IFIP Advances in Information and Communication Technology",17,"https://www.scopus.com/inward/record.uri?eid=2-s2.0-85000667525&doi=10.1007%2f978-3-319-54660-5_40&partnerID=40&md5=da8ce8cf32dbb216d8ceb99b76bd03e6","The increasing use of Building Information Modelling (BIM) across the construction industry highlights the potential for a common endpoint with manufacturing industries. Previous research work has shown that it is possible to improve BIM with the features and the best practices from Product Lifecycle Management (PLM) approach. This article provides a comparison between the PLM and BIM approaches from the standpoint of the Product Structure (PS) and the Bill of Material (BOM). It discusses the need to explicit a structuring concept in the BIM approach in order be able to switch to an information-centric management approach in construction projects instead of the current activity-based approach. © IFIP International Federation for Information Processing 2016.",Conference Paper,"Final",Scopus,2-s2.0-85000667525
"Zhang Q., Lu X., Peng Z., Ren M.","Perspective: a review of lifecycle management research on complex products in smart-connected environments",2019,"International Journal of Production Research",15,"https://www.scopus.com/inward/record.uri?eid=2-s2.0-85063088143&doi=10.1080%2f00207543.2019.1587186&partnerID=40&md5=aa5482b438538c2a43e5dbc00335e5fd","Smart-connected technologies, such as the Internet of things and cloud computing, are transforming how industries and enterprises do business by improving the lifecycle management of their product. Therefore, to study the lifecycle management of complex products under smart-connected environment, many studies have been published outlining new methods for smart development, intelligent manufacturing, and data-driven services. This paper first proposes the concept and architecture of smart-connected products and then systematically reviews the current research about new paradigms of product development, manufacturing and services. The paper also summarises the conceptual framework, research issues and opportunities of each phase of the product lifecycle management. © 2019, © 2019 Informa UK Limited, trading as Taylor & Francis Group.",Article,"Final",Scopus,2-s2.0-85063088143
"Alvarez-Anton L., Koob M., Diaz J., Minnert J.","Optimization of a hybrid tower for onshore wind turbines by Building Information Modeling and prefabrication techniques",2016,"Visualization in Engineering",14,"https://www.scopus.com/inward/record.uri?eid=2-s2.0-85031725689&doi=10.1186%2fs40327-015-0032-4&partnerID=40&md5=b0746cf23f564fc3a872bb46c2edd303","Background: Nowadays wind energy is becoming increasingly significant in the planning, development and growth of new electricity supply systems. Special attention has been given to land-based turbines for ensuring the efficient economical operation of massive hubs rising 100m above the ground, based on the idea that the bigger the turbine, the more complicated are the transportation and assembly processes. Methods: A new design of a wind turbine has several advantages compared to conventional designs; one of these advantages lies in the use of prefabricated elements, which increases efficiency. The implementation of information technology as a complement to prefabrication techniques is a further aim of this research, which seeks to improve the overall performance of the project. Consequently, Building Information Modelling is suggested as the most suitable methodology for complementing off-site techniques and reaching higher efficiency by improving design, manufacture, transportation and assembly processes. Results: This paper will present the research project “hybrid² tower for wind turbines” funded by the State of Hesse, Germany, which focuses on a new, efficient and economical design for high wind turbine towers. The new hybrid² tower is composed of a concrete tower containing prefabricated concrete quarter-circle elements, steel beams and a steel tube tower on the top. The combination of concrete and steel beams improves the static and dynamic performance of the main supporting structure. With this new design, the weight of the concrete tower is estimated to decrease by 40 % compared to a traditional full-concrete tower and, as a positive consequence, the cost of assembly (including assembly on site) is reduced. Conclusions: Due to the energy revolution, a special focus is put on the development of renewable energies, especially wind power. The steadily increasing hub heights of wind turbines means that tower structures have to be more massive. The development of the hybrid² tower by using Building Information Modeling and prefabrication techniques leads to an optimized performance and reduces transport and assembly costs. © 2016, Alvarez-Anton et al.",Article,"Final",Scopus,2-s2.0-85031725689
"Donoghue I., Hannola L., Papinniemi J., Mikkola A.","The benefits and impact of digital twins in product development phase of PLM",2018,"IFIP Advances in Information and Communication Technology",10,"https://www.scopus.com/inward/record.uri?eid=2-s2.0-85058533550&doi=10.1007%2f978-3-030-01614-2_40&partnerID=40&md5=983ad9906c341c688ee2a23463c4e93b","The concept of the Digital Twins offers opportunities for business-to-business (B2B) manufacturing companies to co-create and maintain Product-Service-Systems. This facilitates closer relationship with customers over the lifespan of the delivered solution. However, the definition of the Digital Twin is not yet established in the companies that took part in this research that forms the basis to understand the relationship between the Digital Twins and Product-Service-Systems. The objective of this paper is to define the concepts of Digital Twin and real-time simulation, and increase understanding of the benefits and impacts that B2B companies face when applying real-time simulation, and understand where the transformation should start in Product Lifecycle Management. The case companies that participated in this research are mobile work machine manufactures, but the findings are applicable to other B2B manufacturing companies which have complex solution deliveries that are managed over the lifecycle. Results of this study show that B2B manufacturing companies are using real-time simulation to create digital twins of their real-world solutions. The companies participating in the research project create functioning digital twins but managing them is tedious and not integrated to the Product Lifecycle Management operations. First, only applying this to product development is not enough, but the management must cover the entire lifecycle of the product from Beginning (BOL), Middle (MOL) and End-of-Lifecycle (EOL). Second, the need to rethink the approach to product development and management is a key for success. Otherwise, the result is a virtual representation of the real world that is impossible to maintain at industrial level. © IFIP International Federation for Information Processing 2018.",Conference Paper,"Final",Scopus,2-s2.0-85058533550
"Hjort B., Lindgren J., Larsson B., Emmitt S.","Success factors related to industrialized building in Sweden",2014,"Paper presented at the CIB International Conference on Construction in a Changing World",7,,[No abstract available],,"Final",Scopus,2-s2.0-85050853404
"Mukkavaara J.",[No title available],2018,"Structures for Supporting BIM-Based Automation in The Design Process",5,,[No abstract available],,"Final",Scopus,2-s2.0-85059660667
"Jansson G., Mukkavaara J., Elgh F., Lennartsson M.","Breakdown Structure in the Digitalization of Design Work for Industrialized House- Building: A Case Study of Systems Building Using Predefinition Levels of Product Platforms",2019,"ICCREM 2019: Innovative Construction Project Management and Construction Industrialization - Proceedings of the International Conference on Construction and Real Estate Management 2019",4,"https://www.scopus.com/inward/record.uri?eid=2-s2.0-85072934723&doi=10.1061%2f9780784482308.006&partnerID=40&md5=9ed3710f11b234bc47e1a9d588843fa9","Industrialized house-building companies predefine parameters in platforms. In the strive to identify efficient information flow with automation and configuration, the design process requires a breakdown of the product structure of a building to digitally communicate between information systems. The level of predefinitions varies between industrialized house-builders according to market position, type of building processes, and maturity in business. The client decoupling point according to the predefinitions of house-building as a product is central for how and when production information is created. Bill of materials is a breakdown structure that visualize relations and the transformation between engineering, preparation, and production processes from a life cycle perspective. A case study at eight house-building companies was chosen with the aim to identify relations between the level of predefinitions and breakdown structures. House-building platforms with a high level of predefinition on layouts, components, and interfaces show a tendency to use less time in BIM-tools for engineering work and a high level of parameters in manufacturing configuration systems to prepare for production. Meanwhile, the opposite with low levels of predefinitions on components and interfaces focus on BIM-tools for engineering work with longer lead times. An interesting outcome is those with a high level of predefinitions in interfaces but lower levels on component dimensions. These companies have the ability to position their offer to a wide market with flexibility in the engineering work and need to communicate the high levels of interface parameters for the manufacturing sequence with a breakdown of the product together with architects. © 2019 American Society of Civil Engineers.",Conference Paper,"Final",Scopus,2-s2.0-85072934723
"Mukkavaara J., Jansson G., Olofsson T.","Structuring information from BIM: A glance at bills of materials",2018,"ISARC 2018 - 35th International Symposium on Automation and Robotics in Construction and International AEC/FM Hackathon: The Future of Building Things",4,"https://www.scopus.com/inward/record.uri?eid=2-s2.0-85085853061&doi=10.22260%2fisarc2018%2f0052&partnerID=40&md5=8880a9d673baf8711ef678ba25bcadce","Industrialized house-builders are moving towards an enhanced production where management of information along the value chain is critical in order to deliver housing projects on time and with the desired quality. Today digital tools and systems are used in both design and production to produce, deliver and instruct actors throughout the phases of a project. However, the information usually exists in different islands and manual transfers are required to keep the flow of information between IT-systems and individuals continuous. A key to improving the ability for the members in different stages of a project to work with the same information is to facilitate different views. One of the building blocks for creating bridges between the islands of information is to introduce bills of materials which can be used to organize information for different purposes. Uniting the use of building information modeling (BIM) with bills of materials (BOM) is therefore our focus in this paper. This is done in the context of industrialized house-building and the facets which it brings to the subject. The aim of this paper is to present an early endeavor into a BOM based approach for structuring information from BIM models. A demonstration tool was developed, and together with application in a case project from an industrialized house-builder, the generation of BOMs from BIM data is illustrated and discussed. The findings illustrates that we can apply different structures to the information located in our BIM models and that we can produce a BOM perspective on our products. Also, it is highlighted that we still need further studies to better understand how application of BOMs in the context of industrialized house-building is realized. © ISARC 2018 - 35th International Symposium on Automation and Robotics in Construction and International AEC/FM Hackathon: The Future of Building Things. All rights reserved.",Conference Paper,"Final",Scopus,2-s2.0-85085853061
