Authors,Title,Year,Source title,Cited by,Link,Abstract,Document Type,Publication Stage,Source,EID
"Ulrich K.","The role of product architecture in the manufacturing firm",1995,"Research Policy",1962,"https://www.scopus.com/inward/record.uri?eid=2-s2.0-58149321832&doi=10.1016%2f0048-7333%2894%2900775-3&partnerID=40&md5=e400b99557302da0a040af4828f213a8","Product architecture is the scheme by which the function of a product is allocated to physical components. This paper further defines product architecture, provides a typology of product architectures, and articulates the potential linkages between the architecture of the product and five areas of managerial importance: (1) product change; (2) product variety; (3) component standardization; (4) product performance; and (5) product development management. The paper is conceptual and foundational, synthesizing fragments from several different disciplines, including software engineering, design theory, operations management and product development management. The paper is intended to raise awareness of the far-reaching implications of the architecture of the product, to create a vocabulary for discussing and addressing the decisions and issues that are linked to product architecture, and to identify and discuss specific trade-offs associated with the choice of a product architecture. © 1995.",Article,"Final",Scopus,2-s2.0-58149321832
"Meyer M.H., Lehnerd A.P.",[No title available],1997,"The Power of Product Platforms",1262,,[No abstract available],,,Scopus,2-s2.0-0003523966
"Baldwin C.Y., Clark K.B.","Managing in an age of modularity.",1997,"Harvard business review",1090,"https://www.scopus.com/inward/record.uri?eid=2-s2.0-0031227526&partnerID=40&md5=48e8c3111e205c1538cb09099d0b871d","Modularity is a familiar principle in the computer industry. Different companies can independently design and produce components, suck as disk drives or operating software, and those modules will fit together into a complex and smoothly functioning product because the module makers obey a given set of design rules. Modularity in manufacturing is already common in many companies. But now a number of them are beginning to extend the approach into the design of their products and services. Modularity in design should tremendously boost the rate of innovation in many industries as it did in the computer industry. As businesses as diverse as auto manufacturing and financial services move toward modular designs, the authors say, competitive dynamics will change enormously. No longer will assemblers control the final product: suppliers of key modules will gain leverage and even take on responsibility for design rules. Companies will compete either by specifying the dominant design rules (as Microsoft does) or by producing excellent modules (as disk drive maker Quantum does). Leaders in a modular industry will control less, so they will have to watch the competitive environment closely for opportunities to link up with other module makers. They will also need to know more: engineering details that seemed trivial at the corporate level may now play a large part in strategic decisions. Leaders will also become knowledge managers internally because they will need to coordinate the efforts of development groups in order to keep them focused on the modular strategies the company is pursuing.",Article,"Final",Scopus,2-s2.0-0031227526
"Meyer M.H., Utterback J.M.","The product family and the dynamics of core capability",1993,"Sloan Management Review",430,,[No abstract available],,,Scopus,2-s2.0-0002220721
"Erixon G.",[No title available],1998,"Modular Function Deployment - A Method for Product Modularization",288,,[No abstract available],,"Final",Scopus,2-s2.0-0003429388
"Hvam L., Mortensen N.H., Riis J.","Product customization",2008,"Product Customization",236,"https://www.scopus.com/inward/record.uri?eid=2-s2.0-84892099954&doi=10.1007%2f978-3-540-71449-1&partnerID=40&md5=69baa28f016df8dbb60998ca57df13b8","For the majority of industrial companies, customizing products and services is among the most critical means to deliver true customer value and achieve superior competitive advantage. The challenge is not to customize products and services in itself - but to do it in a profitable way. The implementation of a product configuration system is among the most powerful ways of achieving this in practice, offering a reduction of the lead time for products and quotations. It also achieves faster and more qualified responses to customer inquiries, fewer transfers of responsibility and fewer specification mistakes, a reduction of the resources spent for the specification of customized products, and the possibility of optimizing the products according to customer demands. This book presents an operational procedure for the design of product configuration systems in industrial companies. It is based on the experience gained from more than 40 product configuration projects in companies providing customer tailored products and services. © 2008 Springer-Verlag Berlin Heidelberg. All rights are reserved.",Book,"Final",Scopus,2-s2.0-84892099954
"Gosling J., Naim M.M.","Engineer-to-order supply chain management: A literature review and research agenda",2009,"International Journal of Production Economics",234,"https://www.scopus.com/inward/record.uri?eid=2-s2.0-70350568663&doi=10.1016%2fj.ijpe.2009.07.002&partnerID=40&md5=60316679cd7bd634e6f6597f2275b9d0","Product proliferation as a result of meeting ever increasing customer demand preferences is well documented. In addition, customisation has been promoted as a source of competitive advantage. Despite these factors, most of the published research in operations and supply chain management has neglected the needs of the 'engineer-to-order' (ETO) sector and there is no major systematic literature review for the ETO supply chain. This paper presents a comprehensive literature review of published material relating to ETO supply chains. It contributes to the development of a more robust definition of the ETO supply chain, helps to identify strategies that are suitable and investigates the relationship of the ETO sector with lean and agile approaches. The review also presents an analysis of research methods and industry sectors that emerge from the literature search. By analysing different streams of literature this paper helps to provide a foundation for thinking about engineer-to-order supply chain definitions and strategies and provides a research agenda to guide further study. © 2009 Elsevier B.V. All rights reserved.",Article,"Final",Scopus,2-s2.0-70350568663
"Muffatto M.","Introducing a platform strategy in product development",1999,"International Journal of Production Economics",164,"https://www.scopus.com/inward/record.uri?eid=2-s2.0-0032651339&doi=10.1016%2fS0925-5273%2898%2900173-X&partnerID=40&md5=22d5ffb9fa4baa488da502bcb76e62f2","The paper analyses the introduction of a platform strategy in new product development with reference to its application in the automobile industry. A definition of platform and associated core concepts such as product architecture, modularisation and standardisation is given. The implication and benefits of a platform strategy are then discussed both from the technical and organisational points of view. The evolution of product development through the adoption of a platform strategy in Japanese automobile firms is also analysed.",Article,"Final",Scopus,2-s2.0-0032651339
"Rudberg M., Wikner J.","Mass customization in terms of the customer order decoupling point",2004,"Production Planning and Control",151,"https://www.scopus.com/inward/record.uri?eid=2-s2.0-3142674870&doi=10.1080%2f0953728042000238764&partnerID=40&md5=1a591422ac503969e86afad342c18a54","In recent years the customer order decoupling point (CODP) has gained increased acceptance as an important concept when organizing value-adding activities in production and logistics. The CODP, which is defined as the point in the value-adding material flow that separates decisions made under uncertainty from decisions made under certainty concerning customer demand, is however normally only used for production- and distribution- related activities. Here we adjust the typical CODP typology and show how the engineering resources can be integrated with the production process so as to take the features of mass customization environments into account. This paper also examines existing mass customization frameworks and offers a more thorough and nuanced typology for classifying various levels of mass customization. Finally, the adjusted CODP typology is used as a foundation for developing a reliable order promise process for mass customizers.",Article,"Final",Scopus,2-s2.0-3142674870
"Johnsson H., Meiling J.H.","Defects in offsite construction: Timber module prefabrication",2009,"Construction Management and Economics",78,"https://www.scopus.com/inward/record.uri?eid=2-s2.0-70449394020&doi=10.1080%2f01446190903002797&partnerID=40&md5=100b138369860971c6ea55d73d5eea71","The construction industry is based on craftsmanship. Quality control and assurance procedures applied in manufacturing cannot usually be readily applied in construction, where there are higher degrees of uniqueness in each project. One category of companies, industrialized housebuilders, is attempting to bridge some of the gaps between construction and manufacturing. These companies prefabricate building modules for later assembly at the building site. Since they are wholly responsible for large parts of the building process, these companies have greater opportunities to control and improve quality in a more consistent way than ordinary construction companies. Thus, it could be hypothesized that the frequency and severity of defects should be lower in industrialized housing than in ordinary construction. The aim of the study presented here is to examine this hypothesis by measuring and characterizing defects in industrialized housing. The design and manufacturing processes at two Swedish timber module prefabrication firms has been analysed through interviews, site visits and document reviews. Quality audits from three phases of the building process were compiled, analysed and categorized to provide statistical measures of defects in industrialized housing. The results show that the case study companies are better in terms of product quality than conventional housing. © 2009 Taylor & Francis.",Article,"Final",Scopus,2-s2.0-70449394020
"Li X., Shen G.Q., Wu P., Yue T.","Integrating Building Information Modeling and Prefabrication Housing Production",2019,"Automation in Construction",75,"https://www.scopus.com/inward/record.uri?eid=2-s2.0-85059632874&doi=10.1016%2fj.autcon.2018.12.024&partnerID=40&md5=8f21b8ebc06e87ae8d121dac28bdb284","The decision-making system in Prefabrication Housing Production (PHP) lacks efficiency and collaboration because relevant information is stored and managed in heterogeneous systems of various stakeholders, who are commonly geographically isolated. Building Information Modeling (BIM) has advantages of combining its object-oriented attributes and the production-oriented characteristics of PHP to support decision-making and collaborative working for raising working efficiency. Given the emerging recognition of BIM and PHP, an integrated conceptual framework based on existing studies is needed in order to facilitate their recognition and guide future research. Based on a critical review of 65 papers published in the peer-reviewed journals from 2005 to 2017, a conceptual framework is proposed for the integration of BIM and PHP. The framework involves three pillars, including smart BIM platform (SBP), smart work packages (SWPs), and smart PHP objects (SPOs). A gateway with interoperability function is created between the three pillars to facilitate the communication and interaction with the central database. The results can help develop the system architecture of BIM and PHP, which can then be used to benefit various stakeholders to facilitate the integration. © 2019 Elsevier B.V.",Article,"Final",Scopus,2-s2.0-85059632874
"Abanda F.H., Tah J.H.M., Cheung F.K.T.","BIM in off-site manufacturing for buildings",2017,"Journal of Building Engineering",73,"https://www.scopus.com/inward/record.uri?eid=2-s2.0-85031763679&doi=10.1016%2fj.jobe.2017.10.002&partnerID=40&md5=c912fb34863aef52a0f713594c725a1e","The need to overcome challenges faced by construction industry has been at the core of many government reports. Most of the reports suggest the adoption of innovations including off-site manufacture and emerging Building Information Modelling (BIM) to overcome the challenges facing the industry. Current research has largely focused on the impacts of off-site manufacture and BIM independently applied on traditional construction methods. Due to the factory-based nature of off-site manufacture, the benefits of BIM on off-site manufacture have been widely argued to be far greater than those of traditional construction. However, studies about impacts of BIM on off-site manufacture are scarce with far too many on traditional construction. This study investigates the implications of BIM systems on off-site manufacture and traditional construction methods, with emphasis on the technological potential of BIM for off-site manufacture. The specific objectives of the study are threefold. Firstly, it examines how BIM can support off-site manufacture. Secondly, the paper discusses the benefits of BIM and explains how BIM can overcome barriers hindering the uptake of off-site manufacturing. Thirdly, due to the importance to measure the benefits to support wider adoption, an examination of the published quantitative benefits of BIM on off-site manufacture and traditional construction is undertaken. A critical appraisal of the literature was undertaken to achieve the aim of this study. The main findings are the identification of qualitative and quantitative benefits of: BIM on off-site manufacture, off-site manufacture and BIM on traditional construction. The findings reinforce the argument that BIM adoption on off-site manufacturing projects is a rapid, efficient and one of the best ways to improve on the long standing challenges that have plagued the construction industry for generations. © 2017 Elsevier Ltd",Article,"Final",Scopus,2-s2.0-85031763679
"Lee S., Yu J.","Comparative Study of BIM Acceptance between Korea and the United States",2016,"Journal of Construction Engineering and Management",61,"https://www.scopus.com/inward/record.uri?eid=2-s2.0-84958614316&doi=10.1061%2f%28ASCE%29CO.1943-7862.0001076&partnerID=40&md5=fa1b57bf58835a95a0214d64880f6d37","Substantial research has been performed on data standards and exchanges in the AEC/FM (Architecture, Engineering, Construction and Facilities Management) industry over the past several years. The growing popularity of Building Information Modeling (BIM) technology is based heavily on the perception that it can facilitate the sharing and reuse of information during a project's lifecycle. Although many researchers and practitioners are in agreement about the potential applicability and benefit of BIM in construction, it is still unclear why BIM is adopted, and what factors enhance the implementation of BIM. Thus, BIM acceptance and use remains a central concern of BIM research and practice. BIM was accepted in the United States earlier than in Korea, and BIM users are expected to have a higher maturity and positive perception about utilizing BIM depending on a lengthier utilization period. This means that the mechanism for achieving acceptance of BIM in Korea differs from the mechanism in the United States. Therefore, Korea's BIM acceptance model was compared to that in the United States using structural equation modeling. The key components, including the BIM acceptance model, were identified through a literature review of the Technology Acceptance Model (TAM) and related theories and was consolidated by interviews and pilot studies with professionals in the construction industry. Based on these components, a questionnaire was designed and sent out to workers in construction organizations (such as contractors, architects, construction managers, engineers, and facility managers) in Korea and the United States. A total 164 completed questionnaires were retrieved. Structural equation modeling for hypothesis testing was conducted using commercially-available software. The results from this study can serve as a foundation for research looking into the organizational context to further BIM acceptance in the construction industry. The comparison of the mechanism and subsequent results will serve as a guideline for developing an acceptance strategy that is suitable for Korea. © 2015 American Society of Civil Engineers.",Article,"Final",Scopus,2-s2.0-84958614316
"Jansson G., Johnsson H., Engström D.","Platform use in systems building",2014,"Construction Management and Economics",54,"https://www.scopus.com/inward/record.uri?eid=2-s2.0-84896547485&doi=10.1080%2f01446193.2013.793376&partnerID=40&md5=9afbd132ea907d12fe3003182b7c4a9f","The practice of reusing processes and technical solutions leads to the formation of product platforms in house building. Product platforms originate from industries employing a make-to-order production strategy, e.g. the automotive industry. To test how the product platform concept is useful in engineer-to-order production strategies, a case study at two Swedish house-builders was made. Key factors that affect platform use in systems buildings were sought. The smaller company operates a supplier-led platform focusing on commonalities in process knowledge. There is less definition of the product itself to allow for distinctiveness in the product offer. The larger company has a decentralized business and operates a client-driven platform with fragmented standardization. Focus is put on creating commonality through defining the product and handling distinctiveness through an iterative design procedure. Product families were not in use at the case study companies. The companies transform standardized platform solutions into project uniqueness by using support methods. Four platform support methods emerged from the case studies: design planning, collaborative design, design optimization, and requirements iteration. The balance between commonality and distinctiveness in the platform is important to attend to in each house-building project. The engineer-to-order production strategy hinders the implementation of a fully parameterized platform. The product platform concept is therefore expanded with support methods to handle distinctiveness, i.e. project uniqueness. The product platform assets: components, processes, relationships and knowledge, are present also in platforms used in systems building. © 2013 Taylor & Francis.",Article,"Final",Scopus,2-s2.0-84896547485
"Jonsson H., Rudberg M.","Classification of production systems for industrialized building: A production strategy perspective",2014,"Construction Management and Economics",53,"https://www.scopus.com/inward/record.uri?eid=2-s2.0-84896542264&doi=10.1080%2f01446193.2013.812226&partnerID=40&md5=3df389d25a26e9d9b3104e6565a5be87","The purpose is to develop a matrix for classifying production systems for construction with various degrees of industrialization. Previous attempts to classify industrialized production systems for construction focus on dimensions such as the design process, the product technology, or the supply chain structure, but none of them acknowledge the importance of how orders are actually won in the market and that different market segments have different requirements. Using production strategy theory as a base, a matrix is developed linking market requirements, via the product offering, to the design of the production system. The matrix positions typical production systems based on their respective degrees of product standardization and volumes relative to the degree of offsite production. Similar to production systems in manufacturing, production systems for construction also deliver manufacturing outputs at different levels, indicating that the choice of production system will affect the competitiveness of the company. The applicability of the matrix is exemplified through three case illustrations of concepts for industrialized building, and these show that the matrix can be used to analyse the production systems' relative strengths and weaknesses. The matrix can also be used as a guide when developing new, or adjusting existing, production systems for industrialized building so that they will match market requirements and offer competitiveness. © 2013 Taylor & Francis.",Article,"Final",Scopus,2-s2.0-84896542264
"Bosch-Sijtsema P., Isaksson A., Lennartsson M., Linderoth H.C.J.","Barriers and facilitators for BIM use among Swedish medium-sized contractors - “We wait until someone tells us to use it”",2017,"Visualization in Engineering",48,"https://www.scopus.com/inward/record.uri?eid=2-s2.0-85030610313&doi=10.1186%2fs40327-017-0040-7&partnerID=40&md5=95b2a13f4121fd6825e130d4f1884431","Background: The pace of diffusion of BIM (Building Information Modelling) use is considered to increase with governmental initiatives in which public clients in countries like Finland, Singapore, United Kingdom, and Sweden begin requiring BIM as a part of the project delivery. Currently, larger contractor firms use BIM to a certain extent. However, BIM use by mid-sized contractor firms (that is, firms with 50–500 employees that can successfully compete with larger contractors on projects costing a maximum of 50 million Euros) is relatively unknown. Hence, the aim of the paper is to explore current use and perceived constraints and driving forces of BIM-implementation with respect to mid-sized contractors. Methods: A mixed method approach was applied, and data was collected through an interview study and a survey involving chief executive officers or their closest sub-ordinates in mid-sized contractor firms in Sweden. The survey was based on a technology-, organization-, and environment framework that is used in information systems research to study the use of inter-organizational information systems. The total population of firms in the survey corresponded to 104. The study presented the preliminary results based on 32 answers (with a 31% response rate). Results: Fifty-eight percent of the surveyed respondents stated that they had been involved in a project in which BIM was used in some manner. The most commonly used application included visualization, which also facilitates coordination and communication. The biggest perceived constraints involved partners that did not use BIM, lack of demand from clients, and the absence of internal demand in the company. With respect to the two last obstacles, significant differences existed between users and non-users. The most common perceived driving forces included the fact that BIM is perceived as a means to follow technical development and that BIM provides competitive advantages to the company. Conclusions: It is concluded that the main driver responsible for BIM-implementation is mainly determined by an individual’s subjective positive or negative evaluation of BIM, instead of external pressure from clients and partners or by the internal capacity and knowledge to use BIM. © 2017, The Author(s).",Article,"Final",Scopus,2-s2.0-85030610313
"Johnsson H.","Production strategies for pre-engineering in house-building: Exploring product development platforms",2013,"Construction Management and Economics",43,"https://www.scopus.com/inward/record.uri?eid=2-s2.0-84887048476&doi=10.1080%2f01446193.2013.828846&partnerID=40&md5=9af178998c35b9e87e0c38cb9ed8573f","Construction is a trade where the dominating production strategy is engineer-to-order. House-builders can pre-engineer their design to different degrees, resulting in variations of the engineer-to-order strategy: design-to-order, adapt-to-order, and engineer-to-stock. This variation causes different settings for the use of platforms in house-building. The aim of this research is to diversify the engineer-to-order production strategy and its consequences for platform organization by studying its use in house-building. The multiple case study on four engineering/contractor firms reports the core capabilities for engineer-to-order firms: procurement and tendering, market knowledge, engineering, multi-skilled manufacturing, and coordination of sales and manufacturing. Design-to-order, adapt-to-order and engineer-to stock were shown to be production strategies in use in house-building. In design-to-order platforms parts of the platform are undefined while engineer-to-stock platforms are fully predefined. Coordination between market and manufacturing is a crucial capability when engaging in platform organization. When an engineering firm and a contractor collaborate to fulfil client needs, the coordination capability between market and manufacturing was shown to be low. The case study shows that specialized contractors who integrate the supply chain towards a specific market segment benefit fully from the platform concept, while contractors with a wider scope could focus on standardization of processes rather than products. © 2013 Taylor & Francis.",Article,"Final",Scopus,2-s2.0-84887048476
