Authors,Title,Year,Source title,Cited by,Link,Abstract,Document Type,Publication Stage,Source,EID
"Voell C., Chatterjee P., Rauch A., Golovatchev J.","How digital twins enable the next level of PLM – a guide for the concept and the implementation in the internet of everything era",2018,"IFIP Advances in Information and Communication Technology",4,"https://www.scopus.com/inward/record.uri?eid=2-s2.0-85058536698&doi=10.1007%2f978-3-030-01614-2_22&partnerID=40&md5=18f05c6c5cd98062d9903e557831bb35","The idea of a digital twin as a virtual representation of a product is not new. However, the modern IoE (Internet of Everything) technology is able to cover a new dimension in terms of monitoring and controlling an operating state of a products or process. The potential is high to reach a new maturity level in all PLM processes. Unfortunately, it is a very complex topic and has a high impact on internal and external processes. The technical challenges are spread in different domains. The business value is hard to see. Therefore the risks are also high and a well-grounded strategy is necessary. This includes an organic growth with customer benefit and a consistent change management in the company. Besides a successful implementations of digital twins this guide provides a pragmatic approach to get access to the digital twin technology. It covers the range from the conceptual understanding of a digital twin to a successful implementation with a prototype. © IFIP International Federation for Information Processing 2018.",Conference Paper,"Final",Scopus,2-s2.0-85058536698
"Lennartsson M., Elgh F.","Exploring product development in industrialized housing to facilitate a platform strategy",2018,"IGLC 2018 - Proceedings of the 26th Annual Conference of the International Group for Lean Construction: Evolving Lean Construction Towards Mature Production Management Across Cultures and Frontiers",4,"https://www.scopus.com/inward/record.uri?eid=2-s2.0-85056623278&doi=10.24928%2f2018%2f0283&partnerID=40&md5=5f12891f4b60a5f3ffa5f5483085cdc4","Industrialized house-building companies are offering unique products by adopting an engineer-to-order (ETO) strategy. Client satisfaction is achieved by adaptation of product solutions and swift introduction of new technology in combination with cost-efficient production and short lead-time for completion. Product development is executed in collaboration with the clients and changes in requirements are frequent. The use of product platforms, where external and internal efficiency are well-balanced, has been acknowledged as a strategic enabler for mass customization and increased competitiveness. However, ETO-companies struggle with adopting the common product platform approach, set by pre-defined modules and components. Predefinitions may cause an imbalance between product development and a lean production system. The aim of this work was to analyse current strategies and support to master the balance of external and internal efficiency in product development within industrialized housebuilding to facilitate the development of a product platform strategy. Data were gathered from a single case study and an on-going product platform development and includes interviews and document analysis. The findings show that product development is guided by a technical platform, but there is an imbalance where external efficiency is prioritized over the internal efficiency. © IGLC 2018 - Proceedings of the 26th Annual Conference of the International Group for Lean Construction: Evolving Lean Construction Towards Mature Production Management Across Cultures and Frontiers. All rights reserved.",Conference Paper,"Final",Scopus,2-s2.0-85056623278
"André S., Lennartsson M., Elgh F.","Exploring the design platform in industrialized housing for efficient design and production of customized houses",2019,"Advances in Transdisciplinary Engineering",3,"https://www.scopus.com/inward/record.uri?eid=2-s2.0-85082528205&doi=10.3233%2fATDE190115&partnerID=40&md5=1dcf53713d95d7882bcdf833fd8049f5","Industrialized house-building (IHB) is a sector offering unique products by adopting an engineer-to-order (ETO) strategy. Customer satisfaction is achieved by adaptation of product solutions and the fast-paced introduction of new technology in combination with short lead-times and cost-efficient production. Product platforms is acknowledged as a strategic enabler for mass customization and increased competitiveness. The strategy has been a necessity in the mechanical industry for several decades. However, for IHB, platforms have only gained interest in recent years. In general, ETO companies struggle with adopting the common product platform approach, set by pre-defined modules and components. Predefinitions require standardization of the product offer which reduces the customization ability which is regarded as a competitive edge. The Design Platform (DP) approach was developed aimed to support ETO companies by utilizing different types of engineering assets in a coherent transdisciplinary model enabling efficient customization. The long-term aim of this work is to investigate and support the DP applicability in IHB to increase efficiency in development and delivery. For this article, data were gathered from a single case study, including workshops with company representatives combined with interviews and document analysis. Based on the data analysis, engineering assets were identified and characterized. Further, a conceptual PLM solution is proposed and outlined to support the DP application combined with the assets. The results suggest that a PLM system can host parts of the DP and that it is applicable in IHB. © 2019 The authors and IOS Press.",Conference Paper,"Final",Scopus,2-s2.0-85082528205
"Jonsson H.",[No title available],2017,"Production Strategy in Project Based Production Within A HouseBuilding Context",3,,[No abstract available],,"Final",Scopus,2-s2.0-85056645881
"Söderholm E., Johnsson H.","Housing design performance: How is it measured?",2009,"Association of Researchers in Construction Management, ARCOM 2009 - Proceedings of the 25th Annual Conference",2,"https://www.scopus.com/inward/record.uri?eid=2-s2.0-84861071973&partnerID=40&md5=0c3c5a25fff1b0676973033a1e28e6f4","Industrialisation involves reoccurring tasks and interfaces, which enables companies to work with continuous improvements of the process. In order to determine the effects of undertaken measures as well as enhance the manageability of the process, it is important to find measurements for effectiveness and efficiency of the construction design process. The aim of this paper is to serve as a gap analysis regarding the differences between current practice and the characteristics of performance measurement found in literature. This study is based on interviews with middle-managers at six industrial housing companies and four construction engineering consultant firms in Sweden, in order to explore the current methods of performance measuring in the construction design phase. The result shows that the studied companies currently have a limited use of measures and that the present measurements do not serve as a means of control for the design process or enable follow ups of undertaken improvements. For extended control and continuous improvement of the design process additional methods for measuring are required.",Conference Paper,"Final",Scopus,2-s2.0-84861071973
"Jonsson H., Gosling J.","Information Exchange in House-building-A Production Strategy Perspective",2017,"24th EurOMA Conference",1,,[No abstract available],,"Final",Scopus,2-s2.0-85098656156
"Lennartsson M., Movaffaghi H., Linderoth H.","Exploration of the BIM Development and Application : Identifying Key Areas for the Industrialized House-Building Sector",0000,"17th International Conference on Computing in Civil and Building Engineering ICCCBE2018",1,,[No abstract available],,"Final",Scopus,2-s2.0-85098649013
