Authors,Title,Year,Source title,Cited by,Link,Abstract,Document Type,Publication Stage,Source,EID
"Wang M., Deng Y., Won J., Cheng J.C.P.","An integrated underground utility management and decision support based on BIM and GIS",2019,"Automation in Construction",37,"https://www.scopus.com/inward/record.uri?eid=2-s2.0-85071502931&doi=10.1016%2fj.autcon.2019.102931&partnerID=40&md5=b51220d1edfde7ab172df21986aeb9ec","This study aims to improve the underground utility management efficiency from the perspective of utility component and urban utility network, as well as to facilitate the decision-making for utility maintenance work. The main reasons for the inefficient information sharing, poor utility management and reactive decision-making are investigated, after which potential solutions are explored. An integrated utility management framework is proposed based on the integration of Building Information Modeling (BIM) and Geographic Information System (GIS), for which a common utility data model representing utility information in five aspects is developed to facilitate the mapping of Industry Foundation Classes (IFC) and City Geography Markup Language (CityGML). The verification of the proposed framework indicates that the developed data model can represent utility information comprehensively, based on which functions of the integrated BIM-GIS platform are developed to support underground utility management in terms of individual utility components and the utility spatial networks. With the proposed utility management framework, the information sharing process, utility management efficiency and decision-making can be improved and facilitated. In the future, more functions of the framework will be developed according to practical requirements and more maintenance data will be utilized to validate and enhance the framework. © 2019 Elsevier B.V.",Article,"Final",Scopus,2-s2.0-85071502931
"Ninić J., Koch C., Stascheit J.","An integrated platform for design and numerical analysis of shield tunnelling processes on different levels of detail",2017,"Advances in Engineering Software",25,"https://www.scopus.com/inward/record.uri?eid=2-s2.0-85019380814&doi=10.1016%2fj.advengsoft.2017.05.012&partnerID=40&md5=a9d72b1b83e43458389522c111241b89","Building and construction information modelling for decision making during the life cycle of infrastructure projects are vital tools for the analysis of complex, integrated, multi-disciplinary systems. The traditional design process is cumbersome and involves significant manual, time-consuming preparation and analysis as well as significant computational resources. To ensure a seamless workflow during the design and analysis and to minimise the computation time, we propose a novel concept of multi-level numerical simulations, enabling the modelling on different Levels of Detail (LoDs) for each physical component, process information, and analysis type. In this paper, we present SATBIM, an integrated platform for information modelling, structural analysis and visualisation of the mechanised tunnelling process for design support. Based on a multi-level integrated parametric Tunnel Information Model, numerical models for each component on different LoDs are developed, considering proper geometric as well as material representation, interfaces and the representation of the construction process. Our fully automatic modeller for arbitrary tunnel alignments provides a high degree of automation for the generation, the setup and the execution of the simulation model, connecting the multi-level information model with the open-source simulation software KRATOS. The software of SATBIM is organized in a modular way in order to offer high flexibility not only for further extensions, but also for adaptation to future improvements of the simulation software. The SATBIM platform enables practical, yet flexible and user-friendly generation of the tunnel structure for arbitrary alignments on different LoDs, supporting the design process and providing an insight into soil-structure interactions during construction. © 2017 Elsevier Ltd",Article,"Final",Scopus,2-s2.0-85019380814
"Krijnen T., Beetz J.","An IFC schema extension and binary serialization format to efficiently integrate point cloud data into building models",2017,"Advanced Engineering Informatics",24,"https://www.scopus.com/inward/record.uri?eid=2-s2.0-85016642028&doi=10.1016%2fj.aei.2017.03.008&partnerID=40&md5=34f237bc86316c84fbc6f4fca892bf28","In this paper we suggest an extension to the Industry Foundation Classes (IFC) model to integrate point cloud datasets. The proposal includes a schema extension to the core model allowing the storage of points, either as Cartesian coordinates, points in parametric space of associated building element surfaces or as discrete height fields projected as grids onto building elements. To handle the considerable amounts of data generated in the process of scanning building structures, we present intelligent compression approaches combined with the Hierarchical Data Format (HDF) as an efficient serialization and an alternative to clear text encoded ISO 10303 part 21 files. Based on prototypical implementations we show results of various serialization options and their impacts on storage efficiency. In this proposal the deepened semantic relationships have been favoured over compression ratios. Nevertheless, with various near-lossless layers of compression and binary serialization applied, a compression ratio of up to 67.7% is obtained for a building model with integrated point clouds, compared to the raw source data. The binary serialization is able to handle hundreds of millions of points, out of which specific spatial and semantic subsets can rapidly be extracted due to the containerized hierarchical storage model and association to building elements. The authors advocate the use of binary storage for sizeable point cloud scans, but also show how especially the grid discretization can result into usable points cloud segments embedded into text-based IFC models. © 2017 Elsevier Ltd",Article,"Final",Scopus,2-s2.0-85016642028
"Yang D., Eastman C.M.","A rule-based subset generation method for product data models",2007,"Computer-Aided Civil and Infrastructure Engineering",22,"https://www.scopus.com/inward/record.uri?eid=2-s2.0-33845483364&doi=10.1111%2fj.1467-8667.2006.00476.x&partnerID=40&md5=6573b7d6c206b9ec230cacbbf65551c9","A neutral product model facilitates data exchange and integration. Particularly in the Architecture, Engineering and Construction product domains, neutral product models have been developed to support integration across segments of the product lifecycle and thus support a range of applications. Because of this, only subsets of the neutral data structures are utilized in any one exchange. Subsets are also called conformance classes (ISO-STEP, CIS/2) or views (IFC), and include subtle conceptual and intentional differences. In current practice, the subset definition method ranges from just selecting entity data types, to defining a sub schema (data model), or to describing the purpose of the subset in natural language. This diversity in defining a subset comes from the complexity of reference relationships and subtyping capabilities of current product data models defined in the EXPRESS product modeling language. This article presents a formal method for defining a schema subset using set theory. It introduces the concept of a base set. A base set works as a building block of a subset with identified rules. It also identifies subset generation rules and a classification of rules according to schema versus instance, and semantic versus syntactic characteristics of subsets. The presented capabilities are intended to facilitate the generation of views within a product model schema supporting specific exchanges. © 2007 Computer-Aided Civil and Infrastructure Engineering.",Article,"Final",Scopus,2-s2.0-33845483364
"Diakite A.A., Zlatanova S.","Automatic geo-referencing of BIM in GIS environments using building footprints",2020,"Computers, Environment and Urban Systems",21,"https://www.scopus.com/inward/record.uri?eid=2-s2.0-85076711893&doi=10.1016%2fj.compenvurbsys.2019.101453&partnerID=40&md5=fd523f1b455cd19491efce2b16aeb6db","The integration of Building Information Models (BIM) in environments such as Geographic Information System (GIS) is currently one of the main investigated research problem in the urban spatial information community. Among the several issues that are involved in the adequate realisation of such type of integration, one particularly relevant to the GIS world is the geo-referencing of data coming from the BIM domain. The latter, which is inherited from the Computer Aided Design (CAD) world, often relies on local coordinate systems and thereby provides models with no or wrong information with respect to their actual geographic position. Based on well-known processes in the field of computer vision, this paper proposes an automatic framework that allows to transform the local coordinates of a BIM model into its real world geographic coordinates. Starting from a geo-referenced 2D polygon of the building (footprint or vertical projection), our method directly applies a rigid motion transformation to a corresponding 2D projection generated from the BIM model in order to obtain the transformation matrix that will align the geometry of the BIM to the map's one. In comparison with the most common approaches of shape alignment and rigid body transformation, our approach requires neither the input polygons to have the same number of points nor their sequence of points to be corresponding, allowing thereby to maximize the automation of the process while still providing accurate results. Several cases of BIM geo-referencing are presented and discussed. Furthermore, our experiments show that centimetre accurary can be reached in the alignment process. © 2019 Elsevier Ltd",Article,"Final",Scopus,2-s2.0-85076711893
"Zverovich V., Mahdjoubi L., Boguslawski P., Fadli F., Barki H.","Emergency Response in Complex Buildings: Automated Selection of Safest and Balanced Routes",2016,"Computer-Aided Civil and Infrastructure Engineering",20,"https://www.scopus.com/inward/record.uri?eid=2-s2.0-84960192936&doi=10.1111%2fmice.12197&partnerID=40&md5=b52e02cf427129f7fdf049a040203387","The extreme importance of emergency response in complex buildings during natural and human-induced disasters has been widely acknowledged. In particular, there is a need for efficient algorithms for finding safest evacuation routes, which would take into account the 3-D structure of buildings, their relevant semantics, and the nature and shape of hazards. In this article, we propose algorithms for safest routes and balanced routes in buildings, where an extreme event with many epicenters is occurring. In a balanced route, a trade-off between route length and hazard proximity is made. The algorithms are based on a novel approach that integrates a multiattribute decision-making technique, Dijkstra's classical algorithm and the introduced hazard proximity numbers, hazard propagation coefficient and proximity index for a route. © 2016 Computer-Aided Civil and Infrastructure Engineering",Article,"Final",Scopus,2-s2.0-84960192936
"Xu Z., Zhang L., Li H., Lin Y.-H., Yin S.","Combining IFC and 3D tiles to create 3D visualization for building information modeling",2020,"Automation in Construction",18,"https://www.scopus.com/inward/record.uri?eid=2-s2.0-85075102316&doi=10.1016%2fj.autcon.2019.102995&partnerID=40&md5=6690056689622b95051f616eadf003e0","Integrating two critical technologies, Building Information Modeling (BIM) and Geographic Information System (GIS), can bring excellent results into digital construction. However, a point of contention in this integration has yet to be resolved. In view of the shortcomings of the network transmission and browser rendering of current integrated BIM-GIS schemes, accordingly the 3D Tiles data format using Web Graphics Library (WebGL) as the standard for rendering 3D models has been widely considered in recent years. This study provides an implementation plan for data integration and information interaction between BIM and GIS. It aims to improve the traditional model simplification processing solution, analyze the current insufficient network transmission and browser rendering ability of the BIM and GIS integration scheme, and transform the BIM model from the Industry Foundation Classes (IFC) into the 3D Tiles data format. In this study, IFC standard files are first exported as the data source, and the mapping relationship between BIM files and 3D Tiles files is analyzed. The integral IFC model is then reorganized to form JSON files associated with semantic attributes and building component models with geometric information. The proposed relationship mapping allows the attribute contained in the IFC models to be delivered to 3D tiles. Meanwhile, the coordinate transformation, data mapping, spatial index, and Level of Details (LOD) hierarchical division are completed during conversion to ensure fast and efficient rendering interaction of BIM data and geographical features in the 3D WebGIS framework. The experiment results indicated that users can quickly load the BIM model on the Web site, which may be viewed as a feasible solution for the large-scale data integration of GIS and BIM on the Web site. © 2019 Elsevier B.V.",Article,"Final",Scopus,2-s2.0-85075102316
"Ackermann K., Angus S.D.","A resource efficient big data analysis method for the social sciences: The case of global IP activity",2014,"Procedia Computer Science",15,"https://www.scopus.com/inward/record.uri?eid=2-s2.0-84902844754&doi=10.1016%2fj.procs.2014.05.220&partnerID=40&md5=cccf5e12bcdb6d645a0585401ab61a04","This paper presents a novel and efficient way of analysing big datasets used in social science research. We provide and demonstrate a way to deal with such datasets without the need for high performance distributed computational facilities. Using an Internet census dataset and with the help of freely available tools and programming libraries, we visualize global IP activity in a spatial and time dimension. We observe a considerable reduction in storage size of our dataset coupled with a faster processing time. © The Authors. Published by Elsevier B.V.",Conference Paper,"Final",Scopus,2-s2.0-84902844754
"Kuster C., Hippolyte J.-L., Rezgui Y.","The UDSA ontology: An ontology to support real time urban sustainability assessment",2020,"Advances in Engineering Software",14,"https://www.scopus.com/inward/record.uri?eid=2-s2.0-85074789238&doi=10.1016%2fj.advengsoft.2019.102731&partnerID=40&md5=0e36e577c2d47d7acbfd851439947509","Urban sustainability assessment frameworks have emerged during the past decade to address holistically the complexity of the urban landscape through a systems approach, factoring in environmental, social and economic requirements. However, the current assessment schemes are (a) static in nature, and as such don't reflect the dynamic and real-time nature of urban artefacts, (b) are not grounded in semantics (e.g. BIM and GIS), and (c) are at best used to assist in regulatory compliance, for instance in energy design, to meet increasingly stringent regulatory requirements. Information and communication technologies provide a new value proposition capitalizing on the Internet of Things (IoT) and semantics to provide real-time insights and inform decision making. Consequently, there is a real need in the field for data models that could facilitate data exchange and handle data heterogeneity. In this study, a semantic data model is considered to support near real-time urban sustainability assessment and enhance the semantics of sensor network data. Based on an extensive review of urban sustainability assessment frameworks and ontology development methodologies, the Urban District Sustainability Assessment (UDSA) ontology has been developed and validated using real data from the site of “The Works”, a newly refurbished neighbourhood in Ebbw Vale, Wales. This novel approach reconciles several domain-specific ontologies within one high-level ontology that can support the creation of real-time urban sustainability assessment software. In addition, this information model is aligned with 29 authoritative urban sustainability assessment frameworks, thus providing a useful resource not only in urban sustainability assessment, but also in the wider smart cities context. © 2019 Elsevier Ltd",Article,"Final",Scopus,2-s2.0-85074789238
"Krijnen T., Beetz J.","A SPARQL query engine for binary-formatted IFC building models",2018,"Automation in Construction",9,"https://www.scopus.com/inward/record.uri?eid=2-s2.0-85051390191&doi=10.1016%2fj.autcon.2018.07.014&partnerID=40&md5=8c5c61dc7d344fc98464a8f73a60b6be","To date, widely implemented and full-featured query languages for building models in their native exchange formats do not exist. While interesting proposals exist for querying Industry Foundation Classes (IFC) models, their functionality is often incomplete and their semantics not precisely defined. With the introduction of the ifcOWL ontology as an equivalent to the IFC schema in the Web Ontology Language (OWL), an option to represent such models in RDF (Resource Description Framework, a general information modeling method) is provided, and such models can be queried using SPARQL (SPARQL Protocol and RDF Query Language). The size of data sets in complex building projects, however, renders the use of clear-text encoded RDF infeasible in many cases. A SPARQL implementation, compatible with ifcOWL, is proposed, directly atop a standardized binary serialization format for IFC building models. This novel format is the binary equivalent of traditional IFC serialization formats but with more compact storage and less overhead than the graph serialization in RDF. The format is based on ISO 10303-26 and relies on an open standard for organizing large amounts of data: Hierarchical Data Format version 5 (HDF5). Due to hierarchical partitioning and fixed-length records, only small subsets of the data are read to answer queries, improving efficiency. A prototypical implementation of the query engine is provided in the Python programming language. In several realistic use cases, the proposed system performs equivalent to or better than the state of the art in SPARQL querying on building models. For large datasets, the proposed storage format results in files that are 2–3 times smaller than the current, most concise, RDF databases while offering a platform-neutral, containerized exchange file. © 2018 Elsevier B.V.",Article,"Final",Scopus,2-s2.0-85051390191
"Duane W., Livingstone D., Kidd D.","Integrating environmental models with GIS: An object-oriented approach utilising a hierarchical data format (HDF) data repository",2000,"Transactions in GIS",7,"https://www.scopus.com/inward/record.uri?eid=2-s2.0-0033840066&doi=10.1111%2f1467-9671.00053&partnerID=40&md5=567222ee0253ee7eb07a418d233246b3","Conceptual, as well as operational, aspects need to be taken into account when developing an integrated modelling framework. A set of achievable requirements has been identified which are used to realise a solution that is applied to the modelling of ephemeral flood channels. The solution described provides: (1) a common data repository within which all model run details, scientific data sets and output results reside; (2) the ability to interactively visualise and select suitable data sets from the data repository to configure the model; (3) an interface for mediating the flow of information between model and other applications; and (4) the possibility to allow model functionality and associated data to be made available to the wider scientific community. This is achieved using an object-oriented approach within the Research System Inc. Interactive Data Language (IDL) and the adoption of National Center for Supercomputer Application's HDF as a common file format for modelling scenarios. The paper outlines the development of a class library, EM_HDF, for mediating and facilitating data exchange between the model and its HDF data repository. The developed system is designed to be applicable to a wide range of modelling applications beyond the fluvial model described.",Article,"Final",Scopus,2-s2.0-0033840066
"Hu Z.-Z., Yuan S., Benghi C., Zhang J.-P., Zhang X.-Y., Li D., Kassem M.","Geometric optimization of building information models in MEP projects: Algorithms and techniques for improving storage, transmission and display",2019,"Automation in Construction",5,"https://www.scopus.com/inward/record.uri?eid=2-s2.0-85071976947&doi=10.1016%2fj.autcon.2019.102941&partnerID=40&md5=7c0233395eec1d96acd5c5a8f5560d5a","Mechanical, Electrical and Plumbing (MEP) models are generally characterized by information redundancy and a high density of irregularly shaped components. Consequently, they require large storage spaces and are not conducive for interchange purposes. Geometric optimization of MEP models can play a significant role in facilitating model exchange and handover by increasing storage, transmission and display efficiency. To date, the body of knowledge on such geometric optimization, unfortunately, is still very narrow. This paper presents and tests a solution for the optimization of storage, transmission, and display of MEP models. Storage optimization was achieved through a mapping-based model description method and a novel Quadric-Error-Metric (QEM) mesh simplification algorithm, reducing required storage while maintaining the contour of components. For transmission optimization, a normal vector compression algorithm and a fixed-dictionary specific compression algorithm were proposed to achieve efficient compression of data thus, fulfilling the need for cross-platform interchange. Display optimization was obtained through a normal vector regeneration algorithm for clustering triangle meshes to improve 3D display effects. The evaluation of the solution, performed for each individual component separately as well as for an entire solution, proved successful. Volume of storage data was reduced by 40% to 50% through mesh simplification. Data transmission volume was reduced by more than 80% for components with complicated geometry without affecting the topology of the components. Finally, the display process was capable of decreasing the number of triangles and delivering very good quality of displayed models. © 2019 Elsevier B.V.",Article,"Final",Scopus,2-s2.0-85071976947
"Chen Y., Wang F., Li S., Xiao B.J., Yang F.","The implementation of a data acquisition and service system based on HDF5",2016,"Fusion Engineering and Design",4,"https://www.scopus.com/inward/record.uri?eid=2-s2.0-84975705626&doi=10.1016%2fj.fusengdes.2016.02.047&partnerID=40&md5=a9c8e3c34187d958cf994d891f8d778e","A data acquisition and service system based on HDF5 has been designed. It includes four components: data acquisition console, data acquisition subsystem, data archive system and data service. The data acquisition console manages all DAQ information and controls the acquisition process. The data acquisition subsystem supports continuous data acquisition with different sampling rates which can be divided into low, medium and high level. All experimental data will be remotely transferred to the data archive system. It adopts HDF5 as its low-level data storage format. The hierarchical data structure of HDF5 is useful for efficiently managing the experimental data and allows users to define special data types and compression filter which can be useful to deal with special signals. Several data service tools have also been developed so that users can get data service via Client/Server or Brower/Server. The system will be demonstrated on Keda Torus eXperiment (KTX) device, which is a new Reversed Field Pinch (RFP) magnetic confinement device. The details are presented in the paper. © 2016 Elsevier B.V.",Article,"Final",Scopus,2-s2.0-84975705626
"Krijnen T.F.",[No title available],2019,"Efficient Storage and Retrieval of Detailed Building Models: Multi-Disciplinary and Long-Term Use of Geometric and Semantic Construction Information Eindhoven",3,,[No abstract available],,"Final",Scopus,2-s2.0-85098861482
[No author name available],[No title available],2020,"HDF5 Documentation",2,,[No abstract available],,"Final",Scopus,2-s2.0-85098849605
[No author name available],"Citygml | OGC",2020,"CityGML | OGC",2,,[No abstract available],,"Final",Scopus,2-s2.0-85098857761
