Authors,Title,Year,Source title,Cited by,Link,Abstract,Document Type,Publication Stage,Source,EID
"Pətrəucean V., Armeni I., Nahangi M., Yeung J., Brilakis I., Haas C.","State of research in automatic as-built modelling",2015,"Advanced Engineering Informatics",222,"https://www.scopus.com/inward/record.uri?eid=2-s2.0-84937515039&doi=10.1016%2fj.aei.2015.01.001&partnerID=40&md5=96e6b0f83ff79ae9cc701178846dbec8","Building Information Models (BIMs) are becoming the official standard in the construction industry for encoding, reusing, and exchanging information about structural assets. Automatically generating such representations for existing assets stirs up the interest of various industrial, academic, and governmental parties, as it is expected to have a high economic impact. The purpose of this paper is to provide a general overview of the as-built modelling process, with focus on the geometric modelling side. Relevant works from the Computer Vision, Geometry Processing, and Civil Engineering communities are presented and compared in terms of their potential to lead to automatic as-built modelling. © 2015 Elsevier Ltd. All rights reserved.",Article,"Final",Scopus,2-s2.0-84937515039
"El Saddik A.","Digital Twins: The Convergence of Multimedia Technologies",2018,"IEEE Multimedia",218,"https://www.scopus.com/inward/record.uri?eid=2-s2.0-85051272175&doi=10.1109%2fMMUL.2018.023121167&partnerID=40&md5=1f0cc65d2de15e4c4d8326890036049d","Originally developed to improve manufacturing processes, digital twins are being redefined as digital replications of living as well as nonliving entities that enable data to be seamlessly transmitted between the physical and virtual worlds. Digital twins facilitate the means to monitor, understand, and optimize the functions of all physical entities and for humans provide continuous feedback to improve quality of life and well-being. © 1994-2012 IEEE.",Article,"Final",Scopus,2-s2.0-85051272175
"Nguyen A., Le B.","3D point cloud segmentation: A survey",2013,"IEEE Conference on Robotics, Automation and Mechatronics, RAM - Proceedings",212,"https://www.scopus.com/inward/record.uri?eid=2-s2.0-84898036866&doi=10.1109%2fRAM.2013.6758588&partnerID=40&md5=7dba34477f10c1207eb0d3a10490d1f5","3D point cloud segmentation is the process of classifying point clouds into multiple homogeneous regions, the points in the same region will have the same properties. The segmentation is challenging because of high redundancy, uneven sampling density, and lack explicit structure of point cloud data. This problem has many applications in robotics such as intelligent vehicles, autonomous mapping and navigation. Many authors have introduced different approaches and algorithms. In this survey, we examine methods that have been proposed to segment 3D point clouds. The advantages, disadvantages, and design mechanisms of these methods are analyzed and discussed. Finally, we outline the promising future research directions. © 2013 IEEE.",Conference Paper,"Final",Scopus,2-s2.0-84898036866
"Chernov N., Lesort C.","Least squares fitting of circles",2005,"Journal of Mathematical Imaging and Vision",201,"https://www.scopus.com/inward/record.uri?eid=2-s2.0-24944557190&doi=10.1007%2fs10851-005-0482-8&partnerID=40&md5=78f40e60bc04d22d93de8b3c36717e6e","Fitting standard shapes or curves to incomplete data (which represent only a small part of the curve) is a notoriously difficult problem. Even if the curve is quite simple, such as an ellipse or a circle, it is hard to reconstruct it from noisy data sampled along a short arc. Here we study the least squares fit (LSF) of circular arcs to incomplete scattered data. We analyze theoretical aspects of the problem and reveal the cause of unstable behavior of conventional algorithms. We also find a remedy that allows us to build another algorithm that accurately fits circles to data sampled along arbitrarily short arcs. © 2005 Springer Science + Business Media, Inc.",Article,"Final",Scopus,2-s2.0-24944557190
"Marton Z.C., Rusu R.B., Beetz M.","On fast surface reconstruction methods for large and noisy point clouds",2009,"Proceedings - IEEE International Conference on Robotics and Automation",193,"https://www.scopus.com/inward/record.uri?eid=2-s2.0-85059647843&doi=10.1109%2fROBOT.2009.5152628&partnerID=40&md5=1fc0b82fd0130f5cebaeeaf3e165f97f","In this paper we present a method for fast surface reconstruction from large noisy datasets. Given an unorganized 3D point cloud, our algorithm recreates the underlying surface's geometrical properties using data resampling and a robust triangulation algorithm in near realtime. For resulting smooth surfaces, the data is resampled with variable densities according to previously estimated surface curvatures. Incremental scans are easily incorporated into an existing surface mesh, by determining the respective overlapping area and reconstructing only the updated part of the surface mesh. The proposed framework is flexible enough to be integrated with additional point label information, where groups of points sharing the same label are clustered together and can be reconstructed separately, thus allowing fast updates via triangular mesh decoupling. To validate our approach, we present results obtained from laser scans acquired in both indoor and outdoor environments. © 2009 IEEE.",Conference Paper,"Final",Scopus,2-s2.0-85059647843
"Thompson W.B., Owen J.C., De St. Germain H.J., Stark Jr. S.R., Henderson T.C.","Feature-based reverse engineering of mechanical parts",1999,"IEEE Transactions on Robotics and Automation",192,"https://www.scopus.com/inward/record.uri?eid=2-s2.0-0033078814&doi=10.1109%2f70.744602&partnerID=40&md5=ae9af5229051ff70bce97ab1a45f9cf8","Reverse engineering of mechanical parts requires extraction of information about an instance of a particular part sufficient to replicate the part using appropriate manufacturing techniques. This is important in a wide variety of situations, since functional CAD models are often unavailable or unusable for parts which must be duplicated or modified. Computer vision techniques applied to three-dimensional (3-D) data acquired using noncontact, 3-D position digitizers have the potential for significantly aiding the process. Serious challenges must be overcome, however, if sufficient accuracy is to be obtained and if models produced from sensed data are to be truly useful for manufacturing operations. This paper describes a prototype of a reverse engineering system which uses manufacturing features as geometric primitives. This approach has two advantages over current practice. The resulting models can be directly imported into feature-based CAD systems without loss of the semantics and topological information inherent in feature-based representations. In addition, the feature-based approach facilitates methods capable of producing highly accurate models, even when the original 3-D sensor data has substantial errors.",Article,"Final",Scopus,2-s2.0-0033078814
"Xiang Y., Choi W., Lin Y., Savarese S.","Data-driven 3D Voxel Patterns for object category recognition",2015,"Proceedings of the IEEE Computer Society Conference on Computer Vision and Pattern Recognition",189,"https://www.scopus.com/inward/record.uri?eid=2-s2.0-84959238956&doi=10.1109%2fCVPR.2015.7298800&partnerID=40&md5=c3ee953b0a86583f1fb24df83401370f","Despite the great progress achieved in recognizing objects as 2D bounding boxes in images, it is still very challenging to detect occluded objects and estimate the 3D properties of multiple objects from a single image. In this paper, we propose a novel object representation, 3D Voxel Pattern (3DVP), that jointly encodes the key properties of objects including appearance, 3D shape, viewpoint, occlusion and truncation. We discover 3DVPs in a data-driven way, and train a bank of specialized detectors for a dictionary of 3DVPs. The 3DVP detectors are capable of detecting objects with specific visibility patterns and transferring the meta-data from the 3DVPs to the detected objects, such as 2D segmentation mask, 3D pose as well as occlusion or truncation boundaries. The transferred meta-data allows us to infer the occlusion relationship among objects, which in turn provides improved object recognition results. Experiments are conducted on the KITTI detection benchmark [17] and the outdoor-scene dataset [41]. We improve state-of-the-art results on car detection and pose estimation with notable margins (6% in difficult data of KITTI). We also verify the ability of our method in accurately segmenting objects from the background and localizing them in 3D. © 2015 IEEE.",Conference Paper,"Final",Scopus,2-s2.0-84959238956
"Zhou Y., Tuzel O.","VoxelNet: End-to-end learning for point cloud based 3D object detection",2017,"Voxelnet: End-To-End Learning for Point Cloud Based 3D Object Detection",176,,[No abstract available],,"Final",Scopus,2-s2.0-85049882048
"Ochmann S., Vock R., Wessel R., Klein R.","Automatic reconstruction of parametric building models from indoor point clouds",2016,"Computers and Graphics (Pergamon)",176,"https://www.scopus.com/inward/record.uri?eid=2-s2.0-84939192627&doi=10.1016%2fj.cag.2015.07.008&partnerID=40&md5=d9f51536ca4b70abfd05bbc547fce3c9","We present an automatic approach for the reconstruction of parametric 3D building models from indoor point clouds. While recently developed methods in this domain focus on mere local surface reconstructions which enable e.g. efficient visualization, our approach aims for a volumetric, parametric building model that additionally incorporates contextual information such as global wall connectivity. In contrast to pure surface reconstructions, our representation thereby allows more comprehensive use: first, it enables efficient high-level editing operations in terms of e.g. wall removal or room reshaping which always result in a topologically consistent representation. Second, it enables easy taking of measurements like e.g. determining wall thickness or room areas. These properties render our reconstruction method especially beneficial to architects or engineers for planning renovation or retrofitting. Following the idea of previous approaches, the reconstruction task is cast as a labeling problem which is solved by an energy minimization. This global optimization approach allows for the reconstruction of wall elements shared between rooms while simultaneously maintaining plausible connectivity between all wall elements. An automatic prior segmentation of the point clouds into rooms and outside area filters large-scale outliers and yields priors for the definition of labeling costs for the energy minimization. The reconstructed model is further enriched by detected doors and windows. We demonstrate the applicability and reconstruction power of our new approach on a variety of complex real-world datasets requiring little or no parameter adjustment. © 2015 The Authors. Published by Elsevier Ltd.",Article,"Final",Scopus,2-s2.0-84939192627
"Grilli E., Menna F., Remondino F.","A review of point clouds segmentation and classification algorithms",2017,"International Archives of the Photogrammetry, Remote Sensing and Spatial Information Sciences - ISPRS Archives",173,"https://www.scopus.com/inward/record.uri?eid=2-s2.0-85021757670&doi=10.5194%2fisprs-archives-XLII-2-W3-339-2017&partnerID=40&md5=3b5644d4a40c7b6a33d8e34e909529c2","Today 3D models and point clouds are very popular being currently used in several fields, shared through the internet and even accessed on mobile phones. Despite their broad availability, there is still a relevant need of methods, preferably automatic, to provide 3D data with meaningful attributes that characterize and provide significance to the objects represented in 3D. Segmentation is the process of grouping point clouds into multiple homogeneous regions with similar properties whereas classification is the step that labels these regions. The main goal of this paper is to analyse the most popular methodologies and algorithms to segment and classify 3D point clouds. Strong and weak points of the different solutions presented in literature or implemented in commercial software will be listed and shortly explained. For some algorithms, the results of the segmentation and classification is shown using real examples at different scale in the Cultural Heritage field. Finally, open issues and research topics will be discussed.",Conference Paper,"Final",Scopus,2-s2.0-85021757670
"Dick A.R., Torr P.H.S., Cipolla R.","Modelling and interpretation of architecture from several images",2004,"International Journal of Computer Vision",172,"https://www.scopus.com/inward/record.uri?eid=2-s2.0-3042841708&doi=10.1023%2fB%3aVISI.0000029665.07652.61&partnerID=40&md5=ebf73444758ac3e738b55aec4d989254","This paper describes the automatic acquisition of three dimensional architectural models from short image sequences. The approach is Bayesian and model based. Bayesian methods necessitate the formulation of a prior distribution; however designing a generative model for buildings is a difficult task. In order to overcome this a building is described as a set of walls together with a 'Lego' kit of parameterised primitives, such as doors or windows. A prior on wall layout and a prior on the parameters of each primitive can then be defined. Part of this prior is learnt from training data and part comes from expert architects. The validity of the prior is tested by generating example buildings using MCMC and verifying that plausible buildings are generated under varying conditions. The same MCMC machinery can also be used for optimising the structure recovery, this time generating a range of possible solutions from the posterior. The fact that a range of solutions can be presented allows the user to select the best when the structure recovery is ambiguous.",Review,"Final",Scopus,2-s2.0-3042841708
"Kalogerakis E., Averkiou M., Maji S., Chaudhuri S.","3D Shape segmentation with projective convolutional networks",2017,"Proceedings - 30th IEEE Conference on Computer Vision and Pattern Recognition, CVPR 2017",164,"https://www.scopus.com/inward/record.uri?eid=2-s2.0-85042260380&doi=10.1109%2fCVPR.2017.702&partnerID=40&md5=f8890cc8eff827d87d6d12056cd6cd74","This paper introduces a deep architecture for segmenting 3D objects into their labeled semantic parts. Our architecture combines image-based Fully Convolutional Networks (FCNs) and surface-based Conditional Random Fields (CRFs) to yield coherent segmentations of 3D shapes. The image-based FCNs are used for efficient view-based reasoning about 3D object parts. Through a special projection layer, FCN outputs are effectively aggregated across multiple views and scales, then are projected onto the 3D object surfaces. Finally, a surface-based CRF combines the projected outputs with geometric consistency cues to yield coherent segmentations. The whole architecture (multi-view FCNs and CRF) is trained end-to-end. Our approach significantly outperforms the existing state-of-the-art methods in the currently largest segmentation benchmark (ShapeNet). Finally, we demonstrate promising segmentation results on noisy 3D shapes acquired from consumer-grade depth cameras. © 2017 IEEE.",Conference Paper,"Final",Scopus,2-s2.0-85042260380
"BSI",[No title available],2013,"PAS 1192-2:2013: Specification for Information Management for the Capital/delivery Phase of Construction Projects Using Building Information Modelling",164,,[No abstract available],,"Final",Scopus,2-s2.0-84887062145
"Rabbani T., Van Den Heuvel F.","Efficient Hough transform for automatic detection of cylinders in point clouds",2005,"International Archives of the Photogrammetry, Remote Sensing and Spatial Information Sciences - ISPRS Archives",163,"https://www.scopus.com/inward/record.uri?eid=2-s2.0-84970877112&partnerID=40&md5=4b9bc850142f2a4d9eda81a32a1e7b94","We present an efficient Hough transform for automatic detection of cylinders in point clouds. As cylinders are one of the most frequently used primitives for industrial design, automatic and robust methods for their detection and fitting are essential for reverse engineering from point clouds. The current methods employ automatic segmentation followed by geometric fitting, which requires a lot of manual interaction during modelling. Although Hough transform can be used for automatic detection of cylinders, the required 5D Hough space has a prohibitively high time and space complexity for most practical applications. We address this problem in this paper and present a sequential Hough transform for automatic detection of cylinders in point clouds. Our algorithm consists of two sequential steps of low dimensional Hough transforms. The first step, called Orientation Estimation, uses the Gaussian sphere of the input data and performs a 2D Hough Transform for finding strong hypotheses for the direction of cylinder axis. The second step of Position and Radius Estimation, consists of a 3D Hough transform for estimating cylinder position and radius. This sequential breakdown reduces the space and time complexity while retaining the advantages of robustness against outliers and multiple instances. The results of applying this algorithm to real data sets from two industrial sites are presented that demonstrate the effectiveness of this procedure for automatic cylinder detection. © 2005 International Society for Photogrammetry and Remote Sensing. All rights reserved.",Conference Paper,"Final",Scopus,2-s2.0-84970877112
"Kim V.G., Li W., Mitra N.J., Chaudhuri S., Di Verdi S., Funkhouser T.","Learning part-based templates from large collections of 3D shapes",2013,"ACM Transactions on Graphics",158,"https://www.scopus.com/inward/record.uri?eid=2-s2.0-84880820276&doi=10.1145%2f2461912.2461933&partnerID=40&md5=a98ad714c0efc9a678bc107919efce6d","As large repositories of 3D shape collections continue to grow, understanding the data, especially encoding the inter-model similarity and their variations, is of central importance. For example, many data-driven approaches now rely on access to semantic segmentation information, accurate inter-model point-to-point correspondence, and deformation models that characterize the model collections. Existing approaches, however, are either supervised requiring manual labeling; or employ super-linear matching algorithms and thus are unsuited for analyzing large collections spanning many thousands of models.We propose an automatic algorithm that starts with an initial template model and then jointly optimizes for part segmentation, point-to-point surface correspondence, and a compact deformation model to best explain the input model collection. As output, the algorithm produces a set of probabilistic part-based templates that groups the original models into clusters of models capturing their styles and variations. We evaluate our algorithm on several standard datasets and demonstrate its scalability by analyzing much larger collections of up to thousands of shapes. Copyright © ACM 2013.",Article,"Final",Scopus,2-s2.0-84880820276
"Rusu R.B., Blodow N., Marton Z.C., Beetz M.","Close-range scene segmentation and reconstruction of 3D point cloud maps for mobile manipulation in domestic environments",2009,"2009 IEEE/RSJ International Conference on Intelligent Robots and Systems, IROS 2009",157,"https://www.scopus.com/inward/record.uri?eid=2-s2.0-76249088726&doi=10.1109%2fIROS.2009.5354683&partnerID=40&md5=d5f3380980a7d8daf5cccecca18af811","In this paper we present a framework for 3D geometric shape segmentation for close-range scenes used in mobile manipulation and grasping, out of sensed point cloud data. Our proposed approach proposes a robust geometric mapping pipeline for large input datasets that extracts relevant objects useful for a personal robotic assistant to perform manipulation tasks. The objects are segmented out from partial views and a reconstructed model is computed by fitting geometric primitive classes such as planes, spheres, cylinders, and cones. The geometric shape coefficients are then used to reconstruct missing data. Residual points are resampled and triangulated, to create smooth decoupled surfaces that can be manipulated. The resulted map is represented as a hybrid concept and is comprised of 3D shape coefficients and triangular meshes used for collision avoidance in manipulation routines. © 2009 IEEE.",Conference Paper,"Final",Scopus,2-s2.0-76249088726
"Carr J.C., Beatson R.K., McCallum B.C., Fright W.R., McLennan T.J., Mitchell T.J.","Smooth surface reconstruction from noisy range data",2003,"Proceedings of the 1st International Conference on Computer Graphics and Interactive Techniques in Australasia and South East Asia, GRAPHITE '03",156,"https://www.scopus.com/inward/record.uri?eid=2-s2.0-77953211739&doi=10.1145%2f604471.604495&partnerID=40&md5=d790e7c29707cda8c64df101855c1bd2","This paper shows that scattered range data can be smoothed at low cost by fitting a Radial Basis Function (RBF) to the data and convolving with a smoothing kernel (low pass filtering). The RBF exactly describes the range data and interpolates across holes and gaps. The data is smoothed during evaluation of the RBF by simply changing the basic function. The amount of smoothing can be varied as required without having to fit a new RBF to the data. The key feature of our approach is that it avoids resampling the RBF on a fine grid or performing a numerical convolution. Furthermore, the computation required is independent of the extent of the smoothing kernel, i.e., the amount of smoothing. We show that particular smoothing kernels result in the applicability of fast numerical methods. We also discuss an alternative approach in which a discrete approximation to the smoothing kernel achieves similar results by adding new centres to the original RBF during evaluation. This approach allows arbitrary filter kernels, including anisotropic and spatially varying filters, to be applied while also using established fast evaluation methods. We illustrate both techniques with LIDAR laser scan data and noisy synthetic data. Copyright © 2003 by the Association for Computing Machinery, Inc.",Conference Paper,"Final",Scopus,2-s2.0-77953211739
"Wang C., Cho Y.K., Kim C.","Automatic BIM component extraction from point clouds of existing buildings for sustainability applications",2015,"Automation in Construction",155,"https://www.scopus.com/inward/record.uri?eid=2-s2.0-84928163215&doi=10.1016%2fj.autcon.2015.04.001&partnerID=40&md5=7d2fa77c5aa1a0ff811ffd97ed438e3f","Building information models (BIMs) are increasingly being applied throughout a building's lifecycle for various applications, such as progressive construction monitoring and defect detection, building renovation, energy simulation, and building system analysis in the Architectural, Engineering, Construction, and Facility Management (AEC/FM) domains. In conventional approaches, as-is BIM is primarily manually created from point clouds, which is labor-intensive, costly, and time consuming. This paper proposes a method for automatically extracting building geometries from unorganized point clouds. The collected raw data undergo data downsizing, boundary detection, and building component categorization, resulting in the building components being recognized as individual objects and their visualization as polygons. The results of tests conducted on three collected as-is building data to validate the technical feasibility and evaluate the performance of the proposed method indicate that it can simplify and accelerate the as-is building model from the point cloud creation process. © 2015 Elsevier B.V.F.",Article,"Final",Scopus,2-s2.0-84928163215
