Authors,Title,Year,Source title,Cited by,Link,Abstract,Document Type,Publication Stage,Source,EID
"Czerniawski T., Nahangi M., Haas C., Walbridge S.","Pipe spool recognition in cluttered point clouds using a curvature-based shape descriptor",2016,"Automation in Construction",38,"https://www.scopus.com/inward/record.uri?eid=2-s2.0-84991200926&doi=10.1016%2fj.autcon.2016.08.011&partnerID=40&md5=1a9f94bb082dfa4e7a9a88c5f9e08134","Automating dimensional compliance control and progress tracking using computer vision has been identified as a central opportunity for improvement in the construction industry. Current 3D imaging sensors provide massive amounts of spatial data that remain underutilized due to the prohibitively time-consuming manual process of extracting usable information. Desired information is typically centered on a specific object of interest within 3D images, so there is a need for construction specific object recognition processes. In this paper, we present an automated method for locating and extracting pipe spools in cluttered point cloud scans. The method is based on local data level curvature estimation, clustering, and bag-of-features matching. Experimental results from two point clouds containing pipe spool objects demonstrate the method's ability to successfully extract spools from cluttered scenes as well as differentiate between similar spools in a single scene. © 2016 Elsevier B.V.",Article,"Final",Scopus,2-s2.0-84991200926
"Stergiou C., Psannis K.E.","Efficient and secure BIG data delivery in Cloud Computing",2017,"Multimedia Tools and Applications",37,"https://www.scopus.com/inward/record.uri?eid=2-s2.0-85017107163&doi=10.1007%2fs11042-017-4590-4&partnerID=40&md5=18e0cd9cae83714522ceef8822aa3996","Big Data (BD) is a new technology which rapidly growing in the telecommunications sectors, especially in the contemporary field of wireless telecommunications. Another technology that grows rapidly in the field of wireless telecommunications is Cloud Computing (CC). CC concerns an infrastructure where data storage and processing take place outside of the user’s device. Both of them face security and privacy issues in their function. In order to improve them and to optimize their privacy and security issues conducted the present survey. In this paper, we survey BD and CC technology and their basic characteristics, with a focus on the security and privacy issues of both technologies. Specifically, we try to combine the functionality of the two technologies (i.e BD and CC) with the aim to examine the frequent features, and also to discover the benefits related in security issues of their integration. Concluding, we present a new method of an algorithm that can be used for the purpose of improving Cloud Computing’s security through the use of algorithms that can provide more privacy in the data related to Big Data technology. At the end, there is a survey about the challenges of the integration of BD and CC related to their security level. © 2017, Springer Science+Business Media New York.",Article,"Final",Scopus,2-s2.0-85017107163
"Borrmann A., König M., Koch C., Beetz J.","Building information modeling: Technology foundations and industry practice",2018,"Building Information Modeling: Technology Foundations and Industry Practice",36,"https://www.scopus.com/inward/record.uri?eid=2-s2.0-85063561220&doi=10.1007%2f978-3-319-92862-3&partnerID=40&md5=8c214df31ebf588d96314a68ac86f930","Building Information Modeling (BIM) refers to the consistent and continuous use of digital information throughout the entire lifecycle of a built facility, including its design, construction and operation. In order to exploit BIM methods to their full potential, a fundamental grasp of their key principles and applications is essential. Accordingly, this book combines discussions of theoretical foundations with reports from the industry on currently applied best practices. The book's content is divided into six parts: Part I discusses the technological basics of BIM and addresses computational methods for the geometric and semantic modeling of buildings, as well as methods for process modeling. Next, Part II covers the important aspect of the interoperability of BIM software products and describes in detail the standardized data format Industry Foundation Classes. It presents the different classification systems, discusses the data format CityGML for describing 3D city models and COBie for handing over data to clients, and also provides an overview of BIM programming tools and interfaces. Part III is dedicated to the philosophy, organization and technical implementation of BIM-based collaboration, and discusses the impact on legal issues including construction contracts. In turn, Part IV covers a wide range of BIM use cases in the different lifecycle phases of a built facility, including the use of BIM for design coordination, structural analysis, energy analysis, code compliance checking, quantity take-off, prefabrication, progress monitoring and operation. In Part V, a number of design and construction companies report on the current state of BIM adoption in connection with actual BIM projects, and discuss the approach pursued for the shift toward BIM, including the hurdles taken. Lastly, Part VI summarizes the book's content and provides an outlook on future developments. The book was written both for professionals using or programming such tools, and for students in Architecture and Construction Engineering programs. © Springer International Publishing AG, part of Springer Nature 2015, 2018. All rights reserved.",Book,"Final",Scopus,2-s2.0-85063561220
"Wang Y., Zou Y., Henrickson K., Wang Y., Tang J., Park B.-J.","Google Earth elevation data extraction and accuracy assessment for transportation applications",2017,"PLoS ONE",36,"https://www.scopus.com/inward/record.uri?eid=2-s2.0-85018245007&doi=10.1371%2fjournal.pone.0175756&partnerID=40&md5=a0c1cf5cb503035b317b7e80e84248fa","Roadway elevation data is critical for a variety of transportation analyses. However, it has been challenging to obtain such data and most roadway GIS databases do not have them. This paper intends to address this need by proposing a method to extract roadway elevation data from Google Earth (GE) for transportation applications. A comprehensive accuracy assessment of the GE-extracted elevation data is conducted for the area of conterminous USA. The GE elevation data was compared with the ground truth data from nationwide GPS benchmarks and roadway monuments from six states in the conterminous USA. This study also compares the GE elevation data with the elevation raster data from the U.S. Geological Survey National Elevation Dataset (USGS NED), which is a widely used data source for extracting roadway elevation. Mean absolute error (MAE) and root mean squared error (RMSE) are used to assess the accuracy and the test results show MAE, RMSE and standard deviation of GE roadway elevation error are 1.32 meters, 2.27 meters and 2.27 meters, respectively. Finally, the proposed extraction method was implemented and validated for the following three scenarios: (1) extracting roadway elevation differentiating by directions, (2) multi-layered roadway recognition in freeway segment and (3) slope segmentation and grade calculation in freeway segment. The methodology validation results indicate that the proposed extraction method can locate the extracting route accurately, recognize multi-layered roadway section, and segment the extracted route by grade automatically. Overall, it is found that the high accuracy elevation data available from GE provide a reliable data source for various transportation applications. © 2017 Wang et al.This is an open access article distributed under the terms of the Creative Commons Attribution License, which permits unrestricted use, distribution, and reproduction in any medium, provided the original author and source are credited.",Article,"Final",Scopus,2-s2.0-85018245007
"Shi Y., Long P., Xu K., Huang H., Xiong Y.","Data-driven contextual modeling for 3D scene understanding",2016,"Computers and Graphics (Pergamon)",36,"https://www.scopus.com/inward/record.uri?eid=2-s2.0-84955616048&doi=10.1016%2fj.cag.2015.11.003&partnerID=40&md5=5d3d3ce64efb5350e83d7147b9f41c9f","The recent development of fast depth map fusion technique enables the realtime, detailed scene reconstruction using commodity depth camera, making the indoor scene understanding more possible than ever. To address the specific challenges in object analysis at subscene level, this work proposes a data-driven approach to modeling contextual information covering both intra-object part relations and inter-object object layouts. Our method combines the detection of individual objects and object groups within the same framework, enabling contextual analysis without knowing the objects in the scene a priori. The key idea is that while contextual information could benefit the detection of either individual objects or object groups, both can contribute to object extraction when objects are unknown. Our method starts with a robust segmentation and partitions a subscene into segments, each of which represents either an independent object or a part of some object. A set of classifiers are trained for both individual objects and object groups, using a database of 3D scene models. We employ the multiple kernel learning (MKL) to learn per-category optimized classifiers for objects and object groups. Finally, we perform a graph matching to extract objects using the classifiers, thus grouping the segments into either an object or an object group. The output is an object-level labeled segmentation of the input subscene. Experiments demonstrate that the unified contextual analysis framework achieves robust object detection and recognition over cluttered subscenes. © 2015 Elsevier Ltd. All rights reserved.",Article,"Final",Scopus,2-s2.0-84955616048
"Tang P., Akinci B.","Automatic execution of workflows on laser-scanned data for extracting bridge surveying goals",2012,"Advanced Engineering Informatics",35,"https://www.scopus.com/inward/record.uri?eid=2-s2.0-84867899122&doi=10.1016%2fj.aei.2012.07.004&partnerID=40&md5=e5516d3ab572ee24907b9a951a1fc6a6","Graphical abstract: Highlights: Manual data processing impedes bridge inspectors from effectively using 3D data. A framework for executing user-defined 3D data processing workflows is developed. Automatic workflow executions save more than 70% of surveying goal extraction time. Workflow automation enables quantitative characterization of data processing options With the capability of capturing detailed geometry of bridges in minutes, laser scanning technology has attracted the interests of bridge inspectors and researchers in the domain of bridge management. A challenge of effectively utilizing laser scanned point clouds for bridge inspection is that inspectors need to manually extract and measure large numbers of geometric features (e.g., points) for deriving geometric information items (e.g., the minimum underclearance) of bridges, named as bridge surveying goals in this research. Tedious manual data processing impedes inspectors from quantitatively understanding how various data processing options (e.g., algorithms, parameter values) influence the data processing time and the reliabilities of the surveying goal results. This paper shows the needs of automatic workflow executions for extracting surveying goals from laser scanned point clouds, and presents a computational framework for addressing these needs. This computational framework is composed of formal representations of workflows and mechanisms for constructing and executing workflows. Using a prototype system implemented based on this framework, we constructed and quantitatively characterized three workflows for extracting three representative bridge surveying goals, using three metrics of workflow performance defined in this research: exhaustiveness of measurement sampling, reliability of surveying goal results, and time efficiency. © 2012 Elsevier Ltd. All rights reserved.",Conference Paper,"Final",Scopus,2-s2.0-84867899122
"Valero E., Adan A., Cerrada C.","Automatic construction of 3D basic-semantic models of inhabited interiors using laser scanners and RFID sensors",2012,"Sensors (Switzerland)",35,"https://www.scopus.com/inward/record.uri?eid=2-s2.0-84861552895&doi=10.3390%2fs120505705&partnerID=40&md5=609ead68aaa11dba819e6c6789d605c1","This paper is focused on the automatic construction of 3D basic-semantic models of inhabited interiors using laser scanners with the help of RFID technologies. This is an innovative approach, in whose field scarce publications exist. The general strategy consists of carrying out a selective and sequential segmentation from the cloud of points by means of different algorithms which depend on the information that the RFID tags provide. The identification of basic elements of the scene, such as walls, floor, ceiling, windows, doors, tables, chairs and cabinets, and the positioning of their corresponding models can then be calculated. The fusion of both technologies thus allows a simplified 3D semantic indoor model to be obtained. This method has been tested in real scenes under difficult clutter and occlusion conditions, and has yielded promising results. © 2012 by the authors; licensee MDPI, Basel, Switzerland.",Article,"Final",Scopus,2-s2.0-84861552895
"Valero E., Adán A., Bosché F.","Semantic 3D reconstruction of furnished interiors using laser scanning and RFID technology",2016,"Journal of Computing in Civil Engineering",34,"https://www.scopus.com/inward/record.uri?eid=2-s2.0-84975263210&doi=10.1061%2f%28ASCE%29CP.1943-5487.0000525&partnerID=40&md5=1bcff0e06c34f4f09988dfa05d24c1f5","Terrestrial Laser Scanning (TLS) technology is increasingly used for the generation of accurate three-dimensional (3D) models of objects and scenes. But converting the acquired 3D point cloud data into a representative, semantic 3D model of the scene requires advanced processing and skills. This research field is challenging, particularly when considering inhabited, furnished environments that are characterised by clutter and occlusions. This paper presents a TLS data-processing pipeline aimed at producing semantic 3D models of furnished office and home interiors. The structure of rooms (floor, ceiling, and walls with window and door openings) is created using Boundary Representation (B-Rep) models that not only encode the geometry of those elements, but also their connectivity. Windows and doors are recognized and modeled using a novel method based on molding detection. For the furniture, the approach uniquely integrates smart technology [radio frequency identification (RFID)] that is increasingly used for Facilities Management (FM). RFID tags attached to furniture are sensed at the same time as laser scanning is conducted. The collected IDs are used to retrieve discriminatory geometric information about those objects from the building's FM database; this information is used to support their recognition and modeling in the point cloud data. The manuscript particularly reports results for the recognition and modeling of chairs, tables, and wardrobes (and other similar objects like chests of drawers). Extended experimentation of the method has been carried out in real scenarios yielding encouraging results. © 2015 American Society of Civil Engineers.",Article,"Final",Scopus,2-s2.0-84975263210
"Huang J., You S.","Point cloud matching based on 3D self-similarity",2012,"IEEE Computer Society Conference on Computer Vision and Pattern Recognition Workshops",33,"https://www.scopus.com/inward/record.uri?eid=2-s2.0-84864980305&doi=10.1109%2fCVPRW.2012.6238913&partnerID=40&md5=67bdf784ce8766e9ef866bcfccbba936","Point cloud is one of the primitive representations of 3D data nowadays. Despite that much work has been done in 2D image matching, matching 3D points achieved from different perspective or at different time remains to be a challenging problem. This paper proposes a 3D local descriptor based on 3D self-similarities. We not only extend the concept of 2D self-similarity [1] to the 3D space, but also establish the similarity measurement based on the combination of geometric and photometric information. The matching process is fully automatic i.e. needs no manually selected land marks. The results on the LiDAR and model data sets show that our method has robust performance on 3D data under various transformations and noises. © 2012 IEEE.",Conference Paper,"Final",Scopus,2-s2.0-84864980305
"Li Y., Wu X., Wu X., Chrysathou Y., Sharf A., Cohen-Or D., Mitra N.J.","GlobFit: Consistently Fitting Primitives by Discovering Global Relations",2011,"ACM Transactions on Graphics",33,"https://www.scopus.com/inward/record.uri?eid=2-s2.0-85024253284&doi=10.1145%2f2010324.1964947&partnerID=40&md5=bb86cddce6306ab99fddfddf2c741a95","Given a noisy and incomplete point set, we introduce a method that simultaneously recovers a set of locally fitted primitives along with their global mutual relations. We operate under the assumption that the data corresponds to a man-made engineering object consisting of basic primitives, possibly repeated and globally aligned under common relations. We introduce an algorithm to directly couple the local and global aspects of the problem. The local fit of the model is determined by how well the inferred model agrees to the observed data, while the global relations are iteratively learned and enforced through a constrained optimization. Starting with a set of initial RANSAC based locally fitted primitives, relations across the primitives such as orientation, placement, and equality are progressively learned and conformed to. In each stage, a set of feasible relations are extracted among the candidate relations, and then aligned to, while best fitting to the input data. The global coupling corrects the primitives obtained in the local RANSAC stage, and brings them to precise global alignment. We test the robustness of our algorithm on a range of synthesized and scanned data, with varying amounts of noise, outliers, and non-uniform sampling, and validate the results against ground truth, where available. © 2011, ACM. All rights reserved.",Article,"Final",Scopus,2-s2.0-85024253284
"Kim H., Haas C.T., Rauch A.F., Browne C.","Dimensional ratios for stone aggregates from three-dimensional laser scans",2002,"Journal of Computing in Civil Engineering",33,"https://www.scopus.com/inward/record.uri?eid=2-s2.0-16444378194&doi=10.1061%2f%28ASCE%290887-3801%282002%2916%3a3%28175%29&partnerID=40&md5=942c9c96e60e9985e4c3a87958bb2a39","The ""laser-based aggregate scanning system"" (LASS) was developed to rapidly and accurately characterize the three-dimensional shape properties of unbound stone aggregates. A linear motion slide, a laser line scanner, and an integrated computer constitute the hardware of the LASS. Using profile data obtained from laser scans of aggregate particles spread out on a platform, the LASS software virtually rotates each irregularly shaped particle to determine the three principal dimensions used to characterize particle shape. The computational method employed can rapidly process the scanned data without losing critical information. Two hundred randomly selected particles, which have variable material and shape characteristics, were manually measured to obtain data that were then used to verify the accuracy of the LASS results. Good correlation with the manual measurements demonstrates that laser profiling has the potential to be a powerful tool for rapidly analyzing the dimensions of irregularly shaped objects, and could be used for quality-control testing and performance-related characterization of stone aggregate materials. © ASCE,.",Article,"Final",Scopus,2-s2.0-16444378194
"Sharif M.-M., Nahangi M., Haas C., West J.","Automated Model-Based Finding of 3D Objects in Cluttered Construction Point Cloud Models",2017,"Computer-Aided Civil and Infrastructure Engineering",32,"https://www.scopus.com/inward/record.uri?eid=2-s2.0-85029210189&doi=10.1111%2fmice.12306&partnerID=40&md5=32096b6e05eabc7ca96164b8a09f95b3","Finding construction components in cluttered point clouds is a critical pre-processing task that requires intensive and manual operations. Accurate isolation of an object from point clouds is a key for further processing steps such as positive identification, scan-to-building information modeling (BIM), and robotic manipulation. Manual isolaton is tedious, time consuming, and disconnected from the automated tasks involved in the process. This article adapts and examines a method for finding objects within 3D point clouds robustly, quickly, and automatically. A local feature on a pair of points is employed for representing 3D shapes. The method has three steps: (1) offline model library generation, (2) online searching and matching, and (3) match refinement and isolation. Experimental tests are carried out for finding industrial (curvilinear) and structural (rectilinear) elements. The method is verified under various circumstances in order to measure its performance toward addressing the major challenges involved in 3D object finding. Results show that the method is sufficiently quick and robust to be integrated with automated process control frameworks. © 2017 Computer-Aided Civil and Infrastructure Engineering",Article,"Final",Scopus,2-s2.0-85029210189
"Kim H., Rauch A.F., Haas C.T.","Automated quality assessment of stone aggregates based on laser imaging and a neural network",2004,"Journal of Computing in Civil Engineering",32,"https://www.scopus.com/inward/record.uri?eid=2-s2.0-16444382403&doi=10.1061%2f%28ASCE%290887-3801%282004%2918%3a1%2858%29&partnerID=40&md5=eb050946d6f2112abd7b739c5a0fd02c","An automated quality assessment technique is proposed for rapidly detecting excessive size variations during the production of stone aggregates. The system uses a laser profiler to scan collections of aggregate particles and obtain three-dimensional data points on the particle surfaces. For computational efficiency, the resulting data are converted into digital images. Wavelet transforms are then applied to the images to extract features indicative of the material gradation. These wavelet-based features are used as inputs to an artificial neural network, which is trained to classify the aggregate sample. Taken together, these components form a neural network-based classification system that can determine whether or not an aggregate product is in compliance with a given specification. Verification tests show that this approach could potentially help to determine, in an accurate and fast (real-time) manner, when adjustments or repairs to the production equipment are needed. © ASCE,.",Article,"Final",Scopus,2-s2.0-16444382403
"Xu K., Kim V.G., Huang Q., Kalogerakis E.","Data-Driven Shape Analysis and Processing",2017,"Computer Graphics Forum",31,"https://www.scopus.com/inward/record.uri?eid=2-s2.0-85014968807&doi=10.1111%2fcgf.12790&partnerID=40&md5=af779137908a60858bad271b9c0e83b8","Data-driven methods serve an increasingly important role in discovering geometric, structural and semantic relationships between shapes. In contrast to traditional approaches that process shapes in isolation of each other, data-driven methods aggregate information from 3D model collections to improve the analysis, modelling and editing of shapes. Data-driven methods are also able to learn computational models that reason about properties and relationships of shapes without relying on hard-coded rules or explicitly programmed instructions. Through reviewing the literature, we provide an overview of the main concepts and components of these methods, as well as discuss their application to classification, segmentation, matching, reconstruction, modelling and exploration, as well as scene analysis and synthesis. We conclude our report with ideas that can inspire future research in data-driven shape analysis and processing. © 2016 The Authors Computer Graphics Forum © 2016 The Eurographics Association and John Wiley & Sons Ltd.",Article,"Final",Scopus,2-s2.0-85014968807
