Authors,Title,Year,Source title,Cited by,Link,Abstract,Document Type,Publication Stage,Source,EID
"Krizhevsky A., Sutskever I., Hinton G.E.","ImageNet classification with deep convolutional neural networks",2012,"Advances in Neural Information Processing Systems",57043,"https://www.scopus.com/inward/record.uri?eid=2-s2.0-84876231242&partnerID=40&md5=621b2cd1757ccc77341281f8a2f2ecaf","We trained a large, deep convolutional neural network to classify the 1.2 million high-resolution images in the ImageNet LSVRC-2010 contest into the 1000 different classes. On the test data, we achieved top-1 and top-5 error rates of 37.5% and 17.0% which is considerably better than the previous state-of-the-art. The neural network, which has 60 million parameters and 650,000 neurons, consists of five convolutional layers, some of which are followed by max-pooling layers, and three fully-connected layers with a final 1000-way softmax. To make training faster, we used non-saturating neurons and a very efficient GPU implementation of the convolution operation. To reduce overfitting in the fully-connected layers we employed a recently-developed regularization method called ""dropout"" that proved to be very effective. We also entered a variant of this model in the ILSVRC-2012 competition and achieved a winning top-5 test error rate of 15.3%, compared to 26.2% achieved by the second-best entry.",Conference Paper,"Final",Scopus,2-s2.0-84876231242
"Breiman L.","Random forests",2001,"Machine Learning",53290,"https://www.scopus.com/inward/record.uri?eid=2-s2.0-0035478854&doi=10.1023%2fA%3a1010933404324&partnerID=40&md5=4b9f43897146098c0df3a2af232cf2f4","Random forests are a combination of tree predictors such that each tree depends on the values of a random vector sampled independently and with the same distribution for all trees in the forest. The generalization error for forests converges a.s. to a limit as the number of trees in the forest becomes large. The generalization error of a forest of tree classifiers depends on the strength of the individual trees in the forest and the correlation between them. Using a random selection of features to split each node yields error rates that compare favorably to Adaboost (Y. Freund & R. Schapire, Machine Learning: Proceedings of the Thirteenth International conference, * * *, 148-156), but are more robust with respect to noise. Internal estimates monitor error, strength, and correlation and these are used to show the response to increasing the number of features used in the splitting. Internal estimates are also used to measure variable importance. These ideas are also applicable to regression.",Article,"Final",Scopus,2-s2.0-0035478854
"Hastie T., Tibshirani R., Friedman J.",[No title available],2001,"The Elements of Statistical Learning: Data Mining, Inference, and Prediction",34709,,[No abstract available],,,Scopus,2-s2.0-0003684449
"Cortes C., Vapnik V.","Support-Vector Networks",1995,"Machine Learning",31907,"https://www.scopus.com/inward/record.uri?eid=2-s2.0-34249753618&doi=10.1023%2fA%3a1022627411411&partnerID=40&md5=97a8591c7d55575e8c48344379ee2796","The support-vector network is a new learning machine for two-group classification problems. The machine conceptually implements the following idea: input vectors are non-linearly mapped to a very high-dimension feature space. In this feature space a linear decision surface is constructed. Special properties of the decision surface ensures high generalization ability of the learning machine. The idea behind the support-vector network was previously implemented for the restricted case where the training data can be separated without errors. We here extend this result to non-separable training data. High generalization ability of support-vector networks utilizing polynomial input transformations is demonstrated. We also compare the performance of the support-vector network to various classical learning algorithms that all took part in a benchmark study of Optical Character Recognition. © 1995, Kluwer Academic Publishers. All rights reserved.",Article,"Final",Scopus,2-s2.0-34249753618
"Bishop C.M.",[No title available],2006,"Pattern Recognition and Machine Learning",29014,,[No abstract available],,"Final",Scopus,2-s2.0-33846516584
"Srivastava N., Hinton G., Krizhevsky A., Sutskever I., Salakhutdinov R.","Dropout: A simple way to prevent neural networks from overfitting",2014,"Journal of Machine Learning Research",19075,"https://www.scopus.com/inward/record.uri?eid=2-s2.0-84904163933&partnerID=40&md5=b865fd654b3befc5d829dbe5d42b80c3","Deep neural nets with a large number of parameters are very powerful machine learning systems. However, overfitting is a serious problem in such networks. Large networks are also slow to use, making it difficult to deal with overfitting by combining the predictions of many different large neural nets at test time. Dropout is a technique for addressing this problem. The key idea is to randomly drop units (along with their connections) from the neural network during training. This prevents units from co-adapting too much. During training, dropout samples from an exponential number of different ""thinned"" networks. At test time, it is easy to approximate the effect of averaging the predictions of all these thinned networks by simply using a single unthinned network that has smaller weights. This significantly reduces overfitting and gives major improvements over other regularization methods. We show that dropout improves the performance of neural networks on supervised learning tasks in vision, speech recognition, document classification and computational biology, obtaining state-of-the-art results on many benchmark data sets. © 2014 Nitish Srivastava, Geoffrey Hinton, Alex Krizhevsky, Ilya Sutskever and Ruslan Salakhutdinov.",Article,"Final",Scopus,2-s2.0-84904163933
"Fischler M.A., Bolles R.C.","Random sample consensus: A Paradigm for Model Fitting with Applications to Image Analysis and Automated Cartography",1981,"Communications of the ACM",16385,"https://www.scopus.com/inward/record.uri?eid=2-s2.0-0019574599&doi=10.1145%2f358669.358692&partnerID=40&md5=723688ad3a3685cd1b335a0ef3882605","A new paradigm, Random Sample Consensus (RANSAC), for fitting a model to experimental data is introduced. RANSAC is capable of interpreting/smoothing data containing a significant percentage of gross errors, and is thus ideally suited for applications in automated image analysis where interpretation is based on the data provided by error-prone feature detectors. A major portion of this paper describes the application of RANSAC to the Location Determination Problem (LDP): Given an image depicting a set of landmarks with known locations, determine that point in space from which the image was obtained. In response to a RANSAC requirement, new results are derived on the minimum number of landmarks needed to obtain a solution, and algorithms are presented for computing these minimum-landmark solutions in closed form. These results provide the basis for an automatic system that can solve the LDP under difficult viewing. © 1981, ACM. All rights reserved.",Article,"Final",Scopus,2-s2.0-0019574599
"Besl P.J., McKay N.D.","A Method for Registration of 3-D Shapes",1992,"IEEE Transactions on Pattern Analysis and Machine Intelligence",12199,"https://www.scopus.com/inward/record.uri?eid=2-s2.0-0026821209&doi=10.1109%2f34.121791&partnerID=40&md5=ee06231fbe1dba306ad906353ec3701d","This paper describes a general-purpose, representation-independent method for the accurate and computationally efficient registration of 3-D shapes including free-form curves and surfaces. The method handles the full six degrees of freedom and is based on the iterative closest point (ICP) algorithm, which requires only a procedure to find the closest point on a geometric entity to a given point. The ICP algorithm always converges monotonically to the nearest local minimum of a mean-square distance metric, and experience shows that the rate of convergence is rapid during the first few iterations. Therefore, given an adequate set of initial rotations and translations for a particular class of objects with a certain level of “shape complexity,” one can globally minimize the mean-square distance metric over all six degrees of freedom by testing each initial registration. For example, a given “model” shape and a sensed “data” shape that represents a major portion of the model shape can be registered in minutes by testing one initial translation and a relatively small set of rotations to allow for the given level of model complexity. One important application of this method is to register sensed data from unfixtured rigid objects with an ideal geometric model prior to shape inspection. The described method is also useful for deciding fundamental issues such as the congruence (shape equivalence) of different geometric representations as well as for estimating the motion between point sets where the correspondences are not known. Experimental results show the capabilities of the registration algorithm on point sets, curves, and surfaces. © 1992 IEEE",Article,"Final",Scopus,2-s2.0-0026821209
"Freund Y., Schapire R.E.","A Decision-Theoretic Generalization of On-Line Learning and an Application to Boosting",1997,"Journal of Computer and System Sciences",9305,"https://www.scopus.com/inward/record.uri?eid=2-s2.0-0031211090&doi=10.1006%2fjcss.1997.1504&partnerID=40&md5=996d0921b2d1f1002b5593aaee472b2e","In the first part of the paper we consider the problem of dynamically apportioning resources among a set of options in a worst-case on-line framework. The model we study can be interpreted as a broad, abstract extension of the well-studied on-line prediction model to a general decision-theoretic setting. We show that the multiplicative weight-update Littlestone-Warmuth rule can be adapted to this model, yielding bounds that are slightly weaker in some cases, but applicable to a considerably more general class of learning problems. We show how the resulting learning algorithm can be applied to a variety of problems, including gambling, multiple-outcome prediction, repeated games, and prediction of points in ℝn. In the second part of the paper we apply the multiplicative weight-update technique to derive a new boosting algorithm. This boosting algorithm does not require any prior knowledge about the performance of the weak learning algorithm. We also study generalizations of the new boosting algorithm to the problem of learning functions whose range, rather than being binary, is an arbitrary finite set or a bounded segment of the real line. © 1997 Academic Press.",Article,"Final",Scopus,2-s2.0-0031211090
"Lafferty J., McCallum A., Pereira F.","Conditional random fields: Probabilistic models for segmenting and labeling sequence data",2001,"Proc. 18th International Conf. on Machine Learning",8883,,[No abstract available],,,Scopus,2-s2.0-0142192295
"James G., Witten D., Hastie T., Tibshirani R.","An Introduction to Statistical Learning",2013,"An Introduction to Statistical Learning with Applications in R",6380,,[No abstract available],,"Final",Scopus,2-s2.0-84893874008
"Freund Y., Schapire R.E.","Experiments with a new boosting algorithm",1996,"Proceedings of the Thirteenth International Conference on Machine Learning",5835,,[No abstract available],,,Scopus,2-s2.0-0002978642
"Murphy K.P.",[No title available],2012,"Machine Learning: A Probabilistic Perspective",5357,,[No abstract available],,"Final",Scopus,2-s2.0-84857466151
"Zitová B., Flusser J.","Image registration methods: A survey",2003,"Image and Vision Computing",5246,"https://www.scopus.com/inward/record.uri?eid=2-s2.0-0043237770&doi=10.1016%2fS0262-8856%2803%2900137-9&partnerID=40&md5=1896e5bba2ee4fa60f306a2b30c77d97","This paper aims to present a review of recent as well as classic image registration methods. Image registration is the process of overlaying images (two or more) of the same scene taken at different times, from different viewpoints, and/or by different sensors. The registration geometrically align two images (the reference and sensed images). The reviewed approaches are classified according to their nature (area-based and feature-based) and according to four basic steps of image registration procedure: feature detection, feature matching, mapping function design, and image transformation and resampling. Main contributions, advantages, and drawbacks of the methods are mentioned in the paper. Problematic issues of image registration and outlook for the future research are discussed too. The major goal of the paper is to provide a comprehensive reference source for the researchers involved in image registration, regardless of particular application areas. © 2003 Elsevier B.V. All rights reserved.",Article,"Final",Scopus,2-s2.0-0043237770
"LeCun Y., Boser B., Denker J.S., Henderson D., Howard R.E., Hubbard W., Jackel L.D.","Backpropagation applied to handwritten zip code recognition",1989,"Neural Computation",5201,,[No abstract available],,,Scopus,2-s2.0-0000359337
"Sivic J., Zisserman A.","Video google: A text retrieval approach to object matching in videos",2003,"Proceedings of the IEEE International Conference on Computer Vision",5134,"https://www.scopus.com/inward/record.uri?eid=2-s2.0-0345414182&doi=10.1109%2ficcv.2003.1238663&partnerID=40&md5=7651e33e8959ec7e1d959362f33522cb","We describe an approach to object and scene retrieval which searches for and localizes all the occurrences of a user outlined object in a video. The object is represented by a set of viewpoint invariant region descriptors so that recognition can proceed successfully despite changes in viewpoint, illumination and partial occlusion. The temporal continuity of the video within a shot is used to track the regions in order to reject unstable regions and reduce the effects of noise in the descriptors. The analogy with text retrieval is in the implementation where matches on descriptors are pre-computed (using vector quantization), and inverted file systems and document rankings are used. The result is that retrieval is immediate, returning a ranked list of key frames/shots in the manner of Google. The method is illustrated for matching on two full length feature films.",Conference Paper,"Final",Scopus,2-s2.0-0345414182
"Hsu C.-W., Chang C.-C., Lin C.-J.","A practical guide to support vector classification",2003,"A Practical Guide to Support Vector Classification",4938,,[No abstract available],,,Scopus,2-s2.0-4944228528
"Duda R.O., Hart P.E.","Use of the Hough Transformation to Detect Lines and Curves in Pictures",1972,"Communications of the ACM",4709,"https://www.scopus.com/inward/record.uri?eid=2-s2.0-0015285440&doi=10.1145%2f361237.361242&partnerID=40&md5=0105a40397590837fe52eee4ac4a80fd","Hough has proposed an interesting and computationally efficient procedure for detecting lines in pictures. This paper points out that the use of angle-radius rather than slope-intercept parameters simplifies the computation further. It also shows how the method can be used for more general curve fitting, and gives alternative interpretations that explain the source of its efficiency. © 1972, ACM. All rights reserved.",Article,"Final",Scopus,2-s2.0-0015285440
"Hotelling H.","Analysis of a complex of statistical variables into principal components",1933,"Journal of Educational Psychology",4605,"https://www.scopus.com/inward/record.uri?eid=2-s2.0-58149421595&doi=10.1037%2fh0071325&partnerID=40&md5=f86eda8f44cd231d65fd3f9d9c5a3ed8","The problem is stated in detail, a method of analysis is derived and its geometrical meaning shown, methods of solution are illustrated and certain derivative problems are discussed. (To be concluded in October issue.) (PsycINFO Database Record (c) 2006 APA, all rights reserved). © 1933 American Psychological Association.",Article,"Final",Scopus,2-s2.0-58149421595
"Bentley J.L.","Multidimensional Binary Search Trees Used for Associative Searching",1975,"Communications of the ACM",4278,"https://www.scopus.com/inward/record.uri?eid=2-s2.0-0016557674&doi=10.1145%2f361002.361007&partnerID=40&md5=53c42d0c268454a4eb75b99b632cddd5","This paper develops the multidimensional binary search tree (or k-d tree, where k is the dimensionality of the search space) as a data structure for storage of information to be retrieved by associative searches. The k-d tree is defined and examples are given. It is shown to be quite efficient in its storage requirements. A significant advantage of this structure is that a single data structure can handle many types of queries very efficiently. Various utility algorithms are developed; their proven average running times in an n record file are: insertion, O(log n); deletion of the root, O(n(k-1)/k); deletion of a random node, O(log n); and optimization (guarantees logarithmic performance of searches), O(n log n). Search algorithms are given for partial match queries with t keys specified [proven maximum running time of O(n(k-t)/k)] and for nearest neighbor queries [empirically observed average running time of O(log n).] These performances far surpass the best currently known algorithms for these tasks. An algorithm is presented to handle any general intersection query. The main focus of this paper is theoretical. It is felt, however, that k-d trees could be quite useful in many applications, and examples of potential uses are given. © 1975, ACM. All rights reserved.",Article,"Final",Scopus,2-s2.0-0016557674
"Qi C.R., Su H., Mo K., Guibas L.J.","PointNet: Deep learning on point sets for 3D classification and segmentation",2017,"Proceedings - 30th IEEE Conference on Computer Vision and Pattern Recognition, CVPR 2017",3556,"https://www.scopus.com/inward/record.uri?eid=2-s2.0-85043534104&doi=10.1109%2fCVPR.2017.16&partnerID=40&md5=e11897ee95a057bbc78aef23d420f926","Point cloud is an important type of geometric data structure. Due to its irregular format, most researchers transform such data to regular 3D voxel grids or collections of images. This, however, renders data unnecessarily voluminous and causes issues. In this paper, we design a novel type of neural network that directly consumes point clouds, which well respects the permutation invariance of points in the input. Our network, named PointNet, provides a unified architecture for applications ranging from object classification, part segmentation, to scene semantic parsing. Though simple, PointNet is highly efficient and effective. Empirically, it shows strong performance on par or even better than state of the art. Theoretically, we provide analysis towards understanding of what the network has learnt and why the network is robust with respect to input perturbation and corruption. © 2017 IEEE.",Conference Paper,"Final",Scopus,2-s2.0-85043534104
"Bates D.M., Watts D.G.",[No title available],1988,"Nonlinear Regression Analysis and Its Applications",3252,,[No abstract available],,"Final",Scopus,2-s2.0-0003456815
"Do Carmo M.P.",[No title available],1976,"Differential Geometry of Curves and Surfaces",3189,,[No abstract available],,,Scopus,2-s2.0-0003533718
"Powers D.M.W.","Evaluation: From precision, recall and F-measure to ROC, informedness, markedness & correlation",2011,"Journal of Machine Learning Technologies",3123,,[No abstract available],,"Final",Scopus,2-s2.0-84864758525
"Eastman C.M., Teicholz P., Sacks R., Liston K.",[No title available],2008,"BIM Handbook: A Guide to Building Information Modeling for Owners, Managers, Architects, Engineers, Contractors, and Fabricators",3033,,[No abstract available],,"Final",Scopus,2-s2.0-38649094993
"Rusinkiewicz S., Levoy M.","Efficient variants of the ICP algorithm",2001,"Proceedings of International Conference on 3-D Digital Imaging and Modeling, 3DIM",2978,"https://www.scopus.com/inward/record.uri?eid=2-s2.0-84949236475&doi=10.1109%2fIM.2001.924423&partnerID=40&md5=8ce35ec134f1ca6df34433ed583897fd","The ICP (Iterative Closest Point) algorithm is widely used for geometric alignment of three-dimensional models when an initial estimate of the relative pose is known. Many variants of ICP have been proposed, affecting all phases of the algorithm from the selection and matching of points to the minimization strategy. We enumerate and classify many of these variants, and evaluate their effect on the speed with which the correct alignment is reached. In order to improve convergence for nearly-flat meshes with small features, such as inscribed surfaces, we introduce a new variant based on uniform sampling of the space of normals. We conclude by proposing a combination of ICP variants optimized for high speed. We demonstrate an implementation that is able to align two range images in a few tens of milliseconds, assuming a good initial guess. This capability has potential application to real-time 3D model acquisition and model-based tracking.",Article,"Final",Scopus,2-s2.0-84949236475
"Sokolova M., Lapalme G.","A systematic analysis of performance measures for classification tasks",2009,"Information Processing and Management",2554,"https://www.scopus.com/inward/record.uri?eid=2-s2.0-65649138430&doi=10.1016%2fj.ipm.2009.03.002&partnerID=40&md5=3a9ff121deadfac8c95683fa0a8e179c","This paper presents a systematic analysis of twenty four performance measures used in the complete spectrum of Machine Learning classification tasks, i.e., binary, multi-class, multi-labelled, and hierarchical. For each classification task, the study relates a set of changes in a confusion matrix to specific characteristics of data. Then the analysis concentrates on the type of changes to a confusion matrix that do not change a measure, therefore, preserve a classifier's evaluation (measure invariance). The result is the measure invariance taxonomy with respect to all relevant label distribution changes in a classification problem. This formal analysis is supported by examples of applications where invariance properties of measures lead to a more reliable evaluation of classifiers. Text classification supplements the discussion with several case studies. © 2009 Elsevier Ltd. All rights reserved.",Article,"Final",Scopus,2-s2.0-65649138430
"Penrose R.","A generalized inverse for matrices",1955,"Mathematical Proceedings of the Cambridge Philosophical Society",2537,"https://www.scopus.com/inward/record.uri?eid=2-s2.0-84947145047&doi=10.1017%2fS0305004100030401&partnerID=40&md5=372ca7631b4522136ca565146d8e839e",[No abstract available],Article,"Final",Scopus,2-s2.0-84947145047
"Liu Z., Luo P., Wang X., Tang X.","Deep learning face attributes in the wild",2015,"Proceedings of the IEEE International Conference on Computer Vision",2499,"https://www.scopus.com/inward/record.uri?eid=2-s2.0-84973917446&doi=10.1109%2fICCV.2015.425&partnerID=40&md5=1da67f13acf28106db916aa791f0012d","Predicting face attributes in the wild is challenging due to complex face variations. We propose a novel deep learning framework for attribute prediction in the wild. It cascades two CNNs, LNet and ANet, which are fine-tuned jointly with attribute tags, but pre-trained differently. LNet is pre-trained by massive general object categories for face localization, while ANet is pre-trained by massive face identities for attribute prediction. This framework not only outperforms the state-of-the-art with a large margin, but also reveals valuable facts on learning face representation. (1) It shows how the performances of face localization (LNet) and attribute prediction (ANet) can be improved by different pre-training strategies. (2) It reveals that although the filters of LNet are fine-tuned only with image-level attribute tags, their response maps over entire images have strong indication of face locations. This fact enables training LNet for face localization with only image-level annotations, but without face bounding boxes or landmarks, which are required by all attribute recognition works. (3) It also demonstrates that the high-level hidden neurons of ANet automatically discover semantic concepts after pre-training with massive face identities, and such concepts are significantly enriched after fine-tuning with attribute tags. Each attribute can be well explained with a sparse linear combination of these concepts. © 2015 IEEE.",Conference Paper,"Final",Scopus,2-s2.0-84973917446
