Authors,Title,Year,Source title,Cited by,Link,Abstract,Document Type,Publication Stage,Source,EID
"Yang J., Shi Z., Wu Z.","Vision-based action recognition of construction workers using dense trajectories",2016,"Advanced Engineering Informatics",78,"https://www.scopus.com/inward/record.uri?eid=2-s2.0-84966925836&doi=10.1016%2fj.aei.2016.04.009&partnerID=40&md5=e3029100250fdc2761e5e12d4b6d47f0","Wide spread monitoring cameras on construction sites provide large amount of information for construction management. The emerging of computer vision and machine learning technologies enables automated recognition of construction activities from videos. As the executors of construction, the activities of construction workers have strong impact on productivity and progress. Compared to machine work, manual work is more subjective and may differ largely in operation flow and productivity among different individuals. Hence only a handful of work studies on vision based action recognition of construction workers. Lacking of publicly available datasets is one of the main reasons that currently hinder advancement. The paper studies worker actions comprehensively, abstracts 11 common types of actions from 5 kinds of trades and establishes a new real world video dataset with 1176 instances. For action recognition, a cutting-edge video description method, dense trajectories, has been applied. Support vector machines are integrated with a bag-of-features pipeline for action learning and classification. Performances on multiple types of descriptors (Histograms of Oriented Gradients - HOG, Histograms of Optical Flow - HOF, Motion Boundary Histogram - MBH) and their combination have been evaluated. Discussion on different parameter settings and comparison to the state-of-the-art method are provided. Experimental results show that the system with codebook size 500 and MBH descriptor has achieved an average accuracy of 59% for worker action recognition, outperforming the state-of-the-art result by 24%. © 2016 Elsevier Ltd.",Article,"Final",Scopus,2-s2.0-84966925836
"Walsh S.B., Borello D.J., Guldur B., Hajjar J.F.","Data processing of point clouds for object detection for structural engineering applications",2013,"Computer-Aided Civil and Infrastructure Engineering",78,"https://www.scopus.com/inward/record.uri?eid=2-s2.0-84880146006&doi=10.1111%2fmice.12016&partnerID=40&md5=4543f3fcad9d1ceed57cadbb570230e9","This research investigates the use of high-resolution three-dimensional terrestrial laser scanners as tools to capture geometric range data of complex scenes for structural engineering applications. Laser scanning technology is continuously improving, with commonly available scanners now able to capture over 1,000,000 points per second with an accuracy of ∼0.1 mm. This research focuses on developing the foundation toward the use of laser scanning to structural engineering applications, including structural health monitoring, collapse assessment, and post-hazard response assessment. One of the keys to this work is to establish a process for extracting important information from raw laser-scanned data sets such as the location, orientation, and size of objects in a scene, and location of damaged regions on a structure. A methodology for processing range data to identify objects in the scene is presented. Previous work in this area has created an initial foundation of basic data processing steps. Existing algorithms, including sharp feature detection and segmentation are implemented and extended in this work. Additional steps to remove extraneous and outlying points are added. Object detection based on a predefined library is developed allowing generic description of objects. The algorithms are demonstrated on synthetic scenes as well as validated on range data collected from an experimental test specimen and a collapsed bridge. The accuracy of the object detection is presented, demonstrating the applicability of the methodology. These additional steps and modifications to existing algorithms are presented to advance the performance of data processing on laser scan range data sets for future application in structural engineering applications such as robust determination of damage location and finite element modeling. © 2013 Computer-Aided Civil and Infrastructure Engineering.",Article,"Final",Scopus,2-s2.0-84880146006
"Behley J., Steinhage V., Cremers A.B.","Performance of histogram descriptors for the classification of 3D laser range data in urban environments",2012,"Proceedings - IEEE International Conference on Robotics and Automation",77,"https://www.scopus.com/inward/record.uri?eid=2-s2.0-84864421786&doi=10.1109%2fICRA.2012.6225003&partnerID=40&md5=5085408106ed03d1a068bb8678a59318","The selection of suitable features and their parameters for the classification of three-dimensional laser range data is a crucial issue for high-quality results. In this paper we compare the performance of different histogram descriptors and their parameters on three urban datasets recorded with various sensors - sweeping SICK lasers, tilting SICK lasers and a Velodyne 3D laser range scanner. These descriptors are 1D, 2D, and 3D histograms capturing the distribution of normals or points around a query point. We also propose a novel histogram descriptor, which relies on the spectral values in different scales. We argue that choosing a larger support radius and a z-axis based global reference frame/axis can boost the performance of all kinds of investigated classification models significantly. The 3D histograms relying on the point distribution, normal orientations, or spectral values, turned out to be the best choice for the classification in urban environments. © 2012 IEEE.",Conference Paper,"Final",Scopus,2-s2.0-84864421786
"Lee J., Son H., Kim C., Kim C.","Skeleton-based 3D reconstruction of as-built pipelines from laser-scan data",2013,"Automation in Construction",75,"https://www.scopus.com/inward/record.uri?eid=2-s2.0-84884499636&doi=10.1016%2fj.autcon.2013.05.009&partnerID=40&md5=e4710df610a66f183e4fedbe0631fe7e","There has been a growing demand for an as-built 3D pipeline model. Although several studies on automation of the process of reconstruction of as-built 3D pipelines have been carried out, previous approaches have been limited to the generation of only a portion of an entire 3D pipeline. The aim of this study was to propose an automated approach to the generation of as-built 3D pipeline models of entire pipelines composed of straight pipes, elbows, and tee pipes from laser-scan data. First, the skeletons of individual pipelines are extracted. Then the extracted skeletons are segmented into their individual components, and a set of parameters for them are calculated. The experimental results show that the proposed approach is robust to incompleteness of the laser-scan data, as well as to noise and to density variations in the data. As a result, the proposed method enables the generation of reliable as-built 3D pipeline models. © 2013 Elsevier B.V.",Article,"Final",Scopus,2-s2.0-84884499636
"Poullis C.","A framework for automatic modeling from point cloud data",2013,"IEEE Transactions on Pattern Analysis and Machine Intelligence",74,"https://www.scopus.com/inward/record.uri?eid=2-s2.0-84884573272&doi=10.1109%2fTPAMI.2013.64&partnerID=40&md5=6768d5fbdd4c0fff18306c0cae893dc9","We propose a complete framework for the automatic modeling from point cloud data. Initially, the point cloud data are preprocessed into manageable datasets, which are then separated into clusters using a novel two-step, unsupervised clustering algorithm. The boundaries extracted for each cluster are then simplified and refined using a fast energy minimization process. Finally, three-dimensional models are generated based on the roof outlines. The proposed framework has been extensively tested, and the results are reported. © 1979-2012 IEEE.",Article,"Final",Scopus,2-s2.0-84884573272
"Awwad T.M., Zhu Q., Du Z., Zhang Y.","An improved segmentation approach for planar surfaces from unstructured 3D point clouds",2010,"Photogrammetric Record",74,"https://www.scopus.com/inward/record.uri?eid=2-s2.0-77951661846&doi=10.1111%2fj.1477-9730.2009.00564.x&partnerID=40&md5=54479e19beb1a07d5294beb2d7d897c0","The extraction of object features from massive unstructured point clouds with different local densities, especially in the presence of random noisy points, is not a trivial task even if that feature is a planar surface. Segmentation is the most important step in the feature extraction process. In practice, most segmentation approaches use geometrical information to segment the 3D point cloud. The features generally include the position of each point (X, Y and Z), locally estimated surface normals and residuals of best fitting surfaces; however, these features could be affected by noisy points and in consequence directly affect the segmentation results. Therefore, massive unstructured and noisy point clouds also lead to bad segmentation (over-segmentation, under-segmentation or no segmentation). While the RANSAC (random sample consensus) algorithm is effective in the presence of noise and outliers, it has two significant disadvantages, namely, its efficiency and the fact that the plane detected by RANSAC may not necessarily belong to the same object surface; that is, spurious surfaces may appear, especially in the case of parallel-gradual planar surfaces such as stairs. The innovative idea proposed in this paper is a modification for the RANSAC algorithm called Seq-NV-RANSAC. This algorithm checks the normal vector (NV) between the existing point clouds and the hypothesised RANSAC plane, which is created by three random points, under an intuitive threshold value. After extracting the first plane, this process is repeated sequentially (Seq) and automatically, until no planar surfaces can be extracted from the remaining points under the existing threshold value. This prevents the extraction of spurious surfaces, brings an improvement in quality to the computed attributes and increases the degree of automation of surface extraction. Thus the best fit is achieved for the real existing surfaces. © 2010 The Authors. Journal Compilation © 2010 The Remote Sensing and Photogrammetry Society and Blackwell Publishing Ltd.",Article,"Final",Scopus,2-s2.0-77951661846
"Ochmann S., Vock R., Klein R.","Automatic reconstruction of fully volumetric 3D building models from oriented point clouds",2019,"ISPRS Journal of Photogrammetry and Remote Sensing",72,"https://www.scopus.com/inward/record.uri?eid=2-s2.0-85063442343&doi=10.1016%2fj.isprsjprs.2019.03.017&partnerID=40&md5=5cf9d1476f8ef76576bea4b3e2454e39","We present a novel method for reconstructing parametric, volumetric, multi-story building models from unstructured, unfiltered indoor point clouds with oriented normals by means of solving an integer linear optimization problem. Our approach overcomes limitations of previous methods in several ways: First, we drop assumptions about the input data such as the availability of separate scans as an initial room segmentation. Instead, a fully automatic room segmentation and outlier removal is performed on the unstructured point clouds. Second, restricting the solution space of our optimization approach to arrangements of volumetric wall entities representing the structure of a building enforces a consistent model of volumetric, interconnected walls fitted to the observed data instead of unconnected, paper-thin surfaces. Third, we formulate the optimization as an integer linear programming problem which allows for an exact solution instead of the approximations achieved with most previous techniques. Lastly, our optimization approach is designed to incorporate hard constraints which were difficult or even impossible to integrate before. We evaluate and demonstrate the capabilities of our proposed approach on a variety of complex real-world point clouds. © 2019",Article,"Final",Scopus,2-s2.0-85063442343
"Olsen M.J., Roe G.V., Glennie C., Persi F., Reedy M., Hurwitz D., Williams K., Tuss H., Squellati A., Knodler M.","""Guidelines for the use of mobile LiDAR in transportation applications""",2013,"Guidelines for the Use of Mobile LIDAR in Transportation Applications",72,,[No abstract available],,"Final",Scopus,2-s2.0-84884685158
"Kjer H.M., Wilm J.","Evaluation of surface registration algorithms for PET motion correction",2010,"Evaluation of Surface Registration Algorithms for PET Motion Correction",72,,[No abstract available],,"Final",Scopus,2-s2.0-84870817734
"Valero E., Adán A., Cerrada C.","Automatic method for building indoor boundary models from dense point clouds collected by laser scanners",2012,"Sensors (Switzerland)",71,"https://www.scopus.com/inward/record.uri?eid=2-s2.0-84871677181&doi=10.3390%2fs121216099&partnerID=40&md5=f8a1c49af3a3651b10ead594a2fe4a78","In this paper we present a method that automatically yields Boundary Representation Models (B-rep) for indoors after processing dense point clouds collected by laser scanners from key locations through an existing facility. Our objective is particularly focused on providing single models which contain the shape, location and relationship of primitive structural elements of inhabited scenarios such as walls, ceilings and floors. We propose a discretization of the space in order to accurately segment the 3D data and generate complete B-rep models of indoors in which faces, edges and vertices are coherently connected. The approach has been tested in real scenarios with data coming from laser scanners yielding promising results. We have deeply evaluated the results by analyzing how reliably these elements can be detected and how accurately they are modeled. © 2012 by the authors; licensee MDPI, Basel, Switzerland.",Article,"Final",Scopus,2-s2.0-84871677181
"Triebel R., Kersting K., Burgard W.","Robust 3D scan point classification using associative Markov networks",2006,"Proceedings - IEEE International Conference on Robotics and Automation",71,"https://www.scopus.com/inward/record.uri?eid=2-s2.0-33845652336&doi=10.1109%2fROBOT.2006.1642094&partnerID=40&md5=65608a564305efb8a65f5dad4d1c58b9","In this paper we present an efficient technique to learn Associative Markov Networks (AMNs) for the segmentation of 3D scan data. Our technique is an extension of the work recently presented by Anguelov et al. [1], in which AMNs are applied and the learning is done using max-margin optimization. In this paper we show that by adaptively reducing the training data, the training process can be performed much more efficiently while still achieving good classification results. The reduction is obtained by utilizing kd-trees and pruning them appropriately. Our algorithm does not require any additional parameters and yields an abstraction of the training data. In experiments with real data collected from a mobile outdoor robot we demonstrate that our approach yields accurate segmentations. ©2006 IEEE.",Conference Paper,"Final",Scopus,2-s2.0-33845652336
"Rvachev V.L.",[No title available],1974,"Methods of Logic Algebra in Mathematical Physics",71,,[No abstract available],,"Final",Scopus,2-s2.0-0012981733
"Limberger F.A., Oliveira M.M.","Real-time detection of planar regions in unorganized point clouds",2015,"Pattern Recognition",68,"https://www.scopus.com/inward/record.uri?eid=2-s2.0-84925356037&doi=10.1016%2fj.patcog.2014.12.020&partnerID=40&md5=d7611fec29c430845d83971a59f13bd5","Automatic detection of planar regions in point clouds is an important step for many graphics, image processing, and computer vision applications. While laser scanners and digital photography have allowed us to capture increasingly larger datasets, previous techniques are computationally expensive, being unable to achieve real-time performance for datasets containing tens of thousands of points, even when detection is performed in a non-deterministic way. We present a deterministic technique for plane detection in unorganized point clouds whose cost is O(nlogn) in the number of input samples. It is based on an efficient Hough-transform voting scheme and works by clustering approximately co-planar points and by casting votes for these clusters on a spherical accumulator using a trivariate Gaussian kernel. A comparison with competing techniques shows that our approach is considerably faster and scales significantly better than previous ones, being the first practical solution for deterministic plane detection in large unorganized point clouds. © 2015 Elsevier Ltd. All rights reserved.",Article,"Final",Scopus,2-s2.0-84925356037
"Laefer D.F., Truong-Hong L., Carr H., Singh M.","Crack detection limits in unit based masonry with terrestrial laser scanning",2014,"NDT and E International",68,"https://www.scopus.com/inward/record.uri?eid=2-s2.0-84890779641&doi=10.1016%2fj.ndteint.2013.11.001&partnerID=40&md5=a5cbd3d34ce352497f042f62b1ff7f72","This paper presents the fundamental mathematics to determine the minimum crack width detectable with a terrestrial laser scanner in unit-based masonry. Orthogonal offset, interval scan angle, crack orientation, and crack depth are the main parameters. The theoretical work is benchmarked against laboratory tests using 4 samples with predesigned crack widths of 1-7 mm scanned at orthogonal distances of 5.0-12.5 m and at angles of 0 -30. Results showed that absolute errors of crack width were mostly less than 1.37 mm when the orthogonal distance varied 5.0-7.5 m but significantly increased for greater distances. The orthogonal distance had a disproportionately negative effect compared to the scan angle. © 2013 Elsevier Ltd. All rights reserved.",Article,"Final",Scopus,2-s2.0-84890779641
"Masuda T.","Registration and integration of multiple range images by matching signed distance fields for object shape modeling",2002,"Computer Vision and Image Understanding",66,"https://www.scopus.com/inward/record.uri?eid=2-s2.0-0043031061&doi=10.1006%2fcviu.2002.0982&partnerID=40&md5=902adc9b92d83f17516926c7690a5fed","Modeling object shapes from multiple range images requires three processes: correction of measurement errors, registration of data shapes, and integrating them as a unified shape representation. We propose a method by which these tasks can be solved simultaneously. Discrete samples of the signed distance field (SDF) of the object surface are used as the shape representation. If the data shapes are registered correctly, the SDFs should match in the common coordinate system. The data shapes are first integrated by averaging the data SDFs assuming that they are roughly pre-registered. Then, each data shape is registered to the integrated shape by estimating the optimal transformation. Integration and registration are alternately iterated until the input shapes are properly registered to the integrated shape. Weighting values are controlled to reject outliers derived from measurement errors and wrong correspondences. The proposed method does not suffer from cumulative registration errors because all data shapes are registered to the integrated shape. From the SDF shape representation, a polygon surface model is directly generated. The method was tested on synthetic and real range images.",Article,"Final",Scopus,2-s2.0-0043031061
"Gould S., Baumstarck P., Quigley M., Ng A.Y., Koller D.","Integrating visual and range data for robotic object detection",2008,"ECCV Workshop on Multi-camera and Multi-modal Sensor Fusion Algorithms and Applications (M2SFA2)",65,,[No abstract available],,"Final",Scopus,2-s2.0-76249104768
"Liu Y., Xiong Y.","Automatic segmentation of unorganized noisy point clouds based on the Gaussian map",2008,"CAD Computer Aided Design",64,"https://www.scopus.com/inward/record.uri?eid=2-s2.0-44249120508&doi=10.1016%2fj.cad.2008.02.004&partnerID=40&md5=e0001e25e0b43e0c6760fd756078badb","A nonparametric clustering algorithm, called cell mean shift (CMS), is developed to extract clusters of a set of points on the Gaussian sphere S2. It is computationally more efficient than the traditional mean shift (MS). Based on the singular value decomposition, the dimensional analysis is introduced to classify these clusters into point-, curve-, and area-form clusters. Each cluster is the Gaussian image of a set of points which will be examined by a connected search in R3. An orientation analysis of the Gaussian map to area-form clusters is applied to identify hyperbolic and elliptical regions. A signed point-to-plane distance function is used to identify points of convex and concave regions. Segmentation results of several real as well as synthetic point clouds, together with complexity analyses, are presented. © 2008 Elsevier Ltd. All rights reserved.",Article,"Final",Scopus,2-s2.0-44249120508
"Boulch A., Marlet R.","Deep Learning for Robust Normal Estimation in Unstructured Point Clouds",2016,"Computer Graphics Forum",63,"https://www.scopus.com/inward/record.uri?eid=2-s2.0-84982124657&doi=10.1111%2fcgf.12983&partnerID=40&md5=ec2c6200a70353cafc53ce82f9e703ed","Normal estimation in point clouds is a crucial first step for numerous algorithms, from surface reconstruction and scene understanding to rendering. A recurrent issue when estimating normals is to make appropriate decisions close to sharp features, not to smooth edges, or when the sampling density is not uniform, to prevent bias. Rather than resorting to manually-designed geometric priors, we propose to learn how to make these decisions, using ground-truth data made from synthetic scenes. For this, we project a discretized Hough space representing normal directions onto a structure amenable to deep learning. The resulting normal estimation method outperforms most of the time the state of the art regarding robustness to outliers, to noise and to point density variation, in the presence of sharp edges, while remaining fast, scaling up to millions of points. © 2016 The Author(s) Computer Graphics Forum © 2016 The Eurographics Association and John Wiley & Sons Ltd. Published by John Wiley & Sons Ltd.",Article,"Final",Scopus,2-s2.0-84982124657
"Budroni A., Boehm J.","Automated 3D reconstruction of interiors from point clouds",2010,"Int. J. Archit. Comput.",63,,[No abstract available],,"Final",Scopus,2-s2.0-84873288546
"Patil A.K., Holi P., Lee S.K., Chai Y.H.","An adaptive approach for the reconstruction and modeling of as-built 3D pipelines from point clouds",2017,"Automation in Construction",62,"https://www.scopus.com/inward/record.uri?eid=2-s2.0-85007247145&doi=10.1016%2fj.autcon.2016.12.002&partnerID=40&md5=f01f1045257c33357152ff1b4bdf997e","Automated extraction of 3D geometric shapes such as planes, spheres, cylinders, cones, and tori in laser-scanned point clouds is a challenging problem and a tedious process, especially when using cluttered data. This paper describes a modification of the existing Hough transform for the automatic detection of cylinder parameters in point clouds. Careful analysis reveals that the existing method still has excessive space and time complexity or yields imprecise outcomes. The approach described here modifies the orientation estimation with an area-based adaptive method that utilizes a small accumulator to detect significant peaks in the Hough space in the presence of single or multiple cylinders in the point cloud data. After orientation estimation, the position and radius are estimated using an orthonormal coordinate system with a circle fitting algorithm. These modifications are tested with extensive sets of real point cloud data, and experimental results show that the presented approach minimizes the space and time complexity. After detection, the relationship between cylinders is reconstructed to form a continuous axis network by tracking cylinder parameters obtained from earlier steps. Using the axis network of cylinders obtained from point clouds, models of entire pipelines that include straight pipes, elbow joints, and T-junctions are determinately defined, and output data is reconstructed in Smart Plant 3D (SP3D). The presented results show that the proposed approach indeed improves the computational complexity by reducing the space and time, and yields methods that can be employed in the automation of 3D pipeline model reconstruction. © 2016 Elsevier B.V.",Article,"Final",Scopus,2-s2.0-85007247145
"Shu Z., Qi C., Xin S., Hu C., Wang L., Zhang Y., Liu L.","Unsupervised 3D shape segmentation and co-segmentation via deep learning",2016,"Computer Aided Geometric Design",62,"https://www.scopus.com/inward/record.uri?eid=2-s2.0-84977950750&doi=10.1016%2fj.cagd.2016.02.015&partnerID=40&md5=c2fbb47468a52e37d31f0d0f616cfdca","In this paper, we propose a novel unsupervised algorithm for automatically segmenting a single 3D shape or co-segmenting a family of 3D shapes using deep learning. The algorithm consists of three stages. In the first stage, we pre-decompose each 3D shape of interest into primitive patches to generate over-segmentation and compute various signatures as low-level shape features. In the second stage, high-level features are learned, in an unsupervised style, from the low-level ones based on deep learning. Finally, either segmentation or co-segmentation results can be quickly reported by patch clustering in the high-level feature space. The experimental results on the Princeton Segmentation Benchmark and the Shape COSEG Dataset exhibit superior segmentation performance of the proposed method over the previous state-of-the-art approaches. © 2016 Elsevier B.V. All rights reserved.",Article,"Final",Scopus,2-s2.0-84977950750
