Authors,Title,Year,Source title,Cited by,Link,Abstract,Document Type,Publication Stage,Source,EID
"Chacón R., Sánchez-Juny M., Real E., Gironella F.X., Puigagut J., Ledesma A.","Digital twins in civil and environmental engineering classrooms",2018,"EUCEET 2018 - 4th International Conference on Civil Engineering Education: Challenges for the Third Millennium",5,"https://www.scopus.com/inward/record.uri?eid=2-s2.0-85088268558&partnerID=40&md5=576872d73f987123e9ec62f00546cd16","Digital twins are understood as digital replica of physical models whose behavior can be observed simultaneously (digitally and physically) in real time. These tools are increasingly used in advanced industries for several purposes. The digital representation provides both the elements and the dynamics of how an Internet of Things (IoT) device operates and lives throughout its life cycle. Despite its complexity, the materialization of these digital artifacts in their simplest form imply the use of a threefold technology: sensors, data acquisition systems (DAS) and graphical user interfaces (GUI). This paper describes several educational exploratory tasks performed at the School of Civil Engineering in Barcelona (UPC) aimed at developing meaningful yet simple digital twins for civil engineering classrooms. The project encompasses the use of simple GUIs that show in real time physical systems from several disciplines such as structural engineering, soils mechanics, hydraulics, environmental engineering, coastal engineering or structural dynamics. The project has shown potential for civil engineering classrooms at two levels: i) these portable tools can be used pedagogically for demonstrating key concepts with a high degree of interactivity, ii) the development of these artifacts (from sensors to GUIs) may provide a key understanding of several concepts associated with IoT mechanics for civil engineering students. It is noteworthy that nowadays, average students are seldom acquainted with sensors, electronics and virtualization of physical magnitudes at Bachelor and Master level. IoT technologies will be needed in civil engineering classrooms in the following years due to the increasing trends related to automation, monitoring and digitalization that the construction industry will undertake. Experimental and numerical pedagogical activities may be enriched with this concept since they allow navigating from physical to virtual realms and vice versa. The paper includes several examples with real applications as well as some recommendations for its potential application. © 2018 EUCEET 2018 - 4th International Conference on Civil Engineering Education: Challenges for the Third Millennium. All rights reserved.",Conference Paper,"Final",Scopus,2-s2.0-85088268558
"Camba J.D., De Leon A.B., De La Torre J., Saorin J.L., Contero M.","Application of low-cost 3D scanning technologies to the development of educational Augmented Reality content",2016,"Proceedings - Frontiers in Education Conference, FIE",5,"https://www.scopus.com/inward/record.uri?eid=2-s2.0-85006760106&doi=10.1109%2fFIE.2016.7757673&partnerID=40&md5=de4a054d33a9140dd5a9437ed4c82a3d","This paper builds on the authors' previous work with Augmented Reality (AR) technology as a tool to enhance traditional visualizations and facilitate the understanding of complex information. In this paper, we expand our previous work with AR technology by focusing on the process of creating custom content. Based on users' feedback, we describe and compare various strategies to create 3D models from real objects that can be subsequently integrated into augmented reality scenes. Specifically, we evaluate current 3D scanning technologies that are affordable and suitable for educational applications. We present a comparative analysis of low-cost 3D scanning technologies, its use, integration with AR, and implementation as educational tools. Factors considered in our study include portability, model size, resolution, and postproduction requirements. © 2016 IEEE.",Conference Paper,"Final",Scopus,2-s2.0-85006760106
"Chacón R., Puig-Polo C., Real E.","TLS measurements of initial imperfections of steel frames for structural analysis within BIM-enabled platforms",2021,"Automation in Construction",4,"https://www.scopus.com/inward/record.uri?eid=2-s2.0-85100704201&doi=10.1016%2fj.autcon.2021.103618&partnerID=40&md5=80be6c060501b2de3114caa58ab066bb","Terrestrial Laser Scanners (TLS) provide manifold possibilities in construction sites. In buildings assembled with steel frames, the “as-built” configuration of the structure can be virtualized by means of TLS measurements in the form of digital 3D point cloud data. This paper presents an integration of procedures related to the reproduction of realistic wire representations of steel frames. This integration encompasses the use of terrestrial laser scanning (TLS) measurements and the development of BIM-friendly wire models based on these measurements. These models are intended to be used in subsequent geometrically nonlinear analysis of the frames using similar BIM environments. All measurements are taken on laboratory tests of sway and non-sway stainless steel subjected to vertical and lateral loading. The “as-built” geometrical initial conditions can be used for the development of models embedded within BIM platforms for their subsequent usage in structural verification. © 2021 The Author(s)",Article,"Final",Scopus,2-s2.0-85100704201
"Zhou X., Liu J., Cheng G., Li D., Chen Y.F.","Automated locating of replaceable coupling steel beam using terrestrial laser scanning",2021,"Automation in Construction",4,"https://www.scopus.com/inward/record.uri?eid=2-s2.0-85096486939&doi=10.1016%2fj.autcon.2020.103468&partnerID=40&md5=6806cd095df581145294de1e974f9a3c","The replaceable coupling steel beam (RCSB) is an optimal component of earthquake-resilient structures. In practice, the RCSB is connected to RC shear wall using numerous bolts with a small construction tolerance of 2 mm. However, conventional methods to locate the bolt holes are mainly manual and rely on an approximate measurement, thus time-consuming and subjective. Addressing this issue, this paper describes a fully-automated method to locate the bolt holes in RC shear walls using the terrestrial laser scanning. Specifically, the bolt holes can be first detected by an effective boundary detecting technique and then accurately fitted with a robust random sample consensus algorithm. The proposed technique is validated with the experimental results including the radius and relative position estimations of bolt holes. The fully-automated method can therefore be adopted to locate the RCSBs. © 2020 Elsevier B.V.",Article,"Final",Scopus,2-s2.0-85096486939
"Sotelino E.D., Natividade V., Travassos Do Carmo C.S.","Teaching BIM and Its Impact on Young Professionals",2020,"Journal of Civil Engineering Education",4,"https://www.scopus.com/inward/record.uri?eid=2-s2.0-85085626955&doi=10.1061%2f%28ASCE%29EI.2643-9115.0000019&partnerID=40&md5=ebd66f8fb9454b56252e13adf391d9cc","This paper reports a 6-year experience teaching building information modeling (BIM) methodology in the undergraduate/graduate architecture, engineering, and construction (AEC) program at the Pontificia Universidade Catolica do Rio de Janeiro (PUC-Rio), Brazil. This work is part of the long-term goal of developing a new BIM AEC-based curriculum track for engineering and architecture students at this university. The paper also reports the results of a survey on the student's perception on how this knowledge has affected their way of working with other disciplines and how it has influenced their professional lives. The adopted approach involved theoretical lectures, computer laboratory practice, student oral presentations, and the complete project of an enterprise. The lectures delivered by specialists with practical experience in the subject exposed the students to BIM concepts. In the laboratory, students were trained in the software tools that enables BIM activity. To develop the project, multidisciplinary teams of students were formed and each team was challenged to emulate the change in process that BIM implies. The task was to develop the complete project of an enterprise considering all different specialties involved in its design, detailing, and planning. More specifically, these specialties consisted of architecture, structural engineering, mechanical and electrical systems, and BIM management. The teams made oral presentations to the client (the professor) and consultants roughly on a weekly basis. In each year, the studentś performance was evaluated in several ways. In particular, a 360° evaluation tool was used, which was crucial to provide feedback to each team member during the exercise. The culmination of this experience is the elaboration of this article that aims to describe the challenges and the successes of the adopted approach. © 2020 American Society of Civil Engineers.",Article,"Final",Scopus,2-s2.0-85085626955
"Zhao D.","Peer Pressure in BIM-Based Collaboration Improves Student Learning",2021,"Journal of Civil Engineering Education",3,"https://www.scopus.com/inward/record.uri?eid=2-s2.0-85097385334&doi=10.1061%2f%28ASCE%29EI.2643-9115.0000038&partnerID=40&md5=6bcc895ad0f975e75344c343786ad55c","Building information modeling (BIM)-based collaboration may be associated with peer pressure in educational settings. Peer pressure creates a challenge for educators to foster students' BIM skills and prepare them for a career in the architectural, engineering, and construction (AEC) industry. However, the effects of peer pressure on student learning in BIM classes remain unknown. This research aims to explore how peer pressure influences student learning of BIM technology. This study designed four pedagogical scenarios to stimulate different degrees of peer pressure in a BIM class at Michigan State University, and compared student learning outcomes in the four scenarios. Results of multiple regression indicate a positive relationship between the level of peer pressure and the student learning outcome. Students exposed to a higher level of peer pressure demonstrated higher and stabler grades. Findings suggest peer pressure works as a ""social magnet""to attract students to progress together. Implications are discussed for educators and practitioners to create effective learning environments and promote the diffusion of knowledge and technology. © 2020 American Society of Civil Engineers.",Article,"Final",Scopus,2-s2.0-85097385334
"Li F., Kim M.-K.","Mirror-aided registration-free geometric quality inspection of planar-type prefabricated elements using terrestrial laser scanning",2021,"Automation in Construction",3,"https://www.scopus.com/inward/record.uri?eid=2-s2.0-85096351938&doi=10.1016%2fj.autcon.2020.103442&partnerID=40&md5=a63d74212c257afe4d567a833348bd03","This study presents a new technique that enables entire surface geometric quality inspection (GQI) of planar-type prefabricated construction elements without registration of point cloud data. Laser scanning technology has gained much attention in the area of GQI of manufactured planar-type construction elements such as precast concrete (PC) elements during the fabrication or manufacturing stage, due to its speed and accuracy. However, the scope of existing GQI techniques using laser scanning are limited to single surface GQI of planar-type construction elements. Because of this, a registration process is inevitably necessary to merge different sets of point cloud data acquired at multiple scanning locations. The current multiple scans and registration approach for the GQI of planar-type construction elements are, however, time consuming and error prone due to registration errors. This study aims to develop a registration-free GQI technique that is capable of scanning invisible side surfaces of planar-type elements from the terrestrial laser scanner (TLS) using flat mirrors in order to tackle the limitations of the prior GQI studies. Firstly, the geometrical relationship between the flat mirror and the invisible surfaces of the planar-type element is identified based on the mirror reflection principle of laser beams. The virtual scan points of the invisible side surfaces generated by the flat mirror are then transformed to the location of the actual side surface based on the identified geometrical relationship and the mirror plane estimated using rectangular patches attached to the mirror. To investigate the feasibility of the proposed registration-free GQI technique, a series of tests on a laboratory-scale specimen with varying scan parameters are conducted. In addition, comparison tests with traditional registration methods are performed to further analyze the performance of the proposed technique in terms of GQI accuracy and efficiency. The results show that the proposed technique provides more accurate GQI results while reducing scanning time compared to traditional registration methods, demonstrating great potential for application in the GQI of planar-type prefabricated construction elements during the fabrication stage. © 2020 Elsevier B.V.",Article,"Final",Scopus,2-s2.0-85096351938
"Chizhova M., Popovas D., Gorkovchuk D., Gorkovchuk J., Hess M., Luhmann T.","VIRTUAL TERRESTRIAL LASER SCANNER SIMULATOR for DIGITALISATION of TEACHING ENVIRONMENT: CONCEPT and FIRST RESULTS",2020,"International Archives of the Photogrammetry, Remote Sensing and Spatial Information Sciences - ISPRS Archives",3,"https://www.scopus.com/inward/record.uri?eid=2-s2.0-85091996876&doi=10.5194%2fisprs-archives-XLIII-B5-2020-91-2020&partnerID=40&md5=62c8d776a7528a86bcdcd0629f6d9ef5","We are presenting a concept and first results of a Terrestrial Laser Scanner simulator-a tool, which could be a valuable educational tool for geomatics and engineering students. The main goal of the VirScan3D project is to cover engineering digitisation by two major project parts: 1) Development of a virtual environment for creation and processing of digital 3D scan data; 2) Digital teaching and e-learning material with interactive tools and practical experiences. Part 1 will be solved through the development of a virtual system that allows users to create realistic data in the absence of a real measuring device. At the time of writing (April 2020) all higher education teaching and learning worldwide has been changed to online delivery due to the Covid pandemic. However, this has affected the courses that involve working with equipment and-consequently-require the presence of students and devices. In this project, the development of such equipment simulator proposes a real and feasible solution, which allows undisturbed continuing the teaching. The virtual scanner will be based on existing software packages. It will be part of a general e-learning concept that will be implemented in partner universities. Part 2 is addressed through an integrated teaching concept that includes interactive learning tools (for both teachers and students) and practical exercises (for example project weeks, summer schools) where the theoretical and virtual education is connected to practical experience with real instrumentation and data. One outcome of the experimental work is additional e-learning material based on the experiences and results of the project work. The prototype implementation of the virtual laser scanner is realized within a game engine, which allows for fast and easy 3D visualisation and navigation. Within this environment, the user can freely navigate and define suitable scanning positions/stations. At each scanning station a simulated scan is performed, which is based on the technical specifications of a real scanner. The mathematical solution is based on 3D line intersection with the virtual 3D surface including noise and colour as well as an intensity simulation. As a result, 3D point clouds for each station are generated, which will be further processed for registration and modelling using standard software packages. © 2020 Authors.",Conference Paper,"Final",Scopus,2-s2.0-85091996876
"Chacón R.","Designing construction 4.0 activities for aec classrooms",2021,"Buildings",1,"https://www.scopus.com/inward/record.uri?eid=2-s2.0-85118999460&doi=10.3390%2fbuildings11110511&partnerID=40&md5=07273e5462f0d0395013b433ddcc4bcd","This article describes the outcomes of the development of the project MATES to STEAM. The project is aimed at integrating Construction 4.0 content to a recently started new degree on Technologies on Civil Engineering. This integration is underpinned by the creation of STEAM-rich activities that can complement such degree. The philosophical design of these activities followed three requirements: (i) the activities should infuse Construction 4.0-related technologies, (ii) the activities should foster motivation among students with a STEAM vision by-design and (iii) the activities should be designed with a hardware-software independent perspective (open-source, accessible, affordable). Cornerstone and capstone projects as well as a set of workshops represent the demonstrators of these activities. All these demonstrators are knitted together in a single path in which an educational attempt to fill the identified Construction 4.0 gaps is proposed. The STEAM perspective provides completeness to the whole development. During the last two years, the project was developed and the design, the development and implementation of several demonstrators were completed. In the years to come, a systematic deployment and analysis of such demonstrators is expected when a full implementation of the new degree of Technologies in Civil Engineering will be addressed. © 2021 by the author. Licensee MDPI, Basel, Switzerland.",Article,"Final",Scopus,2-s2.0-85118999460
"Meadati P., Akhnoukh A.","3D scans—a new teaching tool in construction education",2019,"Collaboration and integration in construction, engineering, management and technology",1,,[No abstract available],,"Final",Scopus,2-s2.0-85124599289
"Szafranko E., Pawłowicz J.A.","The application of a 3D laser scanner in contemporary education of civil engineering students",2017,"IOP Conference Series: Materials Science and Engineering",1,"https://www.scopus.com/inward/record.uri?eid=2-s2.0-85034443421&doi=10.1088%2f1757-899X%2f251%2f1%2f012001&partnerID=40&md5=02473394d6f8670df5f10147a125a591","The programs of study in field of civil engineering include a number of objects, which concern with details of the planning, design and realization of buildings. These are buildings and structures such as, roads, bridges, tunnels, viaducts. Most of these objects are located far from university and it was difficult to show them on the lessons. Discussing the structure based on the description of the object, photographs or drawings do not always allow to imagine the actual shapes and sizes of buildings, roads, bridges and viaducts. In such a situation, terrestrial photogrammetric technology could be helpful. One of them is 3D laser scanning technology Measurements performed with a laser scanner allows to introduce selected objects in the form of spatial models. They give you the ability to rotate and zoom them in order to know the details of construction of the object. The article presents the possibility of using a 3D laser scanner in teaching. © Published under licence by IOP Publishing Ltd.",Conference Paper,"Final",Scopus,2-s2.0-85034443421
"Lu R., Brilakis I.",[No title available],0000,,1,,[No abstract available],,"Final",Scopus,2-s2.0-85124620577
"Ye C., Butler L., Bartek C., Iangurazov M., Lu Q., Gregory A., Girolami M.",[No title available],0000,,1,,[No abstract available],,"Final",Scopus,2-s2.0-85124617610
[No author name available],[No title available],0000,"Rhinoceros V7.0. Mcneel Associates",1,,[No abstract available],,"Final",Scopus,2-s2.0-85124591119
