Authors,Title,Year,Source title,Cited by,Link,Abstract,Document Type,Publication Stage,Source,EID
"Li J.-F., Wang Q.-H., Liu X.-M., Zhang M.-Y.","An autonomous waist-mounted pedestrian dead reckoning system by coupling low-cost MEMS inertial sensors and GPS receiver for 3D urban navigation",2014,"Journal of Engineering Science and Technology Review",14,"https://www.scopus.com/inward/record.uri?eid=2-s2.0-84898842071&doi=10.25103%2fjestr.071.02&partnerID=40&md5=8d05fd97096a9a84417d775606715d2d","Global positioning system (GPS) offers a perfect solution to the 3-dimension(3D) navigation. However, the GPS-only solution can't provide continuous and accurate position information in the unfavourable environments, such as urban canyons, indoor buildings, dense foliages due to signal blockage, interference, or jamming etc. A pedestrian dead reckoning (PDR) system integrating the self-contained inertial sensors with GPS receiver is proposed to provide a seamless outdoor/indoor 3D pedestrian navigation. The MEM sensor module attached to the user's waist is composed of a 3-axis accelerometer, a 3-axis gyroscope, a 3-axis digital compass and a barometric pressure sensor, which doesn't rely on any infrastructure. The positioning algorithm implements a loosely coupled GPS/PDR integration. The sensor data are fused via a complementary filter to reduce the integral drift and magnetic disturbance for accurate heading. The four key components of the PDR algorithm: step detection, stride length estimation, heading and position determination are described in detail and implemented by the microcontroller. The step is detected using the accelerometer signals by the combination of three approaches: sliding window, peak detection and zero-crossing. The step length is estimated using a simple linear relationship with the step frequency. By coupling the step length, azimuth and height, 3D navigation is achieved. The performance of the proposed system is carefully verified through several field outdoor and indoor walking tests. The positioning errors are below 3% of the total traveled distance. The main error source comes from the orientation estimation. The results indicate that the proposed system is effective in accurate tracking. © 2014 Kavala Institute of Technology.",Article,"Final",Scopus,2-s2.0-84898842071
"Zhang D., Xu X., Lin H., Gui R., Cao M., He L.","Automatic road-marking detection and measurement from laser-scanning 3D profile data",2019,"Automation in Construction",13,"https://www.scopus.com/inward/record.uri?eid=2-s2.0-85073054183&doi=10.1016%2fj.autcon.2019.102957&partnerID=40&md5=db617b697edccbdc88a818e15d643a2d","Automatic road-marking detection and measurement have great significance for pavement maintenance and management. Laser-scanning 3D profile data provide a new way of road-marking detection and measurement with an elevation accuracy of about 0.25 mm. This paper presents an automatic road-marking detection and measurement method that uses laser scanning of 3D pavement data. The elevation characteristics and geometric statistics that characterize road markings have been fully analyzed using 3D data. The first step was to use a specially designed step-shaped operator to convolve profile data to identify the regions of suspected marking edges at the profile level, which helps reduce the influence of other pavement factors, including crosswise-slope information, cracks, and rutting. Next, by combining the geometric characteristics of the road-marking region and the continuity of the convolution features at image level, the regions of suspected 3D road markings were extracted. Third, a convolutional neural network was introduced to distinguish real-marking data more clearly. Finally, the three-dimension measurement information was extracted from the detected region and from elevation information. Road-marking recognition experiments were then conducted based on real measured 3D data. The detection accuracies were all greater than 90.8% for 4178 test samples from five road sections with different kinds of road markings. Furthermore, the repeatability of multiple measurement results for road-marking elevations from two selected road sections was about 95%, and the correlation of the obtained road-marking elevations with manually measured elevations was about 85.36% for 200 measurement points. © 2019",Article,"Final",Scopus,2-s2.0-85073054183
"Riveiro B., Lindenbergh R.",[No title available],2019,"Laser Scanning: An Emerging Technology in Structural Engineering",13,,[No abstract available],,"Final",Scopus,2-s2.0-85084847353
"Noordermeer L., Økseter R., Ole Ørka H., Gobakken T., Næsset E., Bollandsås O.M.","Classifications of forest change by using bitemporal airborne laser scanner data",2019,"Remote Sensing",12,"https://www.scopus.com/inward/record.uri?eid=2-s2.0-85072633001&doi=10.3390%2frs11182145&partnerID=40&md5=8149827d48f5189647b420f68f156339","Changes in forest areas have great impact on a range of ecosystem functions, and monitoring forest change across different spatial and temporal resolutions is a central task in forestry. At the spatial scales of municipalities, forest properties and stands, local inventories are carried out periodically to inform forest management, in which airborne laser scanner (ALS) data are often used to estimate forest attributes. As local forest inventories are repeated, the availability of bitemporal field and ALS data is increasing. The aim of this study was to assess the utility of bitemporal ALS data for classification of dominant height change, aboveground biomass change, forest disturbances, and forestry activities. We used data obtained from 558 field plots and four repeated ALS-based forest inventories in southeastern Norway, with temporal resolutions ranging from11 to 15 years. We applied the k-nearest neighbor method for classification of: (i) increasing versus decreasing dominant height, (ii) increasing versus decreasing aboveground biomass, (iii) undisturbed versus disturbed forest, and (iv) forestry activities, namely untouched, partial harvest, and clearcut. Leave-one-out cross-validation revealed overall accuracies of 96%, 95%, 89%, and 88% across districts for the four change classifications, respectively. Thus, our results demonstrate that various changes in forest structure can be classified with high accuracy at plot level using data from repeated ALS-based forest inventories. © 2019 by the authors.",Article,"Final",Scopus,2-s2.0-85072633001
"Chacón R., Codony D., Toledo Á.","From physical to digital in structural engineering classrooms using digital fabrication",2017,"Computer Applications in Engineering Education",12,"https://www.scopus.com/inward/record.uri?eid=2-s2.0-85020209051&doi=10.1002%2fcae.21845&partnerID=40&md5=c8c8b09f71a714d651fec4a01a7c4e65","In this paper, a set of digital artifacts related to simple examples of structural engineering are presented. The artifacts are real-time applications and visualizations of typical problems students from the architecture, engineering, and construction (AEC) schools are acquainted with. The real-time nature of the examples allow a high level of interaction between humans and the classic visualization of results, namely, bending and shear force diagrams, internal stresses distributions, and contour plots. These artifacts may provide in AEC a twofold educational target: (i) for users, to provide visual understanding in real time of typical problems that must be understood in classic lectures of structural engineering; (ii) for developers, to provide meaningful applications of applied digital fabrication using sensors, microcontrollers, and GUI's and their potential in the development of tools related to Structural Health Monitoring (SHM) and the Internet of Things (IoT) among students of the AEC sector. © 2017 Wiley Periodicals, Inc.",Article,"Final",Scopus,2-s2.0-85020209051
"Shanbari H.A., Blinn N.M., Issa R.R.","Laser scanning technology and BIM in construction management education",2016,"Journal of Information Technology in Construction",12,"https://www.scopus.com/inward/record.uri?eid=2-s2.0-84991111230&partnerID=40&md5=0c1de321efc65938b7066ccfc4dad29b","Laser scanning technology has emerged as a useful tool in documenting existing conditions of buildings. The main application for such documentation is to assess current as-built conditions of existing, mostly historical, buildings. The technology can also be used as an integral part of construction progress documentation in new projects. In order to equip students with knowledge on the latest technologies in the industry, laser scanning was introduced to students in a BIM course. Students were given a thorough demonstration on how the equipment functions. After that, several campus buildings' exteriors were scanned. Students had the chance to see the scanning in action. More importantly, the generated point-clouds from the scanner were given to students as part of the final project. Five teams were formed and each team was given a set of floor plans, with minimal details, of an existing campus building. The teams were then asked to take measurements from the point-clouds and model the buildings in Autodesk Revit. The lack of marked elevation drawings did not prevent the teams from modeling the buildings fairly accurately. The point-clouds gave the students a large amount of information that were lacking in the provided documents. Even though the learning curve for navigating such point-clouds was a bit steep, the extracted information helped the students better understand the buildings' envelopes and appreciate the real value of laser scanning technology. © 2016 The author.",Article,"Final",Scopus,2-s2.0-84991111230
"Gargoum S.A., Karsten L.","Virtual assessment of sight distance limitations using LiDAR technology: Automated obstruction detection and classification",2021,"Automation in Construction",11,"https://www.scopus.com/inward/record.uri?eid=2-s2.0-85101050042&doi=10.1016%2fj.autcon.2021.103579&partnerID=40&md5=ee95853cb09394f5e9f3815e6d8a528b","The amount of sight distance available to drivers is an extremely critical design element with significant impacts on the safe operation of highways. If the available sight distance on a roadway is limited, this reduces the ability of drivers to safely carry out certain maneuvers such as stopping or passing. Obstructions to sight distance are often caused by a range of different factors. This includes roadside vegetation overgrowing into the road's right of way and obstructions related to the road's alignment. To ensure that sufficient sight distance is available throughout a road's service life, transportation agencies are required to conduct regular long site visits to identify the existence of any obstructions while identifying the types of those obstructions. Although many studies have attempted quantifying available sight distance in the past, not much work has been done to automatically identify and study the types of obstructions causing sight distance limitations. This information is critical to entities looking to decide on the appropriate construction activity required to alleviate sight distance limitations. To fill in this gap, this paper proposes a fully automated novel method to assess sight distance on highways scanned using mobile LiDAR technology, while also proposing a method for the automated classification of the type of obstruction detected. The algorithm is tested on multiple roadway segments in Alberta, Canada and was successful in identifying limitations in sight distance and classifying obstructions into different types of objects. © 2021 Elsevier B.V.",Article,"Final",Scopus,2-s2.0-85101050042
"Li H., Zhang C., Song S., Demirkesen S., Chang R.","Improving tolerance control on modular construction project with 3d laser scanning and bim: A case study of removable floodwall project",2020,"Applied Sciences (Switzerland)",10,"https://www.scopus.com/inward/record.uri?eid=2-s2.0-85097378774&doi=10.3390%2fapp10238680&partnerID=40&md5=38c9714f9019847aa18fecac2b9f9357","Quality control is essential to a successful modular construction project and should be enhanced throughout the project from design to construction and installation. The current methods for analyzing the assembly quality of a removable floodwall heavily rely on manual inspection and contact-type measurements, which are time-consuming and costly. This study presents a systematic and practical approach to improve quality control of the prefabricated modular construction projects by integrating building information modeling (BIM) with three-dimensional (3D) laser scanning technology. The study starts with a thorough literature review of current quality control methods in modular construction. Firstly, the critical quality control procedure for the modular construction structure and components should be identified. Secondly, the dimensions of the structure and components in a BIM model is considered as quality tolerance control benchmarking. Thirdly, the point cloud data is captured with 3D laser scanning, which is used to create the as-built model for the constructed structure. Fourthly, data analysis and field validation are carried out by matching the point cloud data with the as-built model and the BIM model. Finally, the study employs the data of a removable floodwall project to validate the level of technical feasibility and accuracy of the presented methods. This method improved the efficiency and accuracy of modular construction quality control. It established a preliminary foundation for using BIM and laser scanning to conduct quality control in removable floodwall installation. The results indicated that the proposed integration of BIM and 3D laser scanning has great potential to improve the quality control of a modular construction project. © 2020 by the authors. Licensee MDPI, Basel, Switzerland.",Article,"Final",Scopus,2-s2.0-85097378774
"Yan Y., Hajjar J.F.","Automated extraction of structural elements in steel girder bridges from laser point clouds",2021,"Automation in Construction",9,"https://www.scopus.com/inward/record.uri?eid=2-s2.0-85100512231&doi=10.1016%2fj.autcon.2021.103582&partnerID=40&md5=7d5615d0b2bdb75bdb8c139151fc047c","This study proposes a heuristic-based method to automate the semantic segmentation of laser point clouds collected from steel girder bridges and thus to facilitate the applications of laser scanning in bridge inspection and management. In the proposed method, domain knowledge on the geometric and topological constraints of steel girder bridges are utilized to recognize and extract individual instances of the main structural elements, which include the bridge deck, steel girders, cross-frames, piers and abutments. The effectiveness of the proposed method is validated using point clouds acquired by a terrestrial laser scanner and a UAV-based laser scanner. The results demonstrate that the proposed method on average can achieve a 98.3% element-level accuracy and a 96.1% point-level accuracy on terrestrial laser scanning data. For UAV-based laser scanning data, the average accuracy is reduced slightly to 96.0% in element-level and 93.3% in point-level. © 2021 Elsevier B.V.",Article,"Final",Scopus,2-s2.0-85100512231
"Chacón R., Posada H., Toledo Á., Gouveia M.","Development of IoT applications in civil engineering classrooms using mobile devices",2018,"Computer Applications in Engineering Education",9,"https://www.scopus.com/inward/record.uri?eid=2-s2.0-85053818788&doi=10.1002%2fcae.21985&partnerID=40&md5=8ce7fb26d56b36f466f274a22632abfe","This paper presents academic efforts aimed at integrating methodologies associated with the use of mobile devices, the potential of the Internet of Things (IoT), and the role of experimental education in civil engineering. This integration is developed by encompassing the use of sensors, microcontrollers, civil engineering problems, app development, and fabrication. The proposal provides an explorative way of approaching the numerous possibilities that arise in civil engineering when it comes to IoT, automation, monitoring, and control of civil engineering processes. The used tools represent accessible and affordable ways for application in classrooms and in educational laboratories for beginners. The initial explorative approach implies the fusion of three realms: (i) the phenomenology and mathematics of varied civil engineering problems; (ii) the systematic use of digital fabrication technologies and electronic prototyping platforms; and (iii) the creative and visual way of developing codes provided by block-based development platforms. This integration of perspectives is an attempt of approaching civil engineering mathematics to technology and arts with a rigorous scientific approach. A set of different examples is presented with the corresponding findings in educational terms. These examples are developed in a constructive, scaffolding-based way and may contribute as a potential alternative in the development of open-source teaching labs in civil engineering schools. © 2018 Wiley Periodicals, Inc.",Article,"Final",Scopus,2-s2.0-85053818788
"Rausch C., Haas C.","Automated shape and pose updating of building information model elements from 3D point clouds",2021,"Automation in Construction",8,"https://www.scopus.com/inward/record.uri?eid=2-s2.0-85099717898&doi=10.1016%2fj.autcon.2021.103561&partnerID=40&md5=cdc73c4896df1af11380feca8cfc00da","Generating an up-to-date BIM that accurately reflects as-built conditions is becoming necessary for ensuring fit between assemblies and construction sites. If an initial BIM (“proto-BIM”) could be automatically updated to reflect as-built conditions by changing shape and pose of BIM elements, it would be preferable over scan-to-BIM in many instances. An approach is presented herein for creating geometric agency within BIMs by exploiting their parametric capabilities, the accuracy of 3D point clouds, and the dexterity of metaheuristics. The result is a dynamic BIM (“dyna-BIM”) capable of updating its geometry to match a 3D point cloud. A case study for cast-in-place concrete footings shows how the average error between a BIM and the as-built conditions can be reduced from 50.4 mm to 5.69 mm. This paper provides a way to progressively capture accurate as-built conditions in BIM and predict potential assembly conflicts, while maintaining the initial semantics and fidelity of an as-designed BIM. © 2021 Elsevier B.V.",Article,"Final",Scopus,2-s2.0-85099717898
"Rausch C., Lu R., Talebi S., Haas C.","Deploying 3D scanning based geometric digital twins during fabrication and assembly in offsite manufacturing",2021,"International Journal of Construction Management",7,"https://www.scopus.com/inward/record.uri?eid=2-s2.0-85102267353&doi=10.1080%2f15623599.2021.1896942&partnerID=40&md5=ba118265cc247ffb1c1d619d148ee400","Verifying geometric compliance in offsite manufacturing (OSM) is key for ensuring adequate fit-up, structural integrity, building system performance, and assembly alignment on site. The use of a geometric digital twin (gDT) from 3 D scanning can be used to digitize an assembly to detect and resolve potential problems in a prescient manner. The contribution of this article is the development of a framework for deploying and comparing three distinct gDT approaches for use during fabrication and assembly in OSM: (1) a scan-vs-BIM approach, (2) a scan-to-BIM approach and (3) a parametric BIM updating approach. Results from a commercial building project show that scan-vs-BIM is the most accurate approach, parametric BIM updating produces the most semantically rich gDT, and scan-to-BIM is a middle-tiered option, striking a balance between representational accuracy and semantic enrichment. This study concludes that future research should develop a hybrid solution of these gDT approaches and additional more accurate measurement technologies for optimal deployment in OSM. © 2021 Informa UK Limited, trading as Taylor & Francis Group.",Article,"Article in Press",Scopus,2-s2.0-85102267353
"Agirbas A.","Teaching construction sciences with the integration of BIM to undergraduate architecture students",2020,"Frontiers of Architectural Research",7,"https://www.scopus.com/inward/record.uri?eid=2-s2.0-85083879028&doi=10.1016%2fj.foar.2020.03.007&partnerID=40&md5=283aaba50903b94406c75754a49b904f","This study aims to test two hypotheses: teaching building information modeling (BIM) in relation to construction science provides students with a remarkable understanding of the nature of construction science (Hypothesis 1), and if the student has positive attitude toward the use of the BIM program, then efficiency by which construction science is taught by its means is improved (Hypothesis 2). Results and process of a case study with a novel teaching methodology were discussed in terms of the benefits of the students. A questionnaire study was conducted on the student group with which the case study was performed to test each student's attitude. Results were evaluated statistically. When BIM is integrated with the teaching of basic construction courses within architecture degree programs, the students understood the building system principles simply and effectively. As a result of the statistical analysis, the students find the applied method effective. Moreover, their attitude toward BIM affects the process. © 2020 The Author",Article,"Final",Scopus,2-s2.0-85083879028
"Akyazi T., Alvarez I., Alberdi E., Oyarbide-Zubillaga A., Goti A., Bayon F.","Skills needs of the civil engineering sector in the european union countries: Current situation and future trends",2020,"Applied Sciences (Switzerland)",7,"https://www.scopus.com/inward/record.uri?eid=2-s2.0-85092790481&doi=10.3390%2fapp10207226&partnerID=40&md5=67d22ea11fe109a76b8caef23ab0a58b","The construction sector has always occupied a strategic place in the European economy. The European construction industry suffered during the 2007–2008 global financial crisis, and today the sector is undergoing a recovery process. Among all the construction subsectors, civil engineering has the highest growth rate. Currently, the sector has to face profound industrial changes emerging with digital transformations (Industry 4.0), sustainability, climate change and energy efficiency. To promote the growth of the civil engineering sector and accelerate the recovery, we need to create a highly qualified and competent workforce that can handle the challenges coming up with the technological progress and global competitiveness. The main condition to achieve this capable workforce is to define the expected evolution of skills requirements. For that purpose, our work focuses on identifying current and near-future key skills required by the civil engineering occupations. To achieve this, we developed an automated sectoral database for the current and near-future skills requirements of the selected professional profiles. It is our belief that this sectoral database is a fundamental framework that will guide the sector through the future changes. We also believe that our research can be used as a key tool for construction companies, policy-makers, academics and training centers to develop well-designed and efficient training programs for upskilling and reskilling the workforce. © 2020 by the authors. Licensee MDPI, Basel, Switzerland.",Article,"Final",Scopus,2-s2.0-85092790481
