Authors,Title,Year,Source title,Cited by,Link,Abstract,Document Type,Publication Stage,Source,EID
"Hallermann N., Helmrich M., Morgenthal G., Schnitzler E., Rodehorst V., Debus P.","UAS-based diagnostics of infrastructure structures - Part of a digital maintenance strategy [UAS-basierte Diagnostik von Infrastrukturbauwerken: Teil einer digitalen Instandhaltungsstrategie]",2018,"Bautechnik",2,"https://www.scopus.com/inward/record.uri?eid=2-s2.0-85053555204&doi=10.1002%2fbate.201800066&partnerID=40&md5=192356e68a605d42f648cb667959f32e","UAS-based diagnostics of infrastructure structures – part of a digital maintenance strategy. Ensuring structural safety and serviceability is a top priority for infrastructure structures. However, the load-bearing capacity, which decreases due to of aging and damage over the service life, can only be predicted relatively inaccurately. Therefore, a regular recording and evaluation of the structural condition is required. Since the classical visual inspection incurs, especially for large structures, very high costs, the focus has shifted to the use of small Unmanned Aircraft Systems (UAS) as an alternative. The current state of the art and the equipment with high-quality cameras qualify these systems for diverse inspection tasks. A case study was performed with DB Netz AG and flanked by research work to investigate possible applications of UAS for the inspection of large bridges and retaining structures as part of a digital maintenance strategy. Because of the unique character, geometric complexity and demanding environmental conditions of the structures, the flight path generation, data analysis and information extraction require more research work. Therefore, an automated flight path generation for extensive image data acquisition has been developed and carried out for typical reference objects. This forms the basis for a highly accurate and dense 3-D-reconstruction and evaluation of the structural geometry and for an automated image analysis for the extraction of condition information. © 2018, Ernst und Sohn. All rights reserved.",Article,"Final",Scopus,2-s2.0-85053555204
"Demharter J., Fuchs S., Schapke S.-E., Scherer R.J.","Multimodell und Multimodellcontainer",2014,"Informationssysteme im Bauwesen 1",2,,[No abstract available],,"Final",Scopus,2-s2.0-85017080286
"Mirzazade A., Popescu C., Blanksvärd T., Täljsten B.","Workflow for off-site bridge inspection using automatic damage detection-case study of the pahtajokk bridge",2021,"Remote Sensing",1,"https://www.scopus.com/inward/record.uri?eid=2-s2.0-85110626604&doi=10.3390%2frs13142665&partnerID=40&md5=355da43ea5c3054b192bf92aa5ee53af","For the inspection of structures, particularly bridges, it is becoming common to replace humans with autonomous systems that use unmanned aerial vehicles (UAV). In this paper, a framework for autonomous bridge inspection using a UAV is proposed with a four-step workflow: (a) data acquisition with an efficient UAV flight path, (b) computer vision comprising training, testing and validation of convolutional neural networks (ConvNets), (c) point cloud generation using intelligent hierarchical dense structure from motion (DSfM), and (d) damage quantification. This workflow starts with planning the most efficient flight path that allows for capturing of the minimum number of images required to achieve the maximum accuracy for the desired defect size, then followed by bridge and damage recognition. Three types of autonomous detection are used: masking the background of the images, detecting areas of potential damage, and pixel-wise damage segmentation. Detection of bridge components by masking extraneous parts of the image, such as vegetation, sky, roads or rivers, can improve the 3D reconstruction in the feature detection and matching stages. In addition, detecting damaged areas involves the UAV capturing close-range images of these critical regions, and damage segmentation facilitates damage quantification using 2D images. By application of DSfM, a denser and more accurate point cloud can be generated for these detected areas, and aligned to the overall point cloud to create a digital model of the bridge. Then, this generated point cloud is evaluated in terms of outlier noise, and surface deviation. Finally, damage that has been detected is quantified and verified, based on the point cloud generated using the Terrestrial Laser Scanning (TLS) method. The results indicate this workflow for autonomous bridge inspection has potential. © 2021 by the authors. Licensee MDPI, Basel, Switzerland. This article is an open access article distributed under the terms and conditions of the Creative Commons Attribution (CC BY) license (https:// creativecommons.org/licenses/by/ 4.0/).",Article,"Final",Scopus,2-s2.0-85110626604
"Helmrich M., Morgenthal G.","Structural parameter identification from image-based acquired information",2021,"Bridge Maintenance, Safety, Management, Life-Cycle Sustainability and Innovations - Proceedings of the 10th International Conference on Bridge Maintenaince, Safety and Management, IABMAS 2020",1,"https://www.scopus.com/inward/record.uri?eid=2-s2.0-85117564120&doi=10.1201%2f9780429279119-18&partnerID=40&md5=a654af70c857de47289d44287964e370","To ensure the structural safety and serviceability is a top priority for large infrastructures. To determine the load bearing capacity for the current state and to predict the structural behaviour for the future life span, regular inspections and evaluations of the structural condition are required. Recently, many different approaches using modern digital technologies were developed to support the engineer with the acquisition and interpretation of structural information. This article focuses on the evaluation of visual data acquired by using small unmanned aircraft systems (UAS) equipped with high-quality cameras. The images obtained are used amongst others to reconstruct a dense 3D point cloud, which contains local (e.g. cross sectional shape, spalling areas) as well as global (e.g. bending line with respect to a reference condition or to earlier observation) geometric information. Furthermore, surface anomalies (e.g. cracks), automatically detected by image analysis algorithms, are mapped to the 3D structure. This paper presents a methodology, which processes and combines the acquired data from consecutive UAS-based inspections to quantify identifiable parameters usable for a validation or calibration of a numerical model. This parameters cover for example cross sectional values, displacements and curvature at each position of the element axis as well as magnitudes of load and effective bending stiffness. The introduced procedure systematically shows on different structural levels and based on the number of data acquisitions and available a priori information about the structure which parameters are identifiable and how they are obtained. The quantification is performed by a combination of mathematical optimization strategies with linked cross sectional and system analysis. Case studies on a laboratory experiment and a semi-integral bridge are used to show the functionality and potential of the proposed method. © 2021 Taylor & Francis Group, London",Conference Paper,"Final",Scopus,2-s2.0-85117564120
"Taraben J., Morgenthal G.","Methods for the Automated Assignment and Comparison of Building Damage Geometries",2021,"Advanced Engineering Informatics",1,"https://www.scopus.com/inward/record.uri?eid=2-s2.0-85096095143&doi=10.1016%2fj.aei.2020.101186&partnerID=40&md5=cb0c42350b816d97002ad794b087a9ff","Condition assessment of structures supports effective repair, restoration or reconstruction works on buildings of infrastructural or cultural importance and is therefore an important contribution to building and infrastructure sustainability. Due to increasing ageing and external influences continuous monitoring is obligatory to maintain the structures. Throughout the entire life cycle, digital scans of changing damages and the building geometry, up to the degree of a digital twin, can be acquired using modern inspection methods. This allows for the automation of condition assessment processes to locate, quantify and predict damage progression at a structure related to building information models. However, the usual inspection documentation as performed in the past neither includes an assignment of damages to digital building models nor relates the history of recordings to a damage entity, which consequently makes a direct condition state comparison unfeasible. The paper presents voxel based methods for the automated assignment of geometrical representations of damages to elements of a corresponding building model as well as to past damage scans, which describe the same damage entity. Furthermore, the comparison and computation of discrete geometric changes based on the assignments is shown. Additionally, the clustering of scanned damage geometries into interest areas for the usage in planning processes for further inspections is presented. The resulting set of methods enables an automated condition comparison of damages on each surveyed state of the structure and supports the integration of inspection data to building information models. © 2020 Elsevier Ltd",Article,"Final",Scopus,2-s2.0-85096095143
"Lu R., Brilakis I.",[No title available],2020,"A Benchmarked Framework for Geometric Digital Twinning of Slab and Beam-and-Slab Bridges",1,,[No abstract available],,"Final",Scopus,2-s2.0-85123767933
"Slocum R.",[No title available],2018,"potree-sfm",1,,[No abstract available],,"Final",Scopus,2-s2.0-85123757698
[No author name available],[No title available],0000,"Richtlinie (RIL) 804 (2008) Inspektion von Ingenieurbauwerken",1,,[No abstract available],,"Final",Scopus,2-s2.0-85123792251
