Authors,Title,Year,Source title,Cited by,Link,Abstract,Document Type,Publication Stage,Source,EID
"Girardeau-Montaut D., Roux M., Marc R., Thibault G.","Change detection on points cloud data acquired with a ground laser scanner",2005,"International Archives of the Photogrammetry, Remote Sensing and Spatial Information Sciences - ISPRS Archives",232,"https://www.scopus.com/inward/record.uri?eid=2-s2.0-85036289327&partnerID=40&md5=7c0384c8a65f5580eb08b861266d7a46","Ground based laser scanning is now well settled in the fields of cultural heritage, as-built modelling and monitoring applications. We intend to use laser scanning to detect changes on building sites or inside facilities, mainly for monitoring purposes but also to be able to provide synthetic information in case of an emergency. In both cases, the main constraint is time. A minimum precision on the measure of movements is also required, depending on the type of application. Laser scanner seems to be the perfect tool for such applications as it quickly acquires a large amount of accurate 3D data. But the comparison of so huge datasets implies the use of appropriate structures and ad-hoc algorithms. A specific octree structure is described, and then several simple cloud-to-cloud comparison techniques are presented. The best one, based on the Hausdorff distance computation is improved on various points. Also, as a full automatic process seems still unachievable, a software framework has been developed. It intends to minimize human intervention and therefore prevents from wasting the LiDAR speed in time-consuming post-processing operations. © 2005 International Society for Photogrammetry and Remote Sensing. All rights reserved.",Conference Paper,"Final",Scopus,2-s2.0-85036289327
"Boje C., Guerriero A., Kubicki S., Rezgui Y.","Towards a semantic Construction Digital Twin: Directions for future research",2020,"Automation in Construction",113,"https://www.scopus.com/inward/record.uri?eid=2-s2.0-85082386834&doi=10.1016%2fj.autcon.2020.103179&partnerID=40&md5=914efcd6c064d6a97299f00d812bb8fc","As the Architecture, Engineering and Construction sector is embracing the digital age, the processes involved in the design, construction and operation of built assets are more and more influenced by technologies dealing with value-added monitoring of data from sensor networks, management of this data in secure and resilient storage systems underpinned by semantic models, as well as the simulation and optimisation of engineering systems. Aside from enhancing the efficiency of the value chain, such information-intensive models and associated technologies play a decisive role in minimising the lifecycle impacts of our buildings. While Building Information Modelling provides procedures, technologies and data schemas enabling a standardised semantic representation of building components and systems, the concept of a Digital Twin conveys a more holistic socio-technical and process-oriented characterisation of the complex artefacts involved by leveraging the synchronicity of the cyber-physical bi-directional data flows. Moreover, BIM lacks semantic completeness in areas such as control systems, including sensor networks, social systems, and urban artefacts beyond the scope of buildings, thus requiring a holistic, scalable semantic approach that factors in dynamic data at different levels. The paper reviews the multi-faceted applications of BIM during the construction stage and highlights limits and requirements, paving the way to the concept of a Construction Digital Twin. A definition of such a concept is then given, described in terms of underpinning research themes, while elaborating on areas for future research. © 2020 The Authors",Review,"Final",Scopus,2-s2.0-85082386834
"Schütz M.","Potree: Rendering large point clouds in web browsers",2016,"Potree: Rendering Large Point Clouds in Web Browsers",85,,[No abstract available],,"Final",Scopus,2-s2.0-85040717824
"Morgenthal G., Hallermann N., Kersten J., Taraben J., Debus P., Helmrich M., Rodehorst V.","Framework for automated UAS-based structural condition assessment of bridges",2019,"Automation in Construction",70,"https://www.scopus.com/inward/record.uri?eid=2-s2.0-85056178604&doi=10.1016%2fj.autcon.2018.10.006&partnerID=40&md5=abcf420457165de6f6cb8de65c038b8c","This paper presents a coherent framework for automated unmanned aircraft system based inspections of large bridges to facilitate an automated condition assessment. Modern camera equipped unmanned aircraft systems are used to generate high-resolution digital image data of the structural surface. The flight path is automatically computed from a basic 3D model and ensures that the image set will satisfy defined quality parameters according to the desired information extraction. State-of-the-art photogrammetry and machine learning based feature detection methods are employed to automatically compute high-resolution geo-referenced 3D structural geometries and to identify typical damage patterns such as cracks. Further framework components dedicated to condition assessment allow the mapping of damages to structural parts and the calibration of mechanical numerical simulation models used to compute the internal structural demand under design loads. Data models are proposed that allow a consistent data storage and management to serve as a basis for all algorithmic components. The application of the framework to a large bridge structure showcases how the integration of digital systems and algorithms forms the basis for an intelligent and potentially autonomous safety assessment of very large infrastructures. © 2018 Elsevier B.V.",Article,"Final",Scopus,2-s2.0-85056178604
"Sacks R., Kedar A., Borrmann A., Ma L., Brilakis I., Hüthwohl P., Daum S., Kattel U., Yosef R., Liebich T., Barutcu B.E., Muhic S.","SeeBridge as next generation bridge inspection: Overview, Information Delivery Manual and Model View Definition",2018,"Automation in Construction",52,"https://www.scopus.com/inward/record.uri?eid=2-s2.0-85042407578&doi=10.1016%2fj.autcon.2018.02.033&partnerID=40&md5=a088875ae311b0f4ac4d4e88cb6d1111","Innovative solutions for rapid and intelligent survey and assessment methods are required in maintenance, repair, retrofit and rebuild of enormous numbers of bridges in service throughout the world. Motivated by this need, a next-generation integrated bridge inspection system, called SeeBridge, has been proposed. An Information Delivery Manual (IDM) was compiled to specify the technical components, activities and information exchanges in the SeeBridge process, and a Model View Definition (MVD) was prepared to specify the data exchange schema to serve the IDM. The MVD was bound to the IFC4 Add2 data schema standard. The IDM and MVD support research and development of the system by rigorously defining the information and data that structure bridge engineers' knowledge. The SeeBridge process is mapped, parts of the data repositories are presented, and the future use of the IDM is discussed. The development underlines the real potential for automated inspection of infrastructure at large, because it demonstrates that the hurdles in the way of automated acquisition of detailed and semantically rich models of existing infrastructure are computational in nature, not instrumental, and are surmountable with existing technologies. © 2018",Article,"Final",Scopus,2-s2.0-85042407578
[No author name available],"Ingenieurbauwerke im Zuge von Straßen und Wegen, Überwachung und Prüfung",1999,"Ingenieurbauwerke im Zuge von Straßen und Wegen; Überwachung und Prüfung",51,,[No abstract available],,"Final",Scopus,2-s2.0-3342968388
"Errandonea I., Beltrán S., Arrizabalaga S.","Digital Twin for maintenance: A literature review",2020,"Computers in Industry",43,"https://www.scopus.com/inward/record.uri?eid=2-s2.0-85092055078&doi=10.1016%2fj.compind.2020.103316&partnerID=40&md5=5b3b1a11954bcab4908307fb7cab2802","In recent years, Digital Twins (DT) have been implemented in different industrial sectors, in several applications areas such as design, production, manufacturing, and maintenance. In particular, maintenance is one of the most researched applications, as the impact of the execution of maintenance task may have a great impact in the business of the companies. For example, in sector such as energy or manufacturing, a maintenance activity can cause the shutdown of an entire production line, or in the case of a wind turbine inspection, may face the safety of an operator to measure a simple indicator. Hence, the application of more intelligent maintenance strategies can offer huge benefits. In this context, this paper focuses on the review of DT applications for maintenance, as no previous work has been found with this aim. For instance, both “Digital Twin” and “maintenance” concepts and strategies are described in detail, and then a literature review is carried out where these two concepts are involved. In addition to identifying and analyzing how DTs are currently being applied for maintenance, this paper also highlights future research lines and open issues. © 2020 Elsevier B.V.",Review,"Final",Scopus,2-s2.0-85092055078
"Chow J.K., Su Z., Wu J., Tan P.S., Mao X., Wang Y.H.","Anomaly detection of defects on concrete structures with the convolutional autoencoder",2020,"Advanced Engineering Informatics",36,"https://www.scopus.com/inward/record.uri?eid=2-s2.0-85083812356&doi=10.1016%2fj.aei.2020.101105&partnerID=40&md5=b73b496dfef5f02271141c4504891fbf","This paper reports the application of deep learning for implementing the anomaly detection of defects on concrete structures, so as to facilitate the visual inspection of civil infrastructure. A convolutional autoencoder was trained as a reconstruction-based model, with the defect-free images, to rapidly and reliably detect defects from the large volume of image datasets. This training process was in the unsupervised mode, with no label needed, thereby requiring no prior knowledge and saving an enormous amount of time for label preparation. The built anomaly detector favors minimizing the reconstruction errors of defect-free images, which renders high reconstruction errors of defects, in turn, detecting the location of defects. The assessment shows that the proposed anomaly detection technique is robust and adaptable to defects on wide ranges of scales. Comparison was also made with the segmentation results produced by other automatic classical methods, revealing that the results made by the anomaly map outperform other segmentation methods, in terms of precision, recall, F1 measure and F2 measure, without severe under- and over-segmentation. Further, instead of merely being a binary map, each pixel of the anomaly map is represented by the anomaly score, which acts as a risk indicator for alerting inspectors, wherever defects on concrete structures are detected. © 2020 Elsevier Ltd",Article,"Final",Scopus,2-s2.0-85083812356
"Hüthwohl P., Brilakis I., Borrmann A., Sacks R.","Integrating RC Bridge Defect Information into BIM Models",2018,"Journal of Computing in Civil Engineering",30,"https://www.scopus.com/inward/record.uri?eid=2-s2.0-85042209887&doi=10.1061%2f%28ASCE%29CP.1943-5487.0000744&partnerID=40&md5=43cb50858887a469aab061652f8862ca","Reinforced concrete bridges are a vitally important part of modern infrastructure. The status of this infrastructure needs to be monitored on a continuous basis in order to ensure its safety and functionality. This is currently being done by authorities worldwide via bridge inspection reports. The format and storage of these reports varies considerably across different authorities around the world and is sometimes compiled into a bridge management system (BMS). The lack of standardization severely hinders the use of inspection information for knowledge-generation use cases by both practitioners and researchers. This paper presents an exploratory analysis, and as a result, an information model and a candidate binding to Industry Foundation Classes (IFC) to categorize inspection information on RC bridges and to standardize storage of this information in a format suitable for sharing and comparing it between different users and varying requirements. The authors were able to show in three steps that IFC in its latest version provides sufficient functionality to serve as a basis for integrating relevant defect information and imagery. First, types of defects and properties needed for bridge assessment were extracted from existing bridge inspection manuals. Second, the authors modeled the defect entities, their properties, and their relationships, and third, mapped them to appropriate IFC entities. A prototypical implementation serves as a proof of concept for automated sharing and comparing of information needed in RC bridge inspections and for establishing a knowledge base for bridge performance over time and across authorities. © 2018 American Society of Civil Engineers.",Article,"Final",Scopus,2-s2.0-85042209887
"Ye C., Acikgoz S., Pendrigh S., Riley E., DeJong M.J.","Mapping deformations and inferring movements of masonry arch bridges using point cloud data",2018,"Engineering Structures",23,"https://www.scopus.com/inward/record.uri?eid=2-s2.0-85049748965&doi=10.1016%2fj.engstruct.2018.06.094&partnerID=40&md5=1e4d063896410c7b2d362d5cb39ccd0d","Many historic masonry arch bridges experience damage due to support movements during their lifetime. This damage may influence the performance of the bridge and reduce its load carrying capacity. This paper proposes a new method to quantify past support movements by investigating distortions in bridge geometry. In this method, the bridge geometry is recorded in point cloud format and segmented into different structural components (e.g. 3D piers and barrels or 2D pier and barrel cross-sections). The geometry of each component is investigated further by fitting primitive shapes (e.g. 3D planes and cylinders or 2D lines and arcs) which represent the design intent. The discrepancy between these fitted shapes and the point clouds reveals a characteristic distortion signature. This signature is compared with theoretical distortion traces, which are obtained from kinematical analyses of the arch subjected to a range of support movements. The most likely support movement scenarios identified from these comparisons are then validated with visual indications of damage, such as crack location and size, and other geometric quantities, such as the change of the bedding joint elevations along the bridge. The proposed technique is applied to two masonry rail viaducts in the UK, which demonstrate different evidence of damage. Using the proposed method, past support movements of both bridges, which led to the observed damage, are inferred. © 2018 The Authors",Article,"Final",Scopus,2-s2.0-85049748965
"Harirchian E., Harirchian A.","Earthquake Hazard Safety Assessment of Buildings via Smartphone App: An Introduction to the Prototype Features- 30",2018,"Forum Bauinformatik: von jungen Forschenden für junge Forschende: September 2018, Informatik im Bauwesen",14,,[No abstract available],,"Final",Scopus,2-s2.0-85083553223
"Benz C., Debus P., Ha H.K., Rodehorst V.","Crack Segmentation on UAS-based Imagery using Transfer Learning",2019,"International Conference Image and Vision Computing New Zealand",9,"https://www.scopus.com/inward/record.uri?eid=2-s2.0-85078702225&doi=10.1109%2fIVCNZ48456.2019.8960998&partnerID=40&md5=19cd67e937c99a36a1f6636a6a2e658d","The vast number of images that typically arise from automated structure inspection, e.g. by means of unmanned aircraft systems (UAS), pose a challenge for inspectors. In order to support the human responsible, automated crack detection can help determine grave defects that require close-up inspection. The available crack datasets showed to be unsuited for crack segmentation on UAS-acquired imagery. Thus, a crack dataset was created to reflect the difficulties connected to the UAS-based imagery. The challenges mainly are low resolution and intensity of the cracks and re-occurring planking patterns. A convolutional neural network (CNN) for crack segmentation was derived from TERNAUSNET [1] applying transfer learning. It achieved an average precision (AP) of 75% on the challenging dataset. The code and dataset are available at https://github.com/khanhha/crack-segmentation. © 2019 IEEE.",Conference Paper,"Final",Scopus,2-s2.0-85078702225
"Mohammadi M., Rashidi M., Mousavi V., Karami A., Yu Y., Samali B.","Quality evaluation of digital twins generated based on uav photogrammetry and tls: Bridge case study",2021,"Remote Sensing",7,"https://www.scopus.com/inward/record.uri?eid=2-s2.0-85114553959&doi=10.3390%2frs13173499&partnerID=40&md5=5e97c2992e573192ab010982b698899f","In the current modern era of information and technology, emerging remote advancements have been widely established for detailed virtual inspections and assessments of infrastructure assets, especially bridges. These technologies are capable of creating an accurate digital representation of the existing assets, commonly known as the digital twins. Digital twins are suitable alternatives to in-person and on-site based assessments that can provide safer, cheaper, more reliable, and less distributive bridge inspections. In the case of bridge monitoring, Unmanned Aerial Vehicle (UAV) photogrammetry and Terrestrial Laser Scanning (TLS) are among the most common advanced technologies that hold the potential to provide qualitative digital models; however, the research is still lacking a reliable methodology to evaluate the generated point clouds in terms of quality and geometric accuracy for a bridge size case study. Therefore, this paper aims to provide a comprehensive methodology along with a thorough bridge case study to evaluate two digital point clouds developed from an existing Australian heritage bridge via both UAV-based photogrammetry and TLS. In this regard, a range of proposed approaches were employed to compare point clouds in terms of points’ distribution, level of outlier noise, data completeness, surface deviation, and geometric accuracy. The comparative results of this case study not only proved the capability and applicability of the proposed methodology and approaches in evaluating these two voluminous point clouds, but they also exhibited a higher level of point density and more acceptable agreements with as-is measurements in TLS-based point clouds subjected to the implementation of a precise data capture and a 3D reconstruction model. © 2021 by the authors. Licensee MDPI, Basel, Switzerland.",Article,"Final",Scopus,2-s2.0-85114553959
"Morgenthal G., Eick J.F., Rau S., Taraben J.","Wireless sensor networks composed of standard microcomputers and smartphones for applications in structural health monitoring",2019,"Sensors (Switzerland)",5,"https://www.scopus.com/inward/record.uri?eid=2-s2.0-85065673957&doi=10.3390%2fs19092070&partnerID=40&md5=3f32fb03cbf85b6ffc47ea8479862cc8","Wireless sensor networks have attracted great attention for applications in structural health monitoring due to their ease of use, flexibility of deployment, and cost-effectiveness. This paper presents a software framework for WiFi-based wireless sensor networks composed of low-cost mass market single-board computers. A number of specific system-level software components were developed to enable robust data acquisition, data processing, sensor network communication, and timing with a focus on structural health monitoring (SHM) applications. The framework was validated on Raspberry Pi computers, and its performance was studied in detail. The paper presents several characteristics of the measurement quality such as sampling accuracy and time synchronization and discusses the specific limitations of the system. The implementation includes a complementary smartphone application that is utilized for data acquisition, visualization, and analysis. A prototypical implementation further demonstrates the feasibility of integrating smartphones as data acquisition nodes into the network, utilizing their internal sensors. The measurement system was employed in several monitoring campaigns, three of which are documented in detail. The suitability of the system is evaluated based on comparisons of target quantities with reference measurements. The results indicate that the presented system can robustly achieve a measurement performance commensurate with that required in many typical SHM tasks such as modal identification. As such, it represents a cost-effective alternative to more traditional monitoring solutions. © 2019 by the authors.",Article,"Final",Scopus,2-s2.0-85065673957
"Taraben J.","A model for building information management of structural inspections",2019,"Tagungsband 31. Forum Bauinformatik",3,,[No abstract available],,"Final",Scopus,2-s2.0-85096084304
"Ali R., Chuah J.H., Talip M.S.A., Mokhtar N., Shoaib M.A.","Structural crack detection using deep convolutional neural networks",2022,"Automation in Construction",2,"https://www.scopus.com/inward/record.uri?eid=2-s2.0-85116927479&doi=10.1016%2fj.autcon.2021.103989&partnerID=40&md5=d81189de859d37f2d950dac75ff099ce","Convolutional Neural Networks (CNN) have immense potential to solve a broad range of computer vision problems. It has achieved encouraging results in numerous applications of engineering, medical, and other research fields due to the advancement in hardware, data collection procedures, and efficient algorithms. These innovations have changed the way how specific problems are solved as compared to conventional methods. This article presents a review of CNN implementation on civil structure crack detection. The review highlights the significant research that has been performed to detect structure cracks through classification and segmentation of crack images with CNN in the perspective of image pre-processing techniques, processing hardware, software tools, datasets, network architectures, learning procedures, loss functions, and network performance. The key contribution of this review article is the study and analysis of the most recent developments on crack detection using CNN. Additionally, this work also presents a discussion on crack detection through a manual process, image processing techniques, and machine learning methods along with their limitations. Finally, this article aims for assisting the readers to understand the motivation and methodology of the various CNN-based crack detection methods and to invoke them for exploring the solutions of challenges outlined in future research. © 2021 Elsevier B.V.",Review,"Final",Scopus,2-s2.0-85116927479
"Debus P., Rodehorst V.",[No title available],2021,"Multi-scale Flight Path Planning for UAS Building Inspection",2,,[No abstract available],,"Final",Scopus,2-s2.0-85122425730
"Taraben J., Morgenthal G.","Automated linking of 3D inspection data for damage analysis",2021,"Bridge Maintenance, Safety, Management, Life-Cycle Sustainability and Innovations - Proceedings of the 10th International Conference on Bridge Maintenaince, Safety and Management, IABMAS 2020",2,"https://www.scopus.com/inward/record.uri?eid=2-s2.0-85096129050&doi=10.1201%2f9780429279119-505&partnerID=40&md5=9051d7c2b5ec39a0f4f18f53ff195906","The inspection of existing bridge structures in defined time intervals is an important process for maintenance and repair. Most countries define this process in detailed laws and guidelines as well as the comprehensiveness of a therefore gained documentation of damages or noticeable features. Each inspection task results in a set of heterogeneous data of the surveyed structure, for example images, 3D scans, sensor data or building models from planning processes or previous inspections, which leads to a hardly structured history of data sets. Therefore, the amount of information has to be stored and managed in an effective and understandable manner for each time interval. Additionally, an automated comparison of the consecutive inspection data sets towards a linking of identified damages for further comparison could support the determination of damage developments. This article proposes a method for the documentation and post-processing of inspection data, especially crack geometries, for condition assessment. Therefore, an image based inspection approach combined with a photogrammetric 3D reconstruction is used. The correspondences among the resulting geometrical data are set by detailed described automated linking approaches. Furthermore, a case study shows the application of the developed approach to a simple structure with focus on the automated comparison of cracks under different load conditions. © 2021 Taylor & Francis Group, London",Conference Paper,"Final",Scopus,2-s2.0-85096129050
