Authors,Title,Year,Source title,Cited by,Link,Abstract,Document Type,Publication Stage,Source,EID
"Li Z., Zhang L., Mathiopoulos P.T., Liu F., Zhang L., Li S., Liu H.","A hierarchical methodology for urban facade parsing from TLS point clouds",2017,"ISPRS Journal of Photogrammetry and Remote Sensing",30,"https://www.scopus.com/inward/record.uri?eid=2-s2.0-85000819173&doi=10.1016%2fj.isprsjprs.2016.11.008&partnerID=40&md5=56d03dc2145854e6dbe243590f713483","The effective and automated parsing of building facades from terrestrial laser scanning (TLS) point clouds of urban environments is an important research topic in the GIS and remote sensing fields. It is also challenging because of the complexity and great variety of the available 3D building facade layouts as well as the noise and data missing of the input TLS point clouds. In this paper, we introduce a novel methodology for the accurate and computationally efficient parsing of urban building facades from TLS point clouds. The main novelty of the proposed methodology is that it is a systematic and hierarchical approach that considers, in an adaptive way, the semantic and underlying structures of the urban facades for segmentation and subsequent accurate modeling. Firstly, the available input point cloud is decomposed into depth planes based on a data-driven method; such layer decomposition enables similarity detection in each depth plane layer. Secondly, the labeling of the facade elements is performed using the SVM classifier in combination with our proposed BieS-ScSPM algorithm. The labeling outcome is then augmented with weak architectural knowledge. Thirdly, least-squares fitted normalized gray accumulative curves are applied to detect regular structures, and a binarization dilation extraction algorithm is used to partition facade elements. A dynamic line-by-line division is further applied to extract the boundaries of the elements. The 3D geometrical façade models are then reconstructed by optimizing facade elements across depth plane layers. We have evaluated the performance of the proposed method using several TLS facade datasets. Qualitative and quantitative performance comparisons with several other state-of-the-art methods dealing with the same facade parsing problem have demonstrated its superiority in performance and its effectiveness in improving segmentation accuracy. © 2016",Article,"Final",Scopus,2-s2.0-85000819173
"Oses N., Dornaika F., Moujahid A.","Image-based delineation and classification of built heritage masonry",2014,"Remote Sensing",27,"https://www.scopus.com/inward/record.uri?eid=2-s2.0-84896994165&doi=10.3390%2frs6031863&partnerID=40&md5=7f145d249211bbc53df926051a598ccd","Fundación Zain is developing new built heritage assessment protocols. The goal is to objectivize and standardize the analysis and decision process that leads to determining the degree of protection of built heritage in the Basque Country. The ultimate step in this objectivization and standardization effort will be the development of an information and communication technology (ICT) tool for the assessment of built heritage. This paper presents the ground work carried out to make this tool possible: the automatic, image-based delineation of stone masonry. This is a necessary first step in the development of the tool, as the built heritage that will be assessed consists of stone masonry construction, and many of the features analyzed can be characterized according to the geometry and arrangement of the stones. Much of the assessment is carried out through visual inspection. Thus, this process will be automated by applying image processing on digital images of the elements under inspection. The principal contribution of this paper is the automatic delineation the framework proposed. The other contribution is the performance evaluation of this delineation as the input to a classifier for a geometrically characterized feature of a built heritage object. The element chosen to perform this evaluation is the stone arrangement of masonry walls. The validity of the proposed framework is assessed on real images of masonry walls. © 2014 by the authors; licensee MDPI, Basel, Switzerland.",Article,"Final",Scopus,2-s2.0-84896994165
"Andriasyan M., Moyano J., Nieto-Julián J.E., Antón D.","From point cloud data to Building Information Modelling: An automatic parametric workflow for heritage",2020,"Remote Sensing",25,"https://www.scopus.com/inward/record.uri?eid=2-s2.0-85084270521&doi=10.3390%2frs12071094&partnerID=40&md5=0813993330c4e05f2a5d4adabf5433a9","Building Information Modelling (BIM) is a globally adapted methodology by government organisations and builders who conceive the integration of the organisation, planning, development and the digital construction model into a single project. In the case of a heritage building, the Historic Building Information Modelling (HBIM) approach is able to cover the comprehensive restoration of the building. In contrast to BIM applied to new buildings, HBIM can address different models which represent either periods of historical interpretation, restoration phases or records of heritage assets over time. Great efforts are currently being made to automatically reconstitute the geometry of cultural heritage elements from data acquisition techniques such as Terrestrial Laser Scanning (TLS) or Structure From Motion (SfM) into BIM (Scan-to-BIM). Hence, this work advances on the parametric modelling from remote sensing point cloud data, which is carried out under the Rhino+Grasshopper-ArchiCAD combination. This workflow enables the automatic conversion of TLS and SFM point cloud data into textured 3D meshes and thus BIM objects to be included in the HBIM project. The accuracy assessment of this workflow yields a standard deviation value of 68.28 pixels, which is lower than other author's precision but suffices for the automatic HBIM of the case study in this research. © 2020, by the authors.",Article,"Final",Scopus,2-s2.0-85084270521
"Bitelli G., Castellazzi G., D'altri A.M., De Miranda S., Lambertini A., Selvaggi I.","Automated voxel model from point clouds for structural analysis of cultural heritage",2016,"International Archives of the Photogrammetry, Remote Sensing and Spatial Information Sciences - ISPRS Archives",24,"https://www.scopus.com/inward/record.uri?eid=2-s2.0-84979279988&doi=10.5194%2fisprsarchives-XLI-B5-191-2016&partnerID=40&md5=feb224fd47a253ae269724c71f064f8e","In the context of cultural heritage, an accurate and comprehensive digital survey of a historical building is today essential in order to measure its geometry in detail for documentation or restoration purposes, for supporting special studies regarding materials and constructive characteristics, and finally for structural analysis. Some proven geomatic techniques, such as photogrammetry and terrestrial laser scanning, are increasingly used to survey buildings with different complexity and dimensions; one typical product is in form of point clouds. We developed a semi- Automatic procedure to convert point clouds, acquired from laserscan or digital photogrammetry, to a filled volume model of the whole structure. The filled volume model, in a voxel format, can be useful for further analysis and also for the generation of a Finite Element Model (FEM) of the surveyed building. In this paper a new approach is presented with the aim to decrease operator intervention in the workflow and obtain a better description of the structure. In order to achieve this result a voxel model with variable resolution is produced. Different parameters are compared and different steps of the procedure are tested and validated in the case study of the North tower of the San Felice sul Panaro Fortress, a monumental historical building located in San Felice sul Panaro (Modena, Italy) that was hit by an earthquake in 2012.",Conference Paper,"Final",Scopus,2-s2.0-84979279988
"Ye M., Xu S., Cao T.","HVNet: Hybrid Voxel Network for LiDAR Based 3D Object Detection",2020,"Proceedings of the IEEE Computer Society Conference on Computer Vision and Pattern Recognition",22,"https://www.scopus.com/inward/record.uri?eid=2-s2.0-85089601115&doi=10.1109%2fCVPR42600.2020.00170&partnerID=40&md5=1a72001b7c89c00df0fd98b163656307","We present Hybrid Voxel Network (HVNet), a novel one-stage unified network for point cloud based 3D object detection for autonomous driving. Recent studies show that 2D voxelization with per voxel PointNet style feature extractor leads to accurate and efficient detector for large 3D scenes. Since the size of the feature map determines the computation and memory cost, the size of the voxel becomes a parameter that is hard to balance. A smaller voxel size gives a better performance, especially for small objects, but a longer inference time. A larger voxel can cover the same area with a smaller feature map, but fails to capture intricate features and accurate location for smaller objects. We present a Hybrid Voxel network that solves this problem by fusing voxel feature encoder (VFE) of different scales at point-wise level and project into multiple pseudo-image feature maps. We further propose an attentive voxel feature encoding that outperforms plain VFE and a feature fusion pyramid network to aggregate multi-scale information at feature map level. Experiments on the KITTI benchmark show that a single HVNet achieves the best mAP among all existing methods with a real time inference speed of 31Hz. © 2020 IEEE.",Conference Paper,"Final",Scopus,2-s2.0-85089601115
"Logothetis S., Stylianidis E.","BIM open source software (OSS) for the documentation of cultural heritage",2016,"Virtual Archaeology Review",21,,[No abstract available],,"Final",Scopus,2-s2.0-85028074836
"Diara F., Rinaudo F.","Open source hbim for cultural heritage: A project proposal",2018,"International Archives of the Photogrammetry, Remote Sensing and Spatial Information Sciences - ISPRS Archives",20,"https://www.scopus.com/inward/record.uri?eid=2-s2.0-85048375090&doi=10.5194%2fisprs-archives-XLII-2-303-2018&partnerID=40&md5=ed842460412f34e8c52afe628f3232ce","Actual technologies are changing Cultural Heritage research, analysis, conservation and development ways, allowing new innovative approaches. The possibility of integrating Cultural Heritage data, like archaeological information, inside a three-dimensional environment system (like a Building Information Modelling) involve huge benefits for its management, monitoring and valorisation. Nowadays there are many commercial BIM solutions. However, these tools are thought and developed mostly for architecture design or technical installations. An example of better solution could be a dynamic and open platform that might consider Cultural Heritage needs as priority. Suitable solution for better and complete data usability and accessibility could be guaranteed by open source protocols. This choice would allow adapting software to Cultural Heritage needs and not the opposite, thus avoiding methodological stretches. This work will focus exactly on analysis and experimentations about specific characteristics of these kind of open source software (DBMS, CAD, Servers) applied to a Cultural Heritage example, in order to verifying their flexibility, reliability and then creating a dynamic HBIM open source prototype. Indeed, it might be a starting point for a future creation of a complete HBIM open source solution that we could adapt to others Cultural Heritage researches and analysis. © Authors 2018.",Conference Paper,"Final",Scopus,2-s2.0-85048375090
"Yang X., Grussenmeyer P., Koehl M., Macher H., Murtiyoso A., Landes T.","Review of built heritage modelling: Integration of HBIM and other information techniques",2020,"Journal of Cultural Heritage",18,"https://www.scopus.com/inward/record.uri?eid=2-s2.0-85087929392&doi=10.1016%2fj.culher.2020.05.008&partnerID=40&md5=3fa0baeca280c1cd1276a9881291a2a5","Built heritage documentation involves the 3D modelling of the geometry (typically using 3D computer graphics, photogrammetry and laser scanning techniques) and information management of semantic knowledge (i.e., using Geographic Information System (GIS) and ontology tools). The recent developed Building Information Modelling (BIM) technique combines 3D modelling and information management. One of its modern application is heritage documentation and has generated a new concept of Historic/Heritage Building Information Modelling (HBIM). This paper summarises the applications of these information techniques on the built heritage documentation. We utilise Web of Science Collection to monitor the publications on built heritage documentation. We analyse the research trend in heritage modelling by comparing the attention paid by researchers before and during the 2010s. The results show that photogrammetry is always the most popular method in heritage modelling. More and more works in heritage modelling have begun to use laser scanning, computer science, GIS and especially BIM techniques. Ontologies and 3D computer graphics are traditional ways for heritage documentation. Moreover, we pay attention to the roles of BIM on heritage documentation and conduct a detailed discussion on how to extend the HBIM capabilities by integrating with other techniques. The integration provides possible enhanced functions in HBIM, including accurate parametric modelling from computer graphics, automatic semantic segmentation of 3D point cloud from reality-based modelling, spatial information management and analysis by GIS, and knowledge modelling by ontology. © 2020 Elsevier Masson SAS",Review,"Final",Scopus,2-s2.0-85087929392
"Gonizzi Barsanti S., Guidi G., De Luca L.","SEGMENTATION of 3D MODELS for CULTURAL HERITAGE STRUCTURAL ANALYSIS - SOME CRITICAL ISSUES",2017,"ISPRS Annals of the Photogrammetry, Remote Sensing and Spatial Information Sciences",17,"https://www.scopus.com/inward/record.uri?eid=2-s2.0-85030242115&doi=10.5194%2fisprs-annals-IV-2-W2-115-2017&partnerID=40&md5=2bd92ae1f32e878c26035bf6822d5ffd","Cultural Heritage documentation and preservation has become a fundamental concern in this historical period. 3D modelling offers a perfect aid to record ancient buildings and artefacts and can be used as a valid starting point for restoration, conservation and structural analysis, which can be performed by using Finite Element Methods (FEA). The models derived from reality-based techniques, made up of the exterior surfaces of the objects captured at high resolution, are - for this reason - made of millions of polygons. Such meshes are not directly usable in structural analysis packages and need to be properly pre-processed in order to be transformed in volumetric meshes suitable for FEA. In addition, dealing with ancient objects, a proper segmentation of 3D volumetric models is needed to analyse the behaviour of the structure with the most suitable level of detail for the different sections of the structure under analysis. Segmentation of 3D models is still an open issue, especially when dealing with ancient, complicated and geometrically complex objects that imply the presence of anomalies and gaps, due to environmental agents such as earthquakes, pollution, wind and rain, or human factors. The aims of this paper is to critically analyse some of the different methodologies and algorithms available to segment a 3D point cloud or a mesh, identifying difficulties and problems by showing examples on different structures. © Authors 2017. CC BY 4.0 License.",Conference Paper,"Final",Scopus,2-s2.0-85030242115
"Ma L., Favier R., Do L., Bondarev E., De With P.H.N.","Plane segmentation and decimation of point clouds for 3D environment reconstruction",2013,"2013 IEEE 10th Consumer Communications and Networking Conference, CCNC 2013",17,"https://www.scopus.com/inward/record.uri?eid=2-s2.0-84875980958&doi=10.1109%2fCCNC.2013.6488423&partnerID=40&md5=a9edfdbf1c498443b4bd41b7082f6aa3","Three-dimensional (3D) models of environments are a promising technique for serious gaming and professional engineering applications. In this paper, we introduce a fast and memory-efficient system for the reconstruction of large-scale environments based on point clouds. Our main contribution is the emphasis on the data processing of large planes, for which two algorithms have been designed to improve the overall performance of the 3D reconstruction. First, a flatness-based segmentation algorithm is presented for plane detection in point clouds. Second, a quadtree-based algorithm is proposed for decimating the point cloud involved with the segmented plane and consequently improving the efficiency of triangulation. Our experimental results have shown that the proposed system and algorithms have a high efficiency in speed and memory for environment reconstruction. Depending on the amount of planes in the scene, the obtained efficiency gain varies between 20% and 50%. © 2013 IEEE.",Conference Paper,"Final",Scopus,2-s2.0-84875980958
"Stathopoulou E.-K., Remondino F.","SEMANTIC PHOTOGRAMMETRY - BOOSTING IMAGE-BASED 3D RECONSTRUCTION with SEMANTIC LABELING",2019,"ISPRS Annals of the Photogrammetry, Remote Sensing and Spatial Information Sciences",15,"https://www.scopus.com/inward/record.uri?eid=2-s2.0-85065434483&doi=10.5194%2fisprs-archives-XLII-2-W9-685-2019&partnerID=40&md5=ebefafc6f5a8bba9382e051a7d7cb66e","Automatic semantic segmentation of images is becoming a very prominent research field with many promising and reliable solutions already available. Labelled images as input for the photogrammetric pipeline have enormous potential to improve the 3D reconstruction results. To support this argument, in this work we discuss the contribution of image semantic labelling towards image-based 3D reconstruction in photogrammetry. We experiment semantic information in various steps starting from feature matching to dense 3D reconstruction. Labelling in 2D is considered as an easier task in terms of data availability and algorithm maturity. However, since semantic labelling of all the images involved in the reconstruction may be a costly, laborious and time consuming task, we propose to use a deep learning architecture to automatically generate semantically segmented images. To this end, we have trained a Convolutional Neural Network (CNN) on historic building façade images that will be further enriched in the future. The first results of this study are promising, with an improved performance on the quality of the 3D reconstruction and the possibility to transfer the labelling results from 2D to 3D. © Authors 2019.",Conference Paper,"Final",Scopus,2-s2.0-85065434483
"Bagnolo V., Argiolas R., Cuccu A.","HBIM for ARCHAEOLOGICAL SITES: From SFM BASED SURVEY to ALGORITHMIC MODELING",2019,"ISPRS Annals of the Photogrammetry, Remote Sensing and Spatial Information Sciences",15,"https://www.scopus.com/inward/record.uri?eid=2-s2.0-85065426792&doi=10.5194%2fisprs-archives-XLII-2-W9-57-2019&partnerID=40&md5=72e75bf1bcf95f3ef3637adf24d40f69","The implementation of new technologies often leads research towards experimentation with new methodological approaches. The BIM process applied in cultural heritage is increasingly consolidating its practices, expanding its potential even in the field of archaeological research. Integrating archaeological data into BIM models has clear benefits but, due to the complexity of the involved elements, archaeological case studies can fit effectively into the BIM process only with the creation of semantic-aware libraries implementing dedicated objects. Cultural heritage can advantage of BIM-based knowledge management only integrating approaches and tools with different characteristics from those commonly used in BIM workflows. In the phase of the geometric modeling process, following that of the survey process and preparatory to the subsequent information modeling process, when the detected geometries are not easily traceable to libraries of pre-compiled objects, an alternative to the so-called ""Scan to BIM"" local modeling can be represented by algorithmic modeling. The paper, focusing on the geometric modelling phase of the HBIM process, presents first results and prospective tasks of an ongoing research project on the last architectural phase of the colonnade of a multilayered temple in the Antas valley in Sardinia (Italy), affected by imposing works of anastylosis and restoration. © Authors 2019.",Conference Paper,"Final",Scopus,2-s2.0-85065426792
"Wu Z., Song S., Khosla A., Yu F., Zhang L., Tang X., Xiao J.","3D ShapeNets: A Deep Representation for Volumetric Shapes",2015,"3D ShapeNets: A Deep Representation for Volumetric Shapes",15,,[No abstract available],,"Final",Scopus,2-s2.0-85019915659
"Moyano J., Nieto-Julián J.E., Bienvenido-Huertas D., Marín-García D.","Validation of close-range photogrammetry for architectural and archaeological heritage: Analysis of point density and 3d mesh geometry",2020,"Remote Sensing",14,"https://www.scopus.com/inward/record.uri?eid=2-s2.0-85094885305&doi=10.3390%2frs12213571&partnerID=40&md5=016dd6d7df62fb3e0e9d62b69342721c","The 3D digitization and Building Information Modeling (BIM), which is based on parametric objects, have considerably advanced by developing massive data capture techniques. Thus, reverse engineering currently plays a major role as these technologies capture accurately and efficiently the geometry, color and textures of complex architectural, archaeological and cultural heritage. This paper aims to validate close-range Structure from Motion (SfM) for heritage by analyzing the point density and the 3D mesh geometry in comparison with Terrestrial Laser Scanning (TLS). The accuracy of the results and the geometry mainly depends on the processing performed on the point set. Therefore, these two variables are significant in the 3D reconstruction of heritage buildings. This paper focuses on a 15th century case study in Seville (Spain): the main façade of Casa de Pilatos. Ten SfM surveys were carried out varying the capture method (simple and stereoscopic) and the number of shots, distances, orientation and procedure. A mathematical analysis is proposed to verify the point spatial resolution and the accuracy of the 3D model geometry by section profiles in SfM data. SfM achieved acceptable accuracy levels to generate 3D meshes despite disordered shots and the number of images. Hence, stereoscopic photography using new instruments improved the results of close-range photogrammetry while reducing the required number of photographs. © 2020 by the authors. Licensee MDPI, Basel, Switzerland.",Article,"Final",Scopus,2-s2.0-85094885305
"Nishanbaev I.","A web repository for geo-located 3D digital cultural heritage models",2020,"Digital Applications in Archaeology and Cultural Heritage",13,"https://www.scopus.com/inward/record.uri?eid=2-s2.0-85081002756&doi=10.1016%2fj.daach.2020.e00139&partnerID=40&md5=abf3ee683081c0ecaccca95e083e6369","Recent advances in 3D surveying and web technologies have made a significant contribution to the digital conservation and dissemination of cultural heritage. 3D cultural heritage models are now a critical component in the cultural heritage conservation, which are also employed for other use cases in education, research, tourism, virtual and augmented reality. The World Wide Web is used as a primary medium for dissemination of 3D cultural heritage models, while databases including databases of web repositories for long-term archiving. This article aims to report a new methodology and a web repository to integrate maps, 3D models, and geospatial data such as geolocation. It can, therefore, be utilized for long-term archiving and visualization of geo-located 3D digital cultural heritage models on the Web. Unlike many previous related projects which developed the web repositories from the ground up, the web repository built using this methodology is based on free and open-source, easy-to-implement content management system namely KeystoneJS and other associated frameworks, which are reusable and completely extendable. It can, thereby, help cultural heritage organizations and cultural heritage professionals facilitate the rapid development of web repositories for geo-located 3D digital cultural heritage models, which can also be further extended per project requirements. While this methodology is presented for the cultural heritage domain in mind, in the long term it can be employed and extended for use in a wide range of domains such as archaeology, engineering, and geographic information systems (GIS) among others. © 2020 Elsevier Ltd",Article,"Final",Scopus,2-s2.0-85081002756
