Authors,Title,Year,Source title,Cited by,Link,Abstract,Document Type,Publication Stage,Source,EID
"Sithole G., Vosselman G.","Experimental comparison of filter algorithms for bare-Earth extraction from airborne laser scanning point clouds",2004,"ISPRS Journal of Photogrammetry and Remote Sensing",795,"https://www.scopus.com/inward/record.uri?eid=2-s2.0-3342949547&doi=10.1016%2fj.isprsjprs.2004.05.004&partnerID=40&md5=fca690b01bd7e68aa2705eacc7b56483","Over the past years, several filters have been developed to extract bare-Earth points from point clouds. ISPRS Working Group III/3 conducted a test to determine the performance of these filters and the influence of point density thereon, and to identify directions for future research. Twelve selected datasets have been processed by eight participants. In this paper, the test results are presented. The paper describes the characteristics of the provided datasets and the used filter approaches. The filter performance is analysed both qualitatively and quantitatively. All filters perform well in smooth rural landscapes, but all produce errors in complex urban areas and rough terrain with vegetation. In general, filters that estimate local surfaces are found to perform best. The influence of point density could not well be determined in this experiment. Future research should be directed towards the usage of additional data sources, segment-based classification, and self-diagnosis of filter algorithms. © 2004 Elsevier B.V. All rights reserved.",Article,"Final",Scopus,2-s2.0-3342949547
"Baltsavias E.P.","Airborne laser scanning: Basic relations and formulas",1999,"ISPRS Journal of Photogrammetry and Remote Sensing",655,"https://www.scopus.com/inward/record.uri?eid=2-s2.0-0032803298&doi=10.1016%2fS0924-2716%2899%2900015-5&partnerID=40&md5=58a5655098a95db1c740c4dfdade9de8","An overview of basic relations and formulas concerning airborne laser scanning is given. They are divided into two main parts, the first treating lasers and laser ranging, and the second one referring to airborne laser scanning. A separate discussion is devoted to the accuracy of 3D positioning and the factors influencing it. Examples are given for most relations, using typical values for ALS and assuming an airplane platform. The relations refer mostly to pulse lasers, but CW lasers are also treated. Different scan patterns, especially parallel lines, are treated. Due to the complexity of the relations, some formulas represent approximations or are based on assumptions like constant flying speed, vertical scan, etc.An overview of basic relations and formulas concerning airborne laser scanning is given. They are divided into two main parts, the first treating lasers and laser ranging, and the second one referring to airborne laser scanning. A separate discussion is devoted to the accuracy of 3D positioning and the factors influencing it. Examples are given for most relations, using typical values for ALS and assuming an airplane platform. The relations refer mostly to pulse lasers, but CW lasers are also treated. Different scan patterns, especially parallel lines, are treated. Due to the complexity of the relations, some formulas represent approximations or are based on assumptions like constant flying speed, vertical scan, etc.",Article,"Final",Scopus,2-s2.0-0032803298
"Biljecki F., Stoter J., Ledoux H., Zlatanova S., Çöltekin A.","Applications of 3D city models: State of the art review",2015,"ISPRS International Journal of Geo-Information",383,"https://www.scopus.com/inward/record.uri?eid=2-s2.0-84952802912&doi=10.3390%2fijgi4042842&partnerID=40&md5=b9b4afccbfc45c8e03e536c5172184fe","In the last decades, 3D city models appear to have been predominantly used for visualisation; however, today they are being increasingly employed in a number of domains and for a large range of tasks beyond visualisation. In this paper, we seek to understand and document the state of the art regarding the utilisation of 3D city models across multiple domains based on a comprehensive literature study including hundreds of research papers, technical reports and online resources. A challenge in a study such as ours is that the ways in which 3D city models are used cannot be readily listed due to fuzziness, terminological ambiguity, unclear added-value of 3D geoinformation in some instances, and absence of technical information. To address this challenge, we delineate a hierarchical terminology (spatial operations, use cases, applications), and develop a theoretical reasoning to segment and categorise the diverse uses of 3D city models. Following this framework, we provide a list of identified use cases of 3D city models (with a description of each), and their applications. Our study demonstrates that 3D city models are employed in at least 29 use cases that are a part of more than 100 applications. The classified inventory could be useful for scientists as well as stakeholders in the geospatial industry, such as companies and national mapping agencies, as it may serve as a reference document to better position their operations, design product portfolios, and to better understand the market. © 2015 by the authors; licensee MDPI, Basel, Switzerland.",Review,"Final",Scopus,2-s2.0-84952802912
"Rottensteiner F., Sohn G., Gerke M., Wegner J.D., Breitkopf U., Jung J.","Results of the ISPRS benchmark on urban object detection and 3D building reconstruction",2014,"ISPRS Journal of Photogrammetry and Remote Sensing",246,"https://www.scopus.com/inward/record.uri?eid=2-s2.0-84902353397&doi=10.1016%2fj.isprsjprs.2013.10.004&partnerID=40&md5=ceb34378eb72ca9f6047710c0db4850d","For more than two decades, many efforts have been made to develop methods for extracting urban objects from data acquired by airborne sensors. In order to make the results of such algorithms more comparable, benchmarking data sets are of paramount importance. Such a data set, consisting of airborne image and laserscanner data, has been made available to the scientific community by ISPRS WGIII/4. Researchers were encouraged to submit their results of urban object detection and 3D building reconstruction, which were evaluated based on reference data. This paper presents the outcomes of the evaluation for building detection, tree detection, and 3D building reconstruction. The results achieved by different methods are compared and analysed to identify promising strategies for automatic urban object extraction from current airborne sensor data, but also common problems of state-of-the-art methods. © 2013 International Society for Photogrammetry and Remote Sensing, Inc. (ISPRS).",Article,"Final",Scopus,2-s2.0-84902353397
"Biljecki F., Ledoux H., Stoter J.","An improved LOD specification for 3D building models",2016,"Computers, Environment and Urban Systems",169,"https://www.scopus.com/inward/record.uri?eid=2-s2.0-84977489262&doi=10.1016%2fj.compenvurbsys.2016.04.005&partnerID=40&md5=4b5ec89bba6a64c04fb46cd8efb237ba","The level of detail (LOD) concept of the OGC standard CityGML 2.0 is intended to differentiate multi-scale representations of semantic 3D city models. The concept is in practice principally used to indicate the geometric detail of a model, primarily of buildings. Despite the popularity and the general acceptance of this categorisation, we argue in this paper that from a geometric point of view the five LODs are insufficient and that their specification is ambiguous.We solve these shortcomings with a better definition of LODs and their refinement. Hereby we present a refined set of 16 LODs focused on the grade of the exterior geometry of buildings, which provide a stricter specification and allow less modelling freedom. This series is a result of an exhaustive research into currently available 3D city models, production workflows, and capabilities of acquisition techniques. Our specification also includes two hybrid models that reflect common acquisition practices. The new LODs are in line with the LODs of CityGML 2.0, and are intended to supplement, rather than replace the geometric part of the current specification. While in our paper we focus on the geometric aspect of the models, our specification is compatible with different levels of semantic granularity. Furthermore, the improved LODs can be considered format-agnostic.Among other benefits, the refined specification could be useful for companies for a better definition of their product portfolios, and for researchers to specify data requirements when presenting use cases of 3D city models. We support our refined LODs with experiments, proving their uniqueness by showing that each yields a different result in a 3D spatial operation. © 2016 Elsevier Ltd.",Article,"Final",Scopus,2-s2.0-84977489262
"Batty M.","Digital twins",2018,"Environment and Planning B: Urban Analytics and City Science",74,"https://www.scopus.com/inward/record.uri?eid=2-s2.0-85053693787&doi=10.1177%2f2399808318796416&partnerID=40&md5=1d2448ab458987cae8f12df070cb063a",[No abstract available],Editorial,"Final",Scopus,2-s2.0-85053693787
"Kutzner T., Chaturvedi K., Kolbe T.H.","CityGML 3.0: New Functions Open Up New Applications",2020,"PFG - Journal of Photogrammetry, Remote Sensing and Geoinformation Science",53,"https://www.scopus.com/inward/record.uri?eid=2-s2.0-85081034645&doi=10.1007%2fs41064-020-00095-z&partnerID=40&md5=b7accafdd98769a6474b5df95503c947","The development of the next major version 3.0 of the international OGC standard CityGML is nearing its end. CityGML 3.0 will come up with a variety of new features and revisions of existing modules that will increase the usability of CityGML for more user groups and areas of application. This includes a new space concept, a revised level-of-detail (LOD) concept, the representation of time-dependent properties, the possibility to manage multiple versions of cities, the representation of city objects by point clouds, an improved modelling of constructions, the representation of building units and storeys, an improved representation of traffic infrastructure as well as a clear separation of the conceptual model and the data encodings that allow for providing further encoding specifications besides GML. This paper gives an overview of these new and revised concepts, and illustrates their application through selected use cases. © 2020, The Author(s).",Article,"Final",Scopus,2-s2.0-85081034645
"Boshernitsan M., Downes M.","Visual programming languages: A survey",2004,"Visual Programming Languages: A Survey",53,,[No abstract available],,"Final",Scopus,2-s2.0-23844476673
"Ruohomaki T., Airaksinen E., Huuska P., Kesaniemi O., Martikka M., Suomisto J.","Smart City Platform Enabling Digital Twin",2018,"9th International Conference on Intelligent Systems 2018: Theory, Research and Innovation in Applications, IS 2018 - Proceedings",35,"https://www.scopus.com/inward/record.uri?eid=2-s2.0-85065998561&doi=10.1109%2fIS.2018.8710517&partnerID=40&md5=61cf8efd0102bedf56b1c98edab5b811","Visual 3D models are being deployed in smart cities around the world. While earlier the motivation was mostly to visualize the buildings, the latest developments will turn the 3D models into a rich source of information related to the urban landscape and built environment. The models can be used to compare the energy consumption between similar buildings or to display the potential solar panels had if mounted on certain district. The models have soon become elemental in not only managing a smart city but also as a platform for co-design and development together with the citizens. © 2018 IEEE.",Conference Paper,"Final",Scopus,2-s2.0-85065998561
"Billen R.","3d city models and urban information: Current issues and perspectives",2014,"3D City Models and Urban Information: Current Issues and Perspectives",33,,[No abstract available],,"Final",Scopus,2-s2.0-85008902475
"Nex F., Rupnik E., Remondino F.","Building Footprints Extraction from Oblique Imagery",2013,"ISPRS Annals of the Photogrammetry, Remote Sensing and Spatial Information Sciences",23,"https://www.scopus.com/inward/record.uri?eid=2-s2.0-85047394586&doi=10.5194%2fisprsannals-II-3-W3-61-2013&partnerID=40&md5=efc9326b73656cdd4fa2ea8f008dca73","Nowadays, multi-camera aerial platforms combining nadir and oblique cameras are experiencing a revival and several companies have proposed new image acquisition systems. Due to their various advantages, oblique imagery have found their place in numerous companies and civil applications. However, the automatic processing of such image blocks still remains a topic of research. Camera configuration indeed poses a challenge on the traditional photogrammetric pipeline used in commercial software but, on the other hand, gives the opportunity to exploit the additional information provided by the oblique views and allows a more reliable feature extraction. In particular, the information that can be provided in correspondence of building façades can open new possibilities for the building detection and footprint extraction. In this paper, a methodology for the automated extraction of building footprints from oblique imagery is presented. The extraction is performed using dense point clouds generated using an image matching algorithm. The developed methodology and the achieved results are described in detail showing the advantages and opportunities offered by oblique aerial systems for cartographic and mapping purposes.",Conference Paper,"Final",Scopus,2-s2.0-85047394586
"Bauer P., Stevens B., Hazeleger W.","A digital twin of Earth for the green transition",2021,"Nature Climate Change",21,"https://www.scopus.com/inward/record.uri?eid=2-s2.0-85100316126&doi=10.1038%2fs41558-021-00986-y&partnerID=40&md5=66535a913d3e15cc1e247e9bf8f6c6aa",[No abstract available],Note,"Final",Scopus,2-s2.0-85100316126
"Noardo F., Harrie L., Ohori K.A., Biljecki F., Ellul C., Krijnen T., Eriksson H., Guler D., Hintz D., Jadidi M.A., Pla M., Sanchez S., Soini V.-P., Stouffs R., Tekavec J., Stoter J.","Tools for BIM-GIS integration (IFC georeferencing and conversions): Results from the GeoBIM benchmark 2019",2020,"ISPRS International Journal of Geo-Information",20,"https://www.scopus.com/inward/record.uri?eid=2-s2.0-85090583725&doi=10.3390%2fijgi9090502&partnerID=40&md5=d3d81a35f9eb0957c59bed551fe429d8","The integration of 3D city models with Building Information Models (BIM), coined as GeoBIM, facilitates improved data support to several applications, e.g., 3D map updates, building permits issuing, detailed city analysis, infrastructure design, context-based building design, to name a few. To solve the integration, several issues need to be tackled and solved, i.e., harmonization of features, interoperability, format conversions, integration of procedures. The GeoBIM benchmark 2019, funded by ISPRS and EuroSDR, evaluated the state of implementation of tools addressing some of those issues. In particular, in the part of the benchmark described in this paper, the application of georeferencing to Industry Foundation Classes (IFC) models and making consistent conversions between 3D city models and BIM are investigated, considering the OGC CityGML and buildingSMART IFC as reference standards. In the benchmark, sample datasets in the two reference standards were provided. External volunteers were asked to describe and test georeferencing procedures for IFC models and conversion tools between CityGML and IFC. From the analysis of the delivered answers and processed datasets, it was possible to notice that while there are tools and procedures available to support georeferencing and data conversion, comprehensive definition of the requirements, clear rules to perform such two tasks, as well as solid technological solutions implementing them, are still lacking in functionalities. Those specific issues can be a sensible starting point for planning the next GeoBIM integration agendas. © 2020 by the authors. Licensee MDPI, Basel, Switzerland.",Article,"Final",Scopus,2-s2.0-85090583725
"Tang L., Li L., Ying S., Lei Y.","A full level-of-detail specification for 3D building models combining indoor and outdoor scenes",2018,"ISPRS International Journal of Geo-Information",20,"https://www.scopus.com/inward/record.uri?eid=2-s2.0-85058051228&doi=10.3390%2fijgi7110419&partnerID=40&md5=6b27b33109b23cc4b28a7e76848134fc","The level of detail (LoD) concept in CityGML (City Geography Markup Language), which indicates how closely the model mirrors its real-world counterpart, has been accepted and applied widely in various applications, including the 3D modeling of buildings. However, with an increasing number of human activities occurring in the indoor environment, the standardized LoD definition appears to be insufficient because of its narrow classifications for interior features, which can be presented only in LoD4. In view of this drawback, an extended indoor LoD (ILoD) specification is proposed, particularly for indoor spaces, allowing the existing LoD to become a more precise outdoor LoD (OLoD) by exploiting the advantages of two other international standards: Industry foundation classes (IFC) and IndoorGML. In this paper, the interior space is divided into distinct systems of three semantic aspects (structure, connectivity, and volume); the approach can be considered the guiding ideology to define the detailed indoor levels following a concrete theoretical realization based on extending the UML diagram of CityGML’s building model. Moreover, a continuous and seamless full LoD (FLoD) set obtained by combining various OLoDs and ILoDs is subsequently listed to realize the full specification for 3D building models. Furthermore, to demonstrate the proposed specification and prove the applicability of the building model at different LoDs, a practical experiment is conducted. © 2018 by the authors.",Article,"Final",Scopus,2-s2.0-85058051228
"Lehner H., Dorffner L.","Digital geoTwin Vienna: Towards a Digital Twin City as Geodata Hub",2020,"PFG - Journal of Photogrammetry, Remote Sensing and Geoinformation Science",15,,[No abstract available],,"Final",Scopus,2-s2.0-85088919204
"Konde A., Tauscher H., Biljecki F., Crawford J.","Floor plans in citygml",2018,"ISPRS Annals of the Photogrammetry, Remote Sensing and Spatial Information Sciences",15,"https://www.scopus.com/inward/record.uri?eid=2-s2.0-85053269508&doi=10.5194%2fisprs-annals-IV-4-W6-25-2018&partnerID=40&md5=b35930230e9538bbaf8db7b6f5b833e6","This paper (1) discusses the modelling of floor plans in CityGML; (2) proposes a delineation of multiple variants of indoor LoD0 in line with the current proposal for CityGML 3.0; (3) demonstrates a method to generate CityGML datasets with included floor plans; and (4) explores their usability. The use of an Application Domain Extension (ADE) is being proposed in order to preserve potentially useful information found within detailed building information models (BIM), specifically Industry Foundation Class (IFC), that cannot be stored in CityGML natively. Our work follows the current developments of CityGML 3.0, and based on the discussions in the CityGML Standards Working Group (SWG) it showcases one of the first datasets consistent with the ongoing development of CityGML 3.0 and one that follows the proposals for a new LOD concept and new interior features. © 2018 Copernicus. All rights reserved.",Conference Paper,"Final",Scopus,2-s2.0-85053269508
"Shahat E., Hyun C.T., Yeom C.","City digital twin potentials: A review and research agenda",2021,"Sustainability (Switzerland)",14,"https://www.scopus.com/inward/record.uri?eid=2-s2.0-85103506867&doi=10.3390%2fsu13063386&partnerID=40&md5=9e056401c425eb66d7149238c02a067f","The city digital twin is anticipated to accurately reflect and affect the city’s functions and processes to enhance its realization, operability, and management. Although research on the city digital twin is still in its infancy, the advancement of the digital twin technology is growing fast and providing viable contributions to augmenting smart city developments. This study reviews the literature to identify the current and prospective potentials and challenges of digital twin cities. A research agenda is also proposed to guide future research on the city digital twincity digital twin to reach the utmost level of a comprehensive and complete city digital twin. Enhancing the efficiency of data processing, promoting the inclusion of socio‐economic components of the city, and developing mutual integration between the two counterparts of the digital twin are proposed to be the future research directions to achieve and utilize a completely mirrored city digital twin. © 2021 by the authors. Licensee MDPI, Basel, Switzerland.",Review,"Final",Scopus,2-s2.0-85103506867
"Jayaraj P., Ramiya A.M.","3D CityGML building modelling from lidar point cloud data",2018,"International Archives of the Photogrammetry, Remote Sensing and Spatial Information Sciences - ISPRS Archives",10,"https://www.scopus.com/inward/record.uri?eid=2-s2.0-85057600335&doi=10.5194%2fisprs-archives-XLII-5-175-2018&partnerID=40&md5=8fe9d68e341bbd58f7cbd095bb04c998","With recent government initiatives for smart cities, 3D virtual city models are in demand for managing and monitoring the urban infrastructure. 3D building models forms an important component of 3D virtual city model. LiDAR remote sensing has revolutionized the way the third dimension can be precisely mapped and proved to be an important source of data for 3D models. The model thus generated should be in an open data format to be used across various applications. CityGML is an open data model framework that enables storage and exchange of 3D models which can be used for diversified applications. The main objective of this research is to develop a methodological workflow to create 3D building models in CityGML standard from airborne LiDAR point cloud. Initially building points were isolated from the airborne LiDAR data using point cloud processing algorithms. 3D building models with levels of detail (LoD1 and LoD2) were generated from the building points in CityGML standard using commercial (ArcGISPro) well as open source packages (3dfier, Citygml4j). Results prove that the models developed using open source packages are comparable to that provided by commercial packages. © Authors 2018.CC BY 4.0 License.",Conference Paper,"Final",Scopus,2-s2.0-85057600335
"Barzegar M., Rajabifard A., Kalantari M., Atazadeh B.","An IFC-based database schema for mapping BIM data into a 3D spatially enabled land administration database",2021,"International Journal of Digital Earth",6,"https://www.scopus.com/inward/record.uri?eid=2-s2.0-85099556378&doi=10.1080%2f17538947.2021.1875062&partnerID=40&md5=707b8150fb08bd403f003668d3c37e51","There are different processes in 3D urban land administration in which spatial analysis plays an underpinning role. Among 3D data models, Industry Foundation Class (IFC) provides the potential capabilities for modelling legal and physical dimensions of urban properties. However, performing spatial analysis using IFC files cannot address the on-demand spatial analysis requirements of 3D urban land administration. In response to this limitation, 3D data needs to be stored in a spatial database to enable spatial analyses required by different stakeholders. Therefore, in this paper, by considering spatial analysis requirements in 3D-enabled urban land administration, an IFC-based database schema is designed. Moreover, a methodology for transforming Building Information Modelling (BIM) data into the proposed schema is provided. This methodology includes seven steps: designing the architectural model and adding legal data, georeferencing, IFC data validation and cleaning, mapping process, database data validation and cleaning, spatial analysis, and visualisation. To demonstrate the feasibility of the proposed database, three datasets are implemented in the database. Moreover, a new method for modelling legal spaces with oblique structures and two applications of spatial analysis in 3D urban land administration are provided. © 2021 Informa UK Limited, trading as Taylor & Francis Group.",Article,"Final",Scopus,2-s2.0-85099556378
"Pfeifer N., Team I.P.F.","DSM / DTM Filtering",2008,"International School on Lidar Technology 2008 IIT Kanpur",3,,[No abstract available],,"Final",Scopus,2-s2.0-85089091082
