Authors,Title,Year,Source title,Cited by,Link,Abstract,Document Type,Publication Stage,Source,EID
"Eriksson H., Harrie L.","Versioning of 3D city models for municipality applications: Needs, obstacles and recommendations",2021,"ISPRS International Journal of Geo-Information",2,"https://www.scopus.com/inward/record.uri?eid=2-s2.0-85106524573&doi=10.3390%2fijgi10020055&partnerID=40&md5=c941931a407e62e6d1f76958ffabff5a","The use of 3D city models is changing from visualization to complex use cases where they act as 3D base maps. This requires links to registers and continuous updating of the city models. Still, most models never change or are recreated instead of updated. This study identifies obstacles to version management of 3D city models and proposes recommendations to overcome them, with a main focus on the municipality perspective, foremost in the planning and building processes. As part of this study, we investigate whether national building registers can control the version management of 3D city models. A case study based on investigations of standards, interviews and a review of tools is presented. The study uses an architectural model divided into four layers: data collection, building theme, city model and application. All layers require changes when implementing a new versioning method: the data collection layer requires restructuring of technical solutions and work processes, storage of the national building register requires restructuring, versioning capabilities must be propagated to the city model layer, and tools at the application layer must handle temporal information better. Strong incentives for including versioning in 3D city models are essential, as substantial investment is required to implement versioning in all the layers. Only capabilities required by applications should be implemented, as the complexity grows with the number of versioning functionalities. One outcome of the study is a recommendation to link 3D city models more closely to building registers. This enables more complex use in, e.g., building permits and 3D cadastres, and authorities can fetch required (versioning) information directly from the city model layer. © 2021 by the authors.",Article,"Final",Scopus,2-s2.0-85106524573
"Hagba D.V., Gura D.A., Pyatashova O.V., Pshidatok S.K., Pavlyukova A.P.","Improving the Technology for Implementing a 3D Cadastre in Existing Accounting Information Systems",2021,"IOP Conference Series: Earth and Environmental Science",1,"https://www.scopus.com/inward/record.uri?eid=2-s2.0-85104826647&doi=10.1088%2f1755-1315%2f720%2f1%2f012030&partnerID=40&md5=7c32de9c15f1169ac59b9b59f3df97dc","In the Russian Federation, the issue of improving the cadastral system is currently more relevant than ever. This is determined by the complication of the procedure for designing and building the cadastral real estate objects. Modern architecture is becoming more complex and diverse year-by-year. The configuration of the construction facilities is becoming more increasingly complex, and these days, they can be built not only on the ground surface but also above or under the ground. In practice, such design solutions lead to uncertainty and ambiguity of their routine cadastral registration, and these objects are registered according to their two-dimensional projection on the ground. Currently, almost all design agencies use 3D simulation in solving issues related to the design, construction, and sale of both industrial or agricultural facilities and residential or office buildings and apartments. Leading Krasnodar enterprises engaged in the design of various real estate objects use three-dimensional models in providing customers with the complete scope of work. The paper authors reveal the basic concepts of a three-dimensional cadastre in a modern system of engineering, design, construction, and architecture. The prerequisites for switching to the 3D cadastre have been considered, the cadastral registration aspects specified, and the issues concerning three-dimensional representation and processing 3D real estate data discussed. The main 3D data representation models are listed. © Published under licence by IOP Publishing Ltd.",Conference Paper,"Final",Scopus,2-s2.0-85104826647
[No author name available],[No title available],2019,,1,,[No abstract available],,"Final",Scopus,2-s2.0-85117809232
"Salamak M., Jasiski M., Paszczyk T., Larski M., Jasinski M., Plaszczyk T., Zarski M.","Analytical Modelling in Dynamo",2018,"Civil Engineering Series",1,,[No abstract available],,"Final",Scopus,2-s2.0-85117858047
"Lisec A., Ferlan M., Tekavec J.","3D Modelling of a Cadastral Treasure: Towards a 3D Cadastre in Slovenia",2017,"GIM International",1,"https://www.scopus.com/inward/record.uri?eid=2-s2.0-85017442665&partnerID=40&md5=43b555b5de5c738e1e6b213d9fc3ca37","There has been a significant global trend towards 3D real property cadastres over a period of time. Besides the legal framework, the modeling and graphical representation of 3D real property units have gained an important place on the research and development agenda. A Slovenian case is used to illustrate what a ‘data treasure’ is, and the cadastral and other spatial data within the national spatial data infrastructure is used for generation of 3D real property graphical models within a 3D cadastre.",Article,"Final",Scopus,2-s2.0-85017442665
"Altun M., Akcamete-Gungor A.","BIM-based Multi-Objective Building Life Cycle Energy Performance Evaluation Using Particle Swarm Optimization",2015,"Proc. of the 32nd CIB W78 Conference 2015",1,,[No abstract available],,"Final",Scopus,2-s2.0-85117823421
