Authors,Title,Year,Source title,Cited by,Link,Abstract,Document Type,Publication Stage,Source,EID
"West T.D., Blackburn M.","Is Digital Thread/Digital Twin Affordable? A Systemic Assessment of the Cost of DoD's Latest Manhattan Project",2017,"Procedia Computer Science",40,"https://www.scopus.com/inward/record.uri?eid=2-s2.0-85040008235&doi=10.1016%2fj.procs.2017.09.003&partnerID=40&md5=8deea5e4f1c48469c9897bbf23264c4a","This paper analyzes challenges the U.S. Air Force will inevitably face as it implements Digital Thread/Digital Twin, a model-centric approach to weapon system development, to include developing the needed computational capability, software tools, and workforce to leverage that capability. A Cost Constructive Model (COCOMO) II based analysis is performed to roughly estimate the scope, cost, and time required to develop robust Digital Thread/Digital Twin models for the Next Generation Air Dominance (NGAD) aircraft. The authors determine that such a thoroughly unprecedented model development effort will require a national commitment on par with the Manhattan Project, which yielded the first atomic bomb.",Conference Paper,"Final",Scopus,2-s2.0-85040008235
"Sepasgozar S.M.E.","Digital twin and web-based virtual gaming technologies for online education: A case of construction management and engineering",2020,"Applied Sciences (Switzerland)",39,"https://www.scopus.com/inward/record.uri?eid=2-s2.0-85087914094&doi=10.3390%2fapp10134678&partnerID=40&md5=1e21c318dbba588644855a8466362308","Mixed reality is advancing exponentially in some innovative industries, includingmanufacturing and aerospace. However, advanced applications of these technologies in architecture, engineering, and construction (AEC) businesses remain nascent. While it is in demand, the use of these technologies in developing the AEC digital pedagogy and for improving professional competence have received little attention. This paper presents a set of five novel digital technologies utilising virtual and augmented reality and digital twin, which adds value to the literature by showing their usefulness in the delivery of construction courses. The project involved designing, developing, and implementing a construction augmented reality (AR), including Piling AR (PAR) and a virtual tunnel boring machine (VTBM) module. The PAR is a smartphone module that presents different elements of a building structure, the footing system, and required equipment for footing construction. VTBM is developed as a multiplayer and avatar-included module for experiencing mechanisms of a tunnel boring machine. The novelty of this project is that it developed innovative immersive construction modules, practices of implementing digital pedagogy, and presenting the capacity of virtual technologies for education. This paper is also highly valuable to educators since it shows how a set of simple to complex technologies can be used for teaching various courses from a distance, either in emergencies such as corona virus disease (COVID-19) or as a part of regular teaching. This paper is a step forward to designing future practices full of virtual education appropriate to the new generation of digitally savvy students. © 2020 by the author.",Article,"Final",Scopus,2-s2.0-85087914094
"Lu Q., Parlikad A.K., Woodall P., Don Ranasinghe G., Xie X., Liang Z., Konstantinou E., Heaton J., Schooling J.","Developing a Digital Twin at Building and City Levels: Case Study of West Cambridge Campus",2020,"Journal of Management in Engineering",39,"https://www.scopus.com/inward/record.uri?eid=2-s2.0-85081580153&doi=10.1061%2f%28ASCE%29ME.1943-5479.0000763&partnerID=40&md5=80fae89f7ab8ce83fa81ca1fb8ba1ed8","A digital twin (DT) refers to a digital replica of physical assets, processes, and systems. DTs integrate artificial intelligence, machine learning, and data analytics to create living digital simulation models that are able to learn and update from multiple sources as well as represent and predict the current and future conditions of physical counterparts. However, current activities related to DTs are still at an early stage with respect to buildings and other infrastructure assets from an architectural and engineering/construction point of view. Less attention has been paid to the operation and maintenance (O&M) phase, which is the longest time span in the asset life cycle. A systematic and clear architecture verified with practical use cases for constructing a DT would be the foremost step for effective operation and maintenance of buildings and cities. According to current research about multitier architectures, this paper presents a system architecture for DTs that is specifically designed at both the building and city levels. Based on this architecture, a DT demonstrator of the West Cambridge site of the University of Cambridge in the UK was developed that integrates heterogeneous data sources, supports effective data querying and analysis, supports decision-making processes in O&M management, and further bridges the gap between human relationships with buildings/cities. This paper aims at going through the whole process of developing DTs in building and city levels from the technical perspective and sharing lessons learned and challenges involved in developing DTs in real practices. Through developing this DT demonstrator, the results provide a clear roadmap and present particular DT research efforts for asset management practitioners, policymakers, and researchers to promote the implementation and development of DT at the building and city levels. © 2020 American Society of Civil Engineers.",Article,"Final",Scopus,2-s2.0-85081580153
"Shim C.-S., Dang N.-S., Lon S., Jeon C.-H.","Development of a bridge maintenance system for prestressed concrete bridges using 3D digital twin model",2019,"Structure and Infrastructure Engineering",39,"https://www.scopus.com/inward/record.uri?eid=2-s2.0-85066812168&doi=10.1080%2f15732479.2019.1620789&partnerID=40&md5=9ba1b50226ea35f615b5482a8a41562b","Preventive maintenance is increasingly becoming an essential strategy in the bridge industry owing to its proactive advantage of maintaining the structural sustainability during its entire service life. Several in-use bridges lack an appropriate regular maintenance solution, leading to extra cost during the operation stage. This paper proposes a new generation of the bridge maintenance system by using a digital twin model concept for more reliable decision-making. A detailed solution is proposed in this work to enhance the bridge maintenance process using a parallel solution: a maintenance information management system based on a 3D information model in conjunction with a digital inspection system using image processing. Three-dimensional digital models are required to utilise information from the entire lifecycle of a project, including design and construction, operation, and maintenance, by continuously exchanging and updating data from each stakeholder. For the maintenance of prestressed concrete bridges, the twin models are defined and their uses are presented. © 2019, © 2019 Informa UK Limited, trading as Taylor & Francis Group.",Article,"Final",Scopus,2-s2.0-85066812168
"Kaewunruen S., Xu N.","Digital twin for sustainability evaluation of railway station buildings",2018,"Frontiers in Built Environment",39,"https://www.scopus.com/inward/record.uri?eid=2-s2.0-85064666442&doi=10.3389%2ffbuil.2018.00077&partnerID=40&md5=eb22e9eb8d23f5712d83d12cca64ef6e","The railway station is a primary asset of public transport systems and plays a crucial role in urban modernization. Most existing railway stations in the UK is historic and have been operated for many years. Maintenance and reconstruction are common concerns in the public railway industry, and clusters of information pertaining to this maintenance must be managed appropriately for effective outcome. Digital twin or BIM (Building information modeling) is a term frequently employed in the construction industry nowadays, because of its ability to provide wider and faster access to comprehensible and integrated information. A digital twin or a BIM is not only a tool, but also a process that can help to make changes in construction industry, which has remained unchanged for hundreds of years. This paper discusses a specific BIM application within the context of railway station buildings using a Revit-based simulation of construction work for King's Cross station in London. The paper highlights the adoption and transformation of 3D model of the King's Cross station building into a 6D building information model. The 6D model contains a time and cost schedule with carbon emissions calculation, and renovation assumptions using Revit. The outcome of this study can provide construction participants with reasonable guidance of BIM adoption on railway station projects that can be used for planning, designing, and operating an economic and environmental efficient construction project. © 2018 Kaewunruen and Xu.",Article,"Final",Scopus,2-s2.0-85064666442
"Lu Q., Xie X., Parlikad A.K., Schooling J.M.","Digital twin-enabled anomaly detection for built asset monitoring in operation and maintenance",2020,"Automation in Construction",38,"https://www.scopus.com/inward/record.uri?eid=2-s2.0-85085247924&doi=10.1016%2fj.autcon.2020.103277&partnerID=40&md5=1f0230cdbd9e34660593d42dc02c0c7d","Effective asset management plays a significant role in delivering the functionality and serviceability of buildings. However, there is a lack of efficient strategies and comprehensive approaches for managing assets and their associated data that can help to monitor, detect, record, and communicate operation and maintenance (O&M) issues. With the importance of Digital Twin (DT) concepts being proven in the architecture, engineering, construction and facility management (AEC/FM) sectors, a DT-enabled anomaly detection system for asset monitoring and its data integration method based on extended industry foundation classes (IFC) in daily O&M management are provided in this study. This paper presents a novel IFC-based data structure, using which a set of monitoring data that carries diagnostic information on the operational condition of assets is extracted from building DTs. Considering that assets run under changing loads determined by human demands, a Bayesian change point detection methodology that handles the contextual features of operational data is adopted to identify and filter contextual anomalies through cross-referencing with external operation information. Using the centrifugal pumps in the heating, ventilation and air-cooling (HVAC) system as a case study, the results indicate and prove that the novel DT-based anomaly detection process flow realizes a continuous anomaly detection of pumps, which contributes to efficient and automated asset monitoring in O&M. © 2020 Elsevier B.V.",Article,"Final",Scopus,2-s2.0-85085247924
"Love P.E.D., Matthews J.","The ‘how’ of benefits management for digital technology: From engineering to asset management",2019,"Automation in Construction",38,"https://www.scopus.com/inward/record.uri?eid=2-s2.0-85070680411&doi=10.1016%2fj.autcon.2019.102930&partnerID=40&md5=d975366979f6b09d8e44a5ca2ad7c603","With advances being made in digital technologies, asset owners are requiring at hand-over a digital twin of their constructed facility that can be used in real-time to support operations and maintenance processes. While there has been considerable focus on ‘why’ organizations operating in the construction industry need to adopt digital technologies to enable Building Information Modelling, Internet of Things and Industry 4.0 and thus deliver assets more effectively and efficiently, there has been limited attention given to ‘how’ they can realize their expected benefits and simultaneously generate value. In light of the drive for organizations to engage with digital technology we bring to the fore in this paper the need for them to legitimize a process of benefits management prior to making a financial investment to understand ‘how’ digital technologies can coalesce to generate business value and improve their competitiveness. As part of a benefits management strategy, a business dependency network (BDN) can enable investment objectives and their resulting benefits to be linked in a structured manner with an organization's capabilities and changes required to ensure they are realized. Relying on empirical findings derived from nine projects that examined the efficiency gains and advantages of using a digital systems information model from an engineering to asset management perspective, we construct a generic BDN to visualize the structure of multiple cause-effect relationships that are used to organise the capabilities, changes and benefits that need to be considered prior to adoption. The insights and experiences that have emerged from this research provide a frame of reference for construction organizations and asset owners to navigate the benefits realization and change management process, which can be used to ensure their investments in digital technology can effectively respond to business drivers and generate value. © 2019 Elsevier B.V.",Article,"Final",Scopus,2-s2.0-85070680411
"Negri E., Fumagalli L., Cimino C., MacChi M.","FMU-supported simulation for CPS digital twin",2019,"Procedia Manufacturing",35,"https://www.scopus.com/inward/record.uri?eid=2-s2.0-85070631431&doi=10.1016%2fj.promfg.2018.12.033&partnerID=40&md5=ae6271c89f476a40c151ee949b44f831","Manufacturing companies are experiencing the fourth industrial revolution characterised by the introduction of new technologies into production equipment, such as the Cyber Physical Systems and the Digital Twin simulations. Companies are then challenged by the digitization of products and production systems information, which leads to new potentials for digital continuity - i.e. information available and continuously updated for the decision makers - along the lifecycles. A semantic data model, that structures and stores physical and operational data from the field, can support the digital continuity to be used in production system simulations in a Digital Twin paradigm. This work proposes to model specific aspects and behaviours of the production system separately from the core simulation, in order to flexibly decide whether to activate the replica of the specific behaviours only when needed. The modules interact with the main simulation run through standard interfaces, allowing an easy reusability of the single modules also in different simulation environments. © 2019 The Authors.",Conference Paper,"Final",Scopus,2-s2.0-85070631431
"Sacks R., Brilakis I., Pikas E., Xie H.S., Girolami M.","Construction with digital twin information systems",2020,"Data-Centric Engineering",34,"https://www.scopus.com/inward/record.uri?eid=2-s2.0-85106009736&doi=10.1017%2fdce.2020.16&partnerID=40&md5=8396c27bccdbbcb71a9830263a4fdb0b","The concept of a digital twin as a model for data-driven management and control of physical systems has emerged over the past decade in the domains of manufacturing, production, and operations. In the context of buildings and civil infrastructure, the notion of a digital twin remains ill-defined, with little or no consensus among researchers and practitioners of the ways in which digital twin processes and data-centric technologies can support design and construction. This paper builds on existing concepts of Building Information Modeling (BIM), lean project production systems, automated data acquisition from construction sites and supply chains, and artificial intelligence to formulate a mode of construction that applies digital twin information systems to achieve closed loop control systems. It contributes a set of four core information and control concepts for digital twin construction (DTC), which define the dimensions of the conceptual space for the information used in DTC workflows. Working from the core concepts, we propose a DTC information system workflow-including information stores, information processing functions, and monitoring technologies-according to three concentric control workflow cycles. DTC should be viewed as a comprehensive mode of construction that prioritizes closing the control loops rather than an extension of BIM tools integrated with sensing and monitoring technologies. ©",Article,"Final",Scopus,2-s2.0-85106009736
"Vathoopan M., Johny M., Zoitl A., Knoll A.","Modular Fault Ascription and Corrective Maintenance Using a Digital Twin",2018,,32,"https://www.scopus.com/inward/record.uri?eid=2-s2.0-85052966280&doi=10.1016%2fj.ifacol.2018.08.470&partnerID=40&md5=fb359b51d73aec2265a6ed4bddfb59da","The industrial environment is slowly transforming to a networked system of systems nature with industry 4.0. Automation systems are getting more production friendly by being more reconfigurable and adaptable. The plant engineering process is also getting improved by offering modular architecture, model-based engineering, etc. This transformation necessitates novel methodologies in maintenance practices as well. With the emergence of predictive maintenance techniques, sometimes it is possible to predict a breakdown and thus conveniently schedule the corrective maintenance. But this is not always the case, the incidence of unscheduled corrective maintenance is prevalent in an industrial environment. And the methodologies for corrective maintenance have to be reshaped fitting to the new plant environment. This paper introduces a new modular corrective maintenance methodology, using the digital twin of an automation module. Fault ascription support for a human technician, performing corrective maintenance action of an automation module is provided by its digital twin and associated visual interface. A use case scenario is propounded and future visions are presented. © 2018",Conference Paper,"Final",Scopus,2-s2.0-85052966280
"Briner R.B., Denyer D.","Systematic Review and Evidence Synthesis as a Practice and Scholarship Tool. Handbook of Evidence-based Management: Companies, Classrooms and Research",2012,"Systematicreviewandevidencesynthesisasapracticeandscholarshiptool.Inhandbookofevidence-Basedmanagement:Companies, Classroomsandresearch",32,,[No abstract available],,"Final",Scopus,2-s2.0-85015776925
"Greif T., Stein N., Flath C.M.","Peeking into the void: Digital twins for construction site logistics",2020,"Computers in Industry",29,"https://www.scopus.com/inward/record.uri?eid=2-s2.0-85087681639&doi=10.1016%2fj.compind.2020.103264&partnerID=40&md5=5e9d65eb855f10bad9cd079f9f8ce37e","Construction is one of the least-digitized industries in the economy. To rein in the rising costs of building activities, digital transformation is one of the pillars that industry leaders rely on. A case in point are logistics processes which are characterized by very limited visibility and inefficient organization. To progress beyond this current state of the art, we conceptualize the idea of a lightweight digital twin for non-high-tech industries. In collaboration with a leading supplier of building materials, we explore the opportunities offered by digital silo twin capabilities. Focusing on fill level monitoring we identify diverse opportunities for generating informational, automational and transformational business value. Leveraging new information sources for the redesign of core business processes drastically increases the complexity of operational decision-making. To tap into these opportunities, we design and implement a decision support system for silo dispatch and replenishment activity. © 2020 Elsevier B.V.",Article,"Final",Scopus,2-s2.0-85087681639
"Luo W., Hu T., Zhu W., Tao F.","Digital twin modeling method for CNC machine tool",2018,"ICNSC 2018 - 15th IEEE International Conference on Networking, Sensing and Control",29,"https://www.scopus.com/inward/record.uri?eid=2-s2.0-85048211080&doi=10.1109%2fICNSC.2018.8361285&partnerID=40&md5=c881c5611d9cc0c6ceb9029dc7bc2f2f","CNC machine tool (CNCMT) is the mother machine of industry, which plays an important role in the coming smart manufacturing. The intelligence of CNCMT has a big significance, which will enables its self-sensing, self-prediction and self-maintenance without user concerns. In order to realize the intelligence of CNCMT, a Digital Twin (DT) modeling method for CNCMT is researched, including a multi-domain unified modeling method, a mapping method and an autonomous strategy. This paper provides a demonstration of DT modeling method for CNCMT. © 2018 IEEE.",Conference Paper,"Final",Scopus,2-s2.0-85048211080
"Leviäkangas P., Mok Paik S., Moon S.","Keeping up with the pace of digitization: The case of the Australian construction industry",2017,"Technology in Society",27,"https://www.scopus.com/inward/record.uri?eid=2-s2.0-85018344595&doi=10.1016%2fj.techsoc.2017.04.003&partnerID=40&md5=59646595cfa525a23eebfed8e847ebf4","The most significant current technological trend is digitization, the impacts of which will be faced by all levels of society. This paper addresses how the Australian construction industry has kept up with the pace of digitization compared with other industries in Australia. The data is drawn mainly from the national accounts hosted by the Australian Bureau of Statistics, within the time period of 1995–2015. Construction has developed into one of the most important industries in Australia. Together with mining and the financial and insurance sector, it has contributed to a significant gross added value (GVA) in the economy. The construction industry has invested around 1% or less in information and communication technologies (ICT) as their share of GVA; however, it has invested about 15% in ICT of their total investments (gross fixed capital formation). Among the selected industries, construction's labour productivity measured by GVA per hour was the third highest, despite low level of investments in digitization. The observed correlation between ICT investments and productivity is weak when using industry level data from the national accounts. Any big leap towards digitization is not recognised for the construction industry; rather there appears to be steady acceptance of the technology. © 2017 Elsevier Ltd",Article,"Final",Scopus,2-s2.0-85018344595
"Angjeliu G., Coronelli D., Cardani G.","Development of the simulation model for Digital Twin applications in historical masonry buildings: The integration between numerical and experimental reality",2020,"Computers and Structures",26,"https://www.scopus.com/inward/record.uri?eid=2-s2.0-85087273661&doi=10.1016%2fj.compstruc.2020.106282&partnerID=40&md5=380c547d99c0c62fefc97c9e7c6d86b2","The structural system integrity in historical masonry buildings is studied by developing the concept of the Digital Twin. The objectives are to develop a procedure for creating an accurate digital model, which integrates the experimental physical reality and to use it to study the structural response of the system, its preventive maintenance and strengthening operations. The key elements examined are the building of an accurate three-dimensional geometric model, the choice of material properties and, the consideration of construction stages along the history. The relation to structural surveys, in situ observation and measurements is explored, with particular attention to reproducing the damage observed. Non-Linear Finite Element modelling is adopted. The structural system is generated in a semi-automatic way, reducing time-consuming modelling tasks and reaching a good approximation of real geometry as well as having an efficient discretization in a finite element model. This procedure can be used to assess with high precision the present structural conditions of the system, study its future evolution for preventive maintenance or practical interventions as well as to understand past documented failures of structural members of the building. An application considered in Milan Cathedral demonstrates the applicability and advantages of the proposed procedure in complex buildings. © 2020 Elsevier Ltd",Article,"Final",Scopus,2-s2.0-85087273661
"Ghosh A.K., Ullah A.M.M.S., Kubo A.","Hidden Markov model-based digital twin construction for futuristic manufacturing systems",2019,"Artificial Intelligence for Engineering Design, Analysis and Manufacturing: AIEDAM",26,"https://www.scopus.com/inward/record.uri?eid=2-s2.0-85065234372&doi=10.1017%2fS089006041900012X&partnerID=40&md5=b2320d002e65db77fdcbfef7a464998a","This paper addresses the construction of digital twins (exact mirror images of real-world in cyberspace) using hidden Markov models for the futuristic manufacturing systems known as Industry 4.0. The proposed digital twin consists of two components namely model component and simulation component. The model component forms a Markov chain that encapsulates the dynamics underlying the phenomenon by using some discrete states and their transition probabilities. The simulation component recreates the phenomenon using a Monte Carlo simulation process. The efficacy of the proposed digital twin construction methodology is shown by a case study, where the digital twin of the surface roughness of a surface created by successive grinding operations is described. The developers of the cyber-physical systems will be benefitted from the outcomes of this study because these systems need the computable virtual abstractions of the manufacturing phenomena to address the issues related to the maturity index of futuristic manufacturing systems (i.e., understand, predict, decide, and adopt). © Cambridge University Press 2019.",Article,"Final",Scopus,2-s2.0-85065234372
