Authors,Title,Year,Source title,Cited by,Link,Abstract,Document Type,Publication Stage,Source,EID
"Webster J., Watson R.T.","Analyzing the past to prepare for the future: Writing a literature review",2002,"MIS Quarterly",4287,,[No abstract available],,"Final",Scopus,2-s2.0-0012903874
"Falagas M.E., Pitsouni E.I., Malietzis G.A., Pappas G.","Comparison of PubMed, Scopus, Web of Science, and Google Scholar: Strengths and weaknesses",2008,"FASEB Journal",1636,"https://www.scopus.com/inward/record.uri?eid=2-s2.0-38949137710&doi=10.1096%2ffj.07-9492LSF&partnerID=40&md5=eefa45f1a071abd9a3c8d870cab3446d","The evolution of the electronic age has led to the development of numerous medical databases on the World Wide Web, offering search facilities on a particular subject and the ability to perform citation analysis. We compared the content coverage and practical utility of PubMed, Scopus, Web of Science, and Google Scholar. The official Web pages of the databases were used to extract information on the range of journals covered, search facilities and restrictions, and update frequency. We used the example of a keyword search to evaluate the usefulness of these databases in biomedical information retrieval and a specific published article to evaluate their utility in performing citation analysis. All databases were practical in use and offered numerous search facilities. PubMed and Google Scholar are accessed for free. The keyword search with PubMed offers optimal update frequency and includes online early articles; other databases can rate articles by number of citations, as an index of importance. For citation analysis, Scopus offers about 20% more coverage than Web of Science, whereas Google Scholar offers results of inconsistent accuracy. PubMed remains an optimal tool in biomedical electronic research. Scopus covers a wider journal range, of help both in keyword searching and citation analysis, but it is currently limited to recent articles (published after 1995) compared with Web of Science. Google Scholar, as for the Web in general, can help in the retrieval of even the most obscure information but its use is marred by inadequate, less often updated, citation information. © FASEB.",Article,"Final",Scopus,2-s2.0-38949137710
"Aria M., Cuccurullo C.","bibliometrix: An R-tool for comprehensive science mapping analysis",2017,"Journal of Informetrics",1127,"https://www.scopus.com/inward/record.uri?eid=2-s2.0-85029313621&doi=10.1016%2fj.joi.2017.08.007&partnerID=40&md5=277ba69eb32d964445d4db7ad9388954","The use of bibliometrics is gradually extending to all disciplines. It is particularly suitable for science mapping at a time when the emphasis on empirical contributions is producing voluminous, fragmented, and controversial research streams. Science mapping is complex and unwieldly because it is multi-step and frequently requires numerous and diverse software tools, which are not all necessarily freeware. Although automated workflows that integrate these software tools into an organized data flow are emerging, in this paper we propose a unique open-source tool, designed by the authors, called bibliometrix, for performing comprehensive science mapping analysis. bibliometrix supports a recommended workflow to perform bibliometric analyses. As it is programmed in R, the proposed tool is flexible and can be rapidly upgraded and integrated with other statistical R-packages. It is therefore useful in a constantly changing science such as bibliometrics. © 2017 Elsevier Ltd",Article,"Final",Scopus,2-s2.0-85029313621
"Tao F., Cheng J., Qi Q., Zhang M., Zhang H., Sui F.","Digital twin-driven product design, manufacturing and service with big data",2018,"International Journal of Advanced Manufacturing Technology",958,"https://www.scopus.com/inward/record.uri?eid=2-s2.0-85015707925&doi=10.1007%2fs00170-017-0233-1&partnerID=40&md5=e9df82a6c28a363f7d0c22bcc013b053","Nowadays, along with the application of new-generation information technologies in industry and manufacturing, the big data-driven manufacturing era is coming. However, although various big data in the entire product lifecycle, including product design, manufacturing, and service, can be obtained, it can be found that the current research on product lifecycle data mainly focuses on physical products rather than virtual models. Besides, due to the lack of convergence between product physical and virtual space, the data in product lifecycle is isolated, fragmented, and stagnant, which is useless for manufacturing enterprises. These problems lead to low level of efficiency, intelligence, sustainability in product design, manufacturing, and service phases. However, physical product data, virtual product data, and connected data that tie physical and virtual product are needed to support product design, manufacturing, and service. Therefore, how to generate and use converged cyber-physical data to better serve product lifecycle, so as to drive product design, manufacturing, and service to be more efficient, smart, and sustainable, is emphasized and investigated based on our previous study on big data in product lifecycle management. In this paper, a new method for product design, manufacturing, and service driven by digital twin is proposed. The detailed application methods and frameworks of digital twin-driven product design, manufacturing, and service are investigated. Furthermore, three cases are given to illustrate the future applications of digital twin in the three phases of a product respectively. © 2017, Springer-Verlag London.",Article,"Final",Scopus,2-s2.0-85015707925
"Cobo M.J., López-Herrera A.G., Herrera-Viedma E., Herrera F.","Science mapping software tools: Review, analysis, and cooperative study among tools",2011,"Journal of the American Society for Information Science and Technology",819,"https://www.scopus.com/inward/record.uri?eid=2-s2.0-79959372931&doi=10.1002%2fasi.21525&partnerID=40&md5=8daa3f91d4ed90726f63e94182117a65","Science mapping aims to build bibliometric maps that describe how specific disciplines, scientific domains, or research fields are conceptually, intellectually, and socially structured. Different techniques and software tools have been proposed to carry out science mapping analysis. The aim of this article is to review, analyze, and compare some of these software tools, taking into account aspects such as the bibliometric techniques available and the different kinds of analysis. © 2011 ASIS&T.",Article,"Final",Scopus,2-s2.0-79959372931
"Succar B.","Building information modelling framework: A research and delivery foundation for industry stakeholders",2009,"Automation in Construction",781,"https://www.scopus.com/inward/record.uri?eid=2-s2.0-59049095324&doi=10.1016%2fj.autcon.2008.10.003&partnerID=40&md5=78f8c1b99d396371ae95905052c163db","Building Information Modelling (BIM) is an expansive knowledge domain within the Architecture, Engineering, Construction and Operations (AECO) industry. To allow a systematic investigation of BIM's divergent fields, its knowledge components must be defined and expanding boundaries delineated. This paper explores some of the publicly available international guidelines and introduces the BIM Framework, a research and delivery foundation for industry stakeholders. This is a 'scene-setting' paper identifying many conceptual parts (fields, stages, steps and lenses), providing examples of their application and listing some of the Framework's deliverables. This paper also identifies and deploys visual knowledge models and a specialised ontology to represent domain concepts and their relations. © 2008 Elsevier B.V. All rights reserved.",Article,"Final",Scopus,2-s2.0-59049095324
"Lee J., Lapira E., Bagheri B., Kao H.-A.","Recent advances and trends in predictive manufacturing systems in big data environment",2013,"Manufacturing Letters",586,"https://www.scopus.com/inward/record.uri?eid=2-s2.0-84892717180&doi=10.1016%2fj.mfglet.2013.09.005&partnerID=40&md5=c57b5aa6761f11c8be06d9b74a9f7a81","The globalization of the world's economies is a major challenge to local industry and it is pushing the manufacturing sector to its next transformation - predictive manufacturing. In order to become more competitive, manufacturers need to embrace emerging technologies, such as advanced analytics and cyber-physical system-based approaches, to improve their efficiency and productivity. With an aggressive push towards ""Internet of Things"", data has become more accessible and ubiquitous, contributing to the big data environment. This phenomenon necessitates the right approach and tools to convert data into useful, actionable information. © 2013 Society of Manufacturing Engineers (SME).",Article,"Final",Scopus,2-s2.0-84892717180
"Rosen R., Von Wichert G., Lo G., Bettenhausen K.D.","About the importance of autonomy and digital twins for the future of manufacturing",2015,"IFAC-PapersOnLine",555,"https://www.scopus.com/inward/record.uri?eid=2-s2.0-84953861813&doi=10.1016%2fj.ifacol.2015.06.141&partnerID=40&md5=c7f2640c3068c4e61f2773f04911c4ef","Industrie 4.0 - the ""brand"" name of the German initiative driving the future of manufacturing - is one of several initiatives around the globe emphasizing the importance of industrial manufacturing for economy and society. Besides the socio-economical if not political question which has to be answered - including the question about the future of labor - there are a couple of substantial technical and technological questions that have to be taken care of as well. © 2015, IFAC (International Federation of Automatic Control) Hosting by Elsevier Ltd. All rights reserved.",Conference Paper,"Final",Scopus,2-s2.0-84953861813
"Grieves M., Vickers J.","Digital twin: Mitigating unpredictable, undesirable emergent behavior in complex systems",2016,"Transdisciplinary Perspectives on Complex Systems: New Findings and Approaches",549,"https://www.scopus.com/inward/record.uri?eid=2-s2.0-85006339863&doi=10.1007%2f978-3-319-38756-7_4&partnerID=40&md5=f71116f0b25733bc9554a6f358ddfc0a","Systems do not simply pop into existence. They progress through lifecycle phases of creation, production, operations, and disposal. The issues leading to undesirable and unpredicted emergent behavior are set in place during the phases of creation and production and realized during the operational phase, with many of those problematic issues due to human interaction. We propose that the idea of the Digital Twin, which links the physical system with its virtual equivalent can mitigate these problematic issues. We describe the Digital Twin concept and its development, show how it applies across the product lifecycle in defining and understanding system behavior, and define tests to evaluate how we are progressing. We discuss how the Digital Twin relates to Systems Engineering and how it can address the human interactions that lead to “normal accidents.” We address both Digital Twin obstacles and opportunities, such as system replication and front running. We finish with NASA's current work with the Digital Twin. © Springer International Publishing Switzerland 2017.",Book Chapter,"Final",Scopus,2-s2.0-85006339863
"Kritzinger W., Karner M., Traar G., Henjes J., Sihn W.","Digital Twin in manufacturing: A categorical literature review and classification",2018,,533,"https://www.scopus.com/inward/record.uri?eid=2-s2.0-85052915281&doi=10.1016%2fj.ifacol.2018.08.474&partnerID=40&md5=89a5c6aec62d7a3f4ec83465a36abfa8","The Digital Twin (DT) is commonly known as a key enabler for the digital transformation, however, in literature is no common understanding concerning this term. It is used slightly different over the disparate disciplines. The aim of this paper is to provide a categorical literature review of the DT in manufacturing and to classify existing publication according to their level of integration of the DT. Therefore, it is distinct between Digital Model (DM), Digital Shadow (DS) and Digital Twin. The results are showing, that literature concerning the highest development stage, the DT, is scarce, whilst there is more literature about DM and DS. © 2018",Conference Paper,"Final",Scopus,2-s2.0-85052915281
"Negri E., Fumagalli L., Macchi M.","A Review of the Roles of Digital Twin in CPS-based Production Systems",2017,"Procedia Manufacturing",520,"https://www.scopus.com/inward/record.uri?eid=2-s2.0-85029833606&doi=10.1016%2fj.promfg.2017.07.198&partnerID=40&md5=8050bdfad87d2c836e7157bd0070c227","The Digital Twin (DT) is one of the main concepts associated to the Industry 4.0 wave. This term is more and more used in industry and research initiatives; however, the scientific literature does not provide a unique definition of this concept. The paper aims at analyzing the definitions of the DT concept in scientific literature, retracing it from the initial conceptualization in the aerospace field, to the most recent interpretations in the manufacturing domain and more specifically in Industry 4.0 and smart manufacturing research. DT provides virtual representations of systems along their lifecycle. Optimizations and decisions making would then rely on the same data that are updated in real-time with the physical system, through synchronization enabled by sensors. The paper also proposes the definition of DT for Industry 4.0 manufacturing, elaborated by the European H2020 project MAYA, as a contribution to the research discussion about DT concept. © 2017 The Authors",Article,"Final",Scopus,2-s2.0-85029833606
"Oesterreich T.D., Teuteberg F.","Understanding the implications of digitisation and automation in the context of Industry 4.0: A triangulation approach and elements of a research agenda for the construction industry",2016,"Computers in Industry",513,"https://www.scopus.com/inward/record.uri?eid=2-s2.0-84992398667&doi=10.1016%2fj.compind.2016.09.006&partnerID=40&md5=49fd6bbda78564ac6c803a50f787cc09","In recent years, Industry 4.0 has been introduced as a popular term to describe the trend towards digitisation and automation of the manufacturing environment. Despite its potential benefits in terms of improvements in productivity and quality, this concept has not gained much attention in the construction industry. This development is founded in the fact that the far-reaching implications of the increasingly digitised and automated manufacturing environment are still widely unknown. Against this backdrop, the primary objective of this paper is to explore the state of the art as well as the state of practice of Industry 4.0 relating technologies in the construction industry by pointing out the political, economic, social, technological, environmental and legal implications of its adoption. In this context, we present the results of our triangulation approach, which consists of a comprehensive systematic literature review and case study research, by illustrating a PESTEL framework and a value chain model. Additionally, we provide recommendations for further research within a research agenda. © 2016 Elsevier B.V.",Review,"Final",Scopus,2-s2.0-84992398667
"Qi Q., Tao F.","Digital Twin and Big Data Towards Smart Manufacturing and Industry 4.0: 360 Degree Comparison",2018,"IEEE Access",488,"https://www.scopus.com/inward/record.uri?eid=2-s2.0-85041173790&doi=10.1109%2fACCESS.2018.2793265&partnerID=40&md5=421f931c692160832c81d6535ddfea0a","With the advances in new-generation information technologies, especially big data and digital twin, smart manufacturing is becoming the focus of global manufacturing transformation and upgrading. Intelligence comes from data. Integrated analysis for the manufacturing big data is beneficial to all aspects of manufacturing. Besides, the digital twin paves a way for the cyber-physical integration of manufacturing, which is an important bottleneck to achieve smart manufacturing. In this paper, the big data and digital twin in manufacturing are reviewed, including their concept as well as their applications in product design, production planning, manufacturing, and predictive maintenance. On this basis, the similarities and differences between big data and digital twin are compared from the general and data perspectives. Since the big data and digital twin can be complementary, how they can be integrated to promote smart manufacturing are discussed. © 2013 IEEE.",Article,"Final",Scopus,2-s2.0-85041173790
"Tao F., Zhang H., Liu A., Nee A.Y.C.","Digital Twin in Industry: State-of-the-Art",2019,"IEEE Transactions on Industrial Informatics",484,"https://www.scopus.com/inward/record.uri?eid=2-s2.0-85054374767&doi=10.1109%2fTII.2018.2873186&partnerID=40&md5=2fd1fcedbc08dff8d43df76d7de1d53f","Digital twin (DT) is one of the most promising enabling technologies for realizing smart manufacturing and Industry 4.0. DTs are characterized by the seamless integration between the cyber and physical spaces. The importance of DTs is increasingly recognized by both academia and industry. It has been almost 15 years since the concept of the DT was initially proposed. To date, many DT applications have been successfully implemented in different industries, including product design, production, prognostics and health management, and some other fields. However, at present, no paper has focused on the review of DT applications in industry. In an effort to understand the development and application of DTs in industry, this paper thoroughly reviews the state-of-the-art of the DT research concerning the key components of DTs, the current development of DTs, and the major DT applications in industry. This paper also outlines the current challenges and some possible directions for future work. © 2005-2012 IEEE.",Article,"Final",Scopus,2-s2.0-85054374767
"Uhlemann T.H.-J., Lehmann C., Steinhilper R.","The Digital Twin: Realizing the Cyber-Physical Production System for Industry 4.0",2017,"Procedia CIRP",433,"https://www.scopus.com/inward/record.uri?eid=2-s2.0-85019987476&doi=10.1016%2fj.procir.2016.11.152&partnerID=40&md5=c5731a8c442c5dd06d70f59e9dc90f1f","Concerning current approaches to planning of manufacturing processes, the acquisition of a sufficient data basis of the relevant process information and subsequent development of feasible layout options requires 74% of the overall time-consumption. However, the application of fully automated techniques within planning processes is not yet common practice. Deficits are to be observed in the course of the use of a fully automated data acquisition of the underlying process data, a key element of Industry 4.0, as well as the evaluation and quantification and analysis of the gathered data. As the majority of the planning operations are conducted manually, the lack of any theoretical evaluation renders a benchmarking of the results difficult. Current planning processes analyze the manually achieved results with the aid of simulation. Evaluation and quantification of the planning procedure are limited by complexity that defies manual controllability. Research is therefore required with regard to automated data acquisition and selection, as the near real-time evaluation and analysis of a highly complex production systems relies on a real-time generated database. The paper presents practically feasible approaches to a multi-modal data acquisition approach, its requirements and limitations. The further concept of the Digital Twin for a production process enables a coupling of the production system with its digital equivalent as a base for an optimization with a minimized delay between the time of data acquisition and the creation of the Digital Twin. Therefore a digital data acquisition approach is necessary. As a consequence a cyber-physical production system can be generated, that opens up powerful applications. To ensure a maximum concordance of the cyber-physical process with its real-life model a multimodal data acquisition and evaluation has to be conducted. The paper therefore presents a concept for the composition of a database and proposes guidelines for the implementation of the Digital Twin in production systems in small and medium-sized enterprises. © 2017 The Authors.",Conference Paper,"Final",Scopus,2-s2.0-85019987476
"Boschert S., Rosen R.","Digital twin-the simulation aspect",2016,"Mechatronic Futures: Challenges and Solutions for Mechatronic Systems and Their Designers",426,"https://www.scopus.com/inward/record.uri?eid=2-s2.0-85016457439&doi=10.1007%2f978-3-319-32156-1_5&partnerID=40&md5=d3eccf1c33e916d426e389be5c6288cd","The vision of the Digital Twin itself refers to a comprehensive physical and functional description of a component, product or system, which includes more or less all information which could be useful in all-the current and subsequent-lifecycle phases. In this chapter we focus on the simulation aspects of the Digital Twin. Today, modelling and simulation is a standard process in system development, e.g. to support design tasks or to validate system properties. During operation and for service first simulation-based solutions are realized for optimized operations and failure prediction. In this sense, simulation merges the physical and virtual world in all life cycle phases. Current practice already enables the users (designer, SW/HW developers, test engineers, operators, maintenance personnel, etc) to master the complexity of mechatronic systems. © Springer International Publishing Switzerland 2016.",Book Chapter,"Final",Scopus,2-s2.0-85016457439
"Osei-Kyei R., Chan A.P.C.","Review of studies on the critical success factors for public-private partnership (PPP) projects from 1990 to 2013",2015,"International Journal of Project Management",362,"https://www.scopus.com/inward/record.uri?eid=2-s2.0-84930757310&doi=10.1016%2fj.ijproman.2015.02.008&partnerID=40&md5=500d16eb48c3a3a84b691249d948dd71","The Critical Success Factors for Public-Private Partnership is a major research interest worldwide therefore this paper aims to methodically review studies on the CSFs for implementing PPP from some selected top tier academic journals from 1990 to 2013 (years inclusive). The search results indicated an increased research interest in the exploration of PPP CSFs since 1990. The mostly identified CSFs are risk allocation and sharing, strong private consortium, political support, community/public support and transparent procurement. It was further noticed that Australia, the U.K., China and Hong Kong have been the countries of focus for most research studies on PPP CSFs. Finally the research approaches adopted are case study, questionnaire survey and mixed methods. The findings revealed provide an overview of CSFs for PPPs in order to enhance future implementations. Moreover a checklist of CSFs for PPPs has been developed, which could be adopted for further empirical studies. © 2015 Elsevier Ltd and IPMA.",Article,"Final",Scopus,2-s2.0-84930757310
"Barbosa F., Woetzel J., Mischke J., Ribeirinho M.J., Sridhar M., Parsons M., Bertram N., Brown S.","Reinventing Construction: A Route to Higher Productivity",2017,"Reinventing Construction: A Route to Higher Productivity",356,,[No abstract available],,"Final",Scopus,2-s2.0-85046345496
"Hardin B.",[No title available],2009,"BIM and Construction Management",338,,[No abstract available],,"Final",Scopus,2-s2.0-77958596448
"Tao F., Sui F., Liu A., Qi Q., Zhang M., Song B., Guo Z., Lu S.C.-Y., Nee A.Y.C.","Digital twin-driven product design framework",2019,"International Journal of Production Research",271,"https://www.scopus.com/inward/record.uri?eid=2-s2.0-85042921933&doi=10.1080%2f00207543.2018.1443229&partnerID=40&md5=ba290742598bd6b1307f8743ec098fc4","With the advent of new generation information technologies in industry and product design, the big data-driven product design era has arrived. However, the big data-driven product design mainly places emphasis on the analysis of physical data rather than the virtual models, in other words, the convergence between product physical and virtual space is usually absent. Digital twin, a new emerging and fast growing technology which connects the physical and virtual world, has attracted much attention worldwide recently. This paper presents a new method for product design based on the digital twin approach. The development of product design is briefly introduced first. The framework of digital twin-driven product design (DTPD) is then proposed and analysed. A case is presented to illustrate the application of the proposed DTPD method. © 2018, © 2018 Informa UK Limited, trading as Taylor & Francis Group.",Article,"Final",Scopus,2-s2.0-85042921933
"Moed H.F.","New developments in the use of citation analysis in research evaluation",2009,"Archivum Immunologiae et Therapiae Experimentalis",247,"https://www.scopus.com/inward/record.uri?eid=2-s2.0-63449112089&doi=10.1007%2fs00005-009-0001-5&partnerID=40&md5=ed3bc54a8a3891550039c0a0c20ec49a","This paper presents an overview of research assessment methodologies developed in the field of evaluative bibliometrics, a subfield of quantitative science and technology studies, aimed to construct indicators of research performance from a quantitative statistical analysis of scientific-scholarly documents. Citation analysis is one of its key methodologies. The paper illustrates the potentialities and limitations of the use of bibliometric indicators in research assessment. It discusses the relationship between metrics and peer review; databases used as sources of bibliometric analysis; the pros and cons of indicators often applied, including journal impact factors, Hirsch indices, and normalized indicators of citation impact; and approaches to the bibliometric measurement of institutional research performance. © 2009 L. Hirszfeld Institute of Immunology and Experimental Therapy, Wroclaw, Poland.",Review,"Final",Scopus,2-s2.0-63449112089
