Authors,Title,Year,Source title,Cited by,Link,Abstract,Document Type,Publication Stage,Source,EID
"Dwaikat L.N., Ali K.N.","Green buildings cost premium: A review of empirical evidence",2016,"Energy and Buildings",126,"https://www.scopus.com/inward/record.uri?eid=2-s2.0-84947996932&doi=10.1016%2fj.enbuild.2015.11.021&partnerID=40&md5=a9ef65513d88b4819f528cdb70e4414f","Evidence indicates that green buildings can outperform conventional (non-green) buildings in many performance areas. Nevertheless, the perceived higher upfront cost by building owners and investors is frequently cited as a hurdle to a widespread adoption of green buildings. In this study, an extensive literature survey was conducted to aggregate the green cost premiums which were reported as results of published empirical studies that investigated the cost premium associated with the green building. Results and methodologies of 17 empirical studies were tabulated and comparatively analyzed to find a conclusive answer whether the green building costs more or less than its conventional counterpart. Yet, consensus is not reached, and a significant gap exists in the quantified cost premium range. More than 90% of the reported green cost premiums through empirical investigations fall within a range from -0.4% to 21%. Two studies found that green buildings cost less than their conventional counterparts. Surprisingly, among the 17 reviewed empirical studies, only six publications were classified as academic publications, of which four research articles published in peer-reviewed journals, one conference paper, and one book. The size of the literature which addresses the issue of green buildings cost premium does not reflect the significance of the problem. © 2015 Elsevier B.V. All rights reserved.",Review,"Final",Scopus,2-s2.0-84947996932
"Urbina Coronado P.D., Lynn R., Louhichi W., Parto M., Wescoat E., Kurfess T.","Part data integration in the Shop Floor Digital Twin: Mobile and cloud technologies to enable a manufacturing execution system",2018,"Journal of Manufacturing Systems",121,"https://www.scopus.com/inward/record.uri?eid=2-s2.0-85044527201&doi=10.1016%2fj.jmsy.2018.02.002&partnerID=40&md5=1bd74f090f16112fa7f1b8c83cc8b567","The availability of data from a manufacturing operation can be used to enable an increase in capability, adaptability, and awareness of the process. In current cyber-physical systems, data are collected from pieces of manufacturing equipment and used to drive useful change and affect production output. The data gathered typically describe the operating state of the equipment, such as a machine tool, and can be provided using standard protocols. One such protocol, known as MTConnect, is becoming increasingly popular to collect data from machine tools. Other useful data can be collected from production personnel using a Manufacturing Execution System (MES) to monitor process output, consumable usage, and operator productivity. However, MTConnect data and MES data usually reside in separate systems that may be proprietary and expensive. This paper describes the development and implementation of a new MES, powered by Android devices and cloud computing tools, that combines MTConnect data with production data collected from operators; the proposed MES is particularly suitable for small manufacturing enterprises, as it is low-cost and easily implementable. A case study using the MES to track a production run of titanium parts is presented, and data from the MES are correlated with MTConnect data from a machine tool. This work is integral to realizing a complete digital model of the shop floor, known as the Shop Floor Digital Twin, that can be used for production control and optimization. © 2018 The Society of Manufacturing Engineers",Article,"Final",Scopus,2-s2.0-85044527201
"Li J., Greenwood D., Kassem M.","Blockchain in the built environment and construction industry: A systematic review, conceptual models and practical use cases",2019,"Automation in Construction",120,"https://www.scopus.com/inward/record.uri?eid=2-s2.0-85062655898&doi=10.1016%2fj.autcon.2019.02.005&partnerID=40&md5=fa2ff537ecae8f73124cf714c19d4d7f","The construction industry is facing many challenges including low productivity, poor regulation and compliance, lack of adequate collaboration and information sharing, and poor payment practices. Advances in distributed ledger technologies (DLT), also referred to as Blockchain, are increasingly investigated as one of the constituents in the digital transformation of the construction industry and its response to these challenges. The overarching aim of this study was to analyse the current state of DLT in the built environment and the construction sector with a view to developing a coherent approach to support its adoption specifically in the construction industry. Three objectives were established to achieve this: (a) to present the first state-of-the-art and literature review on DLT in the built environment and construction industry providing a consolidated view of the applications explored and potential use cases that could support disruption of the construction industry. Seven use-categories were identified: [1] Smart Energy, [2] Smart Cities & the Sharing Economy, [3] Smart Government, [4] Smart Homes, [5] Intelligent Transport, [6] BIM and Construction Management, and [7] Business Models and Organisational Structures; (b) to propose a framework for implementation composed of two conceptual models (i.e. the DLT Four-Dimensional Model, and the DLT Actors Model), developed according to extended socio-technical systems theory and including four dimensions (technical, social, process and policy), to support the development of DLT-based solutions that are adequate to the challenges faced by the construction industry. The DLT Four-Dimensional Model and the DLT Actors Model contribute to improve the understanding of the concepts involved when discussing DLT applications in construction and represent flexible, adaptable and scalable knowledge constructs and foundations that can be used for various further investigations; and (c) to appraise three specific use cases (i.e. Project Bank Accounts, regulation and compliance, and a single shared-access BIM model) as potential areas for DLT through the application of a decision support tool. The results show that Project Bank Accounts (PBAs) and regulation and compliance are candidate areas for DLT applications and warrant further attention. However, for the third use case (i.e. single shared-access BIM model) DLT are still insufficiently developed at this time. The research shows that there is real potential for DLT to support digitalisation in the construction industry and enable solutions to many of its challenges. However, there needs to be further investigation of the readiness of the industry, its organisations and processes, and to evaluate what changes need to occur before implementation can be successful. Further investigations will include the development of a roadmap process incorporating the four dimensions to evaluate readiness across a series of use cases for the construction industry. © 2019 Elsevier B.V.",Article,"Final",Scopus,2-s2.0-85062655898
"Gabor T., Belzner L., Kiermeier M., Beck M.T., Neitz A.","A simulation-based architecture for smart cyber-physical systems",2016,"Proceedings - 2016 IEEE International Conference on Autonomic Computing, ICAC 2016",117,"https://www.scopus.com/inward/record.uri?eid=2-s2.0-84991687905&doi=10.1109%2fICAC.2016.29&partnerID=40&md5=6a3f17439076f1a1d1f6e29f99d07948","In order to accurately predict future states of a smart cyber-physical system, which can change its behavior to a large degree in response to environmental influences, the existence of precise models of the system and its surroundings is demandable. In machine engineering, ultra-high fidelity simulations have been developed to better understand both constraints in system design and possible consequences of external influences during the system's operation. These digital twins enable further applications in software design for complex cyber-physical systems as online planning methods can utilize good simulations to continuously optimize the system behavior, yielding a software architecture framework based on the information flow between the cyber-physical system, its physical environment and the digital twin model. © 2016 IEEE.",Conference Paper,"Final",Scopus,2-s2.0-84991687905
"Boje C., Guerriero A., Kubicki S., Rezgui Y.","Towards a semantic Construction Digital Twin: Directions for future research",2020,"Automation in Construction",113,"https://www.scopus.com/inward/record.uri?eid=2-s2.0-85082386834&doi=10.1016%2fj.autcon.2020.103179&partnerID=40&md5=914efcd6c064d6a97299f00d812bb8fc","As the Architecture, Engineering and Construction sector is embracing the digital age, the processes involved in the design, construction and operation of built assets are more and more influenced by technologies dealing with value-added monitoring of data from sensor networks, management of this data in secure and resilient storage systems underpinned by semantic models, as well as the simulation and optimisation of engineering systems. Aside from enhancing the efficiency of the value chain, such information-intensive models and associated technologies play a decisive role in minimising the lifecycle impacts of our buildings. While Building Information Modelling provides procedures, technologies and data schemas enabling a standardised semantic representation of building components and systems, the concept of a Digital Twin conveys a more holistic socio-technical and process-oriented characterisation of the complex artefacts involved by leveraging the synchronicity of the cyber-physical bi-directional data flows. Moreover, BIM lacks semantic completeness in areas such as control systems, including sensor networks, social systems, and urban artefacts beyond the scope of buildings, thus requiring a holistic, scalable semantic approach that factors in dynamic data at different levels. The paper reviews the multi-faceted applications of BIM during the construction stage and highlights limits and requirements, paving the way to the concept of a Construction Digital Twin. A definition of such a concept is then given, described in terms of underpinning research themes, while elaborating on areas for future research. © 2020 The Authors",Review,"Final",Scopus,2-s2.0-85082386834
"Bruynseels K., de Sio F.S., van den Hoven J.","Digital Twins in health care: Ethical implications of an emerging engineering paradigm",2018,"Frontiers in Genetics",113,"https://www.scopus.com/inward/record.uri?eid=2-s2.0-85042098524&doi=10.3389%2ffgene.2018.00031&partnerID=40&md5=1e5bcfac38a386bbe3a14d94110be920","Personalized medicine uses fine grained information on individual persons, to pinpoint deviations from the normal. 'Digital Twins' in engineering provide a conceptual framework to analyze these emerging data-driven health care practices, as well as their conceptual and ethical implications for therapy, preventative care and human enhancement. Digital Twins stand for a specific engineering paradigm, where individual physical artifacts are paired with digital models that dynamically reflects the status of those artifacts. When applied to persons, Digital Twins are an emerging technology that builds on in silico representations of an individual that dynamically reflect molecular status, physiological status and life style over time. We use Digital Twins as the hypothesis that one would be in the possession of very detailed bio-physical and lifestyle information of a person over time. This perspective redefines the concept of 'normality' or 'health,' as a set of patterns that are regular for a particular individual, against the backdrop of patterns observed in the population. This perspective also will impact what is considered therapy and what is enhancement, as can be illustrated with the cases of the 'asymptomatic ill' and life extension via anti-aging medicine. These changes are the consequence of how meaning is derived, in case measurement data is available. Moral distinctions namely may be based on patterns found in these data and the meanings that are grafted on these patterns. Ethical and societal implications of Digital Twins are explored. Digital Twins imply a data-driven approach to health care. This approach has the potential to deliver significant societal benefits, and can function as a social equalizer, by allowing for effective equalizing enhancement interventions. It can as well though be a driver for inequality, given the fact that a Digital Twin might not be an accessible technology for everyone, and given the fact that patterns identified across a population of Digital Twins can lead to segmentation and discrimination. This duality calls for governance as this emerging technology matures, including measures that ensure transparency of data usage and derived benefits, and data privacy. © 2018 Bruynseels, Santoni de Sio and van den Hoven.",Article,"Final",Scopus,2-s2.0-85042098524
"Schluse M., Rossmann J.","From simulation to experimentable digital twins: Simulation-based development and operation of complex technical systems",2016,"ISSE 2016 - 2016 International Symposium on Systems Engineering - Proceedings Papers",113,"https://www.scopus.com/inward/record.uri?eid=2-s2.0-85006371785&doi=10.1109%2fSysEng.2016.7753162&partnerID=40&md5=455fd53870765cafd1547b17b9337228","Way beyond its industrial roots, robotics evolved to be a highly interdisciplinary field with a variety of applications in a smart world. The eRobotics methodology addresses this evolution by providing platforms where roboticist can exchange ideas and collaborate with experts from other disciplines for developing complex technical systems and automated solutions. Virtual Testbeds are the central method in eRobotics, where complex technical systems and their interaction with prospective working environments are first designed, programmed, controlled and optimized in simulation before commissioning the real system. On the other hand, Industry 4.0 concepts promote the notion of 'Digital Twins', virtual substitutes of real world objects consisting of virtual representations and communication capabilities making up smart objects acting as intelligent nodes inside the internet of things and services. Combining these two approaches, Virtual Testbeds and Digital Twins, leads to a new kind of 'Experimentable Digital Twins' breaking new ground in the simulation-based development and operation of complex technical systems. In this contribution, we describe how such 'Experimentable Digital Twins' can act as the very core of simulation-based development processes streamlining the development process, enabling detailed simulations at system level and realizing intelligent systems. Besides this, the multiple use of models and simulations in various scenarios significantly reduces the effort for the use of simulation technology throughout the life cycle of complex technical systems. © 2016 IEEE.",Conference Paper,"Final",Scopus,2-s2.0-85006371785
"Ilhan B., Yaman H.","Green building assessment tool (GBAT) for integrated BIM-based design decisions",2016,"Automation in Construction",107,"https://www.scopus.com/inward/record.uri?eid=2-s2.0-84976500659&doi=10.1016%2fj.autcon.2016.05.001&partnerID=40&md5=64e20ca837988f2d3f74fcef5f80a05c","The benefits of BIM such as effective decision making, improved analysis, easier access to information and simpler green building certification provide an optimised solution for sustainable design and construction. This study proposes an IFC-based framework within an integrated BIM and sustainable data model for the design stage of the building project life cycle. We present the green building assessment tool (GBAT), which implements the proposed model and aids the design team in the generation of documentation necessary for obtaining green building certification. It extracts the necessary data from BIM models for calculating the green rating and provides feedback for further evaluation. A sample project is run and a green rating score table for the BREEAM materials category is obtained for validation of the model. This tool serves as a proof of concept that green data relevant for BREEAM certification can be automatically processed and used to inform the design. © 2016 Elsevier B.V.",Article,"Final",Scopus,2-s2.0-84976500659
"Arditi D., Mochtar K.","Trends in productivity improvement in the US construction industry",2000,"Construction Management and Economics",106,"https://www.scopus.com/inward/record.uri?eid=2-s2.0-0033980854&doi=10.1080%2f014461900370915&partnerID=40&md5=b1baed50fb48c5aad547609dbce8938a","Surveys of the top 400 US contractors were conducted in 1979, 1983 and 1993 to identify the areas with potential for productivity improvement in the construction industry. The trends in the findings of these surveys are observed and interpreted. The results indicate that cost control, scheduling, design practices, labour training, and quality control are the functions that consistently over the years are perceived as having considerable room for productivity improvement, whereas materials packaging and foreign developments in construction technologies are perceived consistently as functions that do not have much effect on improving construction productivity. The functions that were identified as needing more improvement in 1993 compared with the previous surveys were prefabrication, new materials, value engineering, specifications, labour availability, labour training, and quality control, whereas those that were identified as needing less improvement than in the previous surveys were field inspection and labour contract agreements. Also, respondents indicated consistently over the years that they are willing to participate in activities related to improving construction productivity but are not interested in funding any such activities.",Article,"Final",Scopus,2-s2.0-0033980854
"Agarwal R., Chandrasekaran S., Sridhar M.","Imagining construction's digital future",2016,"Imagining Construction's Digital Future",105,,[No abstract available],,"Final",Scopus,2-s2.0-85046129011
"Xu Y., Sun Y., Liu X., Zheng Y.","A Digital-Twin-Assisted Fault Diagnosis Using Deep Transfer Learning",2019,"IEEE Access",102,"https://www.scopus.com/inward/record.uri?eid=2-s2.0-85062237403&doi=10.1109%2fACCESS.2018.2890566&partnerID=40&md5=d9ca57df562c33025e14f283024e704a","Digital twin is a significant way to achieve smart manufacturing, and provides a new paradigm for fault diagnosis. Traditional data-based fault diagnosis methods mostly assume that the training data and test data are following the same distribution and can acquire sufficient data to train a reliable diagnosis model, which is unrealistic in the dynamic changing production process. In this paper, we present a two-phase digital-twin-assisted fault diagnosis method using deep transfer learning (DFDD), which realizes fault diagnosis both in the development and maintenance phases. At first, the potential problems that are not considered at design time can be discovered through front running the ultra-high-fidelity model in the virtual space, while a deep neural network (DNN)-based diagnosis model will be fully trained. In the second phase, the previously trained diagnosis model can be migrated from the virtual space to physical space using deep transfer learning for real-time monitoring and predictive maintenance. This ensures the accuracy of the diagnosis as well as avoids wasting time and knowledge. A case study about fault diagnosis using DFDD in a car body-side production line is presented. The results show the superiority and feasibility of our proposed method. © 2013 IEEE.",Article,"Final",Scopus,2-s2.0-85062237403
"Syafrudin M., Alfian G., Fitriyani N.L., Rhee J.","Performance analysis of IoT-based sensor, big data processing, and machine learning model for real-time monitoring system in automotive manufacturing",2018,"Sensors (Switzerland)",102,"https://www.scopus.com/inward/record.uri?eid=2-s2.0-85053086211&doi=10.3390%2fs18092946&partnerID=40&md5=615bcb7bdd0c8725fb3d20eefd77a519","With the increase in the amount of data captured during the manufacturing process, monitoring systems are becoming important factors in decision making for management. Current technologies such as Internet of Things (IoT)-based sensors can be considered a solution to provide efficient monitoring of the manufacturing process. In this study, a real-time monitoring system that utilizes IoT-based sensors, big data processing, and a hybrid prediction model is proposed. Firstly, an IoT-based sensor that collects temperature, humidity, accelerometer, and gyroscope data was developed. The characteristics of IoT-generated sensor data from the manufacturing process are: real-time, large amounts, and unstructured type. The proposed big data processing platform utilizes Apache Kafka as a message queue, Apache Storm as a real-time processing engine and MongoDB to store the sensor data from the manufacturing process. Secondly, for the proposed hybrid prediction model, Density-Based Spatial Clustering of Applications with Noise (DBSCAN)-based outlier detection and Random Forest classification were used to remove outlier sensor data and provide fault detection during the manufacturing process, respectively. The proposed model was evaluated and tested at an automotive manufacturing assembly line in Korea. The results showed that IoT-based sensors and the proposed big data processing system are sufficiently efficient to monitor the manufacturing process. Furthermore, the proposed hybrid prediction model has better fault prediction accuracy than other models given the sensor data as input. The proposed system is expected to support management by improving decision-making and will help prevent unexpected losses caused by faults during the manufacturing process. © 2018 by the authors. Licensee MDPI, Basel, Switzerland.",Article,"Final",Scopus,2-s2.0-85053086211
"Liu M., Fang S., Dong H., Xu C.","Review of digital twin about concepts, technologies, and industrial applications",2021,"Journal of Manufacturing Systems",97,"https://www.scopus.com/inward/record.uri?eid=2-s2.0-85087693875&doi=10.1016%2fj.jmsy.2020.06.017&partnerID=40&md5=d2c23bb93aa18432536b333e5fce0311","Various kinds of engineering software and digitalized equipment are widely applied through the lifecycle of industrial products. As a result, massive data of different types are being produced. However, these data are hysteretic and isolated from each other, leading to low efficiency and low utilization of these valuable data. Simulation based on theoretical and static model has been a conventional and powerful tool for the verification, validation, and optimization of a system in its early planning stage, but no attention is paid to the simulation application during system run-time. With the development of new-generation information and digitalization technologies, more data can be collected, and it is time to find a way for the deep application of all these data. As a result, the concept of digital twin has aroused much concern and is developing rapidly. Dispute and discussions around concepts, paradigms, frameworks, applications, and technologies of digital twin are on the rise both in academic and industrial communities. After a complete search of several databases and careful selection according to the proposed criteria, 240 academic publications about digital twin are identified and classified. This paper conducts a comprehensive and in-depth review of these literatures to analyze digital twin from the perspective of concepts, technologies, and industrial applications. Research status, evolution of the concept, key enabling technologies of three aspects, and fifteen kinds of industrial applications in respective lifecycle phase are demonstrated in detail. Based on this, observations and future work recommendations for digital twin research are presented in the form of different lifecycle phases. © 2020 The Society of Manufacturing Engineers",Article,"Final",Scopus,2-s2.0-85087693875
