Authors,Title,Year,Source title,Cited by,Link,Abstract,Document Type,Publication Stage,Source,EID
"Washer G., Connor R., Nasrollahi M., Reising R.","Verification of the Framework for Risk-Based Bridge Inspection",2016,"Journal of Bridge Engineering",12,"https://www.scopus.com/inward/record.uri?eid=2-s2.0-84961262582&doi=10.1061%2f%28ASCE%29BE.1943-5592.0000787&partnerID=40&md5=67d75225b0b0282aeb24d636277a69cc","This paper presents two case studies that were conducted to evaluate the effectiveness of a new, risk-based inspection (RBI) method. The overall objectives of the case studies were to demonstrate the implementation of the methodology and to verify the effectiveness of RBI analysis for determining suitable inspection intervals for highway bridges. Expert elicitations were conducted to develop risk-based data models for RBI analysis for two families of bridges. These data models were used to assign inspection intervals for bridges ranging from 12 to 72 months. A new backcasting method was developed and used to analyze the effectiveness of these data models for identifying suitable inspection intervals. The results of the backcasting procedures verified that the RBI approach determined suitable inspection intervals for the sample bridges assessed through the research. © 2016 American Society of Civil Engineers.",Article,"Final",Scopus,2-s2.0-84961262582
"Ding Y., An Y., Wang C.","Field monitoring of the train-induced hanger vibration in a high-speed railway steel arch bridge",2016,"Smart Structures and Systems",11,"https://www.scopus.com/inward/record.uri?eid=2-s2.0-84969835039&doi=10.12989%2fsss.2016.17.6.1107&partnerID=40&md5=5155367a9a8c9fc5810ec7b268467239","Studies on dynamic characteristics of the hanger vibration using field monitoring data are important for the design and evaluation of high-speed railway truss arch bridges. This paper presents an analysis of the hanger's dynamic displacement responses based on field monitoring of Dashengguan Yangtze River Bridge, which is a high-speed railway truss arch bridge with the longest span throughout the world. The three vibration parameters, i.e., dynamic displacement amplitude, dynamic load factor and vibration amplitude, are selected to investigate the hanger's vibration characteristics in each railway load case including the probability statistical characteristics and coupled vibration characteristics. The influences of carriageway and carriage number on the hanger's vibration characteristics are further investigated. The results indicate that: (1) All the eight railway load cases can be successfully identified according to the relationship of responses from strain sensors and accelerometers in the structural health monitoring system. (2) The hanger's three vibration parameters in each load case in the longitudinal and transverse directions have obvious probabilistic characteristics. However, they fall into different distribution functions. (3) There is good correlation between the hanger's longitudinal/transverse dynamic displacement and the main girder's transverse dynamic displacement in each load case, and their relationships are shown in the hysteresis curves. (4) Influences of the carriageway and carriage number on the hanger's three parameters are different in both longitudinal and transverse directions; while the influence on any of the three parameters presents an obvious statistical trend. The present paper lays a good foundation for the further analysis of train-induced hanger vibration and control. Copyright © 2016 Techno-Press, Ltd.",Article,"Final",Scopus,2-s2.0-84969835039
"Kaewunruen S., Sresakoolchai J., Kerinnonta L.","Potential reconstruction design of an existing townhouse in Washington DC for approaching net zero energy building goal",2019,"Sustainability (Switzerland)",10,"https://www.scopus.com/inward/record.uri?eid=2-s2.0-85082879525&doi=10.3390%2fsu11236631&partnerID=40&md5=67089b3f47b13c4e09d5dcdfef49c991","The concept of the Net Zero Energy Building (NZEB) has received more interest from researchers due to global warming concerns. This paper proposes to illustrate optional solutions to allow existing buildings to achieve NZEB goals. The aim of this study is to investigate factors that can improve existing building performance to be in line with the NZEB concept and be more sustainable. An existing townhouse inWashington, DC was chosen as the research target to study how to retrofit or reconstruct the design of a building according to the NZEB concept. The methodology of this research is modeling an existing townhouse to assess the current situation and creating optional models for improving energy efficiency of the townhouse in Revit and utilising renewable energy technology for energy supply. This residential building was modeled in three versions to compare changes in energy performance including improving thermal efficiency of building envelope, increasing thickness of the wall, and installing smart windows (switchable windows). These solutions can reduce energy and cost by approximately 8.16%, 10.16%, and 14.65%, respectively, compared to the original townhouse. Two renewable energy technologies that were considered in this research were photovoltaic and wind systems. The methods can be applied to reconstruct other existing buildings in the future. © 2019 by the authors.",Article,"Final",Scopus,2-s2.0-85082879525
"Kaewunruen S., Osman M.H.B., Rungskunroch P.","The total track inspection",2019,"Frontiers in Built Environment",10,"https://www.scopus.com/inward/record.uri?eid=2-s2.0-85066836990&doi=10.3389%2ffbuil.2018.00084&partnerID=40&md5=7882b4416c21f3ce24bd32364eefc3d8","Operations of railway business have always placed “safety” as the first priority. Managing “public safety” requires integral risk monitoring and management. The risk monitoring for rail infrastructure management relies on accurate health monitoring and integrated track inspection. Health monitoring of all rail assets have given rise to “Big Data,” which have been derived and recorded from on-board monitoring and on-track inspections of both fixed and mobile assets. In this paper, the safety-critical inspections of fixed assets or railway infrastructures have be emphasized in order to obtain the integral insights into track defects, irregularities and deterioration of track geometry and components. This paper highlights the systems-based integration framework of on-board and on-site inspection data for railway track integrity assurance under uncertain settings. The risks and consequences of extreme climates have been considered in order to improve adaptiveness, agility, and readiness of the systems-based framework of the total track inspection activities that could underpin and assure track infrastructure integrity and resilience. New challenges in observational field data have been highlighted as the evidences for the necessity for the adaptive systems-based framework of the total track inspection. © 2019 Kaewunruen, Osman and Rungskunroch.",Short Survey,"Final",Scopus,2-s2.0-85066836990
"Badrul Hisham A., Marzukhi M., Daud A.","The worst flood in 100 years: Johore experience",2009,"Malays. J. Community Health",9,,[No abstract available],,"Final",Scopus,2-s2.0-84988491455
"Huang X., Ge J., Kaewunruen S., Su Q.","The self-sealing capacity of environmentally friendly, highly damped, fibre-reinforced concrete",2020,"Materials",8,"https://www.scopus.com/inward/record.uri?eid=2-s2.0-85079742789&doi=10.3390%2fma13020298&partnerID=40&md5=5fa6e38325f48051ad49dd1409356829","Cracks could attenuate the service life of concrete structures because of the intrusion of hazardous substances such as water. In this study, different proportions of Duras S500 fibre were employed to investigate the self-sealing capacity of environmentally friendly, highly damped, fibre-reinforced concrete (EFHDFRC) containing 5% crumb rubber. The workability of EFHDFRC with different proportions of the fibre was investigated by mechanical properties test. The self-sealing capacity was first measured by introducing the ultrasonic pulse velocity (UPV) test combined with the damage degree in a time-dependent manner. In addition, the regained compressive strength test and visual inspection were applied as additional measures of the self-sealing capacity. The experimental results show that EFHDFRC with different proportions of fibre showed the maximum sealing degree between the 42nd and 51st days after casting the concrete. EFHDFRC with 0.1% fibre had the best performance and the maximum self-sealing degree (2.82%). In summary, it has been proven that 0.1% fibre could stimulate the self-sealing capacity of EFHDFRC by bridging cracked concrete. Moreover, it is noted that sufficient space in cracks is essential for precipitation formation, which could seal the cracks. The new insights of this innovative self-healing, high-damping material are essential for industrial applications exposed to dynamic load conditions such as railway turnout bearers and sleepers, highspeed rail track slabs, blast-resistant walls and columns, and so on. © 2020 by the authors.",Article,"Final",Scopus,2-s2.0-85079742789
"Sresakoolchai J., Kaewunruen S.","Comparative studies into public private partnership and traditional investment approaches on the high-speed rail project linking 3 airports in Thailand",2020,"Transportation Research Interdisciplinary Perspectives",6,"https://www.scopus.com/inward/record.uri?eid=2-s2.0-85084634010&doi=10.1016%2fj.trip.2020.100116&partnerID=40&md5=3c26b8de41e0e92712fc52d893bc6cee","At present, PPP (Public-Private Partnership) plays an important role in infrastructure project development. This is attributable to the fact that many governments around the world have a budget constraint and may try to prioritize their budget for other developments in need. Allowing a private sector to participate in investment is an important step towards the cost-saving for a government. The private sector has an advantageous opportunity in the investment partnership, and public users tend to have superior service. Thai government envisages potential advantages of PPP and adopts this practice in various projects. However, the new mega project linking 3 airports is one of the first highspeed rail projects in Thailand of which the Thai government has insufficient experience. There are serious concerns whether the PPP adoption could enable a viable option. Therefore, this study aims to analyze benefits and risks of PPP adoption in the High-Speed Rail Project Linking 3 Airports in Thailand. Lifecycle assessment has been carried out by breaking down the project into various phases. Field data have been gathered from different sources such as an official website, feasibility study reports, annual reports of related government agencies, and opinions from technical experts in private sector. Financial analysis is used to analyze and calculate related financial values. The results reveal that the PPP adoption in this project yields different benefits and risks depending on each phase of the project. Adopting PPP can overcome key limitations and provide some real benefits that the traditional approach cannot. Simultaneously, there are risks incurred from the PPP adoption due to the complexity in PPP partnership such additional transaction costs and interrelation complexity. However, the risks can be managed by a rigorous plan and practice. Both governmental and private sectors need to collaborate to ascertain the project's success. © 2020 The Authors",Article,"Final",Scopus,2-s2.0-85084634010
"Osman M.H., Kaewunruen S.","Value of rescheduling of rail inspection",2020,"Proceedings of the Institution of Mechanical Engineers, Part F: Journal of Rail and Rapid Transit",4,"https://www.scopus.com/inward/record.uri?eid=2-s2.0-85060245727&doi=10.1177%2f0954409718820968&partnerID=40&md5=bec847a5f96eb13dc692efc7230f914b","A regular rail inspection schedule has been proposed to minimise any detrimental financial cost incurred due to operations under harsh environments. Missing opportunities to detect a defective rail could ultimately lead to its breaking, which would magnify the repair (as well as maintenance) cost by approximately 30–35% per rail-mile. However, the performance of a pre-planned inspection schedule may be affected by disruptions in one or more element(s) of inspection such as machine/vehicle breakdown or track unavailability, which are usually unpredictable events. As part of the justification for the need to manage a disrupted inspection schedule, this paper proposes a methodology that highlights the value of rescheduling. An extensive literature search was undertaken on the rescheduling framework in order to determine the appropriate policies, strategies and methods for rail inspection. As a result, the value of rescheduling is formulated as the ratio of rescheduling cost to a change in the value of risk from a missed opportunity to repair a defective rail, i.e. late defect detection. This numerical formula demonstrates how the proposed methodology is useful for filtering out a rescheduling strategy that has (negative) value when dealing with a disrupted rail inspection schedule. The discussion portrays several potential aspects to feasibly extend the proposed methodology on a large scale of rail network. © IMechE 2018.",Article,"Final",Scopus,2-s2.0-85060245727
"Geng F.F., Yin F.Z., Ding Y.L., Sun Z., Xu Z.","Bim based monitoring system for health of bridge beams",2018,"Modern Transportation Technology",4,,[No abstract available],,"Final",Scopus,2-s2.0-85070274182
"Xu P., Xiong F., Xia W., Zheng R., Wang L.","Bridge Information Integrated Management System Based on BIM [J]",2016,"Construction Technology",4,,[No abstract available],,"Final",Scopus,2-s2.0-85048327249
"Zhao X., Xu X.Y., Qiming L., Xing Z.","Visual analysis method of building information model based on WebGL and IFC [J]",2016,"Journal of Southeast University (Natural Science Edition)",2,,[No abstract available],,"Final",Scopus,2-s2.0-85085247819
"Wang T., Samsom S., Ng A.K.Y., Earl P.","Climate change and the adaptation planning of inland port and rail infrastructures in the province of Manitoba in Canada",2015,"Climate Change and Adaptation Planning for Ports",2,"https://www.scopus.com/inward/record.uri?eid=2-s2.0-85054202209&doi=10.4324%2f9781315756813-14&partnerID=40&md5=e773b39e345d840ffc57c9165941d9ff","This chapter focuses on the development of a decision support toolkit for climate smart seaports in the Pacific region. The prototype brings together different data and provides structure and guidance that allows port authority personnel to consider current-day vulnerabilities and future risks to a changing climate. The chapter discusses the research by McEvoy and Mullett who had identified a gap in the knowledge of small to medium-sized seaports in relation to accessing and prioritising the climate information that was available to them, and then how to operationalise this knowledge. As a result, a prototype decision-support toolkit was developed for Australian conditions, funded by the Australian National Data Service (ANDS), and it is this resource that formed the platform for the Pacific region work. The prototype decision-support toolkit, climate smart seaports (CSS), which had already been built for the Australian context, was customised to meet the specific needs of seaports in the Pacific region. © 2016 selection and editorial material, Adolf K. Y. Ng, Austin Becker, Stephen Cahoon, Shu-Ling Chen, Paul Earl and Zaili Yang; individual chapters, the contributors.",Book Chapter,"Final",Scopus,2-s2.0-85054202209
"Zhang X., Du S., Huang H.","Discussion on the construction of bridge safety and health perception system in the Internet of Things era",2010,"Munic. Technol",2,,[No abstract available],,"Final",Scopus,2-s2.0-85063122970
"Zhou X., Chen A.","Overview of European bridge management",2004,"World Bridge",2,,[No abstract available],,"Final",Scopus,2-s2.0-84876157062
[No author name available],[No title available],2019,"Risk-based Inspection of Highway Structures-LoBEG",1,,[No abstract available],,"Final",Scopus,2-s2.0-85101233017
"Dong L., Li Y.",[No title available],2018,"World Homes",1,,[No abstract available],,"Final",Scopus,2-s2.0-85101233082
[No author name available],[No title available],2017,"Carbonation Depth of Concrete and Treatment Measures",1,,[No abstract available],,"Final",Scopus,2-s2.0-85101298252
"Ren L.-c., Li Z.-f., Xing J.-X., Cheng J.-z., Zhai W.-q., Han F.","Research on a New Model in Bridge Engineering Risk Assessment Based on the Modified AHP Algorithm",2016,"J. Taiyuan Univ. Sci. Technol",1,,[No abstract available],,"Final",Scopus,2-s2.0-85101230977
"Binfeng Y., Xiaojun M.","Application of BIM and RFID in Open-building Whole Life Cycle Information Management",2015,"CT",1,,[No abstract available],,"Final",Scopus,2-s2.0-85101243940
"Guo R.",[No title available],2014,"Research on Key Issues of Urban Bridge Management System",1,,[No abstract available],,"Final",Scopus,2-s2.0-85101286460
"Hengwei W., Zhenzhong H., Jiarui L., Jianping Z.","Web-oriented BIM 3D viewing and information management",2013,"ITcon",1,,[No abstract available],,"Final",Scopus,2-s2.0-85101273842
[No author name available],[No title available],2011,"Carbonization of Concrete and Its Influencing Factors",1,,[No abstract available],,"Final",Scopus,2-s2.0-85101276790
"Chen C.",[No title available],2009,"The Effect of Carbonation on Reinforced Concrete Bridges",1,,[No abstract available],,"Final",Scopus,2-s2.0-85101245029
"Sun X.",[No title available],2004,"Influence of Crack on Bridge and Crack Treatment",1,,[No abstract available],,"Final",Scopus,2-s2.0-85101221629
