Authors,Title,Year,Source title,Cited by,Link,Abstract,Document Type,Publication Stage,Source,EID
"Jaroszweski D., Hooper E., Baker C., Chapman L., Quinn A.","The impacts of the 28 June 2012 storms on UK road and rail transport",2015,"Meteorological Applications",31,"https://www.scopus.com/inward/record.uri?eid=2-s2.0-84936985121&doi=10.1002%2fmet.1477&partnerID=40&md5=53c4836eb46eb3276c22863fea24ce28","Extreme weather events can cause severe disruption to transport systems, greatly reducing the ability to maintain important social and economic functions such as the delivery of goods and materials within the supply chain. There is a need for greater qualitative and quantitative understanding of how transport systems respond under adverse conditions, to inform event management and to aid adaptation actions. The present study uses the intense storms of 28 June 2012 as a case study to present a novel exploration of the impacts of an extreme event using high spatial and temporal resolution transport data for the UK road and rail networks, as well as weather data from the UK Meteorological Office's MIDAS surface station network and NIMROD weather radar. This event caused widespread disruption, severing the main rail links between England and Scotland and causing 10000 delay minutes to train services throughout the country, as well as causing reduced speeds on local roads and motorways. The present study describes the meteorological situation in the build-up to and during the event, and uses Network Rail train delay data to visualize the way in which the failure of several sections of critical transport infrastructure caused disruption that propagated quickly through the rail network of Great Britain. Highway Agency motorway speed data are used to quantify the impact of this event on the M6 motorway in the West Midlands. Ways in which the insights gained from these data can be used to aid the transport sector in the prioritization of adaptation actions are discussed. © 2014 Royal Meteorological Society.",Article,"Final",Scopus,2-s2.0-84936985121
"Bu G., Lee J., Guan H., Blumenstein M., Loo Y.-C.","Development of an integrated method for probabilistic bridge-deterioration modeling",2014,"Journal of Performance of Constructed Facilities",31,"https://www.scopus.com/inward/record.uri?eid=2-s2.0-84896332687&doi=10.1061%2f%28ASCE%29CF.1943-5509.0000421&partnerID=40&md5=b050bf61648d12b1fddabaf38a1d7701","Probabilistic deterioration models such as state-based and time-based models are only capable of predicting future bridge-condition ratings when a sufficient amount of condition data and reasonable data distribution are available. However, such are usually difficult to acquire from limited bridge-inspection records. As a result, these probabilistic models cannot guarantee reliable long-term prediction for each of the bridge elements concerned. To minimize this shortcoming, this paper proposes an advanced integrated method to construct workable transition probabilities for predicting long-term bridge performance. A selection process within this method automatically chooses a suitable prediction procedure for a given situation in terms of available inspection data. The backward prediction model (BPM) is also incorporated to effectively predict the bridge performance when sufficient inspection data are unavailable. Four different situations in regard to the available inspection data are predefined in this study to demonstrate the capabilities of the proposed integrated method. The outcomes show that the method can help develop an effective prediction model for various situations in terms of the quantity and distribution of available condition-rating data. © 2014 American Society of Civil Engineers.",Conference Paper,"Final",Scopus,2-s2.0-84896332687
"Sáadin S.L.B., Kaewunruen S., Jaroszweski D.","Operational readiness for climate change of Malaysia high-speed rail",2016,"Proceedings of the Institution of Civil Engineers: Transport",30,"https://www.scopus.com/inward/record.uri?eid=2-s2.0-84988490247&doi=10.1680%2fjtran.16.00031&partnerID=40&md5=7691966188bc22d5679328f99b08f385","The Paris Agreement of December 2015 signifies global unity to limit global warming to well below 2°C (above pre-industrial levels) and to pursue efforts to limit the increase to 1·5°C. The global community now agrees that anthropogenic climate change is unequivocal. According to the Intergovernmental Panel on Climate Change, the global average combined land and surface temperature has increased by 0·78°C. Although the magnitude of change in mean temperatures is relatively small, attendant extreme weather events have been shown to have increased in frequency, and are projected to increase in the future. The potential impacts of climate change on railway infrastructure and operations have not been fully assessed in the literature. The projected urban growth in Kuala Lumpur and Singapore has led to the necessity to establish a high-speed rail (HSR) system between the two. However, the existing railway network in the region has been significantly affected by severe weather conditions such as rainfall, lightning, wind and very high temperatures. This research addresses a knowledge gap regarding the potential impacts of climate change on future rail projects in the region, and points out the vulnerabilities that may lead to impaired operations and system failures. These insights are intended to inform the holistic consideration of climate change impacts in the design stage of HSR systems in Malaysia and beyond. © 2016 Thomas Telford Services Ltd. All rights reserved.",Article,"Final",Scopus,2-s2.0-84988490247
"Quirk L., Matos J., Murphy J., Pakrashi V.","Visual inspection and bridge management",2018,"Structure and Infrastructure Engineering",26,"https://www.scopus.com/inward/record.uri?eid=2-s2.0-85024394870&doi=10.1080%2f15732479.2017.1352000&partnerID=40&md5=89c45790a9f34cdd43de91fe127f362d","This paper estimates visual inspection quantitatively prior to its implementation in a Bridge Management System using a Value of Information (VoI) approach employing a Bayesian pre-posterior analysis. Information from a significant number of real bridges from Ireland and Portugal are considered in this regard following existing commercial practices. The variation of different parameters on the estimated VoI is investigated including the assumed probabilistic models of the prior bridge state, the likelihood of inspector assigned condition ratings and the economic setting surrounding the cost matrix for maintenance decision alternatives. The values of no information, perfect information and imperfect information are presented and the change in the optimal strategy based on such information is assessed. The effect of human imperfections in assessment and difference in condition rating scale are also estimated. The studies and findings of this paper are expected to allow a better insight for practising engineers and researchers working in bridge management. © 2017 Informa UK Limited, trading as Taylor & Francis Group.",Article,"Final",Scopus,2-s2.0-85024394870
"Jeong Y., Kim W., Lee I., Lee J.","Bridge inspection practices and bridge management programs in China, Japan, Korea, and U.S.",2018,"Journal of Structural Integrity and Maintenance",24,"https://www.scopus.com/inward/record.uri?eid=2-s2.0-85060343426&doi=10.1080%2f24705314.2018.1461548&partnerID=40&md5=30f169d8378a08b2145ea94ea983a923","The present study reviews bridge inspection practices and bridge management programs in China, Japan, Korea, and U.S. Bridges play an essential role in transportation systems and in the economic production process. Transportation agencies should maintain bridges in acceptable conditions to provide a desirable level of service to the public within limited budgets. In addition, a number of bridges are aging rapidly in these four countries. Fortunately, since several countries have experienced deteriorated bridges due to aging, the countries considered in this study have already developed comprehensive bridge management system (BMS) and bridge inspection practices. Therefore, the goal of this paper is to search for and synthesize useful knowledge on BMSs and bridge inspection practices of the four countries. Finally, recommendations that will serve as guidance to transportation agencies for potential enhancements to BMS and bridge inspections are presented. © 2018, © 2018 Korea Institute for Structural Maintenance and Inspection.",Article,"Final",Scopus,2-s2.0-85060343426
"Kaewunruen S., Sresakoolchai J., Zhou Z.","Sustainability-based lifecycle management for bridge infrastructure using 6D BIM",2020,"Sustainability (Switzerland)",23,"https://www.scopus.com/inward/record.uri?eid=2-s2.0-85082851821&doi=10.3390%2fsu12062436&partnerID=40&md5=58a19684337eb6cfb40998aa59d8462e","A number of bridge infrastructures are rising significantly due to economic expansion and growing numbers of railway and road infrastructures. Owing to the complexity of bridge design, traditional design methods always create tedious and time-consuming construction processes. In recent years, Building Information Modelling (BIM) has been developed rapidly to provide a faster solution to generate and process the integration of information in a shared environment. This paper aims to highlight an innovative 6D BIM approach for the lifecycle asset management of a bridge infrastructure by using Donggou Bridge as a case study. This paper adopts 6D modelling, incorporating 3D model information with time schedule, cost estimation, and carbon footprint analysis across the lifecycle of the bridge project. The results of this paper reveal that raw materials contribute the most embodied carbon emissions, and as the 6D BIM model was developed in the early stage of the lifecycle, stakeholders can collaborate within the BIM environment to enhance a more sustainable and cost-effective outcome in advance. This study also demonstrates the possibility of BIM applications to bridge infrastructure projects throughout the whole lifecycle. The 6D BIM can save time by transforming 2D information to 3D information and reducing errors during the pre-construction and construction stages through better visualisation for staff training. Moreover, 6D BIM can promote efficient asset and project management since it can be applied for various purposes simultaneously, such as sustainability, lifecycle asset management and maintenance, condition monitoring and real-time structural simulations. In addition, BIM can promote cooperation among working parties and improve visualisation of the project for various stakeholders. © 2020 by the authors.",Article,"Final",Scopus,2-s2.0-85082851821
"Chan B., Guan H., Hou L., Jo J., Blumenstein M., Wang J.","Defining a conceptual framework for the integration of modelling and advanced imaging for improving the reliability and efficiency of bridge assessments",2016,"Journal of Civil Structural Health Monitoring",23,"https://www.scopus.com/inward/record.uri?eid=2-s2.0-84990865970&doi=10.1007%2fs13349-016-0191-6&partnerID=40&md5=d9797e323746b903e098fca993dca805","Current bridge inspection practices are typically predicated upon manual paper-based data collection methods, which significantly limit the ability to transfer knowledge gained throughout the lifecycle of the asset, to benefit the assessment of the inspector or engineer. This study aims to overcome the limitations of current practices and proposes a conceptual framework to improve the reliability and efficiency of current bridge asset management practices through the integration of Building Information Modeling (BIM) and advanced computing and imaging technologies. As a tool for bridge inspections, BIM offers significant potential when integrated with laser scanning and keypoint-based texture recognition, which allows for the detection of such defects as cracking, corrosion or settlement in bridge components. In recent years, the construction industry has seen an increased use of BIM technology on-site to aid the construction process. However, the applications of it are deficient through the asset management phases of a project. Given the ability of BIM to house all component specific information gathered from the construction, inspection and maintenance phases, BIM is envisioned to allow emphasis to be placed on retrieving the relevant information throughout the project lifecycle, ultimately enabling engineers and bridge inspectors to make more informed decisions about the current condition of the structure. Using BIM as the focal point for information collection throughout the project lifecycle, findings from advanced imaging and data processing are proposed to be stored within the model for recall at future bridge assessments. © 2016, Springer-Verlag Berlin Heidelberg.",Article,"Final",Scopus,2-s2.0-84990865970
"Kaewunruen S., Wu L., Goto K., Najih Y.M.","Vulnerability of structural concrete to extreme climate variances",2018,"Climate",20,"https://www.scopus.com/inward/record.uri?eid=2-s2.0-85049042241&doi=10.3390%2fcli6020040&partnerID=40&md5=e8e0fa5071abf4853b7a38ad9b63f3c4","For modern infrastructures, structural concrete has been widely adopted for various components and structures such as railway stations, platforms, walkways, railway bridges, tunnelling, concrete sleepers, concrete foundation of overhead wiring structures, etc. These infrastructures are subject to various changes of time, operation, and environment. Environmental conditions are a considerably influential factor to life cycle and durability of concrete structures. This study aims at identifying the influence of climate change on the performance and durability of concrete structures using statistical regression analysis of a number of pertinent experimental and field data. The study into the influence of elevated temperature on compressive strength and splitting tensile strength also has been carried out using experimental data on the basis of environmental temperature and relative humidity, as well as CO2 concentration to the concrete carbonation and steel corrosion rates. The results indicate that environmental temperature, CO2 concentration, and a certain range of relative humidity play an important role in the concrete carbonation rates. Temperature and relative humidity affect the rate of steel corrosion as well. In addition, it is found that there exists a nearly direct correlation between the environmental temperature and the concrete carbonation rates, as well as the corrosion rate of steel embedded in concrete from 25 °C to 60 °C, and a nearly inverse proportion between the environmental relative humidity and the concrete carbonization from 48.75% to 105%. Indeed, the results exhibit that even in extreme natural high temperature, the capacity of compressive strength and splitting tensile strength is not affected significantly. © 2018 by the authors.",Article,"Final",Scopus,2-s2.0-85049042241
"Kaewunruen S., Sresakoolchai J., Peng J.","Life cycle cost, energy and carbon assessments of Beijing-Shanghai high-speed railway",2020,"Sustainability (Switzerland)",14,"https://www.scopus.com/inward/record.uri?eid=2-s2.0-85079532429&doi=10.3390%2fSU12010206&partnerID=40&md5=bc91e1a6b9d67b95873c0c6f8774aebd","The Beijing-Shanghai High-Speed Railway (HSR) is one of the most important railways in China, but it also has impacts on the economy and the environment while creating social benefits. This paper uses a life cycle assessment (LCA) method and a life cycle cost (LCC) analysis method to summarize the energy consumption, carbon emissions and costs of the Beijing-Shanghai HSR from the perspective of life cycle, and proposes some corresponding suggestions based on the results. The research objective of this paper is to analyse the carbon emissions, energy consumption, and costs of the rail system which includes the structure of the track and earthwork of the Beijing-Shanghai HSR during four stages: conception stage, construction stage, operation and maintenance stage, and disposal stage. It is concluded that the majority of the carbon emissions and energy consumption of the entire rail system are from the construction stage, accounting for 64.86% and 54.31% respectively. It is followed by the operation and maintenance stage with 31.60% and 35.32% respectively. In contrast, the amount of carbon emissions and energy consumption from the conception stage is too small to be considered. Furthermore, cement is the major contributor to the carbon emissions and energy consumption during the construction stage. As for the cost, the construction stage spends the largest amount of money (US$4614.00 million), followed by the operation and maintenance stage (US$910.61 million). Improving production technologies and choosing construction machinery are proposed to reduce the cost and protect the environment. © 2019 by the authors.",Article,"Final",Scopus,2-s2.0-85079532429
"Ding Y.-L., Zhao H.-W., Deng L., Li A.-Q., Wang M.-Y.","Early Warning of Abnormal Train-Induced Vibrations for a Steel-Truss Arch Railway Bridge: Case Study",2017,"Journal of Bridge Engineering",14,"https://www.scopus.com/inward/record.uri?eid=2-s2.0-85029214727&doi=10.1061%2f%28ASCE%29BE.1943-5592.0001143&partnerID=40&md5=9645db4a064b7edaac8db34c1440f40e","Considering the new challenges for high-speed railway bridges, the early warning of abnormal train-induced vibrations is necessary for ensuring the operation safety of both the bridge structures and the trains on the bridge. In this study, an online monitoring system for detecting abnormal train-induced vibration responses is developed, and the Dashengguan Yangtze River Bridge is used for illustration. First, to accurately investigate the influence of different train lanes and the number of carriages on train-induced vibrations, the speed-acceleration (train speed-bridge acceleration) correlations under different loading cases are obtained using an online identification method. Then, a two-stage method for early warning of abnormal train-induced acceleration responses of the bridges is developed using wavelet packet decomposition and interval estimation theory. Finally, the early warning method for identifying abnormal train-induced transverse vibrations is presented. The results show that (1) the train lane and the number of carriages affect the speed-acceleration correlations, and the identification of loading cases is needed for the accurate monitoring of speed-acceleration correlations; (2) by using wavelet packet decomposition, the median line of speed-acceleration correlations can be optimally extracted, and the early warning thresholds for abnormal train-induced acceleration responses can be properly determined using the interval estimation theory compared with the point estimation theory; and (3) the train running parameters of the Dashengguan Yangtze River Bridge are all within safe limits, but the wheel unloading rate and derailment coefficient have reached 60% of the limits due to the train-induced transverse vibrations. The effects of train-induced transverse vibration on the train running stability is worthy of attention. © 2017 American Society of Civil Engineers.",Article,"Final",Scopus,2-s2.0-85029214727
"Remennikov A.M., Kaewunruen S.","Determination of prestressing force in railway concrete sleepers using dynamic relaxation technique",2015,"Journal of Performance of Constructed Facilities",14,"https://www.scopus.com/inward/record.uri?eid=2-s2.0-84941929491&doi=10.1061%2f%28ASCE%29CF.1943-5509.0000634&partnerID=40&md5=e1a35732d1faff730febeb7eeab79eb4","Prestressed concrete sleepers (or railroad ties) are designed to carry and transfer the wheel loads from the rails to the track foundation. Over a period of time, a railway track could experience various types of static and dynamic loading conditions, which are attributable to commercial train operations. Previous studies have established two main limit states for the design consideration of concrete sleepers: ultimate limit states under extreme impact and fatigue limit states under repeated probabilistic impact loads. Prestressed concrete has played a significant role in maintaining the high endurance of the sleepers under low to moderate repeated impact loads. Despite the most common use of the prestressed concrete sleepers in railway tracks, their remaining lives are not deeply appreciated nor taken into account for track maintenance and renewal. The present experimental investigation was aimed at determining the residual prestressing force of railway concrete sleepers after revenue services using the dynamic relaxation technique. Fifteen sleepers were extracted from a heavy-haul rail network for testing using experimental facilities at the University of Wollongong in Australia. The structural evaluation program included quasi-static bending tests, dynamic impact tests, and tests to establish the current level of prestress in the steel wires using the dynamic relaxation technique. Two of the sleepers were evaluated for the level of prestressing forces in accordance with Australian standards. It was found that the level of prestress determined using the dynamic relaxation technique was significantly lower than that expected from the theoretical analysis of time-dependent prestressing losses for the concrete sleepers. © 2014 American Society of Civil Engineers.",Article,"Final",Scopus,2-s2.0-84941929491
"Newhook J.P., Edalatmanesh R.","Integrating reliability and structural health monitoring in the fatigue assessment of concrete bridge decks",2013,"Structure and Infrastructure Engineering",14,"https://www.scopus.com/inward/record.uri?eid=2-s2.0-84875206829&doi=10.1080%2f15732479.2011.601745&partnerID=40&md5=d95b2ed826abdd7b189b00f04f92acfc","The overall objective of this article is to demonstrate how the concepts of reliability and structural health monitoring (SHM) can be integrated to create bridge assessment and decision systems. The steel-free concrete bridge deck system was chosen as a specific case study providing tangible focus for the research. The bridge assessment model therefore focused on fatigue cracking issues associated with wheel loads due to heavy truck traffic. The bridge assessment model required five components: a vehicle load model, a fatigue damage accumulation model, a residual strength model, a reliability model and an SHM decision model. Each of these components is discussed within the article with specific reference to previous research on steel-free bridge deck systems. The proposed model is used to develop a decision threshold for monitoring the oldest steel-free bridge deck in service. © 2013 Copyright Taylor and Francis Group, LLC.",Article,"Final",Scopus,2-s2.0-84875206829
"Kaewunruen S., Peng S., Phil-Ebosie O.","Digital twin aided sustainability and vulnerability audit for subway stations",2020,"Sustainability (Switzerland)",13,"https://www.scopus.com/inward/record.uri?eid=2-s2.0-85092140180&doi=10.3390%2fSU12197873&partnerID=40&md5=95af1dc818d0a166c08460c3e2fd9f55","Digital twin (DT) or so-called 'building information model (BIM)' has brought great revolution to the current building industry. Its applications to life cycle management of buildings and infrastructures can further increase the social and economic benefits. As a complete information model, a digital twin integrates the information of a project from different stages of the life cycle into a model, in order to facilitate better asset management and communicate through data visualizations with participants. This paper unprecedently introduces a digital-twin aided life cycle assessment to evaluate a subway station. Dadongmen subway station in Hefei was used as a case study. This new study benchmarks the cost estimation and carbon emission at each life cycle stage of the project. The cost in the construction stage of the project is the highest, accounting for 78% of the total cost. However, the amount of carbon emissions in the operation and maintenance is higher than the amount during the production of building materials, accounting for 67%. Among them, concrete only accounts for 43.66% of the carbon emissions of building materials, even though concrete was mainly used for constructing the metro station. Steel bar and aluminum alloy have carbon emissions of 29.73% and 17.64%, respectively. In addition, emerging risks of the subway stations can be identified. The digital twin has been used to illustrate vulnerability and potential solutions to emerging risks, and to assess the suitability through life cycle cost and carbon footprint. This initiative is relatively new to the industry. The new insight into life cycle assessment or LCA (especially carbon footprint over the life cycle) integrated with digital twin applications will enable sustainable development that will enhance resilience of metro railway systems globally. © 2020 by the authors.",Article,"Final",Scopus,2-s2.0-85092140180
