Authors,Title,Year,Source title,Cited by,Link,Abstract,Document Type,Publication Stage,Source,EID
"Haupt T.C., Akinlolu M., Raliile M.T.","Applications of digital technologies for health and safety management in construction",2019,"World Construction Symposium",3,"https://www.scopus.com/inward/record.uri?eid=2-s2.0-85102167737&doi=10.31705%2fWCS.2019.9&partnerID=40&md5=357d034aed7b75d4d7bf1c9ba0848def","The construction industry has been known for many decades as a high-risk industry with low levels of innovation and reluctance to adopt change. Common causes of construction accidents are associated with human error, hazardous work activities, defective equipment and dangerous working environments. However, to provide a better and safe working environment, the industry can exploit the benefits of emerging health and safety technologies. The purpose of this study is to explore the application of various emerging technologies and how they can be used to improve construction health and safety management. The paper reviewed extensive literature from previous studies on emerging technologies and interventions for construction job site safety such as; Virtual Reality (VR), online databases, Geographic Information Systems (GIS), Building Information Modelling (BIM), Unmanned Aerial Vehicle (UAV), 4D Computer-Aided Design (4D CAD), wearables, robotics, laser scanning, photogrammetry and sensor-based technologies. Furthermore, these technologies were grouped into three categories; people technologies, process technologies and environmental technologies for better analysis. Keywords such as ‘construction health and safety technologies’, ‘digital technologies’ and ‘emerging technologies’ were used to search online databases. This study identified emerging technologies and their application in the construction industry to improve health and safety. © 2019, Ceylon Institute of Builders. All rights reserved.",Conference Paper,"Final",Scopus,2-s2.0-85102167737
"Oshodi O.S., Awuzie B.O., Akotia J., Ademiloye A.S., Ngowi A.","A bibliometric analysis of recycled concrete research (1978–2019)",2020,"Built Environment Project and Asset Management",2,"https://www.scopus.com/inward/record.uri?eid=2-s2.0-85090114011&doi=10.1108%2fBEPAM-01-2020-0009&partnerID=40&md5=fd615e76935da1e95586a0141d4ca8a1","Purpose: The use of recycled concrete (RC) can reduce the greenhouse emissions associated with the production of cement, which is one of the primary materials used for the execution of construction projects. This research aims to review the state of knowledge in the field of RC research. An understanding of the state of the art in the RC domain justifies future research in this field. Design/methodology/approach: A systematic and comprehensive search of RC-related literature was conducted using the Scopus database. In this research, the bibliometrix R-package was used for the analysis of bibliometric information of the selected papers. The software was used to create a map, which highlights the trends and gaps in the RC knowledge domain. Findings: The results reveal the research themes, clusters, collaboration networks and advancement of knowledge in the field of RC research. The study integrates the literature focussed on RC research and provides a platform for progression of knowledge in this field. Originality/value: The study contributes to the growing body of knowledge by providing an up-to-date RC knowledge map based on an analysis of bibliographic data. Information gleaned from previous studies suggests that bibliometric review can strengthen and complement the findings emerging from other forms of literature reviews. The study reported here is one of the first studies to provide insights into the evolution of RC research. © 2020, Emerald Publishing Limited.",Article,"Final",Scopus,2-s2.0-85090114011
"Rahim N.S.A., Zakaria S.A.S.","The framework of building information modeling (BIM) implementation stages for Malaysian construction industry",2017,"IPTEK Journal of Proceedings Series",2,,[No abstract available],,"Final",Scopus,2-s2.0-85102190643
"Akinlolu M.T., Olalusi O.B., Haupt T.C.","A scientometric review and meta-analysis of the health and safety of women in construction: structure and research trends",2020,"Journal of Engineering, Design and Technology",1,,[No abstract available],,"Final",Scopus,2-s2.0-85106350485
"Hostetler C.M.",[No title available],2009,"Building information modeling (BIM) and its potential impacts on sustainable building project delivery",1,,[No abstract available],,"Final",Scopus,2-s2.0-85102198176
