Authors,Title,Year,Source title,Cited by,Link,Abstract,Document Type,Publication Stage,Source,EID
"Farghaly K., Abanda F.H., Vidalakis C., Wood G.","Taxonomy for BIM and Asset Management Semantic Interoperability",2018,"Journal of Management in Engineering",35,"https://www.scopus.com/inward/record.uri?eid=2-s2.0-85044665526&doi=10.1061%2f%28ASCE%29ME.1943-5479.0000610&partnerID=40&md5=28a7be633b7ae352612cfaa7b7eab0ea","At present, the capability to collect information from different sources [building information modeling (BIM), sensors, assets database] for asset management (AM) use has generated significant opportunities for asset owners and facility managers. BIM, in particular, is considered as a potentially effective data pool for storing and managing project information during the building life cycle, providing a common data environment for stakeholder data and guaranteeing information availability and credibility at the handover stage. However, this data integration in a BIM environment has issues related to the establishment of an effective process to extract, store, manage, integrate, and distribute data to ensure interoperability. Furthermore, for the interoperability issue, an important challenge is the identification of which data are relevant, reliable, useful, and can add value to the AM processes. This research explored the asset owner requirements from BIM in the operation and maintenance stage from an AM perspective. The research aim was twofold: first, to synthesize the nongeometric BIM data required for AM and develop a relevant taxonomy; and second, to develop an application programming interface (API) plug-in for Autodesk Revit to implement the proposed taxonomy. To achieve the aims of this study, a critical review of previous literature and face-to-face and focus group interviews with BIM and facilities management (FM) experts were conducted. The main output was a 60-parameter asset-consuming energy information management (ACE-IM) taxonomy and the relevant API plug-in that can help BIM professionals to identify the required data to be submitted to facility managers to improve AM processes. © 2018 American Society of Civil Engineers.",Article,"Final",Scopus,2-s2.0-85044665526
"Chavarro D., Ràfols I., Tang P.","To what extent is inclusion in the Web of Science an indicator of journal 'quality'?",2018,"Research Evaluation",35,"https://www.scopus.com/inward/record.uri?eid=2-s2.0-85045526739&doi=10.1093%2freseval%2frvy001&partnerID=40&md5=cbc049175b6c30d94123bd66ed18649b","The assessment of research based on the journal in which it is published is a widely adopted practice. Some research assessments use the Web of Science (WoS) to identify 'high quality' journals, which are assumed to publish excellent research. The authority of WoS on journal quality stems from its selection of journals based on editorial standards and scientific impact criteria. These can be considered as universalistic criteria, meaning that they can be applied to any journal regardless of its place of publication, language, or discipline. In this article we examine the coverage by WoS of journals produced in Latin America, Spain, and Portugal. We use a logistic regression to examine the probability of a journal to be covered by WoS given universalistic criteria (editorial standards and scientific impact of the journal) and particularistic criteria (country, language, and discipline of the journal). We find that it is not possible to predict the inclusion of journals in WoS only through the universalistic criteria because particularistic variables such as country of the journal, its discipline, and language are strongly related to inclusion in WoS. We conclude that using WoS as a universalistic tool for research assessment can disadvantage science published in journals with adequate editorial standards and scientific merit. We discuss the implications of these findings within the research evaluation literature, specifically for countries and disciplines not extensively covered by WoS. ©The Author(s) 2018. Published by Oxford University Press. All rights reserved. For Permissions, please email: journals.permissions@oup.com.",Article,"Final",Scopus,2-s2.0-85045526739
"Zhong B., Gan C., Luo H., Xing X.","Ontology-based framework for building environmental monitoring and compliance checking under BIM environment",2018,"Building and Environment",34,"https://www.scopus.com/inward/record.uri?eid=2-s2.0-85047812304&doi=10.1016%2fj.buildenv.2018.05.046&partnerID=40&md5=eebdb7138900db4a2dd41bfcd30e8133","Building environmental monitoring and compliance checking are important in ensuring environmental performance. The information required for monitoring and checking is obtained from different data sources in different information systems. In this context, information sharing between stakeholders and the semantic interoperability that prevails with varying information systems are necessary. However, the implementation of information sharing and semantic interoperability can be a challenge. This paper proposes an ontology-based framework to support environmental monitoring and compliance checking under building information modeling (BIM) environment among different information systems. The framework integrates building information from BIM, environmental information provided by sensors, and regulatory information based on building regulations and design requirements. In this framework, four specific ontologies are developed to represent relevant knowledge. Building information is extracted from BIM and then converted, together with environmental information provided by sensors, into resource description framework format as ontology instances. The regulation clauses are transformed into SPARQL (SPARQL Protocol and RDF Query Language) rules. A case study is performed to apply the framework, and environmental monitoring and automated compliance checking are implemented in the context of a real distributed energy station project. The testing results validate the feasibility and effectiveness of the proposed framework. © 2018 Elsevier Ltd",Article,"Final",Scopus,2-s2.0-85047812304
"Wu H., Zuo J., Zillante G., Wang J., Yuan H.","Construction and demolition waste research: a bibliometric analysis",2019,"Architectural Science Review",29,"https://www.scopus.com/inward/record.uri?eid=2-s2.0-85069933206&doi=10.1080%2f00038628.2018.1564646&partnerID=40&md5=b587389c886dba41d0eb9dae06f1a54a","Although construction and demolition (C&D) waste has drawn increasing attention from scholars, there is a lack of study to summarize the latest development of C&D waste research. By using a bibliometric analysis method, this study carries out a holistic review of C&D waste articles published from 1994 to 2017. It shows that the number of C&D waste articles has risen eight-times within the period. This study also demonstrates the social networks among the authors, countries, and organizations. Based on the keywords cluster analysis, the C&D waste research can be divided into five clusters, including (1) environmental concerns of C&D waste; (2) recyclability of C&D waste; (3) performance and behaviour tests of recycled products; (4) C&D waste management; and (5) C&D waste with industrial ecology. Meanwhile, the research status and future directions are discussed as well. The results would be valuable for understanding the streams and trends in C&D waste research. © 2019, © 2019 Informa UK Limited, trading as Taylor & Francis Group.",Review,"Final",Scopus,2-s2.0-85069933206
"Ganbat T., Chong H.-Y., Liao P.-C., Wu Y.-D.","A Bibliometric Review on Risk Management and Building Information Modeling for International Construction",2018,"Advances in Civil Engineering",29,"https://www.scopus.com/inward/record.uri?eid=2-s2.0-85045423420&doi=10.1155%2f2018%2f8351679&partnerID=40&md5=31cba0956c77953d98fa05ee0337f8c5","International construction is complicated and involves high risks. However, with the development of technological innovation, Building Information Modeling (BIM) emerged and seems to be able to address certain risks. To understand BIM applications in risk management for international construction, a state-of-the-art review is required. Therefore, this paper aims to identify the research trends and opportunities for risk management in BIM-enabled international construction by reviewing 526 peer-reviewed journal articles for the years 2007-2017. Thus five steps of bibliometric analysis were conducted based on the proposed frameworks of BIM risk management in international construction (BIM-RM-INTL). The results show that the popularization of BIM not only attracts all stakeholders' interests but also brings some risks. For example, financial factors are hard to detect and control through BIM, information loss during transmission stands out, and BIM has no unified standards and regulations for international construction. The research has mapped existing research results and their relationships for future risk management in BIM-enabled international construction. © 2018 Tsenguun Ganbat et al.",Review,"Final",Scopus,2-s2.0-85045423420
"Holzer D.","The BIM manager's handbook",2016,"BIM manager's handbook",29,,[No abstract available],,"Final",Scopus,2-s2.0-85011274928
"Akinlolu M., Haupt T.C., Edwards D.J., Simpeh F.","A bibliometric review of the status and emerging research trends in construction safety management technologies",2020,"International Journal of Construction Management",27,"https://www.scopus.com/inward/record.uri?eid=2-s2.0-85091098381&doi=10.1080%2f15623599.2020.1819584&partnerID=40&md5=bcbb7c119fc5ec2984a3abf647e7448f","Technologies such as virtual reality (VR), online databases, Geographic Information Systems (GIS), Building Information Modelling (BIM), Unmanned Aerial Vehicle (UAV), 4 D Computer-Aided Design (4 D CAD), wearable robotics have been adopted to improve construction site health and safety. However, little attempt has been made to map global research on construction health and safety technologies. Therefore, this paper conducts a review of technologies for construction health and safety management to reveal emerging research trends. A bibliometric review adopting a two-step literature selection method was conducted to compile relevant publications from the Scopus database. In total, 240 related papers were examined. VOSviewer was used to develop a co-occurrence network based on the bibliographic data obtained. The analysis focussed on co-authorship per country, country/region distribution, the number of publications annually, publication source and source and trend of research topics. Findings revealed that emerging trends in construction health and safety technologies research focussed on project health and safety design and planning, visualisation and image processing for construction projects, digital technologies for project monitoring, information management and Internet of Things, automation and robotic systems, health and safety and accident prevention and structure evaluation. © 2020 Informa UK Limited, trading as Taylor & Francis Group.",Article,"Article in Press",Scopus,2-s2.0-85091098381
"Georgiadou M.C.","An overview of benefits and challenges of building information modelling (BIM) adoption in UK residential projects",2019,"Construction Innovation",27,"https://www.scopus.com/inward/record.uri?eid=2-s2.0-85066836630&doi=10.1108%2fCI-04-2017-0030&partnerID=40&md5=9038851d6b2a4a183c8f247882eabb09","Purpose: This paper aims to present a state-of-the-art review of building information modelling (BIM) in the UK construction practice. In particular, the aim is to examine the scope, value and practical implications of BIM implementation in residential projects by evaluating practitioners’ perspectives working in the Greater London Area (GLA). Design/methodology/approach: The paper outlines the general status quo of BIM adoption and maturity in the UK. It then discusses the feasibility of BIM use in residential projects drawing on an online survey and complementary semi-structured interviews with building professionals. The cross-comparison between the evidence base and literature review uncovers the specific benefits, challenges and risks to BIM implementation in the house building sector. Findings: BIM is an evaluation methodology that helps the management of digital information throughout the project lifecycle. At a conceptual level, a BIM-enabled project offers quality assurance and on-time delivery, collaboration and communication improvement, visual representation and clash detection and whole lifecycle value. The findings, however, suggest that the most frequently reported benefits are related to collaboration and the blend of product (software) and process innovation, whilst lifecycle thinking and waste reduction are often overlooked. At present, there is widespread awareness on BIM but with a financial barrier to invest in developing digital capabilities, particularly for small- and medium-sized enterprises. Practical implications: The paper concludes with a critical commentary on the lack of strategic leadership in both the supply and demand side. The role of policy to streamline commercial drivers for whole lifecycle costing in procurement is endorsed to drive the change management required to address the short-term mind-set of senior management and wider fragmentation of the construction industry, also serving as a research question for further research and development in the field. Originality/value: There are relatively few studies evaluating BIM perspectives in UK residential projects. This paper explores the feasibility and “real-life” value of BIM in housing practice, drawing on views and experiences of building professionals in GLA. In particular, the research findings provide an evidence base evaluating the extent to which the house building industry has the expertise and capability to operate in a BIM environment and to comply with the Level 2 mandate and explore which of the generic barriers and drivers of BIM-readiness are more relevant to the design and construction of housing projects. © 2019, Emerald Publishing Limited.",Article,"Final",Scopus,2-s2.0-85066836630
"Wu J., Zhang J.","New Automated BIM Object Classification Method to Support BIM Interoperability",2019,"Journal of Computing in Civil Engineering",26,"https://www.scopus.com/inward/record.uri?eid=2-s2.0-85069052731&doi=10.1061%2f%28ASCE%29CP.1943-5487.0000858&partnerID=40&md5=0fabfc74ae7d5d9521f038db1298e046","Industry Foundation Classes (IFC) is widely accepted as the future of building information modeling (BIM) to take on the challenge of BIM interoperability and enable its support of various automation tasks. However, it is not uncommon to see misuses of IFC entities during the creation of BIM. Such misuses prevent a successful automation of BIM-supported tasks because misclassification of objects in BIM can lead to significant negative consequences in downstream applications due to incorrect semantic information provided. To address this problem, the authors propose a new data-driven, iterative method that can be used to develop an algorithm to automatically classify each object in an IFC model into predefined categories. The algorithm consists of multiple subalgorithms with each subalgorithm depicting a pattern matching rule that uses inherent features of the geometric representation of an architecture, engineering, and construction (AEC) object. The method was tested in an experiment in which IFC models from three different sources were collected and 1,891 AEC objects were extracted and divided into training and testing data for use. By comparing the classification results of the algorithm developed based on training data and applied to testing data with a manually developed gold standard, 84.45% recall and 85.20% precision were achieved in common building element categories, and 100% recall and precision were achieved in detailed beam categories. The sources of errors were found to be (1) different objects sharing the same geometric shape and (2) uncovered geometric shape representation in the training data. By adding locational information into consideration in addition to geometric information and making sure training data covers all geometric shape representations, 100% precision and recall can be achieved for all categories. © 2019 American Society of Civil Engineers.",Article,"Final",Scopus,2-s2.0-85069052731
"Lozano S., Calzada-Infante L., Adenso-Díaz B., García S.","Complex network analysis of keywords co-occurrence in the recent efficiency analysis literature",2019,"Scientometrics",26,"https://www.scopus.com/inward/record.uri?eid=2-s2.0-85067278478&doi=10.1007%2fs11192-019-03132-w&partnerID=40&md5=e3ee4651aa2a073298a71cad0e5a1f14","A network analysis (NA) of keyword co-occurrences for a broad collection of Data envelopment analysis (DEA) papers in the period 2008–2017 is carried out. The raw keywords have been cleaned up and standardized to consolidate and increase the consistency of the keywords. The resulting network has been characterized using network-level as well as node-level NA measures. Although the size of the network steadily increases with time, the average path length does not, showing its small world character. The disassortativity of the network indicates that the keywords used in a given paper generally include one or more common, frequently-used terms plus other less common terms that refer to the specific context of the research. The evolving nature of the keyword network is highlighted with some DEA keywords staying at the top of the ranking during the whole period and other emerging topics significantly increasing their strength during this period. The community structure of the network, which reflects the field’s knowledge structure, is also presented. The identified communities generally include specific DEA methodology terms, linked with corresponding application areas as well as with some geographical references. Also, the ego-network of some sample keywords is shown, and some research gaps in DEA are identified. © 2019, Akadémiai Kiadó, Budapest, Hungary.",Article,"Final",Scopus,2-s2.0-85067278478
"Olanrewaju O.I., Chileshe N., Babarinde S.A., Sandanayake M.","Investigating the barriers to building information modeling (BIM) implementation within the Nigerian construction industry",2020,"Engineering, Construction and Architectural Management",25,"https://www.scopus.com/inward/record.uri?eid=2-s2.0-85084532001&doi=10.1108%2fECAM-01-2020-0042&partnerID=40&md5=0c31f9041f5f715f1162998d36b0720e","Purpose: The purpose of this paper is to identify and assess the perceptions of constructional professionals on barriers to implementation of building information modeling (BIM) within the Nigerian construction industry. Design/methodology/approach: A scoping literature review was conducted to identify the fourteen barriers to implementation of BIM, which were employed to design a questionnaire survey. Data collected were analyzed using descriptive statistics, mean score, Kruskal–Wallis test, analysis of variance and multivariate techniques such as factor analysis. Findings: The descriptive and empirical analysis demonstrated a disparity of ranking of the 14 barriers factors among the groups; however no statistically significant differences among the 14 barriers to BIM. Based on the mean score ranking results, only three (out of 14) barriers are identified as critical (mean score greater than 3.5): few studies available on BIM and lack of knowledge, inexistence or inadequate government policies, and high cost of implementation. The results of the one-sample t-tests show that they were statistically significant differences in 10 out of 14 barriers as follows: few studies available on BIM and lack of knowledge, lack of demand for use and acceptance of BIM, inadequate contractual coordination, lack of specified standards, cost of data and information sharing, technological availability issues, reluctance of other stakeholders, business and cultural changes, data and intellectual property issues, and interoperability issues. The study, through factor analysis, categorized the fourteen barriers to BIM implementation into four principal factors. The factors are: technology and business-related barriers; training and people-related barriers; cost and standards-related barriers; and process and economic-related barriers. Practical implications: The identification and assessment of the key barriers to BIM implementation would be useful for the construction professionals and other stakeholder of the construction industry with the view to advance BIM adoption in Nigeria. This could also be extended to other developing countries through considerations of the local economic conditions, given the status of BIM as being in the germinating stage of development in Africa. Originality/value: The study provides insights on the barriers to BIM implementation across the Nigerian construction sector environments. The innovative aspect of the study is the identification of the ordered and grouped (composite) set of barriers to BIM which could be used to developing appropriate mitigating solutions. © 2020, Emerald Publishing Limited.",Article,"Final",Scopus,2-s2.0-85084532001
"Alizadeh Salehi S., Yitmen İ.","Modeling and analysis of the impact of BIM-based field data capturing technologies on automated construction progress monitoring",2018,"International Journal of Civil Engineering",24,"https://www.scopus.com/inward/record.uri?eid=2-s2.0-85053529175&doi=10.1007%2fs40999-018-0320-1&partnerID=40&md5=390b76b460b128de8dc341ddd043a58c","Leveraging automated field data capturing technologies and Building Information Modeling (BIM) for site status analysis would play a more significant role in advancing decision-making in construction projects if applied to the traditional progress control. Despite the numerous advances in project progress control technologies, 3D modeling, and BIM execution, there is still a lack of awareness regarding the impact of these technologies on the overall performance of the projects, leading to the use of time-consuming and ineffective monitoring processes by the companies. For this reason, this study proposes a model for BIM-based field data capturing technologies and analyses the impact of field data capturing technologies on automated project progress monitoring comparing 3D model and BIM workflows. The empirical data were collected through a computerized self-administered questionnaire (CSAQ) survey conducted to contracting and engineering consulting companies operating in the Middle East, Mid-Asia, Europe, North America, and the Far East. The structural equation modeling (SEM) method was used to test the hypotheses and develop the skill model. The study confirms the importance of using field data capturing technologies with BIM in two main stages (modeling and execution) to enhance automated project progress monitoring performance. The study highlights the need for further exploration of the role of BIM-based field data capturing technologies in improving automated construction project progress monitoring. © 2018, Iran University of Science and Technology.",Article,"Final",Scopus,2-s2.0-85053529175
"Liang H., Zhang S., Su Y.","The structure and emerging trends of construction safety management research: a bibliometric review",2020,"International Journal of Occupational Safety and Ergonomics",21,"https://www.scopus.com/inward/record.uri?eid=2-s2.0-85044521151&doi=10.1080%2f10803548.2018.1444565&partnerID=40&md5=555e32f89786444ccf78e7cf130b199e","Recently, construction safety management (CSM) practices and systems have become important topics for stakeholders to take care of human resources. However, few studies have attempted to map the global research on CSM. A comprehensive bibliometric review was conducted in this study based on multiple methods. In total, 1172 CSM-related papers from the Web of Science Core Collection database were examined. The analyses focused on publication year, country–institute, publication source, author and research topics. The results indicated that the USA, China, Australia and the UK took leading positions in CSM research. Two branches of journals were identified, namely the branch of engineering science and that of safety science and social science. Additionally, seven themes together with 28 specific topics were detected to allow researchers to track the main structure and temporal evolution of CSM research. Finally, the main research trends and potential research directions were discussed to guide the future research. © 2018, © 2018 Central Institute for Labour Protection–National Research Institute (CIOP-PIB).",Article,"Final",Scopus,2-s2.0-85044521151
