Authors,Title,Year,Source title,Cited by,Link,Abstract,Document Type,Publication Stage,Source,EID
"van Eck N.J., Waltman L.","Software survey: VOSviewer, a computer program for bibliometric mapping",2010,"Scientometrics",3554,"https://www.scopus.com/inward/record.uri?eid=2-s2.0-77953711904&doi=10.1007%2fs11192-009-0146-3&partnerID=40&md5=77f9212dfdeda81adc0aafa9766aa55b","We present VOSviewer, a freely available computer program that we have developed for constructing and viewing bibliometric maps. Unlike most computer programs that are used for bibliometric mapping, VOSviewer pays special attention to the graphical representation of bibliometric maps. The functionality of VOSviewer is especially useful for displaying large bibliometric maps in an easy-to-interpret way. The paper consists of three parts. In the first part, an overview of VOSviewer's functionality for displaying bibliometric maps is provided. In the second part, the technical implementation of specific parts of the program is discussed. Finally, in the third part, VOSviewer's ability to handle large maps is demonstrated by using the program to construct and display a co-citation map of 5,000 major scientific journals. © 2009 The Author(s).",Article,"Final",Scopus,2-s2.0-77953711904
"Pritchard A.","Statistical bibliography or bibliometrics?",1969,"Journal of Documentation",1414,,[No abstract available],,"Final",Scopus,2-s2.0-0000696527
"Azhar S.","Building information modeling (BIM): Trends, benefits, risks, and challenges for the AEC industry",2011,"Leadership and Management in Engineering",982,"https://www.scopus.com/inward/record.uri?eid=2-s2.0-79960269657&doi=10.1061%2f%28ASCE%29LM.1943-5630.0000127&partnerID=40&md5=84ab73626fd5089c413d919fca41f7fe","Building information modeling (BIM) is one of the most promising recent developments in the architecture, engineering, and construction (AEC) industry. With BIM technology, an accurate virtual model of a building is digitally constructed. This model, known as a building information model, can be used for planning, design, construction, and operation of the facility. It helps architects, engineers, and constructors visualize what is to be built in a simulated environment to identify any potential design, construction, or operational issues. BIM represents a new paradigm within AEC, one that encourages integration of the roles of all stakeholders on a project. In this paper, current trends, benefits, possible risks, and future challenges of BIM for the AEC industry are discussed. The findings of this study provide useful information for AEC industry practitioners considering implementing BIM technology in their projects. © 2011 American Society of Civil Engineers.",Article,"Final",Scopus,2-s2.0-79960269657
"Van Eck N.J., Waltman L.","Visualizing bibliometric networks",2014,"Measuring scholarly impact: Methods and practice",895,,[No abstract available],,"Final",Scopus,2-s2.0-84929693891
"Hotho A., Nürnberger A., Paaß G.","A brief survey of text mining",2005,"LDV Forum",489,,[No abstract available],,"Final",Scopus,2-s2.0-33846589319
"Melin G., Persson O.","Studying research collaboration using co-authorships",1996,"Scientometrics",409,"https://www.scopus.com/inward/record.uri?eid=2-s2.0-0000137207&doi=10.1007%2fBF02129600&partnerID=40&md5=314e43a316921f2e85e3a1f074f24a10","Scientific collaboration has become a major issue in science policy. The tremendous growth of collaboration among nations and research institutions witnessed during the last twenty years is a function of the internal dynamics of science as well as science policy initiatives. The need to survey and follow up the collaboration issue calls for statistical indicators sensitive enough to reveal the structure and change of collaborative networks. In this context, bibliometric analysis of co-authored scientific articles is one promising approach. This paper discusses the relationship between collaboration and co-authorship, the nature of bibliometric data, and exemplifies how they can be refined and used to analyse various aspects of collaboration.",Article,"Final",Scopus,2-s2.0-0000137207
"Blayse A.M., Manley K.","Key influences on construction innovation",2004,"Construction Innovation",363,"https://www.scopus.com/inward/record.uri?eid=2-s2.0-84992985871&doi=10.1108%2f14714170410815060&partnerID=40&md5=4912e602ff119c6255dcce844a25b809","The goal of this paper is to identify the main factors driving or hindering construction innovation. An analysis of the relevant literature indicates there are six primary influences: (1) clients and manufacturers; (2) the structure of production; (3) relationships between individuals and firms within the industry and between the industry and externalparties; (4) procurement systems; (5) regulations/standards; and (6) the nature and quality of organizational resources. Attention to these factors by businesses and public policy makers would be a key component of effective innovation strategy and policy. Further research is needed, however, to explore the relationships between innovation influences, and between innovation influences and other aspects of business strategy and environment, in the context of broader societal considerations. Further research should also identify quantitative estimates of the impact of innovation on the construction industry. © 2004, Emerald Group Publishing Limited",Article,"Final",Scopus,2-s2.0-84992985871
"Ghaffarianhoseini A., Tookey J., Ghaffarianhoseini A., Naismith N., Azhar S., Efimova O., Raahemifar K.","Building Information Modelling (BIM) uptake: Clear benefits, understanding its implementation, risks and challenges",2017,"Renewable and Sustainable Energy Reviews",246,"https://www.scopus.com/inward/record.uri?eid=2-s2.0-85007486750&doi=10.1016%2fj.rser.2016.11.083&partnerID=40&md5=acc5ce7792ddc7785d49b1de126b9046","Rapid advancement of technology continues to leverage change and innovation in the construction industry. Continued digitization of the industry offers the opportunity to totally reinvent contemporary construction design and delivery practice for future development. Building Information Modelling (BIM) within the context of Architecture, Engineering & Construction (AEC) has been developing since the early 2000s and is considered to be a key technology. Despite major technical advancements in BIM, it has not been fully adopted and its definitive benefits have not been fully capitalized upon by industry stakeholders. The lack of widespread uptake of BIM appears to be linked to the risks and challenges that are potentially impeding its effectiveness. This paper aims to discuss the reality of BIM, its widespread benefits and current level of uptake. The risks and challenges associated with the adoption of BIM, as well as recommendations regarding how future BIM adoption could be developed are also highlighted. © 2016 Elsevier Ltd",Review,"Final",Scopus,2-s2.0-85007486750
"Liu Y., van Nederveen S., Hertogh M.","Understanding effects of BIM on collaborative design and constructionAn empirical study in China",2017,"International Journal of Project Management",167,"https://www.scopus.com/inward/record.uri?eid=2-s2.0-84978915498&doi=10.1016%2fj.ijproman.2016.06.007&partnerID=40&md5=20cfc69bfa6186e9e51776475172ab86","In construction projects, Building Information Modeling (BIM) influences on the common way of collaboration, including the roles of different participants. The goal of this research is to explore current practices and identify the critical effects of BIM on collaborative design and construction. Through a focus group discussion and interviews with BIM related participants, we explored project professions' understandings of BIM implementation on collaborative design and construction and adopted the grounded theory to analyze the qualitative data. Eight concepts influencing the development of BIM collaboration are identified and classified(1) IT capacity, (2) technology management, (3) attitude and behavior, (4) role-taking, (5) trust, (6) communication, (7) leadership, (8) learning and experience. We discussed the taxonomy of BIM effects into three dimensionstechnology, people and process. Our findings provide empirical insights into the collaborative nature of BIM construction projects and highlight the importance of collaboration within project teams in BIM project delivery. © 2016 Elsevier Ltd, APM and IPMA",Article,"Final",Scopus,2-s2.0-84978915498
"Santos R., Costa A.A., Grilo A.","Bibliometric analysis and review of Building Information Modelling literature published between 2005 and 2015",2017,"Automation in Construction",159,"https://www.scopus.com/inward/record.uri?eid=2-s2.0-85015428366&doi=10.1016%2fj.autcon.2017.03.005&partnerID=40&md5=3d773f3b09a542379b7fd5f0e07ba806","The use of Building Information Modelling (BIM) has increased in recent years, mostly due to the potential of the methodology for improving construction project performance and efficiency. With a view to achieving a better understanding of the research work on this subject, this paper conducts a bibliometric analysis and a review of existing literature on BIM focusing on the last decade. The authors selected the articles published in journals with an impact factor higher then 1.0, as well as the top 100 most cited articles. The search resulted on 381 articles, which were then categorised in order to systematise the research conducted over the years. The authors have not only analysed the existing literature but also highlighted new emerging fields in BIM research, being possible to identify Collaborative Environments and Interoperability, Sustainable Construction, BIM Adoption & Standardisation, and BIM Programming as the categories with the most significant growth in the last years. It was also observed that the most researched topics were related with the development of BIM tools, the study of BIM adoption worldwide, the energy simulation using BIM-based information and, more recently, with the semantic interoperability and ontology. On the other hand, the study on BIM at the academic level is very small, as well as parametric modelling and quantity take-off. © 2017 Elsevier B.V.",Review,"Final",Scopus,2-s2.0-85015428366
"Van Eck N.J., Waltman L.","Text Mining and Visualization Using VOSviewer",2011,"Text Mining and Visualization Using VOSviewer",143,,[No abstract available],,"Final",Scopus,2-s2.0-85013630398
"Li K., Rollins J., Yan E.","Web of Science use in published research and review papers 1997–2017: a selective, dynamic, cross-domain, content-based analysis",2018,"Scientometrics",118,"https://www.scopus.com/inward/record.uri?eid=2-s2.0-85038404199&doi=10.1007%2fs11192-017-2622-5&partnerID=40&md5=dd5493522268856a6de4e94ed9f304aa","Clarivate Analytics’s Web of Science (WoS) is the world’s leading scientific citation search and analytical information platform. It is used as both a research tool supporting a broad array of scientific tasks across diverse knowledge domains as well as a dataset for large-scale data-intensive studies. WoS has been used in thousands of published academic studies over the past 20 years. It is also the most enduring commercial legacy of Eugene Garfield. Despite the central position WoS holds in contemporary research, the quantitative impact of WoS has not been previously examined by rigorous scientific studies. To better understand how this key piece of Eugene Garfield’s heritage has contributed to science, we investigated the ways in which WoS (and associated products and features) is mentioned in a sample of 19,478 English-language research and review papers published between 1997 and 2017, as indexed in WoS databases. We offered descriptive analyses of the distribution of the papers across countries, institutions and knowledge domains. We also used natural language processingtechniques to identify the verbs and nouns in the abstracts of these papers that are grammatically connected to WoS-related phrases. This is the first study to empirically investigate the documentation of the use of the WoS platform in published academic papers in both scientometric and linguistic terms. © 2017, The Author(s).",Article,"Final",Scopus,2-s2.0-85038404199
"Zhang F., Fleyeh H., Wang X., Lu M.","Construction site accident analysis using text mining and natural language processing techniques",2019,"Automation in Construction",101,"https://www.scopus.com/inward/record.uri?eid=2-s2.0-85058940383&doi=10.1016%2fj.autcon.2018.12.016&partnerID=40&md5=6c89d863b6d7c565d8758ea5f2734665","Workplace safety is a major concern in many countries. Among various industries, construction sector is identified as the most hazardous work place. Construction accidents not only cause human sufferings but also result in huge financial loss. To prevent reoccurrence of similar accidents in the future and make scientific risk control plans, analysis of accidents is essential. In construction industry, fatality and catastrophe investigation summary reports are available for the past accidents. In this study, text mining and natural language process (NLP) techniques are applied to analyze the construction accident reports. To be more specific, five baseline models, support vector machine (SVM), linear regression (LR), K-nearest neighbor (KNN), decision tree (DT), Naive Bayes (NB) and an ensemble model are proposed to classify the causes of the accidents. Besides, Sequential Quadratic Programming (SQP) algorithm is utilized to optimize weight of each classifier involved in the ensemble model. Experiment results show that the optimized ensemble model outperforms rest models considered in this study in terms of average weighted F1 score. The result also shows that the proposed approach is more robust to cases of low support. Moreover, an unsupervised chunking approach is proposed to extract common objects which cause the accidents based on grammar rules identified in the reports. As harmful objects are one of the major factors leading to construction accidents, identifying such objects is extremely helpful to mitigate potential risks. Certain limitations of the proposed methods are discussed and suggestions and future improvements are provided. © 2018 Elsevier B.V.",Article,"Final",Scopus,2-s2.0-85058940383
"Weiss S.M., Indurkhya N., Zhang T., Damerau F.","Text mining: Predictive methods for analyzing unstructured information[J]",2010,"Text Mining: Predictive Methods for Analyzing Unstructured Information",101,,[No abstract available],,"Final",Scopus,2-s2.0-33749030359
"Zhao X., Zuo J., Wu G., Huang C.","A bibliometric review of green building research 2000–2016",2019,"Architectural Science Review",92,"https://www.scopus.com/inward/record.uri?eid=2-s2.0-85058335958&doi=10.1080%2f00038628.2018.1485548&partnerID=40&md5=a605d61fc933acfbc09112b9be4883a8","This study presents a summary of green building research through a bibliometric approach. A total of 2980 articles published in 2000–2016 were reviewed and analyzed. The results indicated that green building research had been concentrated on the subject categories of engineering, environmental sciences & ecology, and construction & building technology, and the keywords ‘building envelope’ and ‘living wall’ obtained citation bursts in the recent years. Additionally, based on the cluster analysis and content analysis, the hot research topics were identified: green and cool roof, vertical greening systems, water efficiency, occupants’ comfort and satisfaction, financial benefits of green building, life cycle assessment and rating systems, green retrofit, green building project delivery, and information and communication technologies in green building. Knowledge gaps were detected in the areas of corporate social responsibility, the validation of real performance of green building, the ICT application in green building, as well as the safety and health risks in the construction process of green projects. Future research directions are recommended to fill these gaps and extend the body of green building research. © 2018, © 2018 Informa UK Limited, trading as Taylor & Francis Group.",Review,"Final",Scopus,2-s2.0-85058335958
"Xiang C., Wang Y., Liu H.","A scientometrics review on nonpoint source pollution research",2017,"Ecological Engineering",74,"https://www.scopus.com/inward/record.uri?eid=2-s2.0-84997764808&doi=10.1016%2fj.ecoleng.2016.11.028&partnerID=40&md5=8887cd179156874b92e1fb8c30fad7be","The purpose of this paper is to make insights into certain characteristics of nonpoint source pollution research, and consequently to show the global trends as well as assist researchers to establish future research directions. Based on the SCI-E and SSCI databases, 3246 journal articles on nonpoint source pollution were retrieved from 2001 to 2015. Nonpoint source pollution research maintained steady growth in the past 15 years. Among all countries, USA was the most active contributor with the most publications and cooperation. As for institutions, Chinese Academy of Sciences ranked first with 143 articles, and USDA-ARS in USA played a key role for intimate collaboration with other institutions. And most articles were recorded by Environmental Sciences & Ecology, Environmental Sciences and Water Resources. Further, Journal of Environmental Quality and Water Research were the most productive and influential journals, respectively. Based on keyword co-word and reference co-citation analysis by Citespace, nonpoint source pollution research includes multiple areas (control measures, modeling, pollutants, research regions and technologies). And future researches on nonpoint source pollution will likely focus on SWAT application, GIS and ecological measures. © 2016 Elsevier B.V.",Article,"Final",Scopus,2-s2.0-84997764808
"E Fonseca B.P.F., Sampaio R.B., Fonseca M.V.A., Zicker F.","Co-authorship network analysis in health research: Method and potential use",2016,"Health Research Policy and Systems",72,"https://www.scopus.com/inward/record.uri?eid=2-s2.0-85007483009&doi=10.1186%2fs12961-016-0104-5&partnerID=40&md5=b8d0896435b6fc6b0bfd30944e399fdb","Scientific collaboration networks are a hallmark of contemporary academic research. Researchers are no longer independent players, but members of teams that bring together complementary skills and multidisciplinary approaches around common goals. Social network analysis and co-authorship networks are increasingly used as powerful tools to assess collaboration trends and to identify leading scientists and organizations. The analysis reveals the social structure of the networks by identifying actors and their connections. This article reviews the method and potential applications of co-authorship network analysis in health. The basic steps for conducting co-authorship studies in health research are described and common network metrics are presented. The application of the method is exemplified by an overview of the global research network for Chikungunya virus vaccines. � 2016 Fonseca et al.",Review,"Final",Scopus,2-s2.0-85007483009
"Hanisch B., Wald A.","A bibliometric view on the use of contingency theory in project management research",2012,"Project Management Journal",72,"https://www.scopus.com/inward/record.uri?eid=2-s2.0-84861116750&doi=10.1002%2fpmj.21267&partnerID=40&md5=a95a3964fb05ba064d436ee151e2045b","Contingency theory has influenced organization theory since the 1950s. Project management research has only recently started to consider context factors. In this area, applications of contingency theory still represent a fragmented field with a nonuniform use of terminology. Fully utilizing the contingency theory approach requires a systematic foundation. This article presents an overview of contingency theory in both permanent and temporary organizations. In a bibliometric study based on 1,622 articles from four academic project management journals, we identify dominating authors, prevalent keywords, and different focal areas in project contingency theory as well as the most researched project types. © 2012 Project Management Institute.",Article,"Final",Scopus,2-s2.0-84861116750
"Olawumi T.O., Chan D.W.M., Wong J.K.W.","Evolution in the intellectual structure of BIM research: a bibliometric analysis",2017,"Journal of Civil Engineering and Management",66,"https://www.scopus.com/inward/record.uri?eid=2-s2.0-85038832984&doi=10.3846%2f13923730.2017.1374301&partnerID=40&md5=0ca0132d0d6950b40496438691f15eb4","Building Information Modelling (BIM) processes have continued to gain relevance in the Architectural, Engineering, and Construction (AEC) industry with more resources directed toward it. This study conducts a bibliometric analysis of 445 BIM articles to investigate and understand the pattern of BIM research which include defining BIM research categories, evaluating the project sectors that are influenced by BIM, and tracking the funding structure of BIM research. A network map that displays a visualization of the structure of BIM literature by research origin, funding structure and geographical scope was designed. None of the previous reviews of literature analyzed the BIM articles’ corpus to such level and depth. The findings revealed research categories such as construction and project management and BIM learning, adoption & practice as the core research areas in BIM and highlighted trending research themes in BIM research. Authors based in Asia and Europe received more research grants than their counterparts in other regions; likewise, two-third of the articles was authored by academics in the United States, Korea, and the United Kingdom. The study provides its readers with relevant research areas that require considerations, and the discussion of selected research areas provides an extensive understanding of salient BIM fields. © 2017 Vilnius Gediminas Technical University (VGTU) Press.",Review,"Final",Scopus,2-s2.0-85038832984
"Guo Y.-M., Huang Z.-L., Guo J., Li H., Guo X.-R., Nkeli M.J.","Bibliometric analysis on smart cities research",2019,"Sustainability (Switzerland)",60,"https://www.scopus.com/inward/record.uri?eid=2-s2.0-85068734988&doi=10.3390%2fsu11133606&partnerID=40&md5=a9247d980815564ca6bbadef994610b5","Smart cities have been a global concern in recent years, involving comprehensive scientific research. To obtain a structural overview and assist researchers in making insights into the characteristics of smart cities research, bibliometric analysis was carried out in this paper. With the application of the bibliometric analysis software VOSviewer and CiteSpace, 4409 smart cities were identified by the core collection of the Web of Science in publications between 1998 and 2019 and used in the analysis of this paper. Concretely, this research visually demonstrates a comprehensive overview of the field relating to smart cities in terms of the production of regular publications, main domain of smart cities researchers, most influential countries (institutions, sources and authors), and interesting research directions in the smart city researches. We also present the research collaboration among countries (regions), organizations and authors based on a series of cooperation analyses. The bibliometric analysis of the existing work provided a valuable and seminal reference for researchers and practitioners in smart cities-related research communities. © 2019 by the authors.",Article,"Final",Scopus,2-s2.0-85068734988
"Saka A.B., Chan D.W.M.","A scientometric review and metasynthesis of building information modelling (BIM) research in Africa",2019,"Buildings",44,"https://www.scopus.com/inward/record.uri?eid=2-s2.0-85065927901&doi=10.3390%2fbuildings9040085&partnerID=40&md5=9f25b193d76e91540fce795f104e3041","Building Information Modelling (BIM) has been gaining widespread adoption in the Architecture, Engineering, and Construction (AEC) industry across the globe. Consequently, several research studies have attempted to construct a holistic review of the increasing BIM publications to identify the development trend using manual review, scientometric review, bibliometric review, or latent semantic review. These extant studies have often adopted a global view of the development despite the adoption of BIM varying across firms, countries, and continents. This approach is often regarded as not representative of the BIM development in countries and continents at the infancy stage. As BIM is still at the germinating stage of development in Africa and previous reviews are unrepresentative of BIM development in the AEC industry of Africa. This paper aims to present a scientometric review and metasynthesis of BIM development in the African AEC industry to explore the intellectual evolution of BIM, the status quo of BIM across the regions, and any potential barriers hindering BIM proliferation. The review findings revealed a varying level of BIM growth, with North Africa,West Africa, and Southern Africa leading the research development, whilst East Africa and Central Africa are slightly lagging behind. Additionally, the major challenges facing BIM adoption was found as people/process-related barriers. This study has provided valuable insights into BIM development and application in the growing African AEC industry. © 2019 by the authors.",Review,"Final",Scopus,2-s2.0-85065927901
