Authors,Title,Year,Source title,Cited by,Link,Abstract,Document Type,Publication Stage,Source,EID
"Rausch C., Nahangi M., Haas C., Liang W.","Monte Carlo simulation for tolerance analysis in prefabrication and offsite construction",2019,"Automation in Construction",24,"https://www.scopus.com/inward/record.uri?eid=2-s2.0-85063933117&doi=10.1016%2fj.autcon.2019.03.026&partnerID=40&md5=ab50b341510e96c1db179533e606d1b9","Producing assemblies that experience little to no rework during assembly fit-up is a perennial challenge in offsite construction. While the traditional response has been to solve geometric issues onsite at the expense of large rework costs, manufacturing optimisation techniques can mitigate these issues upstream. Tolerance analysis is one such method that is widely used in manufacturing to predict if problems will occur from the accumulation of tolerances and dimensional variability. This article demonstrates Monte Carlo tolerance simulation on a prefabricated construction assembly, where variations up to 37 mm are identified compared to as-built deviations which range up to 30 mm. Process optimisation is also explored, where risk of rework related to dimensional variability is reduced by 65.6% through selection of alternate fabrication processes. To compare the Monte Carlo method to traditional analysis methods, a simplified 1-D tolerance analysis is used. Compared to an as-built deviation of roughly 11 mm, the Monte Carlo method produces a conservative value of 15.4 mm, while other traditional methods are either overly conservative (worst-case tolerance chain has a deviation of 19.8 mm), or overly ambitious (root sum square tolerance chain has a deviation of 4.6 mm). Tolerance analysis through Monte Carlo simulation is shown to be a proactive design tool with several key advantages for prefabricated and offsite construction. First, complex three-dimensional geometric interactions can be readily modelled using very basic tolerance configurations. Secondly, potential misalignments at key connection points can be identified and quantified in terms of a probability distribution of variation. Finally, design improvements can be achieved by comparing alternate construction processes to mitigate the risk of assembly rework. © 2019 Elsevier B.V.",Article,"Final",Scopus,2-s2.0-85063933117
"Block P., Van Mele T., Liew A., DeJong M., Escobedo D., Ochsendorf J.","Structural design, fabrication and construction of the Armadillo vault",2018,"Structural Engineer",18,"https://www.scopus.com/inward/record.uri?eid=2-s2.0-85046539741&partnerID=40&md5=f3f46e73b1ee9c715303eccdc83dc9db","The Armadillo vault, exhibited at the 2016 Venice Architecture Biennale and commended at the 2017 Structural Awards, is a doubly curved, unreinforced, cut-stone, compression-only vault, constructed from 399 limestone blocks. The thickness of the stone varies from 8-12cm at the supports to 5cm at the peak. With a height of 4.4m and spans of over 15m, the structure has a thickness-to-span ratio half that of an eggshell. This paper describes the form-finding process and detailed structural analysis. Steel supports were designed to take the reaction thrusts of the vault and transfer them safely to both the ground and the internal steel tie system. The stone-cutting process for the limestone is also outlined, describing the rough-finished inner surface, which was patterned to follow lines of internal force flow, and the smooth flat outer surface. Finally, the process of erecting the formwork and falsework on site is also set out, including the process of decentring and the use of custom keystones. © The Institution of Structural Engineers.",Article,"Final",Scopus,2-s2.0-85046539741
"Albers A., Scherer H., Bursac N., Rachenkova G.","Model based systems engineering in construction kit development - Two case studies",2015,"Procedia CIRP",18,"https://www.scopus.com/inward/record.uri?eid=2-s2.0-84948469400&doi=10.1016%2fj.procir.2015.01.044&partnerID=40&md5=0dcffa3a29fac9dd3fc96d7bea1c9124","To offer a large variety of end products with a limited number of components, more and more companies take advantage of the modular design, platform and type series principles resulting in a construction kit development. These standardization methods make the product development processes more complex. This can be encountered with the help of Model Based Systems Engineering (MBSE). In order to support construction kit development with the help of MBSE in a long term, definitions of such terms as module, platform, type series and construction kit are analyzed and defined in the context of MBSE. As a result, some implications of these definitions are presented in this paper. In addition, first findings out of two research studies conducted at an automotive manufacturer are presented and put into the context of MBSE. The studies indicate the potential of MBSE supporting construction kit development. © 2015 The Authors.",Conference Paper,"Final",Scopus,2-s2.0-84948469400
"Smarslik M., Mark P.","Hybrid reinforcement design of longitudinal joints for segmental concrete linings",2019,"Structural Concrete",15,"https://www.scopus.com/inward/record.uri?eid=2-s2.0-85070977069&doi=10.1002%2fsuco.201900081&partnerID=40&md5=141604102384bceb2b2b18e4040c1906","In mechanized tunneling, the performance of segmental tunnel lining segments is closely bound to the longitudinal joint design. The guiding local effect is partial area strip loading with predominantly plane load distribution. Current normative standards only inadequately cover this case, which leads to an underestimation of the actual bearing capacities and thus offers considerable optimization potential. A hybrid material concept is proposed to improve the joints' performance, which is based on the results of robust combined trusscontinuum topology optimization. It combines high-performance steel fiber reinforced concrete in the area of load application with conventional materials used for the remaining regions. A relocation of the gasket to the segments' center proves to provide better protection, and a double hinge neck leads to a more efficient load transfer. The effects of these measures on the structural performance are analyzed experimentally and compared against conventional designs. The results show pronounced increases in bearing capacities by using hybrid reinforcements and provide a quantification of optimization based design modifications. © 2019 fib. International Federation for Structural Concrete",Article,"Final",Scopus,2-s2.0-85070977069
"Niemann J.","Life cycle management-das Paradigma der ganzheitlichen Produktlebenslauf-betrachtung",2017,"Neue Entwicklungen in Der Unternehmensorganisation. Vdi-Buch",14,,[No abstract available],,"Final",Scopus,2-s2.0-85072968504
"Wörner M., Schmeer D., Schuler B., Pfinder J., Garrecht H., Sawodny O., Sobek W.","The technology of graded concrete – From the development of concrete mixtures and the conceptual design to the automatized manufacturing [Gradientenbetontechnologie: Von der Mischungsentwicklung über den Bauteilentwurf bis zur automatisierten Herstellung]",2016,"Beton- und Stahlbetonbau",14,"https://www.scopus.com/inward/record.uri?eid=2-s2.0-85003545022&doi=10.1002%2fbest.201600056&partnerID=40&md5=668f1fc436d91a20af4e4024c9216bd9","In accordance with the principle form follows force, the DFG Priority Programme (SPP) 1542 – Leicht Bauen mit Beton – focuses on energy efficient building elements which are designed specifically for desired operational demands. This concept is a specific adaption of the component's inner structure and works in parallel to the optimization of its outer shape which is often limited due to the outer geometry of slabs, walls and supporting pillars. The technology of graded concrete provides an innovative possibility to adapt the inner structure of a concrete component in order to meet defined static and structural-physical requirements. The challenging demands imposed by the technology of graded concrete require a holistic approach including the development of the concrete mixtures, the design of the building components and finally the automatized manufacturing. In collaboration between the departments ILEK, IWB and ISYS of the University of Stuttgart a complete process chain for the manufacturing of functionally graded concrete components was realized. This approach for concrete results in fully recyclable building elements with significant savings in mass and energy. Copyright © 2016 Ernst & Sohn Verlag für Architektur und technische Wissenschaften GmbH & Co. KG, Berlin",Article,"Final",Scopus,2-s2.0-85003545022
"Han N., Yue Z., Lu Y.","Collision detection of building facility pipes and ducts based on BIM technology",2012,"Advanced Materials Research",13,"https://www.scopus.com/inward/record.uri?eid=2-s2.0-80054074618&doi=10.4028%2fwww.scientific.net%2fAMR.346.312&partnerID=40&md5=d94fd81abe5509f45ec5175acd80cd21","As construction space becomes increasingly constrained, the need to avoid collision among various HVAC, sewage and electronic pipes has become a pressing concern for modern building engineering projects. This article uses Building Information Modeling(BIM) technology to construct a three-dimensional piping model and utilizes Autodesk Navisworks software to integrate project data from various operators in order to pinpoint potential conflicts locations and generate a comprehensive ducting collision detection report. The advantages of this virtual construction vehicle include improving engineering, designing quality and efficiency. © (2012) Trans Tech Publications, Switzerland.",Conference Paper,"Final",Scopus,2-s2.0-80054074618
"Haque M.E., Rahman M.","Time-space-activity conflict detection using 4D visualization in multi-storied construction project",2009,"Lecture Notes in Computer Science (including subseries Lecture Notes in Artificial Intelligence and Lecture Notes in Bioinformatics)",13,"https://www.scopus.com/inward/record.uri?eid=2-s2.0-76549122747&doi=10.1007%2f978-3-642-05036-7_26&partnerID=40&md5=62999e7b96f2a83a644b29bfc2b841ff","This study investigated whether a 4D model can help project participants of construction sites to detect possible errors in construction process. Identifying problems in work sequence and elements are possible when necessary measures are implemented to rectify the problems in advance using a 4D model. The common problem associated with a construction project is a time-space conflict which may lead to project delays and cost overrun. Construction space management and activity sequencing are important aspects for timely project completion within an estimated budget. This research explored the effective use of 4D visualization that could help overcome timespace problems. In order to fulfill this research goal, a 4D model was developed that incorporated spatial requirements along a chronological schedule of events. The model produced logical evidence that a 4D model could effectively be usedin a construction site to detect time-space conflicts. © 2009 Springer-Verlag.",Conference Paper,"Final",Scopus,2-s2.0-76549122747
"Gaganelis G., Mark P.","Downsizing weight while upsizing efficiency: An experimental approach to develop optimized ultra-light UHPC hybrid beams",2019,"Structural Concrete",12,"https://www.scopus.com/inward/record.uri?eid=2-s2.0-85074567271&doi=10.1002%2fsuco.201900215&partnerID=40&md5=43117f5daa834336c4e0a27bfc037340","A three-phase topology optimization is applied to a conventional reinforced concrete (RC) beam loaded in four-point bending. The aim is to reduce material amounts to a minimum while preserving load bearing capacity and stiffness. The optimization result is converted into two alternative designs, namely a RC truss structure and a hybrid concrete-steel (HCS) truss structure. The RC truss structure is constructed in conventional reinforced concrete. By contrast, the HCS truss structure is designed using ultra-high performance fiber-reinforced concrete (UHPFRC) and S355 structural steel. Experimental studies demonstrate a 53% reduction in weight of the RC truss structure compared to the reference beam, while achieving a similar load bearing capacity and a significantly higher stiffness, albeit by increasing the structure's height. For the HCS truss structure, the weight saving is considerably higher, namely 83%, whereas the load bearing capacity can be increased by 10%. The stiffness remains comparable to that of the RC truss structure by increasing the structure's height likewise, while a more ductile type of failure is achieved. © 2019 fib. International Federation for Structural Concrete",Article,"Final",Scopus,2-s2.0-85074567271
"Greinacher S., Overbeck L., Kuhnle A., Krahe C., Lanza G.","Multi-objective optimization of lean and resource efficient manufacturing systems",2020,"Production Engineering",10,"https://www.scopus.com/inward/record.uri?eid=2-s2.0-85077558413&doi=10.1007%2fs11740-019-00945-9&partnerID=40&md5=3c0ecc24b0913705811d210e1a36295b","In the manufacturing industry, target-oriented and efficient use of resources is gaining importance, alongside economic optimization. The economic and organizational optimization of manufacturing systems according to the lean principles is only partly compatible with the goals of resource-efficient manufacturing. Therefore, an approach is sought to improve individual analyses of manufacturing systems. This paper proposes an approach for the multi-objective optimization of lean and resource-efficient manufacturing systems. To predict the dynamic effects of several configurations of manufacturing systems, material, energy, and information flows of a discrete event simulation are coupled with an assessment model, based on objectives of lean and resource-efficient manufacturing. Using design of experiments, Gaussian process meta-models are computed for the behavior of the simulation model. These meta-models allow the approximation of the system behavior to be computed in a short period of time and enable extensive multi-objective optimization and more adequate decision-making support systems. The proposed approach is tested in the metalworking industry. © 2020, German Academic Society for Production Engineering (WGP).",Article,"Final",Scopus,2-s2.0-85077558413
"Forman P., Gaganelis G., Mark P.","Optimization-based design [Optimierungsgestützt entwerfen und bemessen]",2020,"Bautechnik",9,"https://www.scopus.com/inward/record.uri?eid=2-s2.0-85090974979&doi=10.1002%2fbate.202000054&partnerID=40&md5=0c0cd67c97eede491c297a728ba89596","Optimization-based design. Concrete is freely formable. And reinforcements can be placed anywhere in the concrete. Nevertheless, this potential is rarely used. Reinforced concrete structures are commonly rectangular shaped with reinforcement meshes parallel to the surfaces and thus possess large mass. This article shows how topological optimization can be used to create concrete structures affine to the flux of forces. Material consumption decreases rapidly. External shaping, effective cross-section designs, and trajectory-oriented reinforcement layouts are presented. First the very basic equations of the associated structural optimization problem are derived. Then a novel material-specific control mechanism towards tensile or compressive dominant designs is introduced. It is discussed how this enables to account for structural robustness. Numerous examples illustrate application on bridges, pylons, shells, beams, girder grids or support details and quantify the potential material reduction in concrete construction arising thereof. © 2020, Ernst und Sohn. All rights reserved.",Article,"Final",Scopus,2-s2.0-85090974979
"Tkocz J., Mark P.","Heat treatment and shrinkage steering of precast thin walled concrete tubes",2019,"Proceedings of the fib Symposium 2019:  Concrete - Innovations in Materials, Design and Structures",8,"https://www.scopus.com/inward/record.uri?eid=2-s2.0-85066087786&partnerID=40&md5=6a5d46939a71a3de4f7c6aafb493e9e5","The paper focuses on the industrial prefabrication of high performance concrete (HPC) tubes from a resource-saving optimised design of concrete structures. Inspired from stiff structures in the nature as bamboo canes or blades of grass, a circular thin walled cross section is chosen as the key element. The breakthrough of prefabrication of concrete tubes is an integrated heat treatment via tempered water circulation through the inner formwork. It has two benefits, namely to fasten hardening and thus to reduce the cycle times for economic reasons and to anticipate shrinkage in part to increase geometric accuracies. In experimental investigations a self-compacting HPC (NANODUR® concrete) is applied with a water-to-binder ratio of 0.3. Shrinkage of concrete affects the achievable compressive strength of the tubes as vertical cracks due to shortening arise. Otherwise, heating reduces the influence of shrinkage, since it is known that a two days heat treatment on HPC virtually stops the process. The paper presents two aspects. First, a solution to modify the inner stiff steel formwork that prevents the hardening concrete from moving is offered. Thin layers of soft materials as neoprene and foam rubber are applied. Consequently, the strength remains almost unaffected by shrinkage. Second, the effect of heating on the development of strength and shrinkage strains is shown. Initial heating, even short, almost erases an impact on strengths but rather increases bearing capacities as well as decreases shrinkage strains. © Federation Internationale du Beton (fib) - International Federation for Structural Concrete, 2019.",Conference Paper,"Final",Scopus,2-s2.0-85066087786
"Mainka J., Lehmberg S., Budelmann H., Kloft H.","Non-standard principles for joining lightweight members made from UHPFRC [Non-Standard Fügeprinzipien für leichte Bauteile aus UHPFRC]",2013,"Beton- und Stahlbetonbau",8,"https://www.scopus.com/inward/record.uri?eid=2-s2.0-84887421124&doi=10.1002%2fbest.201300055&partnerID=40&md5=a8028501b57c739de345da0d750e9091","Despite the enormous developments in digital design and fabrication methods our thinking in the construction industry is still dominated by the standard of industrial production. The profiles and semi-manufactured parts made from steel and wood as well as the on the market available formwork systems for concrete structures imply the simplest possible geometry and addition. Consequently, today's load-bearing structures are usually composed of bending stress mass-intensive components. Lightweight form-active structures such as built in 1972 Lufthansa Maintenance Hall V at Frankfurt airport, however, are hard to find. In the future, the efficient use of materials and energy will have a crucial importance for the implementation of sustainable construction. Instead of avoiding complexity at the cost of increased masses, the goal for the future will be to save mass by using structural efficiency. The opportunity for this lies in the combination of the latest developments in material technology with the digital planning and production. The aim for high-tech materials such as ultra high performance fibre reinforced concrete (UHPFRC) must be to develop material appropriate non-standard joint principles that are produced economically despite increased complexity. This is where the present contribution starts showing the current research results for innovative principles for joining lightweight members from UHPFRC. Copyright © 2013 Ernst & Sohn Verlag für Architektur und technische Wissenschaften GmbH & Co. KG, Berlin.",Article,"Final",Scopus,2-s2.0-84887421124
"Lehmberg S., Ledderose L., Wirth F., Budelmann H., Kloft H.","Light-Weight Structures made of thin walled, dry jointed surface elements made of UHPFRC [Von der Bauteilfügung zu leichten Tragwerken: Trocken gefügte Flächenelemente aus UHPFRC]",2016,"Beton- und Stahlbetonbau",7,"https://www.scopus.com/inward/record.uri?eid=2-s2.0-85003766024&doi=10.1002%2fbest.201600053&partnerID=40&md5=4c822004c29b76a62c44221cc9f28a47","With the development of novel jointed, thin walled and thus light components the resource-efficient use of ultra-high performance fiber-reinforced fine grained concrete in structures can be realized. The manufacturing of modular and efficient UHPFRC components is achieved by the digital workflow as a result of digital design, calculation and CNC-controlled manufacturing technology. By linking lightweight concrete components with new, high-precision non standardized joints, such components can be connected material and force flow compatible with each other. The results with dry jointed T-beams show the manufacturability and the potential of the dry jointing system on a large scale. When checking the load capacity of thin-walled construction elements, the influence of fiber reinforcement must be especially considered. Copyright © 2016 Ernst & Sohn Verlag für Architektur und technische Wissenschaften GmbH & Co. KG, Berlin",Article,"Final",Scopus,2-s2.0-85003766024
"Mainka J., Kloft H., Baron S., Hoffmeister H.-W., Dröder K.","Non-Waste wax formwork-technology [Non-Waste-Wachsschalungen: Neuartige Präzisionsschalungen aus recycelbaren Industriewachsen]",2016,"Beton- und Stahlbetonbau",7,"https://www.scopus.com/inward/record.uri?eid=2-s2.0-85003520656&doi=10.1002%2fbest.201600055&partnerID=40&md5=1f1fd9f18f336842c5b48536e6a168f8","Today's possibilities to realize complex free-form reinforced concrete shapes, curved walls and filigree details require a formwork technology which meets these challenges. High precision with maximum freedom of form is therefore an essential requirement for the formwork of this new, so-called freeform architectures. Preconditions for this are the 3D digital design and manufacturing technologies, with their help formwork can be designed and manufactured in high precision and with many degrees of freedom in form. This paper describes a research approach using industrial waxes as formwork materials. Due to the nearly 100 % recyclability of the wax, this approach is an economical and ecological manufacturing process for customized free-form-members made of concrete. Copyright © 2016 Ernst & Sohn Verlag für Architektur und technische Wissenschaften GmbH & Co. KG, Berlin",Article,"Final",Scopus,2-s2.0-85003520656
"Mele T.V., Mehrotra A., Echenagucia M.T., Frick U., Ochsendorf J., Dejong M., Block P.","Form finding and structural analysis of a freeform stone vault",2016,"Proceedings of IASS Annual Symposia. International Association for Shell and Spatial Structures (IASS)",7,,[No abstract available],,"Final",Scopus,2-s2.0-85048274779
"Lanza G., Haefner B., Schild L., Berger D., Eschner N., Wagner R., Zaiß M.","In-Line Measurement Technology and Quality Control",2019,"Metrology",6,,[No abstract available],,"Final",Scopus,2-s2.0-85076766674
"Schlaich M.","Shell bridges - And a new specimen made of stainless steel",2018,"Journal of the International Association for Shell and Spatial Structures",6,"https://www.scopus.com/inward/record.uri?eid=2-s2.0-85055642855&doi=10.20898%2fj.iass.2018.197.027&partnerID=40&md5=bd2e8ab0f6f2c4d0ae5c6da705198863","Do double-curved shell bridges make sense, or should a bridge not rather be a linear structure? At the very least shell bridges stimulate the senses and they promise the advantages of shells, namely minimized weight, elegance and stability. When we look around, we detect quite a number of shell bridges in different shapes and made of different materials. In this paper, first several categories of existing shell bridges are described and discussed. Then a shell that forms both structure and deck, the stainless-steel footbridge in Ditzingen, Germany, is introduced. The double-curved shell spans 28m with a plate thickness of only 20mm. Laser cut holes in the shell not only make the structure lighter and translucent, but also the remaining steel work visualizes the path of the principal membrane forces, thus making the bridge more understandable. Copyright © 2018 by Mike Schlaich.",Article,"Final",Scopus,2-s2.0-85055642855
"Kao G., Körner A., Sonntag D., Long Nguyen L., Menges A., Knippers J.","Assembly-aware design of masonry shell structures: a computational approach",2017,"Proceedings of the IASS Annual Symposium",6,,[No abstract available],,"Final",Scopus,2-s2.0-85056671870
"Meier J.",[No title available],2007,"Produktarchitekturtypen Globalisierter Unternehmen",6,,[No abstract available],,"Final",Scopus,2-s2.0-38149031194
