Authors,Title,Year,Source title,Cited by,Link,Abstract,Document Type,Publication Stage,Source,EID
[No author name available],"World population prospects",2019,"World Population Prospects, the 2012 Revision",2148,,[No abstract available],,"Final",Scopus,2-s2.0-85067853981
"Monostori L., Kádár B., Bauernhansl T., Kondoh S., Kumara S., Reinhart G., Sauer O., Schuh G., Sihn W., Ueda K.","Cyber-physical systems in manufacturing",2016,"CIRP Annals",861,"https://www.scopus.com/inward/record.uri?eid=2-s2.0-84990841502&doi=10.1016%2fj.cirp.2016.06.005&partnerID=40&md5=5f72e61fc476b303ff9cde368f8326d3","One of the most significant advances in the development of computer science, information and communication technologies is represented by the cyber-physical systems (CPS). They are systems of collaborating computational entities which are in intensive connection with the surrounding physical world and its on-going processes, providing and using, at the same time, data-accessing and data-processing services available on the Internet. Cyber-physical production systems (CPPS), relying on the latest, and the foreseeable further developments of computer science, information and communication technologies on one hand, and of manufacturing science and technology, on the other, may lead to the 4th industrial revolution, frequently noted as Industrie 4.0. The paper underlines that there are significant roots in general – and in particular to the CIRP community – which point towards CPPS. Expectations towards research in and implementation of CPS and CPPS are outlined and some case studies are introduced. Related new R&D challenges are highlighted. © 2016 CIRP",Article,"Final",Scopus,2-s2.0-84990841502
"Kritzinger W., Karner M., Traar G., Henjes J., Sihn W.","Digital Twin in manufacturing: A categorical literature review and classification",2018,,533,"https://www.scopus.com/inward/record.uri?eid=2-s2.0-85052915281&doi=10.1016%2fj.ifacol.2018.08.474&partnerID=40&md5=89a5c6aec62d7a3f4ec83465a36abfa8","The Digital Twin (DT) is commonly known as a key enabler for the digital transformation, however, in literature is no common understanding concerning this term. It is used slightly different over the disparate disciplines. The aim of this paper is to provide a categorical literature review of the DT in manufacturing and to classify existing publication according to their level of integration of the DT. Therefore, it is distinct between Digital Model (DM), Digital Shadow (DS) and Digital Twin. The results are showing, that literature concerning the highest development stage, the DT, is scarce, whilst there is more literature about DM and DS. © 2018",Conference Paper,"Final",Scopus,2-s2.0-85052915281
"Mehta P.K.","Reducing the environmental impact of concrete",2001,"Concrete International",412,,[No abstract available],,"Final",Scopus,2-s2.0-0041604130
"Koren Y.","The Global Manufacturing Revolution: Product-Process-Business Integration and Reconfigurable Systems",2010,"The Global Manufacturing Revolution: Product-Process-Business Integration and Reconfigurable Systems",376,"https://www.scopus.com/inward/record.uri?eid=2-s2.0-84891584447&doi=10.1002%2f9780470618813&partnerID=40&md5=ed2d7a216fef7d3fcc87b621d497d373","The concrete tools manufacturing enterprises need to thrive in today's global environment. For a manufacturing enterprise to succeed in this current volatile economic environment, a revolution is needed in restructuring its three main components: product design, manufacturing, and business model. The Global Manufacturing Revolution is the first book to focus on these issues. Based on the author's long-standing course work at the University of Michigan, this unique volume proposes new technologies and new business strategies that can increase an enterprise's speed of responsiveness to volatile markets, as well as enhance the integration of its own engineering and business. Introduced here are innovations to the entire manufacturing culture: An original approach to the analysis of manufacturing paradigms. Suggested methods for developing creativity in product design. A quantitative analysis of manufacturing system configurations. A new manufacturing ""reconfigurable"" paradigm, in which the speed of responsiveness is the prime business goal. An original approach to using information technology for workforce empowerment. The book also offers analysis and original models of previous manufacturing paradigms' technical and business dimensions-including mass production and mass customization-in order to fully explain the current revolution in global manufacturing enterprises. In addition, 200 original illustrations and pictures help to clarify the topics. Globalization is creating both opportunities and challenges for companies that manufacture durable goods. The tools, theories, and case studies in this volume will be invaluable to engineers pursuing leadership careers in the manufacturing industry, as well as to leaders of global enterprises and business students who are motivated to lead manufacturing enterprises and ensure their growth. © 2010 John Wiley & Sons, Inc.",Book,"Final",Scopus,2-s2.0-84891584447
"Colledani M., Tolio T., Fischer A., Iung B., Lanza G., Schmitt R., Váncza J.","Design and management of manufacturing systems for production quality",2014,"CIRP Annals - Manufacturing Technology",184,"https://www.scopus.com/inward/record.uri?eid=2-s2.0-84905925313&doi=10.1016%2fj.cirp.2014.05.002&partnerID=40&md5=647e779281e9749a01028a4ad5f05169","Manufacturing companies are continuously facing the challenge of operating their manufacturing processes and systems in order to deliver the required production rates of high quality products, while minimizing the use of resources. Production quality is proposed in this paper as a new paradigm aiming at going beyond traditional six-sigma approaches. This new paradigm is extremely relevant in technology intensive and emerging strategic manufacturing sectors, such as aeronautics, automotive, energy, medical technology, micro-manufacturing, electronics and mechatronics. Traditional six-sigma techniques show strong limitations in highly changeable production contexts, characterized by small batch productions, customized, or even one-of-a-kind products, and in-line product inspections. Innovative and integrated quality, production logistics and maintenance design, management and control methods as well as advanced technological enablers have a key role to achieve the overall production quality goal. This paper revises problems, methods and tools to support this paradigm and highlights the main challenges and opportunities for manufacturing industries in this context. © 2014 CIRP.",Article,"Final",Scopus,2-s2.0-84905925313
"Hong J., Shen G.Q., Feng Y., Lau W.S.-T., Mao C.","Greenhouse gas emissions during the construction phase of a building: A case study in China",2015,"Journal of Cleaner Production",172,"https://www.scopus.com/inward/record.uri?eid=2-s2.0-84931571733&doi=10.1016%2fj.jclepro.2014.11.023&partnerID=40&md5=231f83d52f622cb29af2d4eb20237157","Many studies have been conducted on the contributions of the construction industry to greenhouse gas (GHG) emissions. However, these studies focused on the embodied GHG emissions of buildings and were restricted by limited system boundaries due to a lack of detailed on and off-site process data, especially data for assembly and miscellaneous works as well as construction related human activities. This study therefore analyzed GHG emissions during the construction phase of a case study building on the basis of an extended system boundary in the context of China by utilizing detailed onsite process data. The results show that indirect emissions accounted for 97% of all GHG emissions. On-site electricity use and building materials production were the two greatest contributors to direct and indirect emissions respectively. Recombining the construction activities revealed that construction related human activities generated significant GHG emissions (385 tCO2e), which have been ignored in previous research. The findings also reveal that although some materials used during the construction process are negligible in terms of weight, such as polyamide safety nets and aluminum (&lt;0.1%), they have a considerable impact on GHG emissions (2-3%). © 2014 Elsevier Ltd.",Article,"Final",Scopus,2-s2.0-84931571733
"Zhong R.Y., Peng Y., Xue F., Fang J., Zou W., Luo H., Thomas Ng S., Lu W., Shen G.Q.P., Huang G.Q.","Prefabricated construction enabled by the Internet-of-Things",2017,"Automation in Construction",162,"https://www.scopus.com/inward/record.uri?eid=2-s2.0-85009956057&doi=10.1016%2fj.autcon.2017.01.006&partnerID=40&md5=3d41bbde233873fcf61a5f52c5116500","Prefabricated construction has been used for public rental housing in Hong Kong. In order to speed up housing delivery, Hong Kong Housing Authority (HKHA) have employed advanced technologies, including Building Information Modelling (BIM) and Radio Frequency Identification (RFID), in some of their pilot prefabrication-based construction projects. However, the information obtained from BIM and RFID is not well connected and shared among relevant stakeholders. This paper introduces a multi-dimensional Internet of Things (IoT)-enabled BIM platform (MITBIMP) to achieve real-time visibility and traceability in prefabricated construction. Design considerations of a RFID Gateway Operating System, visibility and traceability tools, Data Source Interoperability Services, and decision support services are specified for developing the MITBIMP. A case study from a real-life construction project in Hong Kong is used as a pilot project to demonstrate advanced decision-making by using cutting-edge concepts and technologies within the MITBIMP to providing a basis for real-time visibility and traceability of the whole processes of prefabrication-based construction. © 2017 Elsevier B.V.",Article,"Final",Scopus,2-s2.0-85009956057
"Sacks R., Eastman C.M., Lee G.","Parametric 3D modeling in building construction with examples from precast concrete",2004,"Automation in Construction",160,"https://www.scopus.com/inward/record.uri?eid=2-s2.0-1642618587&doi=10.1016%2fS0926-5805%2803%2900043-8&partnerID=40&md5=2d868af6f9439d52847ee238707dc340","Buildings are complex products containing relatively large numbers of distinct parts that are collected in multiple assemblies for different design, analysis and production purposes. Modeling buildings in fully parametric 3D computer-aided design (CAD) systems offers numerous benefits in terms of productivity, the ability to rapidly generate design alternatives at different levels and elimination of errors that result from the disparity between different drawings in current practice. However, full realization of these benefits requires specialized functionality, including top-down modeling, objects with functional behavior, the ability to embed contextual design intent, automation of layout and detailing and appropriate management of similar objects. An effective system must provide such functionality while maintaining adequate response times. The requirements, features and performance have been examined as part of specification of a new 3D parametric CAD platform for the North American Precast Concrete Software Consortium (PCSC). They are described and discussed after a review of solid and parametric modeling, with examples from the domain of precast concrete construction. © 2004 Published by Elsevier B.V.",Article,"Final",Scopus,2-s2.0-1642618587
"Suhendro B.","Toward green concrete for better sustainable environment",2014,"Procedia Engineering",130,"https://www.scopus.com/inward/record.uri?eid=2-s2.0-84923342608&doi=10.1016%2fj.proeng.2014.12.190&partnerID=40&md5=e2c35b80bec60c96113c057af520e8aa","Eight to 10 percent of the world's total CO2emissions come from manufacturing cement. The global warming gas is released when limestone and clays are crushed and heated to high temperatures. Green concrete is defined as a concrete which uses waste material as at least one of its components, or its production process does not lead to environmental destruction, or it has high performance and life cycle sustainability. Various efforts have been conducted by researchers to arrive at some alternatives that are able to significantly reduce high energy consumed and environmental impacts during fabrication process of cement, including implementing the concept of industrial ecology and green chemistry as well as nanoengineering that study the behavior of the structure and organization of nanoparticles of cement in the mix for achieving higher performance. The cleaner technologies in concrete production, such as substituting relatively high percentage of cement by fly ash (up to 100%), the use of other natural pozzolans, development of concrete with recycling or waste materials, and developing nanoconcrete by integrating CNT's or self sensing CNT's in the concrete mix for higher performance in terms of strength, stiffness, and durability, have b een developed and are addressed in this paper. Several efforts that have been done so far in implementing the concept of green concrete and material development of nanosilica in Indonesia is discussed. Finally, problems in the realization of and potential barriers to green concrete as well as political scenarios that have been adopted by several countries through implementation of various priorities and deregulation in various fields are also discussed. © 2014 Published by Elsevier Ltd.",Conference Paper,"Final",Scopus,2-s2.0-84923342608
"Becerik-Gerber B., Ku K., Jazizadeh F.","BIM-enabled virtual and collaborative construction engineering and management",2012,"Journal of Professional Issues in Engineering Education and Practice",89,"https://www.scopus.com/inward/record.uri?eid=2-s2.0-84873328635&doi=10.1061%2f%28ASCE%29EI.1943-5541.0000098&partnerID=40&md5=eb47421791c674d487d700080f9a4742","Today's construction engineering and management (CEM) graduates must have strong communication and teamwork skills; they must have the ability to work efficiently within colocated teams; and finally, they must know how to apply fundamental engineering, management, and computer skills in practice. However, the traditional CEM education does not equip future engineers and managers to deal successfully with such issues. The authors describe experiences from a course that focuses on modes of learning involving virtual collaboration, problem-oriented project-based learning, and role-based learning. The aim of this course is to combine experimental and experiential learning into a research driven experience. The course was codesigned and cotaught by two instructors from two universities. The learning outcomes and lessons learned during the introduction of this building information modeling (BIM)-enabled virtual and collaborative construction engineering and management course are discussed. Specifically, it is shown that the introduction of BIM in a virtual collaborative setting allows instructors to design a course that incorporates the use of more realistic scenarios that better simulate real-world challenges. Such experiences teach students how construction projects are executed in practice, how different disciplines rely on one other for information, what type of information is needed from relevant disciplines, and when and how this information could be exchanged/shared between tools and processes. © 2012 American Society of Civil Engineers.",Article,"Final",Scopus,2-s2.0-84873328635
"Mechtcherine V., Nerella V.N., Will F., Näther M., Otto J., Krause M.","Large-scale digital concrete construction – CONPrint3D concept for on-site, monolithic 3D-printing",2019,"Automation in Construction",84,"https://www.scopus.com/inward/record.uri?eid=2-s2.0-85071286002&doi=10.1016%2fj.autcon.2019.102933&partnerID=40&md5=21ef2b05a390e8eb92fb884ac40321e3","The construction industry faces severe problems resulting from low productivity and increasing shortages of skilled labor. The purposeful digitalization and automation of all relevant stages, from design and planning to the actual construction process appears to be the only feasible solution to master these urgent challenges. Additive concrete construction has a high potential to be a key part of the solution. In the first place, technologies are of interest which would enable large-scale, on-site manufacturing of concrete structures in accordance with the demands of contemporary architectural and structural design. The article at hand evaluates the state-of-the-art with respect to these requirements and presents the CONPrint3D concept for on-site, monolithic 3D-printing as developed at the TU Dresden. This concept is driven by the demands and boundary conditions of construction practice. It complies with common architectural norms, valid design codes, existing concrete classes and typical economic constraints. Furthermore, it targets the use of existing construction machinery to the highest possible extent. The interdisciplinary team of authors illuminates various perspectives on the new technology: those of mechanical engineering, concrete technology, data management, and construction management. Some representative results of completed work in these fields are presented as well. © 2019 Elsevier B.V.",Article,"Final",Scopus,2-s2.0-85071286002
"Lin Y.-C., Su Y.-C.","Developing mobile- and BIM-based integrated visual facility maintenance management system",2013,"The Scientific World Journal",78,"https://www.scopus.com/inward/record.uri?eid=2-s2.0-84886647010&doi=10.1155%2f2013%2f124249&partnerID=40&md5=a83184efa493fa443280eaaf078ba0a8","Facility maintenance management (FMM) has become an important topic for research on the operation phase of the construction life cycle. Managing FMM effectively is extremely difficult owing to various factors and environments. One of the difficulties is the performance of 2D graphics when depicting maintenance service. Building information modeling (BIM) uses precise geometry and relevant data to support the maintenance service of facilities depicted in 3D object-oriented CAD. This paper proposes a new and practical methodology with application to FMM using BIM technology. Using BIM technology, this study proposes a BIM-based facility maintenance management (BIMFMM) system for maintenance staff in the operation and maintenance phase. The BIMFMM system is then applied in selected case study of a commercial building project in Taiwan to verify the proposed methodology and demonstrate its effectiveness in FMM practice. Using the BIMFMM system, maintenance staff can access and review 3D BIM models for updating related maintenance records in a digital format. Moreover, this study presents a generic system architecture and its implementation. The combined results demonstrate that a BIMFMM-like system can be an effective visual FMM tool. © 2013 Yu-Cheng Lin and Yu-Chih Su.",Article,"Final",Scopus,2-s2.0-84886647010
"Rodrigues F.A., Joekes I.","Cement industry: Sustainability, challenges and perspectives",2011,"Environmental Chemistry Letters",78,"https://www.scopus.com/inward/record.uri?eid=2-s2.0-79957821872&doi=10.1007%2fs10311-010-0302-2&partnerID=40&md5=6dbf3cf5ef075c8d69427bb859e15fb2","Cement-based materials, such as concrete and mortars, are used in extremely large amounts. For instance, in 2009 concrete production was superior to 10 billion tons. Cement plays an important role in terms of economic and social relevance since it is fundamental to build and improve infrastructure. On the other hand, this industry is also a heavy polluter. Cement production releases 5-6% of all carbon dioxide generated by human activities, accounting for about 4% of global warming. It can release huge amounts of persistent organic pollutants, such as dioxins and heavy metals and particles. Energy consumption is also considerable. Cement production use approximately 0.6% of all energy produced in the United States. On the other hand, the chemistry underlying cement production and its applications can be very helpful to overcome these environmental issues. In terms of manufacture, there are many alternative materials that can be used to minimize carbon dioxide production and reduce energy consumption, such as calcium sulfoaluminates and β-Ca2SiO4-rich cements. Using residues from other industrial sectors can also improve the sustainability of cement industry. Under adequate conditions, waste materials such as tyres, oils, municipal solid waste and solvents can be used as supplementary fuel in cement plants. Concrete can be used for encapsulation of waste materials such as tyres, plastics and glasses. In this review, we discuss some aspects of the cement industry associated with environmental science. Other issues such as economic aspects, the chemistry of cement manufacture and its properties are also presented. Special attention is given to the role that cement chemistry can play in terms of sustainability. The most relevant aspects are outlined, such as the use of alternative materials, new possibilities and also the recycling of materials. It is also argued that an important aspect is the role of research and development necessary to improve cement sustainability. © 2010 Springer-Verlag.",Review,"Final",Scopus,2-s2.0-79957821872
"Dombrowski U., Mielke T.","Ganzheitliche Produktionssysteme",2015,"Ganzheitliche Produktionssysteme",67,,[No abstract available],,"Final",Scopus,2-s2.0-85006998207
"Albers A., Bursac N., Wintergerst E.","Product Generation Development-Importance and Challenges from a Design Research Perspective",2015,"New Developments in Mechanics and Mechanical Engineering",57,,[No abstract available],,"Final",Scopus,2-s2.0-84986630210
"Borrmann A., König M., Koch C., Beetz J.","Preface",2018,"Building Information Modeling: Technology Foundations and Industry Practice",54,"https://www.scopus.com/inward/record.uri?eid=2-s2.0-85083937880&doi=10.1007%2f978-3-319-92862-3&partnerID=40&md5=5664fc9626084cf58025b940e98bba58",[No abstract available],Editorial,"Final",Scopus,2-s2.0-85083937880
"Bertram N., Fuchs S., Mischke J., Palter R., Strube G., Woetzel J.","Modular construction: from projects to products",2019,"Modular Construction: From Projects to Products",50,,[No abstract available],,"Final",Scopus,2-s2.0-85079946862
"Gupta A., Cemesova A., Hopfe C.J., Rezgui Y., Sweet T.","A conceptual framework to support solar PV simulation using an open-BIM data exchange standard",2014,"Automation in Construction",50,"https://www.scopus.com/inward/record.uri?eid=2-s2.0-84887838871&doi=10.1016%2fj.autcon.2013.10.005&partnerID=40&md5=e78c3b53c8a7c0f939f8673126a45adf","With the construction industry moving rapidly towards Building Information Modelling (BIM), it is essential that various analysis tools used in the Architecture, Engineering and Construction (AEC) domain are interoperable with a non-proprietary open BIM schema such as the Industry Foundation Classes (IFC). The UK government will be requiring fully-collaborative BIM in all public sector projects by 2016 and is also chasing the target of achieving zero-carbon buildings by 2019. This dual target will require the use of renewable energy analysis tools in the early stages of the building design process and establish the need for these tools to be IFC-compliant. This paper presents a conceptual framework for developing IFC-compliant renewable energy simulation tools using a multi-model concept in which the IFC data model provides partial input data required to run simulation models. A prototype has been developed as a 'proof-of-concept' for an IFC-compliant solar PV simulation tool. The prototype has been validated against other solar PV simulation tools such as PV*Sol, RETScreen® and HOMER to provide credibility to the simulation model. The developed conceptual framework is applicable not only to solar PV simulation but other renewable energy simulation models as well, thereby making an IFC-compliant renewable energy modelling tool capable of conducting, energy, carbon emissions and financial analysis. © 2013 Elsevier B.V.",Article,"Final",Scopus,2-s2.0-84887838871
"Alashwal A.M., Rahman H.A., Beksin A.M.","Knowledge sharing in a fragmented construction industry: On the hindsight",2011,"Scientific Research and Essays",37,"https://www.scopus.com/inward/record.uri?eid=2-s2.0-79958029445&partnerID=40&md5=5020944b67751d810465ce9a4ea680de","The main motivation behind this study is to ascertain the factors that inhibit and facilitate knowledge sharing among fragmented firms in a construction industry context. By and large, the augmentation of small and medium enterprises (SME) vis-à-vis to the tapering of the large ones causes fragmentation of construction industry. With the lack of collaboration between firms, knowledge sharing might be difficult to achieve. An initial literature review has been undertaken and in-depth interviews with top management individuals have been conducted to explore how project teams share their knowledge within a fragmented environment. The results uncovered five main factors of knowledge sharing: Working relationships, nature of the shared knowledge (Unintimidating Knowledge), policy and sprocedures, contract, and power. Inter-alia, other factors collected from the reviewed literature: Information communication technology (ICT), partnering, and knowledge management (KM) will be used to build up a conceptual model, which facilitates knowledge sharing in construction. For the purpose of validity and generalization, the model will be tested in a quantitative study in future research. © 2011 Academic Journals.",Article,"Final",Scopus,2-s2.0-79958029445
