Authors,Title,Year,Source title,Cited by,Link,Abstract,Document Type,Publication Stage,Source,EID
"Voo Y.L., Foster S., Pek L.G.","Ultra-high performance concrete - Technology for present and future",2017,"High Tech Concrete: Where Technology and Engineering Meet - Proceedings of the 2017 fib Symposium",5,"https://www.scopus.com/inward/record.uri?eid=2-s2.0-85025655637&partnerID=40&md5=2f84b3169246f6c8c871752a71b0321e","Ultra-high performance concrete (UHPC) is an advanced cementitious-based composite material that offers new opportunities for infrastructure works, building constructions and many niche markets. In the last two decades UHPC has been used for both structural and non-structural precast components in many countries. However, this outstanding technology has struggled to become a main-stream for everyday use due to lack of design codes and due to initial high investment costs of manufacturing facilities. Moreover, the high UHPC material cost makes it hard to compete with conventional designs optimized for other materials. Most projects in these countries have been motivated by government agencies as demonstration projects intended to encourage further implementation. However, for most of the countries, the follow-up implementation has been slow. Both private and governmental bodies are increasing their directives for the attention and initiative towards exploiting UHPC as a future concrete construction material, in the belief that UHPC technology embraces a more complete solution for sustainable construction with favourable life cycle values. This paper briefly presents various examples on the application of UHPC technology in the context of Malaysia and Singapore. Examples include past successful and present projects and other potential applications of UHPC technology that are either in the design stage or are envisioned. The examples include the ten equal spans, total 420-metre-long Kg Baharu-Kg Teluk Bridge and the 2016 PCI award winning single span 100-metre-long Batu 6 Bridge. Other examples are internet transmission towers, portal frame structures, retaining walls, light-weight precast bathroom units, external walls for precast-prefinished-volumetric-construction, and others.",Conference Paper,"Final",Scopus,2-s2.0-85025655637
"Forman P., Penkert S., Kämper C., Stallmann T., Mark P., Schnell J.","A survey of solar concrete shell collectors for parabolic troughs",2020,"Renewable and Sustainable Energy Reviews",4,"https://www.scopus.com/inward/record.uri?eid=2-s2.0-85090582434&doi=10.1016%2fj.rser.2020.110331&partnerID=40&md5=fcf3b2ae0a76921529b8104ae50e8524","Concrete shell collectors offer an alternative to conventional parabolic trough collectors. The principle design concept is derived from existing barrel rooves that effectively bridge large spans in halls or buildings with minimum material usage. The concrete troughs merge the bearing structure and mirroring surface to just one shell of a few centimeters. They are made of high-strength concrete and track the sun via pure axial rotation or lateral movements that avoid any lifting works. In the present contribution, basic constraints in materials, geometry, and static calculation are derived and converted into a framework of possible designs. This contribution thereby presents a survey of concepts that range from small-scale prototypes to full-scale realizations of 140 m2 apertures and large-aperture concepts with a 10 m width. Design concepts with bearing and drive systems as well as optimization-based form findings are introduced to elaborate shells of minimum weight with solid sections, stiffeners, and hollow cores. © 2020 Elsevier Ltd",Article,"Final",Scopus,2-s2.0-85090582434
"Kloft H., Empelmann M., Hack N., Herrmann E., Lowke D.","Strategies for the reinforcement for 3D-concrete-printing [Bewehrungsstrategien für den Beton-3D-Druck]",2020,"Beton- und Stahlbetonbau",4,"https://www.scopus.com/inward/record.uri?eid=2-s2.0-85087631360&doi=10.1002%2fbest.202000032&partnerID=40&md5=c3abf65472b3b2c4de0c397faef8eacd","Strategies for the reinforcement for 3D-concrete-printing. The ingenious bridge, hall and shell structures of the last century were designed from the understanding of the congenial interaction of the two materials concrete and steel. Nowadays, reinforced concrete is the most widley used material in construction. The use of system formwork and easy-to-install reinforcement support structures that are optimized in terms of labor costs, but often have an inefficient use of material. In this context, Stefan Polónyi has repeatedly criticised the engineerś lost understanding of the interaction of concrete and reinforcement. With Additive Manufacturing, an innovative digital manufacturing technology is now available that allows new freedom in concrete design while at the same time making resource-efficient use of materials. With regard to practical application, the integration of reinforcement represents a central challenge in 3D-concrete-printing. The authors see here the future chance of a force-flow controlled reinforcement layout. The paper shows new strategies for the combined additive manufacturing of concrete and reinforcement and presents first 3D-printed reinforced concrete elements. © 2020, Ernst und Sohn. All rights reserved.",Article,"Final",Scopus,2-s2.0-85087631360
"Huß W., Kaufmann M., Merz K.",[No title available],2019,"Building in Timber-Room modules",4,,[No abstract available],,"Final",Scopus,2-s2.0-85100981297
"Wagner R., Kuhnle A., Lanza G.","Optimising Matching Strategies for High Precision Products by Functional Models and Machine Learning Algorithms",2017,"WGP Annals",4,,[No abstract available],,"Final",Scopus,2-s2.0-85061984199
"Mark P., Neugebauer P.","Erhalt unserer Bausubstanz",2015,"Betonkalender 2015",3,,[No abstract available],,"Final",Scopus,2-s2.0-85101040541
"Schlaich M., Simon S., Rettinger M., Gänz P., Guhathakurta J.","Modularisierte Tragstrukturen aus nachträglich vorgespannten Carbonbetonbauteilen auf Basis von Trockenfugen und Computertomographie",2021,"BetonWerk International",2,,[No abstract available],,"Final",Scopus,2-s2.0-85100987114
"Gaganelis G., Forman P., Mark P.","Stahlbeton optimiert – für ein Mehr an Weniger",2021,"Handbuch Nachhaltigkeit, Ressourceneffizienz und Klimaschutz",1,,[No abstract available],,"Final",Scopus,2-s2.0-85101035953
"Stindt J., Frey A., Stricker N., Mark P., Lanza G.","Kopplungsmethoden von Entwurf und Produktion zur toleranzfreien Serienfertigung",2021,"BetonWerk International",1,,[No abstract available],,"Final",Scopus,2-s2.0-85101008269
"Fischer O., Borrmann A., Auer D., Afzal M.","Brückenbauwerke mit komplexer Geometrie durch facettierte Flächenelemente aus carbonbewehrtem Ultrahochleistungsbeton",2020,"BetonWerk International",1,,[No abstract available],,"Final",Scopus,2-s2.0-85101029524
"Bekel D., Bletzinger K.-U.","Der digitale Baukasten – Simulationsbasierte Modelle und Methoden für den Entwurf modularer Tragsysteme aus Beton",2020,"BetonWerk International",1,,[No abstract available],,"Final",Scopus,2-s2.0-85100999659
"Mechtcherine V., Lordick D.","Schalungsfreie Fleißfertigung adaptiver Tragstrukturen",2020,"BetonWerk International",1,,[No abstract available],,"Final",Scopus,2-s2.0-85100952209
"Friedrich T.","Wie sehen Betonfertigteile und die zugehörigen Bau- und Produktionprozesse in Zukunft aus?",2018,"BWI – BetonWerk International",1,,[No abstract available],,"Final",Scopus,2-s2.0-85100983609
"Scheerer S., Curbach M.",[No title available],2014,"Leicht Bauen mit Beton. Forschung im Schwerpunktprogramm 1542. Förderphase 1",1,,[No abstract available],,"Final",Scopus,2-s2.0-85101039148
[No author name available],[No title available],0000,"25 Jahre Lean Management: Lean Gestern, Heute und Morgen [online]",1,,[No abstract available],,"Final",Scopus,2-s2.0-85101003087
[No author name available],[No title available],0000,"Modul-Bauweise: 1 Tag – 1 ICON Haus [online]",1,,[No abstract available],,"Final",Scopus,2-s2.0-85100966857
