Authors,Title,Year,Source title,Cited by,Link,Abstract,Document Type,Publication Stage,Source,EID
"Colucci E., de Ruvo V., Lingua A., Matrone F., Rizzo G.","HBIM-GIS integration: From IFC to cityGML standard for damaged cultural heritage in a multiscale 3D GIS",2020,"Applied Sciences (Switzerland)",23,"https://www.scopus.com/inward/record.uri?eid=2-s2.0-85081260779&doi=10.3390%2fapp10041356&partnerID=40&md5=e709be9e5380e677281bc6c003dcffa8","This study describes the technical-systemic and conceptual-informative interoperability tests for the integration of a Historic Building Information Modeling (HBIM) model in a 3D Geographic Information System (GIS) environment aimed to provide complete and useful documentation for multiscale analyses on cultural heritage particularly exposed to risks. The case study of the San Lorenzo Church in Norcia (Italy) has been chosen given the urgent need to update the existing documentation for its protection and conservation issues, due to the extensive damage suffered after the series of earthquakes that occurred in central Italy starting from summer 2016. Different tests to evaluate two levels of conceptual interoperability (technical and semantic) when importing the HBIM model into a GIS environment were performed, whether with commercial software or with open source ones (ArcGIS Pro and QGIS, respectively). A data integration platform (Feature Manipulation Engine, FME) has been used for converting the IFC (Industry Foundation Classes) data format into the GML (Geography Markup Language) format, in order to obtain a unique and unified model and vocabulary for the 3D GIS project, structured with different levels of detail, according to CityGML standard. Finally, as HBIM-GIS integration is considered, the loss of geometric and informative data has been taken into account and evaluated. © 2020 by the author.",Article,"Final",Scopus,2-s2.0-85081260779
"Isikdag U.","Towards the Implementation of Building Information Models in Geospatial Context",2006,"Towards the Implementation of Building Information Models in Geospatial Context",23,,[No abstract available],,"Final",Scopus,2-s2.0-74349111001
"Diakite A.A., Zlatanova S.","Automatic geo-referencing of BIM in GIS environments using building footprints",2020,"Computers, Environment and Urban Systems",21,"https://www.scopus.com/inward/record.uri?eid=2-s2.0-85076711893&doi=10.1016%2fj.compenvurbsys.2019.101453&partnerID=40&md5=fd523f1b455cd19491efce2b16aeb6db","The integration of Building Information Models (BIM) in environments such as Geographic Information System (GIS) is currently one of the main investigated research problem in the urban spatial information community. Among the several issues that are involved in the adequate realisation of such type of integration, one particularly relevant to the GIS world is the geo-referencing of data coming from the BIM domain. The latter, which is inherited from the Computer Aided Design (CAD) world, often relies on local coordinate systems and thereby provides models with no or wrong information with respect to their actual geographic position. Based on well-known processes in the field of computer vision, this paper proposes an automatic framework that allows to transform the local coordinates of a BIM model into its real world geographic coordinates. Starting from a geo-referenced 2D polygon of the building (footprint or vertical projection), our method directly applies a rigid motion transformation to a corresponding 2D projection generated from the BIM model in order to obtain the transformation matrix that will align the geometry of the BIM to the map's one. In comparison with the most common approaches of shape alignment and rigid body transformation, our approach requires neither the input polygons to have the same number of points nor their sequence of points to be corresponding, allowing thereby to maximize the automation of the process while still providing accurate results. Several cases of BIM geo-referencing are presented and discussed. Furthermore, our experiments show that centimetre accurary can be reached in the alignment process. © 2019 Elsevier Ltd",Article,"Final",Scopus,2-s2.0-85076711893
"Uggla G., Horemuz M.","Geographic capabilities and limitations of Industry Foundation Classes",2018,"Automation in Construction",20,"https://www.scopus.com/inward/record.uri?eid=2-s2.0-85055585349&doi=10.1016%2fj.autcon.2018.10.014&partnerID=40&md5=9bdc01eebc924e9bbb361657cc93a8e1","Infrastructure design is conducted in a 3D Cartesian coordinate system with the assumption that the Earth is flat and that the scale is constant over the entire project area. Map projections are commonly used to georeference the designed geometries before constructing them on the surface of the Earth. The scale in a map projection varies depending on the position in the map plane, which leads to scale distortions between the designed geometries and the geometries staked out for construction. These distortions are exaggerated for large longitudinal projects such as the construction of roads and railroads because the construction site spans a larger area. Building Information Modeling (BIM) is increasing in popularity as a way to manage information within a construction project. Its use is more widespread in the building industry, but it is currently being adopted by the infrastructure industry as well. The open BIM standard IFC (Industry Foundation Classes) has recently developed support for alignment geometries, and full support for disciplines such as road and railroad construction is underway. This study tests whether the current IFC standard can facilitate georeferencing with sufficiently low distortion for the construction of infrastructure. This is done by performing georeferencing using three different methods, all using the information provided in the IFC schema, and by calculating the scale distortions caused by the different methods. It is concluded that the geographic capabilities of the IFC schema could be improved by adding a separate scale factor for the horizontal plane and support for object-specific map projections. © 2018 Elsevier B.V.",Article,"Final",Scopus,2-s2.0-85055585349
"Tan Y., Song Y., Zhu J., Long Q., Wang X., Cheng J.C.P.","Optimizing lift operations and vessel transport schedules for disassembly of multiple offshore platforms using BIM and GIS",2018,"Automation in Construction",17,"https://www.scopus.com/inward/record.uri?eid=2-s2.0-85050131498&doi=10.1016%2fj.autcon.2018.07.012&partnerID=40&md5=e73808f5fbdb7167d122851496e69d95","As the coming decades will witness a big trend in the decommissioning of offshore platforms, simultaneously disassembling topsides of multiple offshore platforms is getting increasingly common. Considering high risk and cost of offshore operations, module lift planning among multiple offshore platforms with transport vessels is required to be carefully conducted. The lift planning usually contains two main parts: module layout on vessels planning and vessel transport schedules arrangement. In contrast to the current experience-driven module lift planning, this paper formulates the lift planning optimization problem and develops a web system integrating building information modeling (BIM) and geographical information system (GIS) to efficiently disassemble topsides for multiple offshore platforms. BIM provides detailed information required for planning module layout on vessels and GIS contains the management and analysis of geospatial information for the vessel transport schedule arrangement. As for module layout optimization, three heuristic algorithms, namely genetic algorithm (GA), particle swarm optimization (PSO), and firefly algorithm (FA) are implemented and compared to obtain the module layout with the minimum total lift time. While for vessel transport schedule, graph search technique is integrated with a developed schedule clash detection function to obtain the transport schedule with the minimum sailing time. The proposed optimization algorithms and techniques are integrated into a developed BIM/GIS-based web system. An example of three offshore platforms with eighteen modules in total is used to illustrate the developed system. Results show that the developed system can significantly improve the efficiency of lift planning in multiple topsides disassembly. The developed BIM/GIS-based web system is also effective and practical in the resource allocation and task assignment among multiple locations, such as construction sites, buildings, and even cities. © 2018",Article,"Final",Scopus,2-s2.0-85050131498
"Clemen C., Görne H.","Level of Georeferencing (LoGeoRef) using IFC for BIM",2019,"J. Geod",13,,[No abstract available],,"Final",Scopus,2-s2.0-85089744418
"Borrmann A., Amann J., Chipman T., Hyvärinen J., Liebich T., Muhič S., Mol L., Plume J., Scarponcini P.","IFC Infra Overall Architecture Project Documentation and Guidelines, BuildingSMART",2021,"IFC Infra Overall Architecture Project Documentation and Guidelines",9,,[No abstract available],,"Final",Scopus,2-s2.0-85088434803
"Zhu J., Tan Y., Wang X., Wu P.","BIM/GIS integration for web GIS-based bridge management",2021,"Annals of GIS",9,"https://www.scopus.com/inward/record.uri?eid=2-s2.0-85083567499&doi=10.1080%2f19475683.2020.1743355&partnerID=40&md5=1230d1ec98367f0ee7d263bcabf7c4b4","Integration of Building Information Modelling (BIM) and Geographic Information System (GIS) can benefit both the Architecture, Engineering and Construction/Facility Management (AEC/FM) domain, and the geospatial industry. For GIS, BIM is a promising source of three-dimensional (3D) building information that can be used in the study of smart city, green building, big data, etc. The underlying data transformation from Industry Foundation Classes (IFC) to shapefile enables GIS to use the rich building information. However, this transformation is difficult due to the different modelling methods used by IFC and shapefile. IFC generally represents 3D objects using boundary representation (Brep), swept solid, constructive solid geometry (CSG), clipping and mapped representation, while shapefile only uses Brep. In addition, the use of different coordinate systems also contributes to the geometry transformation issue. Among all the solid modelling methods used by IFC, Brep and swept solid are the most often used two methods. Compared with Brep, the transformation of swept solid is more challenging as each type of profile for swept solid defined in IFC has to be properly interpreted and converted. This paper develops algorithms to interpret the commonly used profiles of swept solid for the transformation of IFC into shapefile. A bridge model is used to validate the proposed method, and a Web GIS-based bridge management system is developed to demonstrate a possible usage of the transformed shapefile model. © 2020 The Author(s). Published by Informa UK Limited, trading as Taylor & Francis Group, on behalf of Nanjing Normal University.",Article,"Final",Scopus,2-s2.0-85083567499
"Chen J., Liu D., Li S., Hu D.","Registering georeferenced photos to a building information model to extract structures of interest",2019,"Advanced Engineering Informatics",9,"https://www.scopus.com/inward/record.uri?eid=2-s2.0-85067016980&doi=10.1016%2fj.aei.2019.100937&partnerID=40&md5=3a126bbd0f08fb978ef1cc65ed6d42af","Vision-based techniques are being used to inspect structures such as buildings and infrastructure. Due to various backgrounds in the acquired images, conventional vision-based techniques rely heavily on manual processing to extract relevant structures of interest for subsequent analysis in many applications, such as distress detection. This practice is laborious, time-consuming, and error-prone. To address the challenge, this study proposes a new method that automatically matches a georeferenced real-life photo with a building information model-rendered synthetic image to allow the extraction of relevant structure of interest. Field experiments were conducted to validate and evaluate the proposed method. The average accuracy of this method is 79.21% and the processing speed is 140 s per image. The proposed method has the potential to reduce the workload of image processing for vision-based structural inspection. © 2019 Elsevier Ltd",Article,"Final",Scopus,2-s2.0-85067016980
"Zhu J., Wu P.","Towards effective bim/gis data integration for smart city by integrating computer graphics technique",2021,"Remote Sensing",7,"https://www.scopus.com/inward/record.uri?eid=2-s2.0-85106470066&doi=10.3390%2frs13101889&partnerID=40&md5=f714c158e80aec443cd5f33cbfa636c6","The development of a smart city and digital twin requires the integration of Building Information Modeling (BIM) and Geographic Information Systems (GIS), where BIM models are to be integrated into GIS for visualization and/or analysis. However, the intrinsic differences between BIM and GIS have led to enormous problems in BIM‐to‐GIS data conversion, and the use of City Geography Markup Language (CityGML) has further escalated this issue. This study aims to facilitate the use of BIM models in GIS by proposing using the shapefile format, and a creative approach for converting Industry Foundation Classes (IFC) to shapefile was developed by integrating a computer graphics technique. Thirteen building models were used to validate the proposed method. The result shows that: (1) the IFC‐to‐shapefile conversion is easier and more flexible to realize than the IFC‐to‐CityGML conversion, and (2) the computer graphics technique can improve the efficiency and reliability of BIM‐to‐GIS data conversion. This study can facilitate the use of BIM information in GIS and benefit studies working on digital twins and smart cities where building models are to be processed and integrated in GIS, or any other studies that need to manipulate IFC geometry in depth. © 2021 by the authors. Licensee MDPI, Basel, Switzerland.",Article,"Final",Scopus,2-s2.0-85106470066
"Jaud, Donaubauer A., Heunecke O., Borrmann A.","Georeferencing in the context of building information modelling",2020,"Automation in Construction",7,"https://www.scopus.com/inward/record.uri?eid=2-s2.0-85089729356&doi=10.1016%2fj.autcon.2020.103211&partnerID=40&md5=34a86a5dad39d583ff7724393568305b","An important element of metadata for any building information modelling (BIM) model is its location and orientation on the Earth. In most cases, engineering design is based on Cartesian coordinate systems. However, as facilities are placed in a geospatial context, discrepancies result from the transformation from the Earth's curved surface to the orthogonal coordinate system and engineers and developers must take this into account. With this in mind, the dimensions of a model may not correspond to those in the real world, but are rather distorted according to the used coordinate reference system (CRS). We provide a thorough background of geospatial and BIM models to define and illustrate the problem at hand. We introduce three possibilities for spatial interpretation of the geometries and their locations within a BIM model. Option A sees the model as a true-to-scale representation of the asset, option B interprets the model distorted in the same manner as the underlying CRS, and option C is a combination of the former. We explore each option with a case study and visual clues. We show that, while Option A is the most prevalent interpretation in the literature, experts from the infrastructure field prefer Option C, whose underlying rationale is explained in detail. We find that introducing infrastructural concepts to BIM methods requires the systematic resolution of georeferencing. We propose a workflow for the correct handling of any BIM geometries for construction projects. Additionally, we provide a decision diagram to help project stakeholders determine when the distortions of a CRS can be knowingly neglected. © 2020 Elsevier B.V.",Article,"Final",Scopus,2-s2.0-85089729356
"Zhu J., Tan Y., Wang J., Wang X.","An economical approach to geo-referencing 3D model for integration of BIM and GIS",2017,"Proceedings of the International Conference on Innovative Production and Construction (IPC 2017)",5,,[No abstract available],,"Final",Scopus,2-s2.0-85043275672
[No author name available],[No title available],0000,"IFC Specifications Database",5,,[No abstract available],,"Final",Scopus,2-s2.0-85082840442
[No author name available],[No title available],0000,"Universal Transverse Mercator Coordinate System",5,,[No abstract available],,"Final",Scopus,2-s2.0-84893085705
"IfcWiki","KIT IFC Examples",0000,"Kit ifc Examples",5,,[No abstract available],,"Final",Scopus,2-s2.0-85067335009
"Uggla G., Horemuz M.","Georeferencing Methods for IFC",2018,"Proceedings - 2018 Baltic Geodetic Congress, BGC-Geomatics 2018",4,"https://www.scopus.com/inward/record.uri?eid=2-s2.0-85053922616&doi=10.1109%2fBGC-Geomatics.2018.00045&partnerID=40&md5=aa949a72246ef9ebd2572febaccf46e2","Building Information Modelling (BIM) is becoming a standard tool for information management throughout the life cycle of a construction project. Elements in BIM are designed in a Cartesian coordinate system (Engineering system) with no direct relation to the project's geographic location. Accurate georeferencing of BIM data is required both for construction and integration with Geographic Information Systems (GIS), as improperly treated or neglected scale distortions can lead to costly delays in construction as problems requiring ad hoc solutions may arise on site Industry Foundation Classes (IFC) is an open BIM standard developed by buildingSMART, and the current version IFC 4 has recently been extended with IFC Alignment, which includes support for alignment geometries used for infrastructure design. This paper investigates the geographic capabilities of IFC 4 and its extension IFC Alignment. The study identifies a lack of support for non-uniform scale factors and object-specific map projections as the largest weaknesses. © 2018 IEEE.",Conference Paper,"Final",Scopus,2-s2.0-85053922616
"Isikdag U., Aouad G., Underwood J., Trodd N.","Investigating the Applicability of ifc in Geospatial Environment in Order to Facilitate the Fire Response Management Process",0000,"Investigating the Applicability of IFC in Geospatial Environment in Order to Facilitate the Fire Response Management Process",4,,[No abstract available],,"Final",Scopus,2-s2.0-85067361370
[No author name available],[No title available],0000,"OGC GeoTIFF Standard",3,,[No abstract available],,"Final",Scopus,2-s2.0-85107958478
"Technology K.I.O.",[No title available],0000,"Kit: Fjk-project-final",3,,[No abstract available],,"Final",Scopus,2-s2.0-85082716477
[No author name available],[No title available],0000,"Fundamentals of Georeferencing a Raster Dataset",2,,[No abstract available],,"Final",Scopus,2-s2.0-85052724975
[No author name available],[No title available],0000,"User Guide for Geo-Referencing in IFC",2,,[No abstract available],,"Final",Scopus,2-s2.0-85107931379
[No author name available],[No title available],0000,"What Does “Georeferenced” Mean?",1,,[No abstract available],,"Final",Scopus,2-s2.0-85108013637
[No author name available],[No title available],0000,"IfcSite",1,,[No abstract available],,"Final",Scopus,2-s2.0-85107992134
[No author name available],[No title available],0000,"Industry Foundation Classes Version 4.1.0.0—IfcMapConversion",1,,[No abstract available],,"Final",Scopus,2-s2.0-85107969386
[No author name available],[No title available],0000,"PROJ. PROJ",1,,[No abstract available],,"Final",Scopus,2-s2.0-85107969115
"Smith H.",[No title available],0000,"Geographic vs Projected Coordinate Systems",1,,[No abstract available],,"Final",Scopus,2-s2.0-85107967785
[No author name available],[No title available],0000,"OGC Abstract Specification Topic 2: Referencing by Coordinates",1,,[No abstract available],,"Final",Scopus,2-s2.0-85107956717
"Moult D.",[No title available],0000,"IFC Coordinate Reference Systems and Revit",1,,[No abstract available],,"Final",Scopus,2-s2.0-85107952470
[No author name available],[No title available],0000,"IfcGeometricRepresentationContext",1,,[No abstract available],,"Final",Scopus,2-s2.0-85107937835
[No author name available],[No title available],0000,"Geolocation Standards in IFC2X3 and IFC4",1,,[No abstract available],,"Final",Scopus,2-s2.0-85107930609
[No author name available],[No title available],0000,"IfcLocalPlacement",1,,[No abstract available],,"Final",Scopus,2-s2.0-85107922069
[No author name available],[No title available],0000,"IfcSpatialStructureElement",1,,[No abstract available],,"Final",Scopus,2-s2.0-85107916685
[No author name available],[No title available],0000,"IfcMapConversion",1,,[No abstract available],,"Final",Scopus,2-s2.0-85107905089
