Authors,Title,Year,Source title,Cited by,Link,Abstract,Document Type,Publication Stage,Source,EID
"Cressie N.A.C.",[No title available],1993,"Statistics for Spatial Data",10923,,[No abstract available],,,Scopus,2-s2.0-0003548569
"Longley P.A., Goodchild M.F., Maguire D.J., Rhind D.W.",[No title available],2001,"Geographic Information Systems and Science",2184,,[No abstract available],,,Scopus,2-s2.0-0003418268
"Hofmann-Wellenhof B., Lichtenegger H., Wasle E.",[No title available],2008,"GNSS - Global Navigation Satellite Systems: GPS, GLONASS, Galileo, and more",1187,,[No abstract available],,"Final",Scopus,2-s2.0-58249107789
"Foley J.D., Van Dam A.","Fundamentals of interactive computer graphics.",1982,"Fundamentals of interactive computer graphics.",862,"https://www.scopus.com/inward/record.uri?eid=2-s2.0-85040276879&partnerID=40&md5=2e16291a973a166e383d6d23d3ddd624","Introduces interactive computer graphics through a description of hardware and a simple graphics package. Geometrical transformations and 3-D viewing are covered, followed by discussion of design architecture and raster operations. Concludes with chapters on shading models and colour applications. -R.Harris",Article,"Final",Scopus,2-s2.0-85040276879
"Hill L.L.",[No title available],2006,"Georeferencing: The Geographic Associations of Information",186,,[No abstract available],,"Final",Scopus,2-s2.0-41049103917
"Isikdag U., Underwood J., Aouad G.","An investigation into the applicability of building information models in geospatial environment in support of site selection and fire response management processes",2008,"Advanced Engineering Informatics",125,"https://www.scopus.com/inward/record.uri?eid=2-s2.0-53349153997&doi=10.1016%2fj.aei.2008.06.001&partnerID=40&md5=c227d5b65d1aeb12a5decc47a942f1a2","Some tasks in the construction industry and urban management field such as site selection and fire response management are usually managed by using a Geographical Information System (GIS), as the tasks in these processes require a high level and amount of integrated geospatial information. Recently, a key element of this integrated geospatial information to emerge is detailed geometrical and semantic information about buildings. In parallel, Building Information Models (BIMs) of today have the capacity for storing and representing such detailed geometrical and semantic information. In this context, the research aimed to investigate the applicability of BIMs in geospatial environment by focusing specifically on these two domains; site selection and fire response management. In the first phase of the research two use case scenarios were developed in order to understand the processes in these domains in a more detailed manner and to establish the scope of a possible software development for transferring information from BIMs into the geospatial environment. In the following phase of the research two data models were developed - a Schema-Level Model View and a geospatial data model. The Schema-Level Model View was used in simplifying the information acquired from the BIM, while the geospatial data model acted as the template for creating physical files and databases in the geospatial environment. Following this, three software components to transfer building information into the geospatial environment were designed, developed, and validated. The first component served for acquiring the building information from the BIM, while the latter two served for transforming the information into the geospatial environment. The overall research demonstrated that it is possible to transfer (high level of geometric and semantic) information acquired from BIMs into the geospatial environment. The results also demonstrated that BIMs provide a sufficient level and amount of (geometric and semantic) information (about the building) for the seamless automation of data management tasks in the site selection and fire response management processes. © 2008 Elsevier Ltd. All rights reserved.",Article,"Final",Scopus,2-s2.0-53349153997
"Zhou Y., Leung H., Blanchette M.","Sensor alignment with earth-centered earth-fixed (ECEF) coordinate system",1999,"IEEE Transactions on Aerospace and Electronic Systems",115,"https://www.scopus.com/inward/record.uri?eid=2-s2.0-1842753074&doi=10.1109%2f7.766925&partnerID=40&md5=75c0f8e6128f3d693b0532f907b57c5f","In this work, we formulate the multiple sensor alignment problem in an Earth-centered Earth-fixed (ECEF) coordinate system. The alignment algorithm maps the sensor measurements to the ECEF coordinates using a geodetic transformation, and attributes the discrepancies in the Earth-referenced system reported by each sensor to the sensor biases. Sensor biases are then estimated using the least squares (LS) technique. Simulated and real-life radar data are used to evaluate the performance of the proposed algorithm. Comparisons are made to those algorithms based on the standard stereographic projection. © 1999 IEEE.",Article,"Final",Scopus,2-s2.0-1842753074
"Zhu J., Wang X., Wang P., Wu Z., Kim M.J.","Integration of BIM and GIS: Geometry from IFC to shapefile using open-source technology",2019,"Automation in Construction",114,"https://www.scopus.com/inward/record.uri?eid=2-s2.0-85062154552&doi=10.1016%2fj.autcon.2019.02.014&partnerID=40&md5=5ac55fbc34909fa9d77626a37016f9ca","Integration of Building Information Modeling (BIM) and Geographic Information System (GIS) largely relies on data exchange between the two systems. However, the usual tool for geometry transformation from IFC (BIM) to shapefile (GIS), i.e., the Data Interoperability extension for ArcGIS (DIA), tends to result in geometric errors and cause geometric information loss. This study proposes an Open-Source Approach (OSA), in which the geometric information in IFC is retrieved through the spatial structure of IFC, i.e., IFC-Tree, and converted into shapefile by developing an automatic multipatch generation algorithm (AMG). A test on bridge model shows that OSA is more efficient than DIA and is comparable to Feature Manipulation Engine (FME), and the transformed model is easier to manage and can be used in more applications. OSA can link BIM and GIS in a more stable and efficient manner by enhancing the data transformation from BIM to GIS. However, its efficiency should be further improved compared with FME. © 2019",Article,"Final",Scopus,2-s2.0-85062154552
"Teo T.-A., Cho K.-H.","BIM-oriented indoor network model for indoor and outdoor combined route planning",2016,"Advanced Engineering Informatics",103,"https://www.scopus.com/inward/record.uri?eid=2-s2.0-84966280684&doi=10.1016%2fj.aei.2016.04.007&partnerID=40&md5=862b1f1a3bd2d3c9fed51f95d3bf8096","Emergency response and pedestrian route planning rely highly on indoor-outdoor geospatial data and a network model of the data; however, indoor geospatial data collection is time-consuming. Several studies have used the architecture, engineering, and construction (AEC) model to generate indoor network models. These models are subject to the input data types, and the attributes of interior building objects are usually incomplete; hence, the integration of building information modeling (BIM) and geographic information systems (GIS) can benefit indoor-outdoor integrated applications. To achieve data interoperability, an open BIM standard called Industry Foundation Classes (IFC) is maintained by buildingSMART. In this study, we propose a multi-purpose geometric network model (MGNM) based on BIM and explore the strategy of indoor and outdoor network connections. To achieve the goals, the IFC-to-MGNM conversion includes the following: (1) extraction of building information from IFC, (2) isolation of the MGNM information from the aforementioned building information, and (3) build up the topological relationships of MGNM into GIS Geodatabase. In addition, an entrance-to-street strategy is proposed to connect indoor networks, entrances, and outdoor networks for detailed route planning. The experimental results indicate that the MGNM could be generated from BIM automatically and applied to connect indoor and outdoor features for the multi-purpose application. Two use-case scenarios were developed to validate the proposed methods. Compared to actual distance, the relative error was improved by 5.1% and 65.5% in the horizontal and vertical routes, respectively, over the conventional indoor network model from 2D ground plan. In addition, the computational time taken by the proposed coarse-to-fine route planning method was 25% that of the traditional single-scale route planning method. © 2016 Elsevier Ltd. All rights reserved.",Article,"Final",Scopus,2-s2.0-84966280684
"Wang Q., Kim M.-K.","Applications of 3D point cloud data in the construction industry: A fifteen-year review from 2004 to 2018",2019,"Advanced Engineering Informatics",93,"https://www.scopus.com/inward/record.uri?eid=2-s2.0-85061601993&doi=10.1016%2fj.aei.2019.02.007&partnerID=40&md5=704db179024538db1a97691d817e3990","3D point cloud data obtained from laser scans, images, and videos are able to provide accurate and fast records of the 3D geometries of construction-related objects. Thus, the construction industry has been using point cloud data for a variety of purposes including 3D model reconstruction, geometry quality inspection, construction progress tracking, etc. Although a number of studies have been reported on applying point cloud data for the construction industry in the recent decades, there has not been any systematic review that summaries these applications and points out the research gaps and future research directions. This paper, therefore, aims to provide a thorough review on the applications of 3D point cloud data in the construction industry and to provide recommendations on future research directions in this area. A total of 197 research papers were collected in this study through a two-fold literature search, which were published within a fifteen-year period from 2004 to 2018. Based on the collected papers, applications of 3D point cloud data in the construction industry are reviewed according to three categories including (1) 3D model reconstruction, (2) geometry quality inspection, and (3) other applications. Following the literature review, this paper discusses on the acquisition and processing of point cloud data, particularly focusing on how to properly perform data acquisition and processing to fulfill the needs of the intended construction applications. Specifically, the determination of required point cloud data quality and the determination of data acquisition parameters are discussed with regard to data acquisition, and the extraction and utilization of semantic information and the platforms for data visualization and processing are discussed with regard to data processing. Based on the review of applications and the following discussions, research gaps and future research directions are recommended including (1) application-oriented data acquisition, (2) semantic enrichment for as-is BIM, (3) geometry quality inspection in fabrication phase, and (4) real-time visualization and processing. © 2019 Elsevier Ltd",Review,"Final",Scopus,2-s2.0-85061601993
"Mignard C., Nicolle C.","Merging BIM and GIS using ontologies application to Urban facility management in ACTIVe3D",2014,"Computers in Industry",92,"https://www.scopus.com/inward/record.uri?eid=2-s2.0-84908099373&doi=10.1016%2fj.compind.2014.07.008&partnerID=40&md5=4f60b2906ebd495171c899cee2bc00e4","This article presents the research work done in order to reduce the gap of heterogeneity between Geographic Information System and Building Information Models. The goal is to extend a platform dedicated to facility management called ACTIVe3D. We want to enlarge its scope to take into account the management of urban elements contained in the building environment, as well as other buildings. The particularity of the platform is that data can be accessed either by a semantic view or through a 3D interface. The SIGA3D project describes a set of processes that aims, for all the stakeholders of urban projects, to manage pieces of information through all the lifecycle of construction projects. To solve the heterogeneity problem between BIM and GIS, we developed a semantic extension to the BIM called UIM (Urban Information Modeling). This extension defines spatial, temporal and multi-representation concepts to build an extensible ontology. The knowledge database can be populated with information coming from standards like IFC and CityGML. This information system has been adapted and implemented into the existing platform and is today fully operational and used by thousands of users. © 2014 Elsevier B.V.",Article,"Final",Scopus,2-s2.0-84908099373
"Zhu J., Wang X., Chen M., Wu P., Kim M.J.","Integration of BIM and GIS: IFC geometry transformation to shapefile using enhanced open-source approach",2019,"Automation in Construction",89,"https://www.scopus.com/inward/record.uri?eid=2-s2.0-85067364738&doi=10.1016%2fj.autcon.2019.102859&partnerID=40&md5=71f372b4de5bf46638e63d6793188121","Efficient data exchange is the foundation of effective integration of Building Information Modeling (BIM) and Geographic Information System (GIS). However, it has not been fully achieved. This study aims to enhance the previously developed Open-Source Approach (OSA), which is for geometry transformation of Industry Foundation Classes (IFC) into the shapefile format. OSA will be strengthened to be enhanced OSA (E-OSA) by developing an enhanced Automatic Multipatch Generation (E-AMG) algorithm that is capable of transforming various types of 3D representation, such as clipping and mapped representation, to boundary representation (Brep). The proposed method was tested and validated using a house model and two building models provided by Karlsruhe Institute of Technology (KIT) as well as a bridge model. The results show that E-AMG has the capacity to successfully transform these models from IFC to shapefile without building element loss. A comparison between Data Interoperability Extension for ArcGIS (DIA), Feature Manipulation Engine (FME) and the proposed E-OSA shows that the proposed method is more reliable than others while dealing with complex models. However, this method currently needs human intervention when handling multiple-clipping geometry. This issue should be addressed in the future to improve the effectiveness of E-OSA. © 2019 Elsevier B.V.",Article,"Final",Scopus,2-s2.0-85067364738
"Wang H., Pan Y., Luo X.","Integration of BIM and GIS in sustainable built environment: A review and bibliometric analysis",2019,"Automation in Construction",89,"https://www.scopus.com/inward/record.uri?eid=2-s2.0-85062851084&doi=10.1016%2fj.autcon.2019.03.005&partnerID=40&md5=c7828e7cdf8ee88f6ad3ef4734c20e41","Building information modelling (BIM) and geographical information systems (GIS) provide digital representation of architectural and environmental entities. BIM focuses on micro-level representation of buildings themselves, and GIS provide macro-level representation of the external environments of buildings. Moreover, their combination can establish a comprehensive view of a built environment based on data integrated, which underpins the development and transition of the architecture, engineering and construction (AEC) industries in the digital era. This paper gives a comprehensive review on BIM-GIS integration in sustainable built environments in order to analyse the status quo and practical applications from four viewpoints: technologies for data integration, applications in the life cycle of AEC projects, building energy management, and urban governance. Three typical modes of BIM-GIS integration, namely, “BIM leads and GIS supports” “GIS leads and BIM supports” and “BIM and GIS are equally involved” are categorised based on the different dominant positions of the two technologies. Furthermore, the research trends and future directions for the applications of BIM-GIS integration are discussed. Specifically, we underline that semantic models and third-party integration platforms should be optimised technically, and information about the whole process of AEC projects needs to be improved. Comprehensive information for building energy management should be digitised and quantified to improve its systematic integration and application to the urban built environment. This review can serve as a roadmap for researchers who focus on studies of BIM-GIS integration in the sustainable built environment. © 2019 Elsevier B.V.",Review,"Final",Scopus,2-s2.0-85062851084
"Donkers S., Ledoux H., Zhao J., Stoter J.","Automatic conversion of IFC datasets to geometrically and semantically correct CityGML LOD3 buildings",2016,"Transactions in GIS",86,"https://www.scopus.com/inward/record.uri?eid=2-s2.0-84942025127&doi=10.1111%2ftgis.12162&partnerID=40&md5=29cfa4f8f7088dc7d28fa869d567a079","Although the international standard CityGML has five levels of detail (LODs), the vast majority of available models are the coarse ones (up to LOD2, i.e. block-shaped buildings with roofs). LOD3 and LOD4 models, which contain architectural details such as balconies, windows and rooms, rarely exist because, unlike coarser LODs, their construction requires several datasets that must be acquired with different technologies, and often extensive manual work is needed. In this article we investigate an alternative to obtaining CityGML LOD3 models: the automatic conversion from already existing architectural models (stored in the IFC format). Existing conversion algorithms mostly focus on the semantic mappings and convert all the geometries, which yields CityGML models having poor usability in practice (spatial analysis, for instance, is not possible). We present a conversion algorithm that accurately applies the correct semantics from IFC models and that constructs valid CityGML LOD3 buildings by performing a series of geometric operations in 3D. We have implemented our algorithm and we demonstrate its effectiveness with several real-world datasets. We also propose specific improvements to both standards to foster their integration in the future. © 2015 John Wiley & Sons Ltd",Article,"Final",Scopus,2-s2.0-84942025127
"Wade T., Sommer S.","A to Z GIS: An Illustrated Dictionary of Geographic Information Systems",2006,"A to Z GIS: An Illustrated Dictionary of Geographic Information Systems",84,,[No abstract available],,"Final",Scopus,2-s2.0-33846005097
"Zhang C., Arditi D.","Automated progress control using laser scanning technology",2013,"Automation in Construction",79,"https://www.scopus.com/inward/record.uri?eid=2-s2.0-84884571181&doi=10.1016%2fj.autcon.2013.08.012&partnerID=40&md5=8f4ce839b987d22e77bfbbffc3e7aac4","Assessing progress in construction activities is time consuming and requires the use of specialized personnel. Automated progress control could reduce the workforce, the cost, and the time used, reduce disagreements, and add to the overall efficiency of project management. Attempts have been made in the past to resolve this issue using image processing and other techniques but the results have not been satisfactory. A new attempt is now made to set up a system that can assess progress control with minimum human input. An experiment makes use of laser scanning technology. The initial results appear to be promising but there are still obstacles to surmount. The system is robust and accurate in laboratory conditions and constitutes proof of concept. Improvements are necessary to accelerate the registration process of multiple scans, to recognize objects of irregular shape, and to assess the practicality and economic feasibility of such a system. © 2013 Elsevier B.V.",Article,"Final",Scopus,2-s2.0-84884571181
"Zhu J., Wright G., Wang J., Wang X.","A critical review of the integration of geographic information system and building information modelling at the data level",2018,"ISPRS International Journal of Geo-Information",72,"https://www.scopus.com/inward/record.uri?eid=2-s2.0-85043262560&doi=10.3390%2fijgi7020066&partnerID=40&md5=0e78d34d4dc5bde97539964b04c8fbb0","The benefits brought by the integration of Building Information Modelling (BIM) and Geographic Information Systems (GIS) are being proved by more and more research. The integration of the two systems is difficult for many reasons. Among them, data incompatibility is the most significant, as BIM and GIS data are created, managed, analyzed, stored, and visualized in different ways in terms of coordinate systems, scope of interest, and data structures. The objective of this paper is to review the relevant research papers to (1) identify the most relevant data models used in BIM/GIS integration and understand their advantages and disadvantages; (2) consider the possibility of other data models that are available for data level integration; and (3) provide direction on the future of BIM/GIS data integration. © 2018 by the authors. Licensee MDPI, Basel, Switzerland.",Conference Paper,"Final",Scopus,2-s2.0-85043262560
"Zhu J., Wu P., Chen M., Kim M.J., Wang X., Fang T.","Automatically processing IFC clipping representation for BIM and GIS integration at the process level",2020,"Applied Sciences (Switzerland)",71,"https://www.scopus.com/inward/record.uri?eid=2-s2.0-85082723633&doi=10.3390%2fapp10062009&partnerID=40&md5=6502e8650c1ae28f3b40632e6e21cad7","The integration of building information modeling (BIM) and geographic information system (GIS) is attracting more attention than ever due to its potential benefits for both the architecture, engineering, and construction (AEC) domain and the geospatial industry. The main challenge in BIM and GIS integrated application comes from the fundamental data conversion, especially for the geometric information. BIM and GIS use di?erent modeling paradigms to represent objects. The BIM dataset takes, for example, Industry Foundation Classes (IFC) that use solid models, such as boundary representation(B-Rep), swept solid, constructive solid geometry(CSG), and clipping, while the GIS data set mainly uses surface model sor B-Rep. The fundamental data conversion between BIM and GIS is the foundation of BIM and GIS integrated application. However, the efficiency of data conversion has been greatly impaired by the human intervention needed, especially for the conversion of the clipping geometry. The goal of this study is to automate the conversion of IFC clipping representation into the shape file format. A process-level approach was developed with an algorithm for instantiating unbounded half spaces using B-Rep. Four IFC models were used to validate the proposed method. The results show that (1) the proposed approach can successfully automate the conversion of IFC clipping representation into the shapefile format; and (2) increasing boundary size has no effect on the file size of unbounded half spaces, but slightly increases the producing time of half spaces and processing time of building components. The efficiency of this study can be further improved by using an open-source package, instead of using the low-efficiency packages provided by ArcGIS. © 2020 by the authors.",Article,"Final",Scopus,2-s2.0-85082723633
"Ohori K.A., Diakité A., Krijnen T., Ledoux H., Stoter J.","Processing BIM and GIS models in practice: Experiences and recommendations from a GeoBIM project in The Netherlands",2018,"ISPRS International Journal of Geo-Information",45,"https://www.scopus.com/inward/record.uri?eid=2-s2.0-85051740461&doi=10.3390%2fijgi7080311&partnerID=40&md5=e1e1b9912d9e588732d3cced79e81eab","It is widely acknowledged that the integration of BIM and GIS data is a crucial step forward for future 3D city modelling, but most of the research conducted so far has covered only the high-level and semantic aspects of GIS-BIM integration. This paper presents the results of the GeoBIM project, which tackled three integration problems focussing instead on aspects involving geometry processing: (i) the automated processing of complex architectural IFC models; (ii) the integration of existing GIS subsoil data in BIM; and (iii) the georeferencing of BIM models for their use in GIS software. All the problems have been studied using real world models and existing datasets made and used by practitioners in The Netherlands. For each problem, this paper exposes in detail the issues faced, proposed solutions, and recommendations for a more successful integration. © 2018 by the authors.",Article,"Final",Scopus,2-s2.0-85051740461
"Hackeloeer A., Klasing K., Krisp J.M., Meng L.","Georeferencing: A review of methods and applications",2014,"Annals of GIS",33,"https://www.scopus.com/inward/record.uri?eid=2-s2.0-84892403664&doi=10.1080%2f19475683.2013.868826&partnerID=40&md5=89970b6faabdaf0bc05cd884f4e23344","Various applications, ranging from map creation tools to navigation systems, employ methods introduced by the domain of georeferencing, which investigates techniques for uniquely identifying geographical objects. This paper aims to provide an overview of ongoing challenges of the georeferencing domain by presenting, classifying and exploring the field and its relevant methods and applications. © 2013 © Taylor & Francis.",Article,"Final",Scopus,2-s2.0-84892403664
