Authors,Title,Year,Source title,Cited by,Link,Abstract,Document Type,Publication Stage,Source,EID
"Vachalek J., Bartalsky L., Rovny O., Sismisova D., Morhac M., Loksik M.","The digital twin of an industrial production line within the industry 4.0 concept",2017,"Proceedings of the 2017 21st International Conference on Process Control, PC 2017",138,"https://www.scopus.com/inward/record.uri?eid=2-s2.0-85027512911&doi=10.1109%2fPC.2017.7976223&partnerID=40&md5=31bb2e758a775ddea30b1d66b905d3b7","This article presents the digital twin concept, which is an augmented manufacturing project created in close collaboration by SOVA Digital and the Institute of Automation, Measurement and Applied Informatics (ÚAMAI), of the Faculty of Mechanical Engineering, Slovak University of Technology in Bratislava with the support of SIEMENS. The project is a technological concept focusing on the continuous optimization of production processes, proactive maintenance, and continuous processing of process data. This project is the basis for further work to promote the concept of Industry 4.0. for the needs of the industry subjects within Slovakia. Its basic goal is to support the existing production structures within the automotive industry and the most efficient use of resources by augmented production and planning strategies, such as the digital twin presented here. © 2017 IEEE.",Conference Paper,"Final",Scopus,2-s2.0-85027512911
"Dave B., Kubler S., Främling K., Koskela L.","Opportunities for enhanced lean construction management using Internet of Things standards",2016,"Automation in Construction",129,"https://www.scopus.com/inward/record.uri?eid=2-s2.0-84949680819&doi=10.1016%2fj.autcon.2015.10.009&partnerID=40&md5=6099e707710515adcda41748e118ab66","Traditionally, production control on construction sites has been challenging, and still remains challenging. The ad-hoc production control methods that are usually used, most of which are informal, foster uncertainty that prevents smooth production flow. Lean construction methods such as the Last Planner System have partially tackled this problem by involving site teams into the decision making process and having them report back to the production management system. However, such systems have relatively long ""lookahead"" planning cycles to respond to the dynamic production requirements of construction, where daily, if not hourly control is needed. New solutions have been proposed such as VisiLean, KanBIM, etc., but again these types of construction management systems require the proximity and availability of computer devices to workers. Through this paper, the authors investigate how the communication framework underlying such construction management systems can be further improved so as to fully or partially automate various communication functions across the construction project lifecycle (e.g., to enable lean and close to real-time reporting of production control information). To this end, the present paper provides evidences of how the Internet of Things (IoT) and related standards can contribute to such an improvement. The paper then provides first insights - through various construction scenarios - into how the proposed communication framework can be beneficial for various actors and core business perspectives, from lean construction management to the management of the entire building lifecycle. © 2015 Elsevier B.V. All rights reserved.",Article,"Final",Scopus,2-s2.0-84949680819
"Dimitrov A., Golparvar-Fard M.","Vision-based material recognition for automated monitoring of construction progress and generating building information modeling from unordered site image collections",2014,"Advanced Engineering Informatics",126,"https://www.scopus.com/inward/record.uri?eid=2-s2.0-84893782757&doi=10.1016%2fj.aei.2013.11.002&partnerID=40&md5=6a9cfdda6d3fc66981eb614098cfc619","Automatically monitoring construction progress or generating Building Information Models using site images collections - beyond point cloud data - requires semantic information such as construction materials and inter-connectivity to be recognized for building elements. In the case of materials such information can only be derived from appearance-based data contained in 2D imagery. Currently, the state-of-the-art texture recognition algorithms which are often used for recognizing materials are very promising (reaching over 95% average accuracy), yet they have mainly been tested in strictly controlled conditions and often do not perform well with images collected from construction sites (dropping to 70% accuracy and lower). In addition, there is no benchmark that validates their performance under real-world construction site conditions. To overcome these limitations, we propose a new vision-based method for material classification from single images taken under unknown viewpoint and site illumination conditions. In the proposed algorithm, material appearance is modeled by a joint probability distribution of responses from a filter bank and principal Hue-Saturation-Value color values and classified using a multiple one-vs.-all χ2 kernel Support Vector Machine classifier. Classification performance is compared with the state-of-the-art algorithms both in computer vision and AEC communities. For experimental studies, a new database containing 20 typical construction materials with more than 150 images per category is assembled and used for validation. Overall, for material classification an average accuracy of 97.1% for 200×200 pixel image patches are reported. In cases where image patches are smaller, our method can synthetically generate additional pixels and maintain a competitive accuracy to those reported above (90.8% for 30×30 pixel patches). The results show the promise of the applicability of the proposed method and expose the limitations of the state-of-the-art classification algorithms under real world conditions. It further defines a new benchmark that could be used to measure the performance of future algorithms. © 2013 Elsevier Ltd. All rights reserved.",Article,"Final",Scopus,2-s2.0-84893782757
"Boje C., Guerriero A., Kubicki S., Rezgui Y.","Towards a semantic Construction Digital Twin: Directions for future research",2020,"Automation in Construction",113,"https://www.scopus.com/inward/record.uri?eid=2-s2.0-85082386834&doi=10.1016%2fj.autcon.2020.103179&partnerID=40&md5=914efcd6c064d6a97299f00d812bb8fc","As the Architecture, Engineering and Construction sector is embracing the digital age, the processes involved in the design, construction and operation of built assets are more and more influenced by technologies dealing with value-added monitoring of data from sensor networks, management of this data in secure and resilient storage systems underpinned by semantic models, as well as the simulation and optimisation of engineering systems. Aside from enhancing the efficiency of the value chain, such information-intensive models and associated technologies play a decisive role in minimising the lifecycle impacts of our buildings. While Building Information Modelling provides procedures, technologies and data schemas enabling a standardised semantic representation of building components and systems, the concept of a Digital Twin conveys a more holistic socio-technical and process-oriented characterisation of the complex artefacts involved by leveraging the synchronicity of the cyber-physical bi-directional data flows. Moreover, BIM lacks semantic completeness in areas such as control systems, including sensor networks, social systems, and urban artefacts beyond the scope of buildings, thus requiring a holistic, scalable semantic approach that factors in dynamic data at different levels. The paper reviews the multi-faceted applications of BIM during the construction stage and highlights limits and requirements, paving the way to the concept of a Construction Digital Twin. A definition of such a concept is then given, described in terms of underpinning research themes, while elaborating on areas for future research. © 2020 The Authors",Review,"Final",Scopus,2-s2.0-85082386834
"Dave B., Buda A., Nurminen A., Främling K.","A framework for integrating BIM and IoT through open standards",2018,"Automation in Construction",104,"https://www.scopus.com/inward/record.uri?eid=2-s2.0-85051379498&doi=10.1016%2fj.autcon.2018.07.022&partnerID=40&md5=9daa502dc1dc7080a41fcd01842cb455","The built environment provides significant opportunities for IoT (Internet of Things) deployment, and can be singled out as one of the most important aspects for IoT related research. While the IoT deployment in the built environment is growing exponentially, there exists a gap in integrating these two in a systematic way through open standards and systems. From technological perspective, there is a need for convergence of diverse fields ranging from Building Information Systems and Building Services to Building Automation Systems, and IoT devices and finally the end user services to develop smart, user oriented applications. This paper outlines the efforts to develop a platform that integrates the built environment data with IoT sensors in a campus wide, web based system called Otaniemi3D that provides information about energy usage, occupancy and user comfort by integrating Building Information Models and IoT devices through open messaging standards (O-MI and O-DF) and IFC models. The paper describes the design criteria, the system architecture, the workflow and a proof of concept with potential use cases that integrate IoT with the built environment. Initial results show that both the end users and other research groups can benefit from such platforms by either consuming the data in their daily life or using the data for more advance research. © 2018 The Authors",Article,"Final",Scopus,2-s2.0-85051379498
"Jans M., Van Der Werf J.M., Lybaert N., Vanhoof K.","A business process mining application for internal transaction fraud mitigation",2011,"Expert Systems with Applications",102,"https://www.scopus.com/inward/record.uri?eid=2-s2.0-79957986425&doi=10.1016%2fj.eswa.2011.04.159&partnerID=40&md5=7e128549930c4b96dab26b2c26894247","Corporate fraud these days represents a huge cost to our economy. In the paper we address one specific type of corporate fraud, internal transaction fraud. Given the omnipresence of stored history logs, the field of process mining rises as an adequate answer to mitigating internal transaction fraud. Process mining diagnoses processes by mining event logs. This way we can expose opportunities to commit fraud in the followed process. In this paper we report on an application of process mining at a case company. The procurement process was selected as example for internal transaction fraud mitigation. The results confirm the contribution process mining can provide to business practice. © 2010 Elsevier Ltd. All rights reserved.",Article,"Final",Scopus,2-s2.0-79957986425
"Buijs J.C.A.M., Van Dongen B.F., Van Der Aalst W.M.P.","Quality dimensions in process discovery: The importance of fitness, precision, generalization and simplicity",2014,"International Journal of Cooperative Information Systems",95,"https://www.scopus.com/inward/record.uri?eid=2-s2.0-84900485338&doi=10.1142%2fS0218843014400012&partnerID=40&md5=950af524fbd22bc95cf0310ec2e47534","Process discovery algorithms typically aim at discovering process models from event logs that best describe the recorded behavior. Often, the quality of a process discovery algorithm is measured by quantifying to what extent the resulting model can reproduce the behavior in the log, i.e. replay fitness. At the same time, there are other measures that compare a model with recorded behavior in terms of the precision of the model and the extent to which the model generalizes the behavior in the log. Furthermore, many measures exist to express the complexity of a model irrespective of the log. In this paper, we first discuss several quality dimensions related to process discovery. We further show that existing process discovery algorithms typically consider at most two out of the four main quality dimensions: replay fitness, precision, generalization and simplicity. Moreover, existing approaches cannot steer the discovery process based on user-defined weights for the four quality dimensions. This paper presents the ETM algorithm which allows the user to seamlessly steer the discovery process based on preferences with respect to the four quality dimensions. We show that all dimensions are important for process discovery. However, it only makes sense to consider precision, generalization and simplicity if the replay fitness is acceptable. © 2014 World Scientific Publishing Company.",Article,"Final",Scopus,2-s2.0-84900485338
"Min Q., Lu Y., Liu Z., Su C., Wang B.","Machine Learning based Digital Twin Framework for Production Optimization in Petrochemical Industry",2019,"International Journal of Information Management",90,"https://www.scopus.com/inward/record.uri?eid=2-s2.0-85066307148&doi=10.1016%2fj.ijinfomgt.2019.05.020&partnerID=40&md5=5cc95ab869c2986f2aa7c98a092105ff","Digital twins, along with the internet of things (IoT), data mining, and machine learning technologies, offer great potential in the transformation of today's manufacturing paradigm toward intelligent manufacturing. Production control in petrochemical industry involves complex circumstances and a high demand for timeliness; therefore, agile and smart controls are important components of intelligent manufacturing in the petrochemical industry. This paper proposes a framework and approaches for constructing a digital twin based on the petrochemical industrial IoT, machine learning and a practice loop for information exchange between the physical factory and a virtual digital twin model to realize production control optimization. Unlike traditional production control approaches, this novel approach integrates machine learning and real-time industrial big data to train and optimize digital twin models. It can support petrochemical and other process manufacturing industries to dynamically adapt to the changing environment, respond in a timely manner to changes in the market due to production optimization, and improve economic benefits. Accounting for environmental characteristics, this paper provides concrete solutions for machine learning difficulties in the petrochemical industry, e.g., high data dimensions, time lags and alignment between time series data, and high demand for immediacy. The approaches were evaluated by applying them in the production unit of a petrochemical factory, and a model was trained via industrial IoT data and used to realize intelligent production control based on real-time data. A case study shows the effectiveness of this approach in the petrochemical industry. © 2019 Elsevier Ltd",Article,"Final",Scopus,2-s2.0-85066307148
"Cheng J.C.P., Chen W., Chen K., Wang Q.","Data-driven predictive maintenance planning framework for MEP components based on BIM and IoT using machine learning algorithms",2020,"Automation in Construction",74,"https://www.scopus.com/inward/record.uri?eid=2-s2.0-85078707972&doi=10.1016%2fj.autcon.2020.103087&partnerID=40&md5=064c227f5e3c92afbeb91ad35da0096e","Facility managers usually conduct reactive maintenance or preventive maintenance strategies in building maintenance management. However, there are some limitations that reactive maintenance cannot prevent failure, and preventive maintenance cannot predict the future condition of MEP components and repair in advance to extend the lifetime of facilities. Therefore, this study aims to apply a predictive maintenance strategy with advanced technologies to overcome these limitations. Building information modeling (BIM) and Internet of Things (IoT) have the potential to improve the efficiency of facility maintenance management (FMM). Despite the significant efforts that have been made to apply BIM and IoT to the architecture, engineering, construction, and facility management (AEC/FM) industry, BIM and IoT integration for FMM is still at an initial stage. In order to provide a better maintenance strategy for building facilities, a data-driven predictive maintenance planning framework based on BIM and IoT technologies for FMM was developed, consisting of an information layer and an application layer. Data collection and data integration among the BIM models, FM system, and IoT network are undertaken in the information layer, while the application layer contains four modules to achieve predictive maintenance, namely: (1) condition monitoring and fault alarming module, (2) condition assessment module, (3) condition prediction module, and (4) maintenance planning module. Machine learning algorithms, ANN and SVM, are used to predict the future condition of MEP components. Furthermore, the developed framework was applied in an illustrative example to validate the feasibility of the approach. The results show that the constantly updated data obtained from the information layer together with the machine learning algorithms in the application layer can efficiently predict the future condition of MEP components for maintenance planning. © 2020 Elsevier B.V.",Article,"Final",Scopus,2-s2.0-85078707972
"Yuan X., Anumba C.J., Parfitt M.K.","Cyber-physical systems for temporary structure monitoring",2016,"Automation in Construction",71,"https://www.scopus.com/inward/record.uri?eid=2-s2.0-84961217447&doi=10.1016%2fj.autcon.2016.02.005&partnerID=40&md5=86f1228b6b88ebd2b78d0e9765238e86","Information technology-based methods, such as Cyber-Physical Systems (CPS), play an important role in industrial transformation and evolution. However, while significant efforts have been made towards CPS application in several other industry sectors, the exploration of CPS benefits and applicability to the construction industry is at the initial stage. While CPS has been identified as a promising solution to address problems in the construction industry, few explorations have been made on CPS application to temporary structures, which have significant safety issues that urgently need to be addressed. With a focus on the enhanced monitoring of temporary structures to prevent potential structural failures, this study proposed a CPS-based temporary structures monitoring (TSM) system that integrates the virtual model of a temporary structure and the physical structure on the construction jobsite. In doing this, the applicability of CPS to temporary structures monitoring is investigated, and end user requirements and system requirements are identified for system design. In addition, a system architecture and a description of the issues surrounding the choice of a system development environment are presented. For better understanding of how the TSM works, aspects of the developed CPS-based TSM are presented with system workflow and simulated examples of the structural monitoring of a scaffolding system. The potential benefits and barriers to CPS implementation in temporary structures, along with future research based on this study, are highlighted. © 2016 Elsevier B.V. All rights reserved.",Article,"Final",Scopus,2-s2.0-84961217447
"Pan Y., Zhang L., Wu X., Skibniewski M.J.","Multi-classifier information fusion in risk analysis",2020,"Information Fusion",70,"https://www.scopus.com/inward/record.uri?eid=2-s2.0-85081156314&doi=10.1016%2fj.inffus.2020.02.003&partnerID=40&md5=0f05307cf8a05f2efc44ef0038fded6f","This paper develops a novel multi-classifier information fusion approach that integrates the probabilistic support vector machine (SVM) and the improved Dempster-Shafer (D-S) evidence theory to support risk analysis under uncertainty. Safety levels for various risk factors can be classified separately using the probabilistic SVM. Then, these multiple classification results will be fused at the decision level to achieve an overall risk evaluation by an improved D-S evidence theory with the integration of the Dempster’ rule and the weighted average rule. The Monte Carlo simulation approach is employed to model the randomness and uncertainty underlying limited observations. A global sensitivity analysis is performed to identify the most significant factors contributing to the risk event. A realistic operational tunnel case in China is used to demonstrate the feasibility and effectiveness of the developed approach, aiming to assess the magnitude of the structural health risk. Results indicate the developed SVM-DS approach is capable of (1) Fusing multi-classifier information effectively from different SVM models with a high classification accuracy of 97.14%; (2) Performing a strong robustness to bias, which can achieve acceptable classification accuracy even under a 20% bias; and (3) Exhibiting a more outstanding classification performance (87.99% accuracy) than the single SVM model (63.84% accuracy) under a high bias (20%). Since the proposed reliable risk analysis method can efficiently fuse multi-sensory information with ubiquitous uncertainties, conflicts, and bias, it provides in-depth analysis for structural health status together with the most critical risk factors, and then proper remedial actions can be taken at an early stage. © 2020",Article,"Final",Scopus,2-s2.0-85081156314
"Lagkas T., Argyriou V., Bibi S., Sarigiannidis P.","UAV IoT framework views and challenges: Towards protecting drones as “things”",2018,"Sensors (Switzerland)",70,"https://www.scopus.com/inward/record.uri?eid=2-s2.0-85056725891&doi=10.3390%2fs18114015&partnerID=40&md5=8262678779844d4d14830e46deff2866","Unmanned aerial vehicles (UAVs) have enormous potential in enabling new applications in various areas, ranging from military, security, medicine, and surveillance to traffic-monitoring applications. Lately, there has been heavy investment in the development of UAVs and multi-UAVs systems that can collaborate and complete missions more efficiently and economically. Emerging technologies such as 4G/5G networks have significant potential on UAVs equipped with cameras, sensors, and GPS receivers in delivering Internet of Things (IoT) services from great heights, creating an airborne domain of the IoT. However, there are many issues to be resolved before the effective use of UAVs can be made, including security, privacy, and management. As such, in this paper we review new UAV application areas enabled by the IoT and 5G technologies, analyze the sensor requirements, and overview solutions for fleet management over aerial-networking, privacy, and security challenges. Finally, we propose a framework that supports and enables these technologies on UAVs. The introduced framework provisions a holistic IoT architecture that enables the protection of UAVs as “flying” things in a collaborative networked environment. © 2018 by the authors. Licensee MDPI, Basel, Switzerland.",Review,"Final",Scopus,2-s2.0-85056725891
"Raedts I., Petković M., Usenko Y.S., Van Der Werf J.M., Groote J.F., Somers L.","Transformation of BPMN models for behaviour analysis",2007,"Proceedings of the 5th International Workshop on Modelling, Simulation, Verification and Validation of Enterprise Information Systems - MSVVEIS 2007; In Conjunction with ICEIS 2007",69,"https://www.scopus.com/inward/record.uri?eid=2-s2.0-58149112794&partnerID=40&md5=b7cdd14cbeca1f52f9c8a2e2ae1f489a","In industry, many business processes are modelled and stored in Enterprise Information Systems (EIS). Tools supporting the verification and validation of business processes can help to improve the quality of these business processes. However, existing tools can not directly be applied to models used in industry. In this paper, we present our approach for model verification and validation: translating industrial models to Petri nets and mCRL2, and subsequently applying existing tools on the models derived from the initial industrial models. The following translations are described: BPMN models to Petri nets and Petri nets to mCRL2. It is shown what the analysis on the derived models can reveal about the original models.",Conference Paper,"Final",Scopus,2-s2.0-58149112794
