Authors,Title,Year,Source title,Cited by,Link,Abstract,Document Type,Publication Stage,Source,EID
"Box G.E.P., Jenkins G.M.",[No title available],1976,"Time Series Analysis: Forecasting and Control",20358,,[No abstract available],,,Scopus,2-s2.0-0004311217
"Hevner A.R., March S.T., Park J., Ram S.","Design science in information systems research",2004,"MIS Quarterly: Management Information Systems",7819,"https://www.scopus.com/inward/record.uri?eid=2-s2.0-0242652022&doi=10.2307%2f25148625&partnerID=40&md5=fb1dde6271e2c2d4d646405dcddea0d1","Two paradigms characterize much of the research in the Information Systems discipline: behavioral science and design science. The behavioral-science paradigm seeks to develop and verify theories that explain or predict human or organizational behavior. The design-science paradigm seeks to extend the boundaries of human and organizational capabilities by creating new and innovative artifacts. Both paradigms are foundational to the IS discipline, positioned as it is at the confluence of people, organizations, and technology. Our objective is to describe the performance of design-science research in Information Systems via a concise conceptual framework and clear guidelines for understanding, executing, and evaluating the research. In the design-science paradigm, knowledge and understanding of a problem domain and its solution are achieved in the building and application of the designed artifact. Three recent exemplars in the research literature are used to demonstrate the application of these guidelines. We conclude with an analysis of the challenges of performing high-quality design-science research in the context of the broader IS community.",Article,"Final",Scopus,2-s2.0-0242652022
"Van der Aalst W.","Process mining: Data science in action",2016,"Process Mining: Data Science in Action",1144,"https://www.scopus.com/inward/record.uri?eid=2-s2.0-84979530122&doi=10.1007%2f978-3-662-49851-4&partnerID=40&md5=2c9677c2cfe2b253453b40c50e86ebb3","This is the second edition of Wil van der Aalst’s seminal book on process mining, which now discusses the field also in the broader context of data science and big data approaches. It includes several additions and updates, e.g. on inductive mining techniques, the notion of alignments, a considerably expanded section on software tools and a completely new chapter of process mining in the large. It is self-contained, while at the same time covering the entire process-mining spectrum from process discovery to predictive analytics. After a general introduction to data science and process mining in Part I, Part II provides the basics of business process modeling and data mining necessary to understand the remainder of the book. Next, Part III focuses on process discovery as the most important process mining task, while Part IV moves beyond discovering the control flow of processes, highlighting conformance checking, and organizational and time perspectives. Part V offers a guide to successfully applying process mining in practice, including an introduction to the widely used open-source tool ProM and several commercial products. Lastly, Part VI takes a step back, reflecting on the material presented and the key open challenges. Overall, this book provides a comprehensive overview of the state of the art in process mining. It is intended for business process analysts, business consultants, process managers, graduate students, and BPM researchers. © Springer-Verlag Berlin Heidelberg 2011, 2016.",Book,"Final",Scopus,2-s2.0-84979530122
"Günther C.W., Van Der Aalst W.M.P.","Fuzzy mining - Adaptive process simplification based on multi-perspective metrics",2007,"Lecture Notes in Computer Science (including subseries Lecture Notes in Artificial Intelligence and Lecture Notes in Bioinformatics)",591,"https://www.scopus.com/inward/record.uri?eid=2-s2.0-38049156249&doi=10.1007%2f978-3-540-75183-0_24&partnerID=40&md5=a8035428ca9ad8f15a5151a0273117cf","Process Mining is a technique for extracting process models from execution logs. This is particularly useful in situations where people have an idealized view of reality. Real-life processes turn out to be less structured than people tend to believe. Unfortunately, traditional process mining approaches have problems dealing with unstructured processes. The discovered models are often ""spaghetti-like"", showing all details without distinguishing what is important and what is not. This paper proposes a new process mining approach to overcome this problem. The approach is configurable and allows for different faithfully simplified views of a particular process. To do this, the concept of a roadmap is used as a metaphor. Just like different roadmaps provide suitable abstractions of reality, process models should provide meaningful abstractions of operational processes encountered in domains ranging from healthcare and logistics to web services and public administration. © Springer-Verlag Berlin Heidelberg 2007.",Conference Paper,"Final",Scopus,2-s2.0-38049156249
"Schleich B., Anwer N., Mathieu L., Wartzack S.","Shaping the digital twin for design and production engineering",2017,"CIRP Annals - Manufacturing Technology",508,"https://www.scopus.com/inward/record.uri?eid=2-s2.0-85018723536&doi=10.1016%2fj.cirp.2017.04.040&partnerID=40&md5=ba7049ec32c79b6298cc70581af3c133","The digitalization of manufacturing fuels the application of sophisticated virtual product models, which are referred to as digital twins, throughout all stages of product realization. Particularly, more realistic virtual models of manufactured products are essential to bridge the gap between design and manufacturing and to mirror the real and virtual worlds. In this paper, we propose a comprehensive reference model based on the concept of Skin Model Shapes, which serves as a digital twin of the physical product in design and manufacturing. In this regard, model conceptualization, representation, and implementation as well as applications along the product life-cycle are addressed. © 2017",Article,"Final",Scopus,2-s2.0-85018723536
"Qi Q., Tao F.","Digital Twin and Big Data Towards Smart Manufacturing and Industry 4.0: 360 Degree Comparison",2018,"IEEE Access",488,"https://www.scopus.com/inward/record.uri?eid=2-s2.0-85041173790&doi=10.1109%2fACCESS.2018.2793265&partnerID=40&md5=421f931c692160832c81d6535ddfea0a","With the advances in new-generation information technologies, especially big data and digital twin, smart manufacturing is becoming the focus of global manufacturing transformation and upgrading. Intelligence comes from data. Integrated analysis for the manufacturing big data is beneficial to all aspects of manufacturing. Besides, the digital twin paves a way for the cyber-physical integration of manufacturing, which is an important bottleneck to achieve smart manufacturing. In this paper, the big data and digital twin in manufacturing are reviewed, including their concept as well as their applications in product design, production planning, manufacturing, and predictive maintenance. On this basis, the similarities and differences between big data and digital twin are compared from the general and data perspectives. Since the big data and digital twin can be complementary, how they can be integrated to promote smart manufacturing are discussed. © 2013 IEEE.",Article,"Final",Scopus,2-s2.0-85041173790
"Tao F., Zhang H., Liu A., Nee A.Y.C.","Digital Twin in Industry: State-of-the-Art",2019,"IEEE Transactions on Industrial Informatics",484,"https://www.scopus.com/inward/record.uri?eid=2-s2.0-85054374767&doi=10.1109%2fTII.2018.2873186&partnerID=40&md5=2fd1fcedbc08dff8d43df76d7de1d53f","Digital twin (DT) is one of the most promising enabling technologies for realizing smart manufacturing and Industry 4.0. DTs are characterized by the seamless integration between the cyber and physical spaces. The importance of DTs is increasingly recognized by both academia and industry. It has been almost 15 years since the concept of the DT was initially proposed. To date, many DT applications have been successfully implemented in different industries, including product design, production, prognostics and health management, and some other fields. However, at present, no paper has focused on the review of DT applications in industry. In an effort to understand the development and application of DTs in industry, this paper thoroughly reviews the state-of-the-art of the DT research concerning the key components of DTs, the current development of DTs, and the major DT applications in industry. This paper also outlines the current challenges and some possible directions for future work. © 2005-2012 IEEE.",Article,"Final",Scopus,2-s2.0-85054374767
"Tao F., Zhang M.","Digital Twin Shop-Floor: A New Shop-Floor Paradigm Towards Smart Manufacturing",2017,"IEEE Access",450,"https://www.scopus.com/inward/record.uri?eid=2-s2.0-85030752762&doi=10.1109%2fACCESS.2017.2756069&partnerID=40&md5=ec2b49226948f1c7116612c0f78f846e","With the developments and applications of the new information technologies, such as cloud computing, Internet of Things, big data, and artificial intelligence, a smart manufacturing era is coming. At the same time, various national manufacturing development strategies have been put forward, such as Industry 4.0, Industrial Internet, manufacturing based on Cyber-Physical System, and Made in China 2025. However, one of specific challenges to achieve smart manufacturing with these strategies is how to converge the manufacturing physical world and the virtual world, so as to realize a series of smart operations in the manufacturing process, including smart interconnection, smart interaction, smart control and management, etc. In this context, as a basic unit of manufacturing, shop-floor is required to reach the interaction and convergence between physical and virtual spaces, which is not only the imperative demand of smart manufacturing, but also the evolving trend of itself. Accordingly, a novel concept of digital twin shop-floor (DTS) based on digital twin is explored and its four key components are discussed, including physical shop-floor, virtual shop-floor, shop-floor service system, and shop-floor digital twin data. What is more, the operation mechanisms and implementing methods for DTS are studied and key technologies as well as challenges ahead are investigated, respectively. © 2013 IEEE.",Article,"Final",Scopus,2-s2.0-85030752762
"Deb C., Zhang F., Yang J., Lee S.E., Shah K.W.","A review on time series forecasting techniques for building energy consumption",2017,"Renewable and Sustainable Energy Reviews",365,"https://www.scopus.com/inward/record.uri?eid=2-s2.0-85015085852&doi=10.1016%2fj.rser.2017.02.085&partnerID=40&md5=626c23f1474b8b76416c0413c27c464a","Energy consumption forecasting for buildings has immense value in energy efficiency and sustainability research. Accurate energy forecasting models have numerous implications in planning and energy optimization of buildings and campuses. For new buildings, where past recorded data is unavailable, computer simulation methods are used for energy analysis and forecasting future scenarios. However, for existing buildings with historically recorded time series energy data, statistical and machine learning techniques have proved to be more accurate and quick. This study presents a comprehensive review of the existing machine learning techniques for forecasting time series energy consumption. Although the emphasis is given to a single time series data analysis, the review is not just limited to it since energy data is often co-analyzed with other time series variables like outdoor weather and indoor environmental conditions. The nine most popular forecasting techniques that are based on the machine learning platform are analyzed. An in-depth review and analysis of the ‘hybrid model’, that combines two or more forecasting techniques is also presented. The various combinations of the hybrid model are found to be the most effective in time series energy forecasting for building. © 2017 Elsevier Ltd",Review,"Final",Scopus,2-s2.0-85015085852
"Leemans S.J.J., Fahland D., Van Der Aalst W.M.P.","Discovering block-structured process models from event logs - A constructive approach",2013,"Lecture Notes in Computer Science (including subseries Lecture Notes in Artificial Intelligence and Lecture Notes in Bioinformatics)",307,"https://www.scopus.com/inward/record.uri?eid=2-s2.0-84879641701&doi=10.1007%2f978-3-642-38697-8_17&partnerID=40&md5=496b0c935efa1a9d200a05b6b6f92e4a","Process discovery is the problem of, given a log of observed behaviour, finding a process model that 'best' describes this behaviour. A large variety of process discovery algorithms has been proposed. However, no existing algorithm guarantees to return a fitting model (i.e., able to reproduce all observed behaviour) that is sound (free of deadlocks and other anomalies) in finite time. We present an extensible framework to discover from any given log a set of block-structured process models that are sound and fit the observed behaviour. In addition we characterise the minimal information required in the log to rediscover a particular process model. We then provide a polynomial-time algorithm for discovering a sound, fitting, block-structured model from any given log; we give sufficient conditions on the log for which our algorithm returns a model that is language-equivalent to the process model underlying the log, including unseen behaviour. The technique is implemented in a prototypical tool. © 2013 Springer-Verlag.",Conference Paper,"Final",Scopus,2-s2.0-84879641701
"March S.T., Storey V.C.","Design science in the information systems discipline: An introduction to the special issue on design science research",2008,"MIS Quarterly: Management Information Systems",284,"https://www.scopus.com/inward/record.uri?eid=2-s2.0-55949085529&doi=10.2307%2f25148869&partnerID=40&md5=e75ba461135100fa8e7b016fccbccfc9",[No abstract available],Article,"Final",Scopus,2-s2.0-55949085529
"Mani G.-F., Feniosky P.-M., Savarese S.","D4AR-A 4-dimensional augmented reality model for automating construction progress monitoring data collection, processing and communication",2009,"Electronic Journal of Information Technology in Construction",282,"https://www.scopus.com/inward/record.uri?eid=2-s2.0-70350154917&partnerID=40&md5=48ea864eb64c180144062cb127f90c1b","Early detection of actual or potential schedule delay in field construction activities is vital to project management. This entails project managers to design, implement, and maintain a systematic approach for construction progress monitoring to promptly identify, process and communicate discrepancies between actual and as-planned performances. To achieve this goal, this research focuses on exploring application of unsorted daily progress photograph logs available on any construction site as a data collection technique. Our approach is based on computing-from the images themselves-the photographer's locations and orientations, along with a sparse 3D geometric representation of the as-built site using daily progress photographs and superimposition of the reconstructed scene over as-planned 4D models. Within such an environment, progress photographs are registered in the virtual as-planned environment and this allows a large unstructured collection of daily construction images to be sorted, interactively browsed and explored. In addition, sparse reconstructed scenes superimposed over 4D models allow site images to be geo-registered with the as-planned components and consequently, location-based image processing technique to be implemented and progress data to be extracted automatically. The results of progress comparison between as-planned and as-built performances are visualized in the D4AR (4D Augmented Reality) environment using a traffic light metaphor. We present our preliminary results on three ongoing construction projects and discuss implementation, perceived benefits and future potential enhancement of this new technology in construction, in all fronts of automatic data collection, processing and communication. © 2009 The authors.",Article,"Final",Scopus,2-s2.0-70350154917
"Tao F., Sui F., Liu A., Qi Q., Zhang M., Song B., Guo Z., Lu S.C.-Y., Nee A.Y.C.","Digital twin-driven product design framework",2019,"International Journal of Production Research",271,"https://www.scopus.com/inward/record.uri?eid=2-s2.0-85042921933&doi=10.1080%2f00207543.2018.1443229&partnerID=40&md5=ba290742598bd6b1307f8743ec098fc4","With the advent of new generation information technologies in industry and product design, the big data-driven product design era has arrived. However, the big data-driven product design mainly places emphasis on the analysis of physical data rather than the virtual models, in other words, the convergence between product physical and virtual space is usually absent. Digital twin, a new emerging and fast growing technology which connects the physical and virtual world, has attracted much attention worldwide recently. This paper presents a new method for product design based on the digital twin approach. The development of product design is briefly introduced first. The framework of digital twin-driven product design (DTPD) is then proposed and analysed. A case is presented to illustrate the application of the proposed DTPD method. © 2018, © 2018 Informa UK Limited, trading as Taylor & Francis Group.",Article,"Final",Scopus,2-s2.0-85042921933
"Glaessgen E.H., Stargel D.S.","The digital twin paradigm for future NASA and U.S. Air force vehicles",2012,"Collection of Technical Papers - AIAA/ASME/ASCE/AHS/ASC Structures, Structural Dynamics and Materials Conference",263,"https://www.scopus.com/inward/record.uri?eid=2-s2.0-84881426231&partnerID=40&md5=cd8379d4891f2ddab1a2bacad8bed2ba","Future generations of NASA and U.S. Air Force vehicles will require lighter mass while being subjected to higher loads and more extreme service conditions over longer time periods than the present generation. Current approaches for certification, fleet management and sustainment are largely based on statistical distributions of material properties, heuristic design philosophies, physical testing and assumed similitude between testing and operational conditions and will likely be unable to address these extreme requirements. To address the shortcomings of conventional approaches, a fundamental paradigm shift is needed. This paradigm shift, the Digital Twin, integrates ultra-high fidelity simulation with the vehicle's on-board integrated vehicle health management system, maintenance history and all available historical and fleet data to mirror the life of its flying twin and enable unprecedented levels of safety and reliability. © 2012 AIAA.",Conference Paper,"Final",Scopus,2-s2.0-84881426231
"Sacks R., Eastman C., Lee G., Teicholz P.","BIM Handbook: A Guide to Building Information Modeling for Owners, Designers, Engineers, Contractors, and Facility Managers",2018,"BIM Handbook: A Guide to Building Information Modeling for Owners, Designers, Engineers, Contractors, and Facility Managers",224,,[No abstract available],,"Final",Scopus,2-s2.0-85054559327
"Ding L., Zhou Y., Akinci B.","Building Information Modeling (BIM) application framework: The process of expanding from 3D to computable nD",2014,"Automation in Construction",191,"https://www.scopus.com/inward/record.uri?eid=2-s2.0-84907426904&doi=10.1016%2fj.autcon.2014.04.009&partnerID=40&md5=ba44e7517229a7099122070dd2f68c28","The utilization of Building Information Modeling (BIM) has been growing significantly and translating into the support of various tasks within the construction industry. In relation to such a growth, many approaches that leverage dimensions of information stored in BIM model are being developed. Through this, it is possible to allow all stakeholders to retrieve and generate information from the same model, enabling them to work cohesively. To identify gaps of existing work and evaluate new studies in this area, a BIM application framework is developed and discussed in this paper. Such a framework gives an overview of BIM applications in the construction industry. A literature review, within this framework, has been conducted and the result reveals a research gap for BIM applications in the project domains of quality, safety and environmental management. A computable multi-dimensional (nD) model is difficult to establish in these areas because with continuously changing conditions, the decision making rules for evaluating whether an individual component is considered good quality, or whether a construction site is safe, also vary as the construction progresses. A process of expanding from 3D to computable nD models, specifically, a possible way to integrate safety, quality and carbon emission variables into BIM during the construction phase of a project is explained in this paper. As examples, the processes of utilizing nD models on real construction sites are described. It is believed to benefit the industry by providing a computable BIM and enabling all project participants to extract any information required for decision making. Finally, the framework is used to identify areas to extend BIM research. © 2014 Elsevier B.V. All rights reserved.",Article,"Final",Scopus,2-s2.0-84907426904
"Buijs J.C.A.M., Van Dongen B.F., Van Der Aalst W.M.P.","On the role of fitness, precision, generalization and simplicity in process discovery",2012,"Lecture Notes in Computer Science (including subseries Lecture Notes in Artificial Intelligence and Lecture Notes in Bioinformatics)",181,"https://www.scopus.com/inward/record.uri?eid=2-s2.0-84872786846&doi=10.1007%2f978-3-642-33606-5_19&partnerID=40&md5=9545edb55f0a2cdfc8bb7ca02be23eaf","Process discovery algorithms typically aim at discovering process models from event logs that best describe the recorded behavior. Often, the quality of a process discovery algorithm is measured by quantifying to what extent the resulting model can reproduce the behavior in the log, i.e. replay fitness. At the same time, there are many other metrics that compare a model with recorded behavior in terms of the precision of the model and the extent to which the model generalizes the behavior in the log. Furthermore, several metrics exist to measure the complexity of a model irrespective of the log. In this paper, we show that existing process discovery algorithms typically consider at most two out of the four main quality dimensions: replay fitness, precision, generalization and simplicity. Moreover, existing approaches can not steer the discovery process based on user-defined weights for the four quality dimensions. This paper also presents the ETM algorithm which allows the user to seamlessly steer the discovery process based on preferences with respect to the four quality dimensions. We show that all dimensions are important for process discovery. However, it only makes sense to consider precision, generalization and simplicity if the replay fitness is acceptable. © 2012 Springer-Verlag.",Conference Paper,"Final",Scopus,2-s2.0-84872786846
"Tang S., Shelden D.R., Eastman C.M., Pishdad-Bozorgi P., Gao X.","A review of building information modeling (BIM) and the internet of things (IoT) devices integration: Present status and future trends",2019,"Automation in Construction",180,"https://www.scopus.com/inward/record.uri?eid=2-s2.0-85060885881&doi=10.1016%2fj.autcon.2019.01.020&partnerID=40&md5=7f882d4aa0b2c069887a02c5094892d6","The integration of Building Information Modeling (BIM) with real-time data from the Internet of Things (IoT) devices presents a powerful paradigm for applications to improve construction and operational efficiencies. Connecting real-time data streams from the rapidly expanding set of IoT sensor networks to the high-fidelity BIM models provides numerous applications. However, BIM and IoT integration research are still in nascent stages, there is a need to understand the current situation of BIM and IoT device integration. This paper conducts a comprehensive review with the intent to identify common emerging areas of application and common design patterns in the approach to tackling BIM-IoT device integration along with an examination of current limitations and predictions of future research directions. Altogether, 97 papers from 14 AEC related journals and databases in other industry over the last decade were reviewed. Several prevalent domains of application namely Construction Operation and Monitoring, Health & Safety Management, Construction Logistic & Management, and Facility Management were identified. The authors summarized 5 integration methods with description, examples, and discussion. These integration methods are utilizing BIM tools’ APIs and relational database, transform BIM data into a relational database using new data schema, create new query language, using semantic web technologies and hybrid approach. Based on the observed limitations, prominent future research directions are suggested, focusing on service-oriented architecture (SOA) patterns and web services-based strategies for BIM and IoT integration, establishing information integration & management standards, solving interoperability issue, and cloud computing. © 2019 Elsevier B.V.",Review,"Final",Scopus,2-s2.0-85060885881
